{"computedActivities":[{"bike_id":null,"calories":null,"commute":null,"display_type":"Ski alpin","distance_raw":31467.7,"elapsed_time_raw":17130,"elevation_gain_raw":1964.34,"elevation_unit":"m","extendedStats":{"cadenceData":null,"elevationData":{"accumulatedElevationAscent":1646.0403669532084,"accumulatedElevationDescent":2682.246671227139,"ascentSpeed":{"avg":2619.2849788619437,"lowerQuartile":1211,"median":3378,"upperQuartile":4009},"ascentSpeedZones":null,"avgElevation":2557,"elevationZones":null,"lowerQuartileElevation":2337,"medianElevation":2619,"upperQuartileElevation":3007},"gradeData":{"avgGrade":-4.708115623321688,"gradeProfile":"HILLY","gradeZones":null,"lowerQuartileGrade":-18,"medianGrade":-11.1,"upFlatDownDistanceData":{"down":19.9813,"flat":1.8922999999999979,"up":9.594100000000003},"upFlatDownInSeconds":{"down":8635,"flat":1954,"total":17129,"up":6540},"upFlatDownMoveData":{"down":8.330362478286045,"flat":3.4863254861821864,"up":5.281155963302753},"upperQuartileGrade":18},"heartRateData":null,"moveRatio":0.9999416228838295,"paceData":{"avgPace":199,"lowerQuartilePace":2000.0000000000002,"medianPace":1000.0000000000001,"paceZones":null,"upperQuartilePace":666.6666666666666,"variancePace":4.722414446620534},"powerData":null,"speedData":{"avgPace":199,"genuineAvgSpeed":18.10402358573179,"lowerQuartileSpeed":1.8,"medianSpeed":3.6,"speedZones":null,"standardDeviationSpeed":27.61017764954078,"totalAvgSpeed":18.102966725043775,"upperQuartileSpeed":5.4,"varianceSpeed":762.3219098392012},"toughnessScore":null},"hasPowerMeter":false,"id":223223849,"moving_time_raw":3036,"name":"Les 2 Alpes","private":false,"short_unit":"km","start_time":"2011-02-05T11:03:49+0000","trainer":false,"type":"AlpineSki"},{"bike_id":824321,"calories":715.5186853099999,"commute":false,"display_type":"Sortie à vélo","distance_raw":32943.4,"elapsed_time_raw":4862,"elevation_gain_raw":99.0665,"elevation_unit":"m","extendedStats":{"cadenceData":null,"elevationData":{"accumulatedElevationAscent":99.05405505251002,"accumulatedElevationDescent":108.39010530010975,"ascentSpeed":{"avg":-1,"lowerQuartile":446,"median":545,"upperQuartile":648},"ascentSpeedZones":null,"avgElevation":219,"elevationZones":null,"lowerQuartileElevation":215,"medianElevation":217,"upperQuartileElevation":220},"gradeData":{"avgGrade":0.0009490520104191727,"gradeProfile":"HILLY","gradeZones":null,"lowerQuartileGrade":-1.6,"medianGrade":0,"upFlatDownDistanceData":{"down":7.866099999999993,"flat":17.36850000000002,"up":7.7087999999999886},"upFlatDownInSeconds":{"down":1126,"flat":2554,"total":4862,"up":1182},"upFlatDownMoveData":{"down":25.149165186500866,"flat":24.481832419733777,"up":23.47857868020301},"upperQuartileGrade":1.5},"heartRateData":null,"moveRatio":1,"paceData":{"avgPace":152,"lowerQuartilePace":208.33333333333331,"medianPace":151.51515151515153,"paceZones":null,"upperQuartilePace":120.48192771084338,"variancePace":25.09687163766813},"powerData":{"avgWatts":127.8596161869003,"avgWattsPerKg":1.826565945527147,"hasPowerMeter":false,"lowerQuartileWatts":0,"medianWatts":77,"powerZones":null,"punchFactor":null,"upperQuartileWatts":213,"variabilityIndex":1.4244642329867025,"weightedPower":182.13145010164712,"weightedWattsPerKg":2.6018778585949587},"speedData":{"avgPace":152,"genuineAvgSpeed":23.658412176059294,"lowerQuartileSpeed":17.28,"medianSpeed":23.759999999999998,"speedZones":null,"standardDeviationSpeed":11.976818155145843,"totalAvgSpeed":23.658412176059294,"upperQuartileSpeed":29.880000000000003,"varianceSpeed":143.44417312143105},"toughnessScore":null},"hasPowerMeter":false,"id":188553109,"moving_time_raw":4862,"name":"03/04/2011 Montbonnot Saint Martin, RA, France","private":false,"short_unit":"km","start_time":"2011-04-03T15:18:42+0000","trainer":false,"type":"Ride"},{"bike_id":824321,"calories":715.5186853099999,"commute":false,"display_type":"Sortie à vélo","distance_raw":32943.4,"elapsed_time_raw":4862,"elevation_gain_raw":99.0665,"elevation_unit":"m","extendedStats":{"cadenceData":null,"elevationData":{"accumulatedElevationAscent":99.05405505251002,"accumulatedElevationDescent":108.39010530010975,"ascentSpeed":{"avg":-1,"lowerQuartile":446,"median":545,"upperQuartile":648},"ascentSpeedZones":null,"avgElevation":219,"elevationZones":null,"lowerQuartileElevation":215,"medianElevation":217,"upperQuartileElevation":220},"gradeData":{"avgGrade":0.0009490520104191727,"gradeProfile":"HILLY","gradeZones":null,"lowerQuartileGrade":-1.6,"medianGrade":0,"upFlatDownDistanceData":{"down":7.866099999999993,"flat":17.36850000000002,"up":7.7087999999999886},"upFlatDownInSeconds":{"down":1126,"flat":2554,"total":4862,"up":1182},"upFlatDownMoveData":{"down":25.149165186500866,"flat":24.481832419733777,"up":23.47857868020301},"upperQuartileGrade":1.5},"heartRateData":null,"moveRatio":1,"paceData":{"avgPace":152,"lowerQuartilePace":208.33333333333331,"medianPace":151.51515151515153,"paceZones":null,"upperQuartilePace":120.48192771084338,"variancePace":25.09687163766813},"powerData":{"avgWatts":127.8596161869003,"avgWattsPerKg":1.826565945527147,"hasPowerMeter":false,"lowerQuartileWatts":0,"medianWatts":77,"powerZones":null,"punchFactor":null,"upperQuartileWatts":213,"variabilityIndex":1.4244642329867025,"weightedPower":182.13145010164712,"weightedWattsPerKg":2.6018778585949587},"speedData":{"avgPace":152,"genuineAvgSpeed":23.658412176059294,"lowerQuartileSpeed":17.28,"medianSpeed":23.759999999999998,"speedZones":null,"standardDeviationSpeed":11.976818155145843,"totalAvgSpeed":23.658412176059294,"upperQuartileSpeed":29.880000000000003,"varianceSpeed":143.44417312143105},"toughnessScore":null},"hasPowerMeter":false,"id":188553581,"moving_time_raw":4862,"name":"10/04/2011 Montbonnot Saint Martin, RA, France","private":false,"short_unit":"km","start_time":"2011-04-10T15:18:42+0000","trainer":false,"type":"Ride"},{"bike_id":824321,"calories":715.5186853099999,"commute":false,"display_type":"Sortie à vélo","distance_raw":32943.4,"elapsed_time_raw":4862,"elevation_gain_raw":99.0665,"elevation_unit":"m","extendedStats":{"cadenceData":null,"elevationData":{"accumulatedElevationAscent":99.05405505251002,"accumulatedElevationDescent":108.39010530010975,"ascentSpeed":{"avg":-1,"lowerQuartile":446,"median":545,"upperQuartile":648},"ascentSpeedZones":null,"avgElevation":219,"elevationZones":null,"lowerQuartileElevation":215,"medianElevation":217,"upperQuartileElevation":220},"gradeData":{"avgGrade":0.0009490520104191727,"gradeProfile":"HILLY","gradeZones":null,"lowerQuartileGrade":-1.6,"medianGrade":0,"upFlatDownDistanceData":{"down":7.866099999999993,"flat":17.36850000000002,"up":7.7087999999999886},"upFlatDownInSeconds":{"down":1126,"flat":2554,"total":4862,"up":1182},"upFlatDownMoveData":{"down":25.149165186500866,"flat":24.481832419733777,"up":23.47857868020301},"upperQuartileGrade":1.5},"heartRateData":null,"moveRatio":1,"paceData":{"avgPace":152,"lowerQuartilePace":208.33333333333331,"medianPace":151.51515151515153,"paceZones":null,"upperQuartilePace":120.48192771084338,"variancePace":25.09687163766813},"powerData":{"avgWatts":127.8596161869003,"avgWattsPerKg":1.826565945527147,"hasPowerMeter":false,"lowerQuartileWatts":0,"medianWatts":77,"powerZones":null,"punchFactor":null,"upperQuartileWatts":213,"variabilityIndex":1.4244642329867025,"weightedPower":182.13145010164712,"weightedWattsPerKg":2.6018778585949587},"speedData":{"avgPace":152,"genuineAvgSpeed":23.658412176059294,"lowerQuartileSpeed":17.28,"medianSpeed":23.759999999999998,"speedZones":null,"standardDeviationSpeed":11.976818155145843,"totalAvgSpeed":23.658412176059294,"upperQuartileSpeed":29.880000000000003,"varianceSpeed":143.44417312143105},"toughnessScore":null},"hasPowerMeter":false,"id":188553868,"moving_time_raw":4862,"name":"17/04/2011 Montbonnot Saint Martin, RA, France","private":false,"short_unit":"km","start_time":"2011-04-17T15:18:42+0000","trainer":false,"type":"Ride"},{"bike_id":824321,"calories":715.5186853099999,"commute":false,"display_type":"Sortie à vélo","distance_raw":32943.4,"elapsed_time_raw":4862,"elevation_gain_raw":99.0665,"elevation_unit":"m","extendedStats":{"cadenceData":null,"elevationData":{"accumulatedElevationAscent":99.05405505251002,"accumulatedElevationDescent":108.39010530010975,"ascentSpeed":{"avg":-1,"lowerQuartile":446,"median":545,"upperQuartile":648},"ascentSpeedZones":null,"avgElevation":219,"elevationZones":null,"lowerQuartileElevation":215,"medianElevation":217,"upperQuartileElevation":220},"gradeData":{"avgGrade":0.0009490520104191727,"gradeProfile":"HILLY","gradeZones":null,"lowerQuartileGrade":-1.6,"medianGrade":0,"upFlatDownDistanceData":{"down":7.866099999999993,"flat":17.36850000000002,"up":7.7087999999999886},"upFlatDownInSeconds":{"down":1126,"flat":2554,"total":4862,"up":1182},"upFlatDownMoveData":{"down":25.149165186500866,"flat":24.481832419733777,"up":23.47857868020301},"upperQuartileGrade":1.5},"heartRateData":null,"moveRatio":1,"paceData":{"avgPace":152,"lowerQuartilePace":208.33333333333331,"medianPace":151.51515151515153,"paceZones":null,"upperQuartilePace":120.48192771084338,"variancePace":25.09687163766813},"powerData":{"avgWatts":127.8596161869003,"avgWattsPerKg":1.826565945527147,"hasPowerMeter":false,"lowerQuartileWatts":0,"medianWatts":77,"powerZones":null,"punchFactor":null,"upperQuartileWatts":213,"variabilityIndex":1.4244642329867025,"weightedPower":182.13145010164712,"weightedWattsPerKg":2.6018778585949587},"speedData":{"avgPace":152,"genuineAvgSpeed":23.658412176059294,"lowerQuartileSpeed":17.28,"medianSpeed":23.759999999999998,"speedZones":null,"standardDeviationSpeed":11.976818155145843,"totalAvgSpeed":23.658412176059294,"upperQuartileSpeed":29.880000000000003,"varianceSpeed":143.44417312143105},"toughnessScore":null},"hasPowerMeter":false,"id":188554587,"moving_time_raw":4862,"name":"24/04/2011 Montbonnot Saint Martin, RA, France","private":false,"short_unit":"km","start_time":"2011-04-24T15:18:42+0000","trainer":false,"type":"Ride"},{"bike_id":824321,"calories":715.5186853099999,"commute":false,"display_type":"Sortie à vélo","distance_raw":32943.4,"elapsed_time_raw":4862,"elevation_gain_raw":99.0665,"elevation_unit":"m","extendedStats":{"cadenceData":null,"elevationData":{"accumulatedElevationAscent":99.05405505251002,"accumulatedElevationDescent":108.39010530010975,"ascentSpeed":{"avg":-1,"lowerQuartile":446,"median":545,"upperQuartile":648},"ascentSpeedZones":null,"avgElevation":219,"elevationZones":null,"lowerQuartileElevation":215,"medianElevation":217,"upperQuartileElevation":220},"gradeData":{"avgGrade":0.0009490520104191727,"gradeProfile":"HILLY","gradeZones":null,"lowerQuartileGrade":-1.6,"medianGrade":0,"upFlatDownDistanceData":{"down":7.866099999999993,"flat":17.36850000000002,"up":7.7087999999999886},"upFlatDownInSeconds":{"down":1126,"flat":2554,"total":4862,"up":1182},"upFlatDownMoveData":{"down":25.149165186500866,"flat":24.481832419733777,"up":23.47857868020301},"upperQuartileGrade":1.5},"heartRateData":null,"moveRatio":1,"paceData":{"avgPace":152,"lowerQuartilePace":208.33333333333331,"medianPace":151.51515151515153,"paceZones":null,"upperQuartilePace":120.48192771084338,"variancePace":25.09687163766813},"powerData":{"avgWatts":127.8596161869003,"avgWattsPerKg":1.826565945527147,"hasPowerMeter":false,"lowerQuartileWatts":0,"medianWatts":77,"powerZones":null,"punchFactor":null,"upperQuartileWatts":213,"variabilityIndex":1.4244642329867025,"weightedPower":182.13145010164712,"weightedWattsPerKg":2.6018778585949587},"speedData":{"avgPace":152,"genuineAvgSpeed":23.658412176059294,"lowerQuartileSpeed":17.28,"medianSpeed":23.759999999999998,"speedZones":null,"standardDeviationSpeed":11.976818155145843,"totalAvgSpeed":23.658412176059294,"upperQuartileSpeed":29.880000000000003,"varianceSpeed":143.44417312143105},"toughnessScore":null},"hasPowerMeter":false,"id":188554871,"moving_time_raw":4862,"name":"01/05/2011 Montbonnot Saint Martin, RA, France","private":false,"short_unit":"km","start_time":"2011-05-01T15:18:42+0000","trainer":false,"type":"Ride"},{"bike_id":824321,"calories":715.5186853099999,"commute":false,"display_type":"Sortie à vélo","distance_raw":32943.4,"elapsed_time_raw":4862,"elevation_gain_raw":99.0665,"elevation_unit":"m","extendedStats":{"cadenceData":null,"elevationData":{"accumulatedElevationAscent":99.05405505251002,"accumulatedElevationDescent":108.39010530010975,"ascentSpeed":{"avg":-1,"lowerQuartile":446,"median":545,"upperQuartile":648},"ascentSpeedZones":null,"avgElevation":219,"elevationZones":null,"lowerQuartileElevation":215,"medianElevation":217,"upperQuartileElevation":220},"gradeData":{"avgGrade":0.0009490520104191727,"gradeProfile":"HILLY","gradeZones":null,"lowerQuartileGrade":-1.6,"medianGrade":0,"upFlatDownDistanceData":{"down":7.866099999999993,"flat":17.36850000000002,"up":7.7087999999999886},"upFlatDownInSeconds":{"down":1126,"flat":2554,"total":4862,"up":1182},"upFlatDownMoveData":{"down":25.149165186500866,"flat":24.481832419733777,"up":23.47857868020301},"upperQuartileGrade":1.5},"heartRateData":null,"moveRatio":1,"paceData":{"avgPace":152,"lowerQuartilePace":208.33333333333331,"medianPace":151.51515151515153,"paceZones":null,"upperQuartilePace":120.48192771084338,"variancePace":25.09687163766813},"powerData":{"avgWatts":127.8596161869003,"avgWattsPerKg":1.826565945527147,"hasPowerMeter":false,"lowerQuartileWatts":0,"medianWatts":77,"powerZones":null,"punchFactor":null,"upperQuartileWatts":213,"variabilityIndex":1.4244642329867025,"weightedPower":182.13145010164712,"weightedWattsPerKg":2.6018778585949587},"speedData":{"avgPace":152,"genuineAvgSpeed":23.658412176059294,"lowerQuartileSpeed":17.28,"medianSpeed":23.759999999999998,"speedZones":null,"standardDeviationSpeed":11.976818155145843,"totalAvgSpeed":23.658412176059294,"upperQuartileSpeed":29.880000000000003,"varianceSpeed":143.44417312143105},"toughnessScore":null},"hasPowerMeter":false,"id":188555093,"moving_time_raw":4862,"name":"08/05/2011 Montbonnot Saint Martin, RA, France","private":false,"short_unit":"km","start_time":"2011-05-08T15:18:42+0000","trainer":false,"type":"Ride"},{"bike_id":824321,"calories":715.5186853099999,"commute":false,"display_type":"Sortie à vélo","distance_raw":32943.4,"elapsed_time_raw":4862,"elevation_gain_raw":99.0665,"elevation_unit":"m","extendedStats":{"cadenceData":null,"elevationData":{"accumulatedElevationAscent":99.05405505251002,"accumulatedElevationDescent":108.39010530010975,"ascentSpeed":{"avg":-1,"lowerQuartile":446,"median":545,"upperQuartile":648},"ascentSpeedZones":null,"avgElevation":219,"elevationZones":null,"lowerQuartileElevation":215,"medianElevation":217,"upperQuartileElevation":220},"gradeData":{"avgGrade":0.0009490520104191727,"gradeProfile":"HILLY","gradeZones":null,"lowerQuartileGrade":-1.6,"medianGrade":0,"upFlatDownDistanceData":{"down":7.866099999999993,"flat":17.36850000000002,"up":7.7087999999999886},"upFlatDownInSeconds":{"down":1126,"flat":2554,"total":4862,"up":1182},"upFlatDownMoveData":{"down":25.149165186500866,"flat":24.481832419733777,"up":23.47857868020301},"upperQuartileGrade":1.5},"heartRateData":null,"moveRatio":1,"paceData":{"avgPace":152,"lowerQuartilePace":208.33333333333331,"medianPace":151.51515151515153,"paceZones":null,"upperQuartilePace":120.48192771084338,"variancePace":25.09687163766813},"powerData":{"avgWatts":127.8596161869003,"avgWattsPerKg":1.826565945527147,"hasPowerMeter":false,"lowerQuartileWatts":0,"medianWatts":77,"powerZones":null,"punchFactor":null,"upperQuartileWatts":213,"variabilityIndex":1.4244642329867025,"weightedPower":182.13145010164712,"weightedWattsPerKg":2.6018778585949587},"speedData":{"avgPace":152,"genuineAvgSpeed":23.658412176059294,"lowerQuartileSpeed":17.28,"medianSpeed":23.759999999999998,"speedZones":null,"standardDeviationSpeed":11.976818155145843,"totalAvgSpeed":23.658412176059294,"upperQuartileSpeed":29.880000000000003,"varianceSpeed":143.44417312143105},"toughnessScore":null},"hasPowerMeter":false,"id":188555531,"moving_time_raw":4862,"name":"15/05/2011 Montbonnot Saint Martin, RA, France","private":false,"short_unit":"km","start_time":"2011-05-15T15:18:42+0000","trainer":false,"type":"Ride"},{"bike_id":824321,"calories":715.5186853099999,"commute":false,"display_type":"Sortie à vélo","distance_raw":32943.4,"elapsed_time_raw":4862,"elevation_gain_raw":99.0665,"elevation_unit":"m","extendedStats":{"cadenceData":null,"elevationData":{"accumulatedElevationAscent":99.05405505251002,"accumulatedElevationDescent":108.39010530010975,"ascentSpeed":{"avg":-1,"lowerQuartile":446,"median":545,"upperQuartile":648},"ascentSpeedZones":null,"avgElevation":219,"elevationZones":null,"lowerQuartileElevation":215,"medianElevation":217,"upperQuartileElevation":220},"gradeData":{"avgGrade":0.0009490520104191727,"gradeProfile":"HILLY","gradeZones":null,"lowerQuartileGrade":-1.6,"medianGrade":0,"upFlatDownDistanceData":{"down":7.866099999999993,"flat":17.36850000000002,"up":7.7087999999999886},"upFlatDownInSeconds":{"down":1126,"flat":2554,"total":4862,"up":1182},"upFlatDownMoveData":{"down":25.149165186500866,"flat":24.481832419733777,"up":23.47857868020301},"upperQuartileGrade":1.5},"heartRateData":null,"moveRatio":1,"paceData":{"avgPace":152,"lowerQuartilePace":208.33333333333331,"medianPace":151.51515151515153,"paceZones":null,"upperQuartilePace":120.48192771084338,"variancePace":25.09687163766813},"powerData":{"avgWatts":127.8596161869003,"avgWattsPerKg":1.826565945527147,"hasPowerMeter":false,"lowerQuartileWatts":0,"medianWatts":77,"powerZones":null,"punchFactor":null,"upperQuartileWatts":213,"variabilityIndex":1.4244642329867025,"weightedPower":182.13145010164712,"weightedWattsPerKg":2.6018778585949587},"speedData":{"avgPace":152,"genuineAvgSpeed":23.658412176059294,"lowerQuartileSpeed":17.28,"medianSpeed":23.759999999999998,"speedZones":null,"standardDeviationSpeed":11.976818155145843,"totalAvgSpeed":23.658412176059294,"upperQuartileSpeed":29.880000000000003,"varianceSpeed":143.44417312143105},"toughnessScore":null},"hasPowerMeter":false,"id":188555767,"moving_time_raw":4862,"name":"22/05/2011 Montbonnot Saint Martin, RA, France","private":false,"short_unit":"km","start_time":"2011-05-22T15:18:42+0000","trainer":false,"type":"Ride"},{"bike_id":824321,"calories":715.5186853099999,"commute":false,"display_type":"Sortie à vélo","distance_raw":32943.4,"elapsed_time_raw":4862,"elevation_gain_raw":99.0665,"elevation_unit":"m","extendedStats":{"cadenceData":null,"elevationData":{"accumulatedElevationAscent":99.05405505251002,"accumulatedElevationDescent":108.39010530010975,"ascentSpeed":{"avg":-1,"lowerQuartile":446,"median":545,"upperQuartile":648},"ascentSpeedZones":null,"avgElevation":219,"elevationZones":null,"lowerQuartileElevation":215,"medianElevation":217,"upperQuartileElevation":220},"gradeData":{"avgGrade":0.0009490520104191727,"gradeProfile":"HILLY","gradeZones":null,"lowerQuartileGrade":-1.6,"medianGrade":0,"upFlatDownDistanceData":{"down":7.866099999999993,"flat":17.36850000000002,"up":7.7087999999999886},"upFlatDownInSeconds":{"down":1126,"flat":2554,"total":4862,"up":1182},"upFlatDownMoveData":{"down":25.149165186500866,"flat":24.481832419733777,"up":23.47857868020301},"upperQuartileGrade":1.5},"heartRateData":null,"moveRatio":1,"paceData":{"avgPace":152,"lowerQuartilePace":208.33333333333331,"medianPace":151.51515151515153,"paceZones":null,"upperQuartilePace":120.48192771084338,"variancePace":25.09687163766813},"powerData":{"avgWatts":127.8596161869003,"avgWattsPerKg":1.826565945527147,"hasPowerMeter":false,"lowerQuartileWatts":0,"medianWatts":77,"powerZones":null,"punchFactor":null,"upperQuartileWatts":213,"variabilityIndex":1.4244642329867025,"weightedPower":182.13145010164712,"weightedWattsPerKg":2.6018778585949587},"speedData":{"avgPace":152,"genuineAvgSpeed":23.658412176059294,"lowerQuartileSpeed":17.28,"medianSpeed":23.759999999999998,"speedZones":null,"standardDeviationSpeed":11.976818155145843,"totalAvgSpeed":23.658412176059294,"upperQuartileSpeed":29.880000000000003,"varianceSpeed":143.44417312143105},"toughnessScore":null},"hasPowerMeter":false,"id":188555954,"moving_time_raw":4862,"name":"29/05/2011 Montbonnot Saint Martin, RA, France","private":false,"short_unit":"km","start_time":"2011-05-29T15:18:42+0000","trainer":false,"type":"Ride"},{"bike_id":824321,"calories":715.5186853099999,"commute":false,"display_type":"Sortie à vélo","distance_raw":32943.4,"elapsed_time_raw":4862,"elevation_gain_raw":99.0665,"elevation_unit":"m","extendedStats":{"cadenceData":null,"elevationData":{"accumulatedElevationAscent":99.05405505251002,"accumulatedElevationDescent":108.39010530010975,"ascentSpeed":{"avg":-1,"lowerQuartile":446,"median":545,"upperQuartile":648},"ascentSpeedZones":null,"avgElevation":219,"elevationZones":null,"lowerQuartileElevation":215,"medianElevation":217,"upperQuartileElevation":220},"gradeData":{"avgGrade":0.0009490520104191727,"gradeProfile":"HILLY","gradeZones":null,"lowerQuartileGrade":-1.6,"medianGrade":0,"upFlatDownDistanceData":{"down":7.866099999999993,"flat":17.36850000000002,"up":7.7087999999999886},"upFlatDownInSeconds":{"down":1126,"flat":2554,"total":4862,"up":1182},"upFlatDownMoveData":{"down":25.149165186500866,"flat":24.481832419733777,"up":23.47857868020301},"upperQuartileGrade":1.5},"heartRateData":null,"moveRatio":1,"paceData":{"avgPace":152,"lowerQuartilePace":208.33333333333331,"medianPace":151.51515151515153,"paceZones":null,"upperQuartilePace":120.48192771084338,"variancePace":25.09687163766813},"powerData":{"avgWatts":127.8596161869003,"avgWattsPerKg":1.826565945527147,"hasPowerMeter":false,"lowerQuartileWatts":0,"medianWatts":77,"powerZones":null,"punchFactor":null,"upperQuartileWatts":213,"variabilityIndex":1.4244642329867025,"weightedPower":182.13145010164712,"weightedWattsPerKg":2.6018778585949587},"speedData":{"avgPace":152,"genuineAvgSpeed":23.658412176059294,"lowerQuartileSpeed":17.28,"medianSpeed":23.759999999999998,"speedZones":null,"standardDeviationSpeed":11.976818155145843,"totalAvgSpeed":23.658412176059294,"upperQuartileSpeed":29.880000000000003,"varianceSpeed":143.44417312143105},"toughnessScore":null},"hasPowerMeter":false,"id":188556312,"moving_time_raw":4862,"name":"05/06/2011 Montbonnot Saint Martin, RA, France","private":false,"short_unit":"km","start_time":"2011-06-05T15:18:42+0000","trainer":false,"type":"Ride"},{"bike_id":824321,"calories":715.5186853099999,"commute":false,"display_type":"Sortie à vélo","distance_raw":32943.4,"elapsed_time_raw":4862,"elevation_gain_raw":99.0665,"elevation_unit":"m","extendedStats":{"cadenceData":null,"elevationData":{"accumulatedElevationAscent":99.05405505251002,"accumulatedElevationDescent":108.39010530010975,"ascentSpeed":{"avg":-1,"lowerQuartile":446,"median":545,"upperQuartile":648},"ascentSpeedZones":null,"avgElevation":219,"elevationZones":null,"lowerQuartileElevation":215,"medianElevation":217,"upperQuartileElevation":220},"gradeData":{"avgGrade":0.0009490520104191727,"gradeProfile":"HILLY","gradeZones":null,"lowerQuartileGrade":-1.6,"medianGrade":0,"upFlatDownDistanceData":{"down":7.866099999999993,"flat":17.36850000000002,"up":7.7087999999999886},"upFlatDownInSeconds":{"down":1126,"flat":2554,"total":4862,"up":1182},"upFlatDownMoveData":{"down":25.149165186500866,"flat":24.481832419733777,"up":23.47857868020301},"upperQuartileGrade":1.5},"heartRateData":null,"moveRatio":1,"paceData":{"avgPace":152,"lowerQuartilePace":208.33333333333331,"medianPace":151.51515151515153,"paceZones":null,"upperQuartilePace":120.48192771084338,"variancePace":25.09687163766813},"powerData":{"avgWatts":127.8596161869003,"avgWattsPerKg":1.826565945527147,"hasPowerMeter":false,"lowerQuartileWatts":0,"medianWatts":77,"powerZones":null,"punchFactor":null,"upperQuartileWatts":213,"variabilityIndex":1.4244642329867025,"weightedPower":182.13145010164712,"weightedWattsPerKg":2.6018778585949587},"speedData":{"avgPace":152,"genuineAvgSpeed":23.658412176059294,"lowerQuartileSpeed":17.28,"medianSpeed":23.759999999999998,"speedZones":null,"standardDeviationSpeed":11.976818155145843,"totalAvgSpeed":23.658412176059294,"upperQuartileSpeed":29.880000000000003,"varianceSpeed":143.44417312143105},"toughnessScore":null},"hasPowerMeter":false,"id":188556867,"moving_time_raw":4862,"name":"12/06/2011 Montbonnot Saint Martin, RA, France","private":false,"short_unit":"km","start_time":"2011-06-12T15:18:42+0000","trainer":false,"type":"Ride"},{"bike_id":824321,"calories":715.5186853099999,"commute":false,"display_type":"Sortie à vélo","distance_raw":32943.4,"elapsed_time_raw":4862,"elevation_gain_raw":99.0665,"elevation_unit":"m","extendedStats":{"cadenceData":null,"elevationData":{"accumulatedElevationAscent":99.05405505251002,"accumulatedElevationDescent":108.39010530010975,"ascentSpeed":{"avg":-1,"lowerQuartile":446,"median":545,"upperQuartile":648},"ascentSpeedZones":null,"avgElevation":219,"elevationZones":null,"lowerQuartileElevation":215,"medianElevation":217,"upperQuartileElevation":220},"gradeData":{"avgGrade":0.0009490520104191727,"gradeProfile":"HILLY","gradeZones":null,"lowerQuartileGrade":-1.6,"medianGrade":0,"upFlatDownDistanceData":{"down":7.866099999999993,"flat":17.36850000000002,"up":7.7087999999999886},"upFlatDownInSeconds":{"down":1126,"flat":2554,"total":4862,"up":1182},"upFlatDownMoveData":{"down":25.149165186500866,"flat":24.481832419733777,"up":23.47857868020301},"upperQuartileGrade":1.5},"heartRateData":null,"moveRatio":1,"paceData":{"avgPace":152,"lowerQuartilePace":208.33333333333331,"medianPace":151.51515151515153,"paceZones":null,"upperQuartilePace":120.48192771084338,"variancePace":25.09687163766813},"powerData":{"avgWatts":127.8596161869003,"avgWattsPerKg":1.826565945527147,"hasPowerMeter":false,"lowerQuartileWatts":0,"medianWatts":77,"powerZones":null,"punchFactor":null,"upperQuartileWatts":213,"variabilityIndex":1.4244642329867025,"weightedPower":182.13145010164712,"weightedWattsPerKg":2.6018778585949587},"speedData":{"avgPace":152,"genuineAvgSpeed":23.658412176059294,"lowerQuartileSpeed":17.28,"medianSpeed":23.759999999999998,"speedZones":null,"standardDeviationSpeed":11.976818155145843,"totalAvgSpeed":23.658412176059294,"upperQuartileSpeed":29.880000000000003,"varianceSpeed":143.44417312143105},"toughnessScore":null},"hasPowerMeter":false,"id":188557566,"moving_time_raw":4862,"name":"19/06/2011 Montbonnot Saint Martin, RA, France","private":false,"short_unit":"km","start_time":"2011-06-19T15:18:42+0000","trainer":false,"type":"Ride"},{"bike_id":824321,"calories":715.5186853099999,"commute":false,"display_type":"Sortie à vélo","distance_raw":32943.4,"elapsed_time_raw":4862,"elevation_gain_raw":99.0665,"elevation_unit":"m","extendedStats":{"cadenceData":null,"elevationData":{"accumulatedElevationAscent":99.05405505251002,"accumulatedElevationDescent":108.39010530010975,"ascentSpeed":{"avg":-1,"lowerQuartile":446,"median":545,"upperQuartile":648},"ascentSpeedZones":null,"avgElevation":219,"elevationZones":null,"lowerQuartileElevation":215,"medianElevation":217,"upperQuartileElevation":220},"gradeData":{"avgGrade":0.0009490520104191727,"gradeProfile":"HILLY","gradeZones":null,"lowerQuartileGrade":-1.6,"medianGrade":0,"upFlatDownDistanceData":{"down":7.866099999999993,"flat":17.36850000000002,"up":7.7087999999999886},"upFlatDownInSeconds":{"down":1126,"flat":2554,"total":4862,"up":1182},"upFlatDownMoveData":{"down":25.149165186500866,"flat":24.481832419733777,"up":23.47857868020301},"upperQuartileGrade":1.5},"heartRateData":null,"moveRatio":1,"paceData":{"avgPace":152,"lowerQuartilePace":208.33333333333331,"medianPace":151.51515151515153,"paceZones":null,"upperQuartilePace":120.48192771084338,"variancePace":25.09687163766813},"powerData":{"avgWatts":127.8596161869003,"avgWattsPerKg":1.826565945527147,"hasPowerMeter":false,"lowerQuartileWatts":0,"medianWatts":77,"powerZones":null,"punchFactor":null,"upperQuartileWatts":213,"variabilityIndex":1.4244642329867025,"weightedPower":182.13145010164712,"weightedWattsPerKg":2.6018778585949587},"speedData":{"avgPace":152,"genuineAvgSpeed":23.658412176059294,"lowerQuartileSpeed":17.28,"medianSpeed":23.759999999999998,"speedZones":null,"standardDeviationSpeed":11.976818155145843,"totalAvgSpeed":23.658412176059294,"upperQuartileSpeed":29.880000000000003,"varianceSpeed":143.44417312143105},"toughnessScore":null},"hasPowerMeter":false,"id":188557826,"moving_time_raw":4862,"name":"26/06/2011 Montbonnot Saint Martin, RA, France","private":false,"short_unit":"km","start_time":"2011-06-26T15:18:42+0000","trainer":false,"type":"Ride"},{"bike_id":824321,"calories":715.5186853099999,"commute":false,"display_type":"Sortie à vélo","distance_raw":32943.4,"elapsed_time_raw":4862,"elevation_gain_raw":99.0665,"elevation_unit":"m","extendedStats":{"cadenceData":null,"elevationData":{"accumulatedElevationAscent":99.05405505251002,"accumulatedElevationDescent":108.39010530010975,"ascentSpeed":{"avg":-1,"lowerQuartile":446,"median":545,"upperQuartile":648},"ascentSpeedZones":null,"avgElevation":219,"elevationZones":null,"lowerQuartileElevation":215,"medianElevation":217,"upperQuartileElevation":220},"gradeData":{"avgGrade":0.0009490520104191727,"gradeProfile":"HILLY","gradeZones":null,"lowerQuartileGrade":-1.6,"medianGrade":0,"upFlatDownDistanceData":{"down":7.866099999999993,"flat":17.36850000000002,"up":7.7087999999999886},"upFlatDownInSeconds":{"down":1126,"flat":2554,"total":4862,"up":1182},"upFlatDownMoveData":{"down":25.149165186500866,"flat":24.481832419733777,"up":23.47857868020301},"upperQuartileGrade":1.5},"heartRateData":null,"moveRatio":1,"paceData":{"avgPace":152,"lowerQuartilePace":208.33333333333331,"medianPace":151.51515151515153,"paceZones":null,"upperQuartilePace":120.48192771084338,"variancePace":25.09687163766813},"powerData":{"avgWatts":127.8596161869003,"avgWattsPerKg":1.826565945527147,"hasPowerMeter":false,"lowerQuartileWatts":0,"medianWatts":77,"powerZones":null,"punchFactor":null,"upperQuartileWatts":213,"variabilityIndex":1.4244642329867025,"weightedPower":182.13145010164712,"weightedWattsPerKg":2.6018778585949587},"speedData":{"avgPace":152,"genuineAvgSpeed":23.658412176059294,"lowerQuartileSpeed":17.28,"medianSpeed":23.759999999999998,"speedZones":null,"standardDeviationSpeed":11.976818155145843,"totalAvgSpeed":23.658412176059294,"upperQuartileSpeed":29.880000000000003,"varianceSpeed":143.44417312143105},"toughnessScore":null},"hasPowerMeter":false,"id":188558068,"moving_time_raw":4862,"name":"03/07/2011 Montbonnot Saint Martin, RA, France","private":false,"short_unit":"km","start_time":"2011-07-03T15:18:42+0000","trainer":false,"type":"Ride"},{"bike_id":824321,"calories":715.5186853099999,"commute":false,"display_type":"Sortie à vélo","distance_raw":32943.4,"elapsed_time_raw":4862,"elevation_gain_raw":99.0665,"elevation_unit":"m","extendedStats":{"cadenceData":null,"elevationData":{"accumulatedElevationAscent":99.05405505251002,"accumulatedElevationDescent":108.39010530010975,"ascentSpeed":{"avg":-1,"lowerQuartile":446,"median":545,"upperQuartile":648},"ascentSpeedZones":null,"avgElevation":219,"elevationZones":null,"lowerQuartileElevation":215,"medianElevation":217,"upperQuartileElevation":220},"gradeData":{"avgGrade":0.0009490520104191727,"gradeProfile":"HILLY","gradeZones":null,"lowerQuartileGrade":-1.6,"medianGrade":0,"upFlatDownDistanceData":{"down":7.866099999999993,"flat":17.36850000000002,"up":7.7087999999999886},"upFlatDownInSeconds":{"down":1126,"flat":2554,"total":4862,"up":1182},"upFlatDownMoveData":{"down":25.149165186500866,"flat":24.481832419733777,"up":23.47857868020301},"upperQuartileGrade":1.5},"heartRateData":null,"moveRatio":1,"paceData":{"avgPace":152,"lowerQuartilePace":208.33333333333331,"medianPace":151.51515151515153,"paceZones":null,"upperQuartilePace":120.48192771084338,"variancePace":25.09687163766813},"powerData":{"avgWatts":127.8596161869003,"avgWattsPerKg":1.826565945527147,"hasPowerMeter":false,"lowerQuartileWatts":0,"medianWatts":77,"powerZones":null,"punchFactor":null,"upperQuartileWatts":213,"variabilityIndex":1.4244642329867025,"weightedPower":182.13145010164712,"weightedWattsPerKg":2.6018778585949587},"speedData":{"avgPace":152,"genuineAvgSpeed":23.658412176059294,"lowerQuartileSpeed":17.28,"medianSpeed":23.759999999999998,"speedZones":null,"standardDeviationSpeed":11.976818155145843,"totalAvgSpeed":23.658412176059294,"upperQuartileSpeed":29.880000000000003,"varianceSpeed":143.44417312143105},"toughnessScore":null},"hasPowerMeter":false,"id":188558944,"moving_time_raw":4862,"name":"10/07/2011 Montbonnot Saint Martin, RA, France","private":false,"short_unit":"km","start_time":"2011-07-10T15:18:42+0000","trainer":false,"type":"Ride"},{"bike_id":824321,"calories":715.5186853099999,"commute":false,"display_type":"Sortie à vélo","distance_raw":32943.4,"elapsed_time_raw":4862,"elevation_gain_raw":99.0665,"elevation_unit":"m","extendedStats":{"cadenceData":null,"elevationData":{"accumulatedElevationAscent":99.05405505251002,"accumulatedElevationDescent":108.39010530010975,"ascentSpeed":{"avg":-1,"lowerQuartile":446,"median":545,"upperQuartile":648},"ascentSpeedZones":null,"avgElevation":219,"elevationZones":null,"lowerQuartileElevation":215,"medianElevation":217,"upperQuartileElevation":220},"gradeData":{"avgGrade":0.0009490520104191727,"gradeProfile":"HILLY","gradeZones":null,"lowerQuartileGrade":-1.6,"medianGrade":0,"upFlatDownDistanceData":{"down":7.866099999999993,"flat":17.36850000000002,"up":7.7087999999999886},"upFlatDownInSeconds":{"down":1126,"flat":2554,"total":4862,"up":1182},"upFlatDownMoveData":{"down":25.149165186500866,"flat":24.481832419733777,"up":23.47857868020301},"upperQuartileGrade":1.5},"heartRateData":null,"moveRatio":1,"paceData":{"avgPace":152,"lowerQuartilePace":208.33333333333331,"medianPace":151.51515151515153,"paceZones":null,"upperQuartilePace":120.48192771084338,"variancePace":25.09687163766813},"powerData":{"avgWatts":127.8596161869003,"avgWattsPerKg":1.826565945527147,"hasPowerMeter":false,"lowerQuartileWatts":0,"medianWatts":77,"powerZones":null,"punchFactor":null,"upperQuartileWatts":213,"variabilityIndex":1.4244642329867025,"weightedPower":182.13145010164712,"weightedWattsPerKg":2.6018778585949587},"speedData":{"avgPace":152,"genuineAvgSpeed":23.658412176059294,"lowerQuartileSpeed":17.28,"medianSpeed":23.759999999999998,"speedZones":null,"standardDeviationSpeed":11.976818155145843,"totalAvgSpeed":23.658412176059294,"upperQuartileSpeed":29.880000000000003,"varianceSpeed":143.44417312143105},"toughnessScore":null},"hasPowerMeter":false,"id":188559691,"moving_time_raw":4862,"name":"17/07/2011 Montbonnot Saint Martin, RA, France","private":false,"short_unit":"km","start_time":"2011-07-17T15:18:42+0000","trainer":false,"type":"Ride"},{"bike_id":824321,"calories":715.5186853099999,"commute":false,"display_type":"Sortie à vélo","distance_raw":32943.4,"elapsed_time_raw":4862,"elevation_gain_raw":99.0665,"elevation_unit":"m","extendedStats":{"cadenceData":null,"elevationData":{"accumulatedElevationAscent":99.05405505251002,"accumulatedElevationDescent":108.39010530010975,"ascentSpeed":{"avg":-1,"lowerQuartile":446,"median":545,"upperQuartile":648},"ascentSpeedZones":null,"avgElevation":219,"elevationZones":null,"lowerQuartileElevation":215,"medianElevation":217,"upperQuartileElevation":220},"gradeData":{"avgGrade":0.0009490520104191727,"gradeProfile":"HILLY","gradeZones":null,"lowerQuartileGrade":-1.6,"medianGrade":0,"upFlatDownDistanceData":{"down":7.866099999999993,"flat":17.36850000000002,"up":7.7087999999999886},"upFlatDownInSeconds":{"down":1126,"flat":2554,"total":4862,"up":1182},"upFlatDownMoveData":{"down":25.149165186500866,"flat":24.481832419733777,"up":23.47857868020301},"upperQuartileGrade":1.5},"heartRateData":null,"moveRatio":1,"paceData":{"avgPace":152,"lowerQuartilePace":208.33333333333331,"medianPace":151.51515151515153,"paceZones":null,"upperQuartilePace":120.48192771084338,"variancePace":25.09687163766813},"powerData":{"avgWatts":127.8596161869003,"avgWattsPerKg":1.826565945527147,"hasPowerMeter":false,"lowerQuartileWatts":0,"medianWatts":77,"powerZones":null,"punchFactor":null,"upperQuartileWatts":213,"variabilityIndex":1.4244642329867025,"weightedPower":182.13145010164712,"weightedWattsPerKg":2.6018778585949587},"speedData":{"avgPace":152,"genuineAvgSpeed":23.658412176059294,"lowerQuartileSpeed":17.28,"medianSpeed":23.759999999999998,"speedZones":null,"standardDeviationSpeed":11.976818155145843,"totalAvgSpeed":23.658412176059294,"upperQuartileSpeed":29.880000000000003,"varianceSpeed":143.44417312143105},"toughnessScore":null},"hasPowerMeter":false,"id":188560198,"moving_time_raw":4862,"name":"24/07/2011 Montbonnot Saint Martin, RA, France","private":false,"short_unit":"km","start_time":"2011-07-24T15:18:42+0000","trainer":false,"type":"Ride"},{"bike_id":824321,"calories":715.5186853099999,"commute":false,"display_type":"Sortie à vélo","distance_raw":32943.4,"elapsed_time_raw":4862,"elevation_gain_raw":99.0665,"elevation_unit":"m","extendedStats":{"cadenceData":null,"elevationData":{"accumulatedElevationAscent":99.05405505251002,"accumulatedElevationDescent":108.39010530010975,"ascentSpeed":{"avg":-1,"lowerQuartile":446,"median":545,"upperQuartile":648},"ascentSpeedZones":null,"avgElevation":219,"elevationZones":null,"lowerQuartileElevation":215,"medianElevation":217,"upperQuartileElevation":220},"gradeData":{"avgGrade":0.0009490520104191727,"gradeProfile":"HILLY","gradeZones":null,"lowerQuartileGrade":-1.6,"medianGrade":0,"upFlatDownDistanceData":{"down":7.866099999999993,"flat":17.36850000000002,"up":7.7087999999999886},"upFlatDownInSeconds":{"down":1126,"flat":2554,"total":4862,"up":1182},"upFlatDownMoveData":{"down":25.149165186500866,"flat":24.481832419733777,"up":23.47857868020301},"upperQuartileGrade":1.5},"heartRateData":null,"moveRatio":1,"paceData":{"avgPace":152,"lowerQuartilePace":208.33333333333331,"medianPace":151.51515151515153,"paceZones":null,"upperQuartilePace":120.48192771084338,"variancePace":25.09687163766813},"powerData":{"avgWatts":127.8596161869003,"avgWattsPerKg":1.826565945527147,"hasPowerMeter":false,"lowerQuartileWatts":0,"medianWatts":77,"powerZones":null,"punchFactor":null,"upperQuartileWatts":213,"variabilityIndex":1.4244642329867025,"weightedPower":182.13145010164712,"weightedWattsPerKg":2.6018778585949587},"speedData":{"avgPace":152,"genuineAvgSpeed":23.658412176059294,"lowerQuartileSpeed":17.28,"medianSpeed":23.759999999999998,"speedZones":null,"standardDeviationSpeed":11.976818155145843,"totalAvgSpeed":23.658412176059294,"upperQuartileSpeed":29.880000000000003,"varianceSpeed":143.44417312143105},"toughnessScore":null},"hasPowerMeter":false,"id":188560546,"moving_time_raw":4862,"name":"31/07/2011 Montbonnot Saint Martin, RA, France","private":false,"short_unit":"km","start_time":"2011-07-31T15:18:42+0000","trainer":false,"type":"Ride"},{"bike_id":824321,"calories":715.5186853099999,"commute":false,"display_type":"Sortie à vélo","distance_raw":32943.4,"elapsed_time_raw":4862,"elevation_gain_raw":99.0665,"elevation_unit":"m","extendedStats":{"cadenceData":null,"elevationData":{"accumulatedElevationAscent":99.05405505251002,"accumulatedElevationDescent":108.39010530010975,"ascentSpeed":{"avg":-1,"lowerQuartile":446,"median":545,"upperQuartile":648},"ascentSpeedZones":null,"avgElevation":219,"elevationZones":null,"lowerQuartileElevation":215,"medianElevation":217,"upperQuartileElevation":220},"gradeData":{"avgGrade":0.0009490520104191727,"gradeProfile":"HILLY","gradeZones":null,"lowerQuartileGrade":-1.6,"medianGrade":0,"upFlatDownDistanceData":{"down":7.866099999999993,"flat":17.36850000000002,"up":7.7087999999999886},"upFlatDownInSeconds":{"down":1126,"flat":2554,"total":4862,"up":1182},"upFlatDownMoveData":{"down":25.149165186500866,"flat":24.481832419733777,"up":23.47857868020301},"upperQuartileGrade":1.5},"heartRateData":null,"moveRatio":1,"paceData":{"avgPace":152,"lowerQuartilePace":208.33333333333331,"medianPace":151.51515151515153,"paceZones":null,"upperQuartilePace":120.48192771084338,"variancePace":25.09687163766813},"powerData":{"avgWatts":127.8596161869003,"avgWattsPerKg":1.826565945527147,"hasPowerMeter":false,"lowerQuartileWatts":0,"medianWatts":77,"powerZones":null,"punchFactor":null,"upperQuartileWatts":213,"variabilityIndex":1.4244642329867025,"weightedPower":182.13145010164712,"weightedWattsPerKg":2.6018778585949587},"speedData":{"avgPace":152,"genuineAvgSpeed":23.658412176059294,"lowerQuartileSpeed":17.28,"medianSpeed":23.759999999999998,"speedZones":null,"standardDeviationSpeed":11.976818155145843,"totalAvgSpeed":23.658412176059294,"upperQuartileSpeed":29.880000000000003,"varianceSpeed":143.44417312143105},"toughnessScore":null},"hasPowerMeter":false,"id":188560789,"moving_time_raw":4862,"name":"07/08/2011 Montbonnot Saint Martin, RA, France","private":false,"short_unit":"km","start_time":"2011-08-07T15:18:42+0000","trainer":false,"type":"Ride"},{"bike_id":null,"calories":30.8566722325,"commute":false,"display_type":"Sortie à vélo","distance_raw":1509.4,"elapsed_time_raw":348,"elevation_gain_raw":11.93,"elevation_unit":"m","extendedStats":{"cadenceData":null,"elevationData":{"accumulatedElevationAscent":11.97866492657866,"accumulatedElevationDescent":15.597874630885912,"ascentSpeed":{"avg":469.86243696222914,"lowerQuartile":466,"median":607,"upperQuartile":773},"ascentSpeedZones":null,"avgElevation":246,"elevationZones":null,"lowerQuartileElevation":244,"medianElevation":245,"upperQuartileElevation":247},"gradeData":{"avgGrade":0.08854511726513886,"gradeProfile":"HILLY","gradeZones":null,"lowerQuartileGrade":-2.3,"medianGrade":0.1,"upFlatDownDistanceData":{"down":0.4658,"flat":0.4779000000000001,"up":0.5657000000000001},"upFlatDownInSeconds":{"down":86,"flat":83,"total":291,"up":122},"upFlatDownMoveData":{"down":19.49860465116279,"flat":20.72819277108434,"up":16.692786885245905},"upperQuartileGrade":3.2},"heartRateData":null,"moveRatio":0.8362068965517241,"paceData":{"avgPace":191,"lowerQuartilePace":243.90243902439028,"medianPace":185.18518518518516,"paceZones":null,"upperQuartilePace":151.51515151515153,"variancePace":34.87528648646315},"powerData":{"avgWatts":103.32575757575758,"avgWattsPerKg":1.476082251082251,"hasPowerMeter":false,"lowerQuartileWatts":0,"medianWatts":66,"powerZones":null,"punchFactor":null,"upperQuartileWatts":166,"variabilityIndex":1.6787545407009017,"weightedPower":173.45858470166363,"weightedWattsPerKg":2.4779797814523374},"speedData":{"avgPace":191,"genuineAvgSpeed":18.861030927835042,"lowerQuartileSpeed":14.76,"medianSpeed":19.44,"speedZones":null,"standardDeviationSpeed":10.159968429729311,"totalAvgSpeed":15.771724137931026,"upperQuartileSpeed":23.759999999999998,"varianceSpeed":103.22495849309627},"toughnessScore":null},"hasPowerMeter":false,"id":170283734,"moving_time_raw":283,"name":"12/08/2011 Montbonnot Saint Martin, RA, France","private":false,"short_unit":"km","start_time":"2011-08-12T21:05:05+0000","trainer":false,"type":"Ride"},{"bike_id":824321,"calories":715.5186853099999,"commute":false,"display_type":"Sortie à vélo","distance_raw":32943.4,"elapsed_time_raw":4862,"elevation_gain_raw":99.0665,"elevation_unit":"m","extendedStats":{"cadenceData":null,"elevationData":{"accumulatedElevationAscent":99.05405505251002,"accumulatedElevationDescent":108.39010530010975,"ascentSpeed":{"avg":-1,"lowerQuartile":446,"median":545,"upperQuartile":648},"ascentSpeedZones":null,"avgElevation":219,"elevationZones":null,"lowerQuartileElevation":215,"medianElevation":217,"upperQuartileElevation":220},"gradeData":{"avgGrade":0.0009490520104191727,"gradeProfile":"HILLY","gradeZones":null,"lowerQuartileGrade":-1.6,"medianGrade":0,"upFlatDownDistanceData":{"down":7.866099999999993,"flat":17.36850000000002,"up":7.7087999999999886},"upFlatDownInSeconds":{"down":1126,"flat":2554,"total":4862,"up":1182},"upFlatDownMoveData":{"down":25.149165186500866,"flat":24.481832419733777,"up":23.47857868020301},"upperQuartileGrade":1.5},"heartRateData":null,"moveRatio":1,"paceData":{"avgPace":152,"lowerQuartilePace":208.33333333333331,"medianPace":151.51515151515153,"paceZones":null,"upperQuartilePace":120.48192771084338,"variancePace":25.09687163766813},"powerData":{"avgWatts":127.8596161869003,"avgWattsPerKg":1.826565945527147,"hasPowerMeter":false,"lowerQuartileWatts":0,"medianWatts":77,"powerZones":null,"punchFactor":null,"upperQuartileWatts":213,"variabilityIndex":1.4244642329867025,"weightedPower":182.13145010164712,"weightedWattsPerKg":2.6018778585949587},"speedData":{"avgPace":152,"genuineAvgSpeed":23.658412176059294,"lowerQuartileSpeed":17.28,"medianSpeed":23.759999999999998,"speedZones":null,"standardDeviationSpeed":11.976818155145843,"totalAvgSpeed":23.658412176059294,"upperQuartileSpeed":29.880000000000003,"varianceSpeed":143.44417312143105},"toughnessScore":null},"hasPowerMeter":false,"id":188561618,"moving_time_raw":4862,"name":"14/08/2011 Montbonnot Saint Martin, RA, France","private":false,"short_unit":"km","start_time":"2011-08-14T15:18:42+0000","trainer":false,"type":"Ride"},{"bike_id":824321,"calories":715.5186853099999,"commute":false,"display_type":"Sortie à vélo","distance_raw":32943.4,"elapsed_time_raw":4862,"elevation_gain_raw":99.0665,"elevation_unit":"m","extendedStats":{"cadenceData":null,"elevationData":{"accumulatedElevationAscent":99.05405505251002,"accumulatedElevationDescent":108.39010530010975,"ascentSpeed":{"avg":-1,"lowerQuartile":446,"median":545,"upperQuartile":648},"ascentSpeedZones":null,"avgElevation":219,"elevationZones":null,"lowerQuartileElevation":215,"medianElevation":217,"upperQuartileElevation":220},"gradeData":{"avgGrade":0.0009490520104191727,"gradeProfile":"HILLY","gradeZones":null,"lowerQuartileGrade":-1.6,"medianGrade":0,"upFlatDownDistanceData":{"down":7.866099999999993,"flat":17.36850000000002,"up":7.7087999999999886},"upFlatDownInSeconds":{"down":1126,"flat":2554,"total":4862,"up":1182},"upFlatDownMoveData":{"down":25.149165186500866,"flat":24.481832419733777,"up":23.47857868020301},"upperQuartileGrade":1.5},"heartRateData":null,"moveRatio":1,"paceData":{"avgPace":152,"lowerQuartilePace":208.33333333333331,"medianPace":151.51515151515153,"paceZones":null,"upperQuartilePace":120.48192771084338,"variancePace":25.09687163766813},"powerData":{"avgWatts":127.8596161869003,"avgWattsPerKg":1.826565945527147,"hasPowerMeter":false,"lowerQuartileWatts":0,"medianWatts":77,"powerZones":null,"punchFactor":null,"upperQuartileWatts":213,"variabilityIndex":1.4244642329867025,"weightedPower":182.13145010164712,"weightedWattsPerKg":2.6018778585949587},"speedData":{"avgPace":152,"genuineAvgSpeed":23.658412176059294,"lowerQuartileSpeed":17.28,"medianSpeed":23.759999999999998,"speedZones":null,"standardDeviationSpeed":11.976818155145843,"totalAvgSpeed":23.658412176059294,"upperQuartileSpeed":29.880000000000003,"varianceSpeed":143.44417312143105},"toughnessScore":null},"hasPowerMeter":false,"id":188561959,"moving_time_raw":4862,"name":"21/08/2011 Montbonnot Saint Martin, RA, France","private":false,"short_unit":"km","start_time":"2011-08-21T15:18:42+0000","trainer":false,"type":"Ride"},{"bike_id":824321,"calories":715.5186853099999,"commute":false,"display_type":"Sortie à vélo","distance_raw":32943.4,"elapsed_time_raw":4862,"elevation_gain_raw":99.0665,"elevation_unit":"m","extendedStats":{"cadenceData":null,"elevationData":{"accumulatedElevationAscent":99.05405505251002,"accumulatedElevationDescent":108.39010530010975,"ascentSpeed":{"avg":-1,"lowerQuartile":446,"median":545,"upperQuartile":648},"ascentSpeedZones":null,"avgElevation":219,"elevationZones":null,"lowerQuartileElevation":215,"medianElevation":217,"upperQuartileElevation":220},"gradeData":{"avgGrade":0.0009490520104191727,"gradeProfile":"HILLY","gradeZones":null,"lowerQuartileGrade":-1.6,"medianGrade":0,"upFlatDownDistanceData":{"down":7.866099999999993,"flat":17.36850000000002,"up":7.7087999999999886},"upFlatDownInSeconds":{"down":1126,"flat":2554,"total":4862,"up":1182},"upFlatDownMoveData":{"down":25.149165186500866,"flat":24.481832419733777,"up":23.47857868020301},"upperQuartileGrade":1.5},"heartRateData":null,"moveRatio":1,"paceData":{"avgPace":152,"lowerQuartilePace":208.33333333333331,"medianPace":151.51515151515153,"paceZones":null,"upperQuartilePace":120.48192771084338,"variancePace":25.09687163766813},"powerData":{"avgWatts":127.8596161869003,"avgWattsPerKg":1.826565945527147,"hasPowerMeter":false,"lowerQuartileWatts":0,"medianWatts":77,"powerZones":null,"punchFactor":null,"upperQuartileWatts":213,"variabilityIndex":1.4244642329867025,"weightedPower":182.13145010164712,"weightedWattsPerKg":2.6018778585949587},"speedData":{"avgPace":152,"genuineAvgSpeed":23.658412176059294,"lowerQuartileSpeed":17.28,"medianSpeed":23.759999999999998,"speedZones":null,"standardDeviationSpeed":11.976818155145843,"totalAvgSpeed":23.658412176059294,"upperQuartileSpeed":29.880000000000003,"varianceSpeed":143.44417312143105},"toughnessScore":null},"hasPowerMeter":false,"id":188562269,"moving_time_raw":4862,"name":"28/08/2011 Montbonnot Saint Martin, RA, France","private":false,"short_unit":"km","start_time":"2011-08-28T15:18:42+0000","trainer":false,"type":"Ride"},{"bike_id":824321,"calories":715.5186853099999,"commute":false,"display_type":"Sortie à vélo","distance_raw":32943.4,"elapsed_time_raw":4862,"elevation_gain_raw":99.0665,"elevation_unit":"m","extendedStats":{"cadenceData":null,"elevationData":{"accumulatedElevationAscent":99.05405505251002,"accumulatedElevationDescent":108.39010530010975,"ascentSpeed":{"avg":-1,"lowerQuartile":446,"median":545,"upperQuartile":648},"ascentSpeedZones":null,"avgElevation":219,"elevationZones":null,"lowerQuartileElevation":215,"medianElevation":217,"upperQuartileElevation":220},"gradeData":{"avgGrade":0.0009490520104191727,"gradeProfile":"HILLY","gradeZones":null,"lowerQuartileGrade":-1.6,"medianGrade":0,"upFlatDownDistanceData":{"down":7.866099999999993,"flat":17.36850000000002,"up":7.7087999999999886},"upFlatDownInSeconds":{"down":1126,"flat":2554,"total":4862,"up":1182},"upFlatDownMoveData":{"down":25.149165186500866,"flat":24.481832419733777,"up":23.47857868020301},"upperQuartileGrade":1.5},"heartRateData":null,"moveRatio":1,"paceData":{"avgPace":152,"lowerQuartilePace":208.33333333333331,"medianPace":151.51515151515153,"paceZones":null,"upperQuartilePace":120.48192771084338,"variancePace":25.09687163766813},"powerData":{"avgWatts":127.8596161869003,"avgWattsPerKg":1.826565945527147,"hasPowerMeter":false,"lowerQuartileWatts":0,"medianWatts":77,"powerZones":null,"punchFactor":null,"upperQuartileWatts":213,"variabilityIndex":1.4244642329867025,"weightedPower":182.13145010164712,"weightedWattsPerKg":2.6018778585949587},"speedData":{"avgPace":152,"genuineAvgSpeed":23.658412176059294,"lowerQuartileSpeed":17.28,"medianSpeed":23.759999999999998,"speedZones":null,"standardDeviationSpeed":11.976818155145843,"totalAvgSpeed":23.658412176059294,"upperQuartileSpeed":29.880000000000003,"varianceSpeed":143.44417312143105},"toughnessScore":null},"hasPowerMeter":false,"id":188562925,"moving_time_raw":4862,"name":"04/09/2011 Montbonnot Saint Martin, RA, France","private":false,"short_unit":"km","start_time":"2011-09-04T15:18:42+0000","trainer":false,"type":"Ride"},{"bike_id":824321,"calories":715.5186853099999,"commute":false,"display_type":"Sortie à vélo","distance_raw":32943.4,"elapsed_time_raw":4862,"elevation_gain_raw":99.0665,"elevation_unit":"m","extendedStats":{"cadenceData":null,"elevationData":{"accumulatedElevationAscent":99.05405505251002,"accumulatedElevationDescent":108.39010530010975,"ascentSpeed":{"avg":-1,"lowerQuartile":446,"median":545,"upperQuartile":648},"ascentSpeedZones":null,"avgElevation":219,"elevationZones":null,"lowerQuartileElevation":215,"medianElevation":217,"upperQuartileElevation":220},"gradeData":{"avgGrade":0.0009490520104191727,"gradeProfile":"HILLY","gradeZones":null,"lowerQuartileGrade":-1.6,"medianGrade":0,"upFlatDownDistanceData":{"down":7.866099999999993,"flat":17.36850000000002,"up":7.7087999999999886},"upFlatDownInSeconds":{"down":1126,"flat":2554,"total":4862,"up":1182},"upFlatDownMoveData":{"down":25.149165186500866,"flat":24.481832419733777,"up":23.47857868020301},"upperQuartileGrade":1.5},"heartRateData":null,"moveRatio":1,"paceData":{"avgPace":152,"lowerQuartilePace":208.33333333333331,"medianPace":151.51515151515153,"paceZones":null,"upperQuartilePace":120.48192771084338,"variancePace":25.09687163766813},"powerData":{"avgWatts":127.8596161869003,"avgWattsPerKg":1.826565945527147,"hasPowerMeter":false,"lowerQuartileWatts":0,"medianWatts":77,"powerZones":null,"punchFactor":null,"upperQuartileWatts":213,"variabilityIndex":1.4244642329867025,"weightedPower":182.13145010164712,"weightedWattsPerKg":2.6018778585949587},"speedData":{"avgPace":152,"genuineAvgSpeed":23.658412176059294,"lowerQuartileSpeed":17.28,"medianSpeed":23.759999999999998,"speedZones":null,"standardDeviationSpeed":11.976818155145843,"totalAvgSpeed":23.658412176059294,"upperQuartileSpeed":29.880000000000003,"varianceSpeed":143.44417312143105},"toughnessScore":null},"hasPowerMeter":false,"id":188563423,"moving_time_raw":4862,"name":"11/09/2011 Montbonnot Saint Martin, RA, France","private":false,"short_unit":"km","start_time":"2011-09-11T15:18:42+0000","trainer":false,"type":"Ride"},{"bike_id":824321,"calories":715.5186853099999,"commute":false,"display_type":"Sortie à vélo","distance_raw":32943.4,"elapsed_time_raw":4862,"elevation_gain_raw":99.0665,"elevation_unit":"m","extendedStats":{"cadenceData":null,"elevationData":{"accumulatedElevationAscent":99.05405505251002,"accumulatedElevationDescent":108.39010530010975,"ascentSpeed":{"avg":-1,"lowerQuartile":446,"median":545,"upperQuartile":648},"ascentSpeedZones":null,"avgElevation":219,"elevationZones":null,"lowerQuartileElevation":215,"medianElevation":217,"upperQuartileElevation":220},"gradeData":{"avgGrade":0.0009490520104191727,"gradeProfile":"HILLY","gradeZones":null,"lowerQuartileGrade":-1.6,"medianGrade":0,"upFlatDownDistanceData":{"down":7.866099999999993,"flat":17.36850000000002,"up":7.7087999999999886},"upFlatDownInSeconds":{"down":1126,"flat":2554,"total":4862,"up":1182},"upFlatDownMoveData":{"down":25.149165186500866,"flat":24.481832419733777,"up":23.47857868020301},"upperQuartileGrade":1.5},"heartRateData":null,"moveRatio":1,"paceData":{"avgPace":152,"lowerQuartilePace":208.33333333333331,"medianPace":151.51515151515153,"paceZones":null,"upperQuartilePace":120.48192771084338,"variancePace":25.09687163766813},"powerData":{"avgWatts":127.8596161869003,"avgWattsPerKg":1.826565945527147,"hasPowerMeter":false,"lowerQuartileWatts":0,"medianWatts":77,"powerZones":null,"punchFactor":null,"upperQuartileWatts":213,"variabilityIndex":1.4244642329867025,"weightedPower":182.13145010164712,"weightedWattsPerKg":2.6018778585949587},"speedData":{"avgPace":152,"genuineAvgSpeed":23.658412176059294,"lowerQuartileSpeed":17.28,"medianSpeed":23.759999999999998,"speedZones":null,"standardDeviationSpeed":11.976818155145843,"totalAvgSpeed":23.658412176059294,"upperQuartileSpeed":29.880000000000003,"varianceSpeed":143.44417312143105},"toughnessScore":null},"hasPowerMeter":false,"id":188563934,"moving_time_raw":4862,"name":"18/09/2011 Montbonnot Saint Martin, RA, France","private":false,"short_unit":"km","start_time":"2011-09-18T15:18:42+0000","trainer":false,"type":"Ride"},{"bike_id":824321,"calories":715.5186853099999,"commute":false,"display_type":"Sortie à vélo","distance_raw":32943.4,"elapsed_time_raw":4862,"elevation_gain_raw":99.0665,"elevation_unit":"m","extendedStats":{"cadenceData":null,"elevationData":{"accumulatedElevationAscent":99.05405505251002,"accumulatedElevationDescent":108.39010530010975,"ascentSpeed":{"avg":-1,"lowerQuartile":446,"median":545,"upperQuartile":648},"ascentSpeedZones":null,"avgElevation":219,"elevationZones":null,"lowerQuartileElevation":215,"medianElevation":217,"upperQuartileElevation":220},"gradeData":{"avgGrade":0.0009490520104191727,"gradeProfile":"HILLY","gradeZones":null,"lowerQuartileGrade":-1.6,"medianGrade":0,"upFlatDownDistanceData":{"down":7.866099999999993,"flat":17.36850000000002,"up":7.7087999999999886},"upFlatDownInSeconds":{"down":1126,"flat":2554,"total":4862,"up":1182},"upFlatDownMoveData":{"down":25.149165186500866,"flat":24.481832419733777,"up":23.47857868020301},"upperQuartileGrade":1.5},"heartRateData":null,"moveRatio":1,"paceData":{"avgPace":152,"lowerQuartilePace":208.33333333333331,"medianPace":151.51515151515153,"paceZones":null,"upperQuartilePace":120.48192771084338,"variancePace":25.09687163766813},"powerData":{"avgWatts":127.8596161869003,"avgWattsPerKg":1.826565945527147,"hasPowerMeter":false,"lowerQuartileWatts":0,"medianWatts":77,"powerZones":null,"punchFactor":null,"upperQuartileWatts":213,"variabilityIndex":1.4244642329867025,"weightedPower":182.13145010164712,"weightedWattsPerKg":2.6018778585949587},"speedData":{"avgPace":152,"genuineAvgSpeed":23.658412176059294,"lowerQuartileSpeed":17.28,"medianSpeed":23.759999999999998,"speedZones":null,"standardDeviationSpeed":11.976818155145843,"totalAvgSpeed":23.658412176059294,"upperQuartileSpeed":29.880000000000003,"varianceSpeed":143.44417312143105},"toughnessScore":null},"hasPowerMeter":false,"id":188564358,"moving_time_raw":4862,"name":"25/09/2011 Montbonnot Saint Martin, RA, France","private":false,"short_unit":"km","start_time":"2011-09-25T15:18:42+0000","trainer":false,"type":"Ride"},{"bike_id":824321,"calories":715.5186853099999,"commute":false,"display_type":"Sortie à vélo","distance_raw":32943.4,"elapsed_time_raw":4862,"elevation_gain_raw":99.0665,"elevation_unit":"m","extendedStats":{"cadenceData":null,"elevationData":{"accumulatedElevationAscent":99.05405505251002,"accumulatedElevationDescent":108.39010530010975,"ascentSpeed":{"avg":-1,"lowerQuartile":446,"median":545,"upperQuartile":648},"ascentSpeedZones":null,"avgElevation":219,"elevationZones":null,"lowerQuartileElevation":215,"medianElevation":217,"upperQuartileElevation":220},"gradeData":{"avgGrade":0.0009490520104191727,"gradeProfile":"HILLY","gradeZones":null,"lowerQuartileGrade":-1.6,"medianGrade":0,"upFlatDownDistanceData":{"down":7.866099999999993,"flat":17.36850000000002,"up":7.7087999999999886},"upFlatDownInSeconds":{"down":1126,"flat":2554,"total":4862,"up":1182},"upFlatDownMoveData":{"down":25.149165186500866,"flat":24.481832419733777,"up":23.47857868020301},"upperQuartileGrade":1.5},"heartRateData":null,"moveRatio":1,"paceData":{"avgPace":152,"lowerQuartilePace":208.33333333333331,"medianPace":151.51515151515153,"paceZones":null,"upperQuartilePace":120.48192771084338,"variancePace":25.09687163766813},"powerData":{"avgWatts":127.8596161869003,"avgWattsPerKg":1.826565945527147,"hasPowerMeter":false,"lowerQuartileWatts":0,"medianWatts":77,"powerZones":null,"punchFactor":null,"upperQuartileWatts":213,"variabilityIndex":1.4244642329867025,"weightedPower":182.13145010164712,"weightedWattsPerKg":2.6018778585949587},"speedData":{"avgPace":152,"genuineAvgSpeed":23.658412176059294,"lowerQuartileSpeed":17.28,"medianSpeed":23.759999999999998,"speedZones":null,"standardDeviationSpeed":11.976818155145843,"totalAvgSpeed":23.658412176059294,"upperQuartileSpeed":29.880000000000003,"varianceSpeed":143.44417312143105},"toughnessScore":null},"hasPowerMeter":false,"id":188565018,"moving_time_raw":4862,"name":"02/10/2011 Montbonnot Saint Martin, RA, France","private":false,"short_unit":"km","start_time":"2011-10-02T15:18:42+0000","trainer":false,"type":"Ride"},{"bike_id":824321,"calories":715.5186853099999,"commute":false,"display_type":"Sortie à vélo","distance_raw":32943.4,"elapsed_time_raw":4862,"elevation_gain_raw":99.0665,"elevation_unit":"m","extendedStats":{"cadenceData":null,"elevationData":{"accumulatedElevationAscent":99.05405505251002,"accumulatedElevationDescent":108.39010530010975,"ascentSpeed":{"avg":-1,"lowerQuartile":446,"median":545,"upperQuartile":648},"ascentSpeedZones":null,"avgElevation":219,"elevationZones":null,"lowerQuartileElevation":215,"medianElevation":217,"upperQuartileElevation":220},"gradeData":{"avgGrade":0.0009490520104191727,"gradeProfile":"HILLY","gradeZones":null,"lowerQuartileGrade":-1.6,"medianGrade":0,"upFlatDownDistanceData":{"down":7.866099999999993,"flat":17.36850000000002,"up":7.7087999999999886},"upFlatDownInSeconds":{"down":1126,"flat":2554,"total":4862,"up":1182},"upFlatDownMoveData":{"down":25.149165186500866,"flat":24.481832419733777,"up":23.47857868020301},"upperQuartileGrade":1.5},"heartRateData":null,"moveRatio":1,"paceData":{"avgPace":152,"lowerQuartilePace":208.33333333333331,"medianPace":151.51515151515153,"paceZones":null,"upperQuartilePace":120.48192771084338,"variancePace":25.09687163766813},"powerData":{"avgWatts":127.8596161869003,"avgWattsPerKg":1.826565945527147,"hasPowerMeter":false,"lowerQuartileWatts":0,"medianWatts":77,"powerZones":null,"punchFactor":null,"upperQuartileWatts":213,"variabilityIndex":1.4244642329867025,"weightedPower":182.13145010164712,"weightedWattsPerKg":2.6018778585949587},"speedData":{"avgPace":152,"genuineAvgSpeed":23.658412176059294,"lowerQuartileSpeed":17.28,"medianSpeed":23.759999999999998,"speedZones":null,"standardDeviationSpeed":11.976818155145843,"totalAvgSpeed":23.658412176059294,"upperQuartileSpeed":29.880000000000003,"varianceSpeed":143.44417312143105},"toughnessScore":null},"hasPowerMeter":false,"id":188565292,"moving_time_raw":4862,"name":"09/10/2011 Montbonnot Saint Martin, RA, France","private":false,"short_unit":"km","start_time":"2011-10-09T15:18:42+0000","trainer":false,"type":"Ride"},{"bike_id":824321,"calories":715.5186853099999,"commute":false,"display_type":"Sortie à vélo","distance_raw":32943.4,"elapsed_time_raw":4862,"elevation_gain_raw":99.0665,"elevation_unit":"m","extendedStats":{"cadenceData":null,"elevationData":{"accumulatedElevationAscent":99.05405505251002,"accumulatedElevationDescent":108.39010530010975,"ascentSpeed":{"avg":-1,"lowerQuartile":446,"median":545,"upperQuartile":648},"ascentSpeedZones":null,"avgElevation":219,"elevationZones":null,"lowerQuartileElevation":215,"medianElevation":217,"upperQuartileElevation":220},"gradeData":{"avgGrade":0.0009490520104191727,"gradeProfile":"HILLY","gradeZones":null,"lowerQuartileGrade":-1.6,"medianGrade":0,"upFlatDownDistanceData":{"down":7.866099999999993,"flat":17.36850000000002,"up":7.7087999999999886},"upFlatDownInSeconds":{"down":1126,"flat":2554,"total":4862,"up":1182},"upFlatDownMoveData":{"down":25.149165186500866,"flat":24.481832419733777,"up":23.47857868020301},"upperQuartileGrade":1.5},"heartRateData":null,"moveRatio":1,"paceData":{"avgPace":152,"lowerQuartilePace":208.33333333333331,"medianPace":151.51515151515153,"paceZones":null,"upperQuartilePace":120.48192771084338,"variancePace":25.09687163766813},"powerData":{"avgWatts":127.8596161869003,"avgWattsPerKg":1.826565945527147,"hasPowerMeter":false,"lowerQuartileWatts":0,"medianWatts":77,"powerZones":null,"punchFactor":null,"upperQuartileWatts":213,"variabilityIndex":1.4244642329867025,"weightedPower":182.13145010164712,"weightedWattsPerKg":2.6018778585949587},"speedData":{"avgPace":152,"genuineAvgSpeed":23.658412176059294,"lowerQuartileSpeed":17.28,"medianSpeed":23.759999999999998,"speedZones":null,"standardDeviationSpeed":11.976818155145843,"totalAvgSpeed":23.658412176059294,"upperQuartileSpeed":29.880000000000003,"varianceSpeed":143.44417312143105},"toughnessScore":null},"hasPowerMeter":false,"id":188565605,"moving_time_raw":4862,"name":"16/10/2011 Montbonnot Saint Martin, RA, France","private":false,"short_unit":"km","start_time":"2011-10-16T15:18:42+0000","trainer":false,"type":"Ride"},{"bike_id":824321,"calories":715.5186853099999,"commute":false,"display_type":"Sortie à vélo","distance_raw":32943.4,"elapsed_time_raw":4862,"elevation_gain_raw":99.0665,"elevation_unit":"m","extendedStats":{"cadenceData":null,"elevationData":{"accumulatedElevationAscent":99.05405505251002,"accumulatedElevationDescent":108.39010530010975,"ascentSpeed":{"avg":-1,"lowerQuartile":446,"median":545,"upperQuartile":648},"ascentSpeedZones":null,"avgElevation":219,"elevationZones":null,"lowerQuartileElevation":215,"medianElevation":217,"upperQuartileElevation":220},"gradeData":{"avgGrade":0.0009490520104191727,"gradeProfile":"HILLY","gradeZones":null,"lowerQuartileGrade":-1.6,"medianGrade":0,"upFlatDownDistanceData":{"down":7.866099999999993,"flat":17.36850000000002,"up":7.7087999999999886},"upFlatDownInSeconds":{"down":1126,"flat":2554,"total":4862,"up":1182},"upFlatDownMoveData":{"down":25.149165186500866,"flat":24.481832419733777,"up":23.47857868020301},"upperQuartileGrade":1.5},"heartRateData":null,"moveRatio":1,"paceData":{"avgPace":152,"lowerQuartilePace":208.33333333333331,"medianPace":151.51515151515153,"paceZones":null,"upperQuartilePace":120.48192771084338,"variancePace":25.09687163766813},"powerData":{"avgWatts":127.8596161869003,"avgWattsPerKg":1.826565945527147,"hasPowerMeter":false,"lowerQuartileWatts":0,"medianWatts":77,"powerZones":null,"punchFactor":null,"upperQuartileWatts":213,"variabilityIndex":1.4244642329867025,"weightedPower":182.13145010164712,"weightedWattsPerKg":2.6018778585949587},"speedData":{"avgPace":152,"genuineAvgSpeed":23.658412176059294,"lowerQuartileSpeed":17.28,"medianSpeed":23.759999999999998,"speedZones":null,"standardDeviationSpeed":11.976818155145843,"totalAvgSpeed":23.658412176059294,"upperQuartileSpeed":29.880000000000003,"varianceSpeed":143.44417312143105},"toughnessScore":null},"hasPowerMeter":false,"id":188565950,"moving_time_raw":4862,"name":"23/10/2011 Montbonnot Saint Martin, RA, France","private":false,"short_unit":"km","start_time":"2011-10-23T15:18:42+0000","trainer":false,"type":"Ride"},{"bike_id":824321,"calories":715.5186853099999,"commute":false,"display_type":"Sortie à vélo","distance_raw":32943.4,"elapsed_time_raw":4862,"elevation_gain_raw":99.0665,"elevation_unit":"m","extendedStats":{"cadenceData":null,"elevationData":{"accumulatedElevationAscent":99.05405505251002,"accumulatedElevationDescent":108.39010530010975,"ascentSpeed":{"avg":-1,"lowerQuartile":446,"median":545,"upperQuartile":648},"ascentSpeedZones":null,"avgElevation":219,"elevationZones":null,"lowerQuartileElevation":215,"medianElevation":217,"upperQuartileElevation":220},"gradeData":{"avgGrade":0.0009490520104191727,"gradeProfile":"HILLY","gradeZones":null,"lowerQuartileGrade":-1.6,"medianGrade":0,"upFlatDownDistanceData":{"down":7.866099999999993,"flat":17.36850000000002,"up":7.7087999999999886},"upFlatDownInSeconds":{"down":1126,"flat":2554,"total":4862,"up":1182},"upFlatDownMoveData":{"down":25.149165186500866,"flat":24.481832419733777,"up":23.47857868020301},"upperQuartileGrade":1.5},"heartRateData":null,"moveRatio":1,"paceData":{"avgPace":152,"lowerQuartilePace":208.33333333333331,"medianPace":151.51515151515153,"paceZones":null,"upperQuartilePace":120.48192771084338,"variancePace":25.09687163766813},"powerData":{"avgWatts":127.8596161869003,"avgWattsPerKg":1.826565945527147,"hasPowerMeter":false,"lowerQuartileWatts":0,"medianWatts":77,"powerZones":null,"punchFactor":null,"upperQuartileWatts":213,"variabilityIndex":1.4244642329867025,"weightedPower":182.13145010164712,"weightedWattsPerKg":2.6018778585949587},"speedData":{"avgPace":152,"genuineAvgSpeed":23.658412176059294,"lowerQuartileSpeed":17.28,"medianSpeed":23.759999999999998,"speedZones":null,"standardDeviationSpeed":11.976818155145843,"totalAvgSpeed":23.658412176059294,"upperQuartileSpeed":29.880000000000003,"varianceSpeed":143.44417312143105},"toughnessScore":null},"hasPowerMeter":false,"id":188566353,"moving_time_raw":4862,"name":"30/10/2011 Montbonnot Saint Martin, RA, France","private":false,"short_unit":"km","start_time":"2011-10-30T15:18:42+0000","trainer":false,"type":"Ride"},{"bike_id":824321,"calories":715.5186853099999,"commute":false,"display_type":"Sortie à vélo","distance_raw":32943.4,"elapsed_time_raw":4862,"elevation_gain_raw":99.0665,"elevation_unit":"m","extendedStats":{"cadenceData":null,"elevationData":{"accumulatedElevationAscent":99.05405505251002,"accumulatedElevationDescent":108.39010530010975,"ascentSpeed":{"avg":-1,"lowerQuartile":446,"median":545,"upperQuartile":648},"ascentSpeedZones":null,"avgElevation":219,"elevationZones":null,"lowerQuartileElevation":215,"medianElevation":217,"upperQuartileElevation":220},"gradeData":{"avgGrade":0.0009490520104191727,"gradeProfile":"HILLY","gradeZones":null,"lowerQuartileGrade":-1.6,"medianGrade":0,"upFlatDownDistanceData":{"down":7.866099999999993,"flat":17.36850000000002,"up":7.7087999999999886},"upFlatDownInSeconds":{"down":1126,"flat":2554,"total":4862,"up":1182},"upFlatDownMoveData":{"down":25.149165186500866,"flat":24.481832419733777,"up":23.47857868020301},"upperQuartileGrade":1.5},"heartRateData":null,"moveRatio":1,"paceData":{"avgPace":152,"lowerQuartilePace":208.33333333333331,"medianPace":151.51515151515153,"paceZones":null,"upperQuartilePace":120.48192771084338,"variancePace":25.09687163766813},"powerData":{"avgWatts":127.8596161869003,"avgWattsPerKg":1.826565945527147,"hasPowerMeter":false,"lowerQuartileWatts":0,"medianWatts":77,"powerZones":null,"punchFactor":null,"upperQuartileWatts":213,"variabilityIndex":1.4244642329867025,"weightedPower":182.13145010164712,"weightedWattsPerKg":2.6018778585949587},"speedData":{"avgPace":152,"genuineAvgSpeed":23.658412176059294,"lowerQuartileSpeed":17.28,"medianSpeed":23.759999999999998,"speedZones":null,"standardDeviationSpeed":11.976818155145843,"totalAvgSpeed":23.658412176059294,"upperQuartileSpeed":29.880000000000003,"varianceSpeed":143.44417312143105},"toughnessScore":null},"hasPowerMeter":false,"id":188566801,"moving_time_raw":4862,"name":"05/11/2011 Montbonnot Saint Martin, RA, France","private":false,"short_unit":"km","start_time":"2011-11-05T15:18:42+0000","trainer":false,"type":"Ride"},{"bike_id":824321,"calories":715.5186853099999,"commute":false,"display_type":"Sortie à vélo","distance_raw":32943.4,"elapsed_time_raw":4862,"elevation_gain_raw":99.0665,"elevation_unit":"m","extendedStats":{"cadenceData":null,"elevationData":{"accumulatedElevationAscent":99.05405505251002,"accumulatedElevationDescent":108.39010530010975,"ascentSpeed":{"avg":-1,"lowerQuartile":446,"median":545,"upperQuartile":648},"ascentSpeedZones":null,"avgElevation":219,"elevationZones":null,"lowerQuartileElevation":215,"medianElevation":217,"upperQuartileElevation":220},"gradeData":{"avgGrade":0.0009490520104191727,"gradeProfile":"HILLY","gradeZones":null,"lowerQuartileGrade":-1.6,"medianGrade":0,"upFlatDownDistanceData":{"down":7.866099999999993,"flat":17.36850000000002,"up":7.7087999999999886},"upFlatDownInSeconds":{"down":1126,"flat":2554,"total":4862,"up":1182},"upFlatDownMoveData":{"down":25.149165186500866,"flat":24.481832419733777,"up":23.47857868020301},"upperQuartileGrade":1.5},"heartRateData":null,"moveRatio":1,"paceData":{"avgPace":152,"lowerQuartilePace":208.33333333333331,"medianPace":151.51515151515153,"paceZones":null,"upperQuartilePace":120.48192771084338,"variancePace":25.09687163766813},"powerData":{"avgWatts":127.8596161869003,"avgWattsPerKg":1.826565945527147,"hasPowerMeter":false,"lowerQuartileWatts":0,"medianWatts":77,"powerZones":null,"punchFactor":null,"upperQuartileWatts":213,"variabilityIndex":1.4244642329867025,"weightedPower":182.13145010164712,"weightedWattsPerKg":2.6018778585949587},"speedData":{"avgPace":152,"genuineAvgSpeed":23.658412176059294,"lowerQuartileSpeed":17.28,"medianSpeed":23.759999999999998,"speedZones":null,"standardDeviationSpeed":11.976818155145843,"totalAvgSpeed":23.658412176059294,"upperQuartileSpeed":29.880000000000003,"varianceSpeed":143.44417312143105},"toughnessScore":null},"hasPowerMeter":false,"id":188567092,"moving_time_raw":4862,"name":"12/11/2011 Montbonnot Saint Martin, RA, France","private":false,"short_unit":"km","start_time":"2011-11-12T15:18:42+0000","trainer":false,"type":"Ride"},{"bike_id":824321,"calories":715.5186853099999,"commute":false,"display_type":"Sortie à vélo","distance_raw":32943.4,"elapsed_time_raw":4862,"elevation_gain_raw":99.0665,"elevation_unit":"m","extendedStats":{"cadenceData":null,"elevationData":{"accumulatedElevationAscent":99.05405505251002,"accumulatedElevationDescent":108.39010530010975,"ascentSpeed":{"avg":-1,"lowerQuartile":446,"median":545,"upperQuartile":648},"ascentSpeedZones":null,"avgElevation":219,"elevationZones":null,"lowerQuartileElevation":215,"medianElevation":217,"upperQuartileElevation":220},"gradeData":{"avgGrade":0.0009490520104191727,"gradeProfile":"HILLY","gradeZones":null,"lowerQuartileGrade":-1.6,"medianGrade":0,"upFlatDownDistanceData":{"down":7.866099999999993,"flat":17.36850000000002,"up":7.7087999999999886},"upFlatDownInSeconds":{"down":1126,"flat":2554,"total":4862,"up":1182},"upFlatDownMoveData":{"down":25.149165186500866,"flat":24.481832419733777,"up":23.47857868020301},"upperQuartileGrade":1.5},"heartRateData":null,"moveRatio":1,"paceData":{"avgPace":152,"lowerQuartilePace":208.33333333333331,"medianPace":151.51515151515153,"paceZones":null,"upperQuartilePace":120.48192771084338,"variancePace":25.09687163766813},"powerData":{"avgWatts":127.8596161869003,"avgWattsPerKg":1.826565945527147,"hasPowerMeter":false,"lowerQuartileWatts":0,"medianWatts":77,"powerZones":null,"punchFactor":null,"upperQuartileWatts":213,"variabilityIndex":1.4244642329867025,"weightedPower":182.13145010164712,"weightedWattsPerKg":2.6018778585949587},"speedData":{"avgPace":152,"genuineAvgSpeed":23.658412176059294,"lowerQuartileSpeed":17.28,"medianSpeed":23.759999999999998,"speedZones":null,"standardDeviationSpeed":11.976818155145843,"totalAvgSpeed":23.658412176059294,"upperQuartileSpeed":29.880000000000003,"varianceSpeed":143.44417312143105},"toughnessScore":null},"hasPowerMeter":false,"id":188567368,"moving_time_raw":4862,"name":"19/11/2011 Montbonnot Saint Martin, RA, France","private":false,"short_unit":"km","start_time":"2011-11-19T15:18:42+0000","trainer":false,"type":"Ride"},{"bike_id":824321,"calories":715.5186853099999,"commute":false,"display_type":"Sortie à vélo","distance_raw":32943.4,"elapsed_time_raw":4862,"elevation_gain_raw":99.0665,"elevation_unit":"m","extendedStats":{"cadenceData":null,"elevationData":{"accumulatedElevationAscent":99.05405505251002,"accumulatedElevationDescent":108.39010530010975,"ascentSpeed":{"avg":-1,"lowerQuartile":446,"median":545,"upperQuartile":648},"ascentSpeedZones":null,"avgElevation":219,"elevationZones":null,"lowerQuartileElevation":215,"medianElevation":217,"upperQuartileElevation":220},"gradeData":{"avgGrade":0.0009490520104191727,"gradeProfile":"HILLY","gradeZones":null,"lowerQuartileGrade":-1.6,"medianGrade":0,"upFlatDownDistanceData":{"down":7.866099999999993,"flat":17.36850000000002,"up":7.7087999999999886},"upFlatDownInSeconds":{"down":1126,"flat":2554,"total":4862,"up":1182},"upFlatDownMoveData":{"down":25.149165186500866,"flat":24.481832419733777,"up":23.47857868020301},"upperQuartileGrade":1.5},"heartRateData":null,"moveRatio":1,"paceData":{"avgPace":152,"lowerQuartilePace":208.33333333333331,"medianPace":151.51515151515153,"paceZones":null,"upperQuartilePace":120.48192771084338,"variancePace":25.09687163766813},"powerData":{"avgWatts":127.8596161869003,"avgWattsPerKg":1.826565945527147,"hasPowerMeter":false,"lowerQuartileWatts":0,"medianWatts":77,"powerZones":null,"punchFactor":null,"upperQuartileWatts":213,"variabilityIndex":1.4244642329867025,"weightedPower":182.13145010164712,"weightedWattsPerKg":2.6018778585949587},"speedData":{"avgPace":152,"genuineAvgSpeed":23.658412176059294,"lowerQuartileSpeed":17.28,"medianSpeed":23.759999999999998,"speedZones":null,"standardDeviationSpeed":11.976818155145843,"totalAvgSpeed":23.658412176059294,"upperQuartileSpeed":29.880000000000003,"varianceSpeed":143.44417312143105},"toughnessScore":null},"hasPowerMeter":false,"id":188567568,"moving_time_raw":4862,"name":"26/11/2011 Montbonnot Saint Martin, RA, France","private":false,"short_unit":"km","start_time":"2011-11-26T15:18:42+0000","trainer":false,"type":"Ride"},{"bike_id":824321,"calories":715.5186853099999,"commute":false,"display_type":"Sortie à vélo","distance_raw":32943.4,"elapsed_time_raw":4862,"elevation_gain_raw":99.0665,"elevation_unit":"m","extendedStats":{"cadenceData":null,"elevationData":{"accumulatedElevationAscent":99.05405505251002,"accumulatedElevationDescent":108.39010530010975,"ascentSpeed":{"avg":-1,"lowerQuartile":446,"median":545,"upperQuartile":648},"ascentSpeedZones":null,"avgElevation":219,"elevationZones":null,"lowerQuartileElevation":215,"medianElevation":217,"upperQuartileElevation":220},"gradeData":{"avgGrade":0.0009490520104191727,"gradeProfile":"HILLY","gradeZones":null,"lowerQuartileGrade":-1.6,"medianGrade":0,"upFlatDownDistanceData":{"down":7.866099999999993,"flat":17.36850000000002,"up":7.7087999999999886},"upFlatDownInSeconds":{"down":1126,"flat":2554,"total":4862,"up":1182},"upFlatDownMoveData":{"down":25.149165186500866,"flat":24.481832419733777,"up":23.47857868020301},"upperQuartileGrade":1.5},"heartRateData":null,"moveRatio":1,"paceData":{"avgPace":152,"lowerQuartilePace":208.33333333333331,"medianPace":151.51515151515153,"paceZones":null,"upperQuartilePace":120.48192771084338,"variancePace":25.09687163766813},"powerData":{"avgWatts":127.8596161869003,"avgWattsPerKg":1.826565945527147,"hasPowerMeter":false,"lowerQuartileWatts":0,"medianWatts":77,"powerZones":null,"punchFactor":null,"upperQuartileWatts":213,"variabilityIndex":1.4244642329867025,"weightedPower":182.13145010164712,"weightedWattsPerKg":2.6018778585949587},"speedData":{"avgPace":152,"genuineAvgSpeed":23.658412176059294,"lowerQuartileSpeed":17.28,"medianSpeed":23.759999999999998,"speedZones":null,"standardDeviationSpeed":11.976818155145843,"totalAvgSpeed":23.658412176059294,"upperQuartileSpeed":29.880000000000003,"varianceSpeed":143.44417312143105},"toughnessScore":null},"hasPowerMeter":false,"id":188567901,"moving_time_raw":4862,"name":"03/12/2011 Montbonnot Saint Martin, RA, France","private":false,"short_unit":"km","start_time":"2011-12-03T15:18:42+0000","trainer":false,"type":"Ride"},{"bike_id":824321,"calories":715.5186853099999,"commute":false,"display_type":"Sortie à vélo","distance_raw":32943.4,"elapsed_time_raw":4862,"elevation_gain_raw":99.0665,"elevation_unit":"m","extendedStats":{"cadenceData":null,"elevationData":{"accumulatedElevationAscent":99.05405505251002,"accumulatedElevationDescent":108.39010530010975,"ascentSpeed":{"avg":-1,"lowerQuartile":446,"median":545,"upperQuartile":648},"ascentSpeedZones":null,"avgElevation":219,"elevationZones":null,"lowerQuartileElevation":215,"medianElevation":217,"upperQuartileElevation":220},"gradeData":{"avgGrade":0.0009490520104191727,"gradeProfile":"HILLY","gradeZones":null,"lowerQuartileGrade":-1.6,"medianGrade":0,"upFlatDownDistanceData":{"down":7.866099999999993,"flat":17.36850000000002,"up":7.7087999999999886},"upFlatDownInSeconds":{"down":1126,"flat":2554,"total":4862,"up":1182},"upFlatDownMoveData":{"down":25.149165186500866,"flat":24.481832419733777,"up":23.47857868020301},"upperQuartileGrade":1.5},"heartRateData":null,"moveRatio":1,"paceData":{"avgPace":152,"lowerQuartilePace":208.33333333333331,"medianPace":151.51515151515153,"paceZones":null,"upperQuartilePace":120.48192771084338,"variancePace":25.09687163766813},"powerData":{"avgWatts":127.8596161869003,"avgWattsPerKg":1.826565945527147,"hasPowerMeter":false,"lowerQuartileWatts":0,"medianWatts":77,"powerZones":null,"punchFactor":null,"upperQuartileWatts":213,"variabilityIndex":1.4244642329867025,"weightedPower":182.13145010164712,"weightedWattsPerKg":2.6018778585949587},"speedData":{"avgPace":152,"genuineAvgSpeed":23.658412176059294,"lowerQuartileSpeed":17.28,"medianSpeed":23.759999999999998,"speedZones":null,"standardDeviationSpeed":11.976818155145843,"totalAvgSpeed":23.658412176059294,"upperQuartileSpeed":29.880000000000003,"varianceSpeed":143.44417312143105},"toughnessScore":null},"hasPowerMeter":false,"id":188568090,"moving_time_raw":4862,"name":"10/12/2011 Montbonnot Saint Martin, RA, France","private":false,"short_unit":"km","start_time":"2011-12-10T15:18:42+0000","trainer":false,"type":"Ride"},{"bike_id":824321,"calories":715.5186853099999,"commute":false,"display_type":"Sortie à vélo","distance_raw":32943.4,"elapsed_time_raw":4862,"elevation_gain_raw":99.0665,"elevation_unit":"m","extendedStats":{"cadenceData":null,"elevationData":{"accumulatedElevationAscent":99.05405505251002,"accumulatedElevationDescent":108.39010530010975,"ascentSpeed":{"avg":-1,"lowerQuartile":446,"median":545,"upperQuartile":648},"ascentSpeedZones":null,"avgElevation":219,"elevationZones":null,"lowerQuartileElevation":215,"medianElevation":217,"upperQuartileElevation":220},"gradeData":{"avgGrade":0.0009490520104191727,"gradeProfile":"HILLY","gradeZones":null,"lowerQuartileGrade":-1.6,"medianGrade":0,"upFlatDownDistanceData":{"down":7.866099999999993,"flat":17.36850000000002,"up":7.7087999999999886},"upFlatDownInSeconds":{"down":1126,"flat":2554,"total":4862,"up":1182},"upFlatDownMoveData":{"down":25.149165186500866,"flat":24.481832419733777,"up":23.47857868020301},"upperQuartileGrade":1.5},"heartRateData":null,"moveRatio":1,"paceData":{"avgPace":152,"lowerQuartilePace":208.33333333333331,"medianPace":151.51515151515153,"paceZones":null,"upperQuartilePace":120.48192771084338,"variancePace":25.09687163766813},"powerData":{"avgWatts":127.8596161869003,"avgWattsPerKg":1.826565945527147,"hasPowerMeter":false,"lowerQuartileWatts":0,"medianWatts":77,"powerZones":null,"punchFactor":null,"upperQuartileWatts":213,"variabilityIndex":1.4244642329867025,"weightedPower":182.13145010164712,"weightedWattsPerKg":2.6018778585949587},"speedData":{"avgPace":152,"genuineAvgSpeed":23.658412176059294,"lowerQuartileSpeed":17.28,"medianSpeed":23.759999999999998,"speedZones":null,"standardDeviationSpeed":11.976818155145843,"totalAvgSpeed":23.658412176059294,"upperQuartileSpeed":29.880000000000003,"varianceSpeed":143.44417312143105},"toughnessScore":null},"hasPowerMeter":false,"id":188568490,"moving_time_raw":4862,"name":"17/12/2011 Montbonnot Saint Martin, RA, France","private":false,"short_unit":"km","start_time":"2011-12-17T15:18:42+0000","trainer":false,"type":"Ride"},{"bike_id":824321,"calories":715.5186853099999,"commute":false,"display_type":"Sortie à vélo","distance_raw":32943.4,"elapsed_time_raw":4862,"elevation_gain_raw":99.0665,"elevation_unit":"m","extendedStats":{"cadenceData":null,"elevationData":{"accumulatedElevationAscent":99.05405505251002,"accumulatedElevationDescent":108.39010530010975,"ascentSpeed":{"avg":-1,"lowerQuartile":446,"median":545,"upperQuartile":648},"ascentSpeedZones":null,"avgElevation":219,"elevationZones":null,"lowerQuartileElevation":215,"medianElevation":217,"upperQuartileElevation":220},"gradeData":{"avgGrade":0.0009490520104191727,"gradeProfile":"HILLY","gradeZones":null,"lowerQuartileGrade":-1.6,"medianGrade":0,"upFlatDownDistanceData":{"down":7.866099999999993,"flat":17.36850000000002,"up":7.7087999999999886},"upFlatDownInSeconds":{"down":1126,"flat":2554,"total":4862,"up":1182},"upFlatDownMoveData":{"down":25.149165186500866,"flat":24.481832419733777,"up":23.47857868020301},"upperQuartileGrade":1.5},"heartRateData":null,"moveRatio":1,"paceData":{"avgPace":152,"lowerQuartilePace":208.33333333333331,"medianPace":151.51515151515153,"paceZones":null,"upperQuartilePace":120.48192771084338,"variancePace":25.09687163766813},"powerData":{"avgWatts":127.8596161869003,"avgWattsPerKg":1.826565945527147,"hasPowerMeter":false,"lowerQuartileWatts":0,"medianWatts":77,"powerZones":null,"punchFactor":null,"upperQuartileWatts":213,"variabilityIndex":1.4244642329867025,"weightedPower":182.13145010164712,"weightedWattsPerKg":2.6018778585949587},"speedData":{"avgPace":152,"genuineAvgSpeed":23.658412176059294,"lowerQuartileSpeed":17.28,"medianSpeed":23.759999999999998,"speedZones":null,"standardDeviationSpeed":11.976818155145843,"totalAvgSpeed":23.658412176059294,"upperQuartileSpeed":29.880000000000003,"varianceSpeed":143.44417312143105},"toughnessScore":null},"hasPowerMeter":false,"id":188569044,"moving_time_raw":4862,"name":"24/12/2011 Montbonnot Saint Martin, RA, France","private":false,"short_unit":"km","start_time":"2011-12-24T15:18:42+0000","trainer":false,"type":"Ride"},{"bike_id":824321,"calories":715.5186853099999,"commute":false,"display_type":"Sortie à vélo","distance_raw":32943.4,"elapsed_time_raw":4862,"elevation_gain_raw":99.0665,"elevation_unit":"m","extendedStats":{"cadenceData":null,"elevationData":{"accumulatedElevationAscent":99.05405505251002,"accumulatedElevationDescent":108.39010530010975,"ascentSpeed":{"avg":-1,"lowerQuartile":446,"median":545,"upperQuartile":648},"ascentSpeedZones":null,"avgElevation":219,"elevationZones":null,"lowerQuartileElevation":215,"medianElevation":217,"upperQuartileElevation":220},"gradeData":{"avgGrade":0.0009490520104191727,"gradeProfile":"HILLY","gradeZones":null,"lowerQuartileGrade":-1.6,"medianGrade":0,"upFlatDownDistanceData":{"down":7.866099999999993,"flat":17.36850000000002,"up":7.7087999999999886},"upFlatDownInSeconds":{"down":1126,"flat":2554,"total":4862,"up":1182},"upFlatDownMoveData":{"down":25.149165186500866,"flat":24.481832419733777,"up":23.47857868020301},"upperQuartileGrade":1.5},"heartRateData":null,"moveRatio":1,"paceData":{"avgPace":152,"lowerQuartilePace":208.33333333333331,"medianPace":151.51515151515153,"paceZones":null,"upperQuartilePace":120.48192771084338,"variancePace":25.09687163766813},"powerData":{"avgWatts":127.8596161869003,"avgWattsPerKg":1.826565945527147,"hasPowerMeter":false,"lowerQuartileWatts":0,"medianWatts":77,"powerZones":null,"punchFactor":null,"upperQuartileWatts":213,"variabilityIndex":1.4244642329867025,"weightedPower":182.13145010164712,"weightedWattsPerKg":2.6018778585949587},"speedData":{"avgPace":152,"genuineAvgSpeed":23.658412176059294,"lowerQuartileSpeed":17.28,"medianSpeed":23.759999999999998,"speedZones":null,"standardDeviationSpeed":11.976818155145843,"totalAvgSpeed":23.658412176059294,"upperQuartileSpeed":29.880000000000003,"varianceSpeed":143.44417312143105},"toughnessScore":null},"hasPowerMeter":false,"id":188569532,"moving_time_raw":4862,"name":"31/12/2011 Montbonnot Saint Martin, RA, France","private":false,"short_unit":"km","start_time":"2011-12-31T15:18:42+0000","trainer":false,"type":"Ride"},{"bike_id":824321,"calories":715.5186853099999,"commute":false,"display_type":"Sortie à vélo","distance_raw":32943.4,"elapsed_time_raw":4862,"elevation_gain_raw":99.0665,"elevation_unit":"m","extendedStats":{"cadenceData":null,"elevationData":{"accumulatedElevationAscent":99.05405505251002,"accumulatedElevationDescent":108.39010530010975,"ascentSpeed":{"avg":-1,"lowerQuartile":446,"median":545,"upperQuartile":648},"ascentSpeedZones":null,"avgElevation":219,"elevationZones":null,"lowerQuartileElevation":215,"medianElevation":217,"upperQuartileElevation":220},"gradeData":{"avgGrade":0.0009490520104191727,"gradeProfile":"HILLY","gradeZones":null,"lowerQuartileGrade":-1.6,"medianGrade":0,"upFlatDownDistanceData":{"down":7.866099999999993,"flat":17.36850000000002,"up":7.7087999999999886},"upFlatDownInSeconds":{"down":1126,"flat":2554,"total":4862,"up":1182},"upFlatDownMoveData":{"down":25.149165186500866,"flat":24.481832419733777,"up":23.47857868020301},"upperQuartileGrade":1.5},"heartRateData":null,"moveRatio":1,"paceData":{"avgPace":152,"lowerQuartilePace":208.33333333333331,"medianPace":151.51515151515153,"paceZones":null,"upperQuartilePace":120.48192771084338,"variancePace":25.09687163766813},"powerData":{"avgWatts":127.8596161869003,"avgWattsPerKg":1.826565945527147,"hasPowerMeter":false,"lowerQuartileWatts":0,"medianWatts":77,"powerZones":null,"punchFactor":null,"upperQuartileWatts":213,"variabilityIndex":1.4244642329867025,"weightedPower":182.13145010164712,"weightedWattsPerKg":2.6018778585949587},"speedData":{"avgPace":152,"genuineAvgSpeed":23.658412176059294,"lowerQuartileSpeed":17.28,"medianSpeed":23.759999999999998,"speedZones":null,"standardDeviationSpeed":11.976818155145843,"totalAvgSpeed":23.658412176059294,"upperQuartileSpeed":29.880000000000003,"varianceSpeed":143.44417312143105},"toughnessScore":null},"hasPowerMeter":false,"id":188712418,"moving_time_raw":4862,"name":"07/01/2012 Montbonnot Saint Martin, RA, France","private":false,"short_unit":"km","start_time":"2012-01-07T15:18:42+0000","trainer":false,"type":"Ride"},{"bike_id":824321,"calories":715.5186853099999,"commute":false,"display_type":"Sortie à vélo","distance_raw":32943.4,"elapsed_time_raw":4862,"elevation_gain_raw":99.0665,"elevation_unit":"m","extendedStats":{"cadenceData":null,"elevationData":{"accumulatedElevationAscent":99.05405505251002,"accumulatedElevationDescent":108.39010530010975,"ascentSpeed":{"avg":-1,"lowerQuartile":446,"median":545,"upperQuartile":648},"ascentSpeedZones":null,"avgElevation":219,"elevationZones":null,"lowerQuartileElevation":215,"medianElevation":217,"upperQuartileElevation":220},"gradeData":{"avgGrade":0.0009490520104191727,"gradeProfile":"HILLY","gradeZones":null,"lowerQuartileGrade":-1.6,"medianGrade":0,"upFlatDownDistanceData":{"down":7.866099999999993,"flat":17.36850000000002,"up":7.7087999999999886},"upFlatDownInSeconds":{"down":1126,"flat":2554,"total":4862,"up":1182},"upFlatDownMoveData":{"down":25.149165186500866,"flat":24.481832419733777,"up":23.47857868020301},"upperQuartileGrade":1.5},"heartRateData":null,"moveRatio":1,"paceData":{"avgPace":152,"lowerQuartilePace":208.33333333333331,"medianPace":151.51515151515153,"paceZones":null,"upperQuartilePace":120.48192771084338,"variancePace":25.09687163766813},"powerData":{"avgWatts":127.8596161869003,"avgWattsPerKg":1.826565945527147,"hasPowerMeter":false,"lowerQuartileWatts":0,"medianWatts":77,"powerZones":null,"punchFactor":null,"upperQuartileWatts":213,"variabilityIndex":1.4244642329867025,"weightedPower":182.13145010164712,"weightedWattsPerKg":2.6018778585949587},"speedData":{"avgPace":152,"genuineAvgSpeed":23.658412176059294,"lowerQuartileSpeed":17.28,"medianSpeed":23.759999999999998,"speedZones":null,"standardDeviationSpeed":11.976818155145843,"totalAvgSpeed":23.658412176059294,"upperQuartileSpeed":29.880000000000003,"varianceSpeed":143.44417312143105},"toughnessScore":null},"hasPowerMeter":false,"id":188712623,"moving_time_raw":4862,"name":"14/01/2012 Montbonnot Saint Martin, RA, France","private":false,"short_unit":"km","start_time":"2012-01-14T15:18:42+0000","trainer":false,"type":"Ride"},{"bike_id":824321,"calories":715.5186853099999,"commute":false,"display_type":"Sortie à vélo","distance_raw":32943.4,"elapsed_time_raw":4862,"elevation_gain_raw":99.0665,"elevation_unit":"m","extendedStats":{"cadenceData":null,"elevationData":{"accumulatedElevationAscent":99.05405505251002,"accumulatedElevationDescent":108.39010530010975,"ascentSpeed":{"avg":-1,"lowerQuartile":446,"median":545,"upperQuartile":648},"ascentSpeedZones":null,"avgElevation":219,"elevationZones":null,"lowerQuartileElevation":215,"medianElevation":217,"upperQuartileElevation":220},"gradeData":{"avgGrade":0.0009490520104191727,"gradeProfile":"HILLY","gradeZones":null,"lowerQuartileGrade":-1.6,"medianGrade":0,"upFlatDownDistanceData":{"down":7.866099999999993,"flat":17.36850000000002,"up":7.7087999999999886},"upFlatDownInSeconds":{"down":1126,"flat":2554,"total":4862,"up":1182},"upFlatDownMoveData":{"down":25.149165186500866,"flat":24.481832419733777,"up":23.47857868020301},"upperQuartileGrade":1.5},"heartRateData":null,"moveRatio":1,"paceData":{"avgPace":152,"lowerQuartilePace":208.33333333333331,"medianPace":151.51515151515153,"paceZones":null,"upperQuartilePace":120.48192771084338,"variancePace":25.09687163766813},"powerData":{"avgWatts":127.8596161869003,"avgWattsPerKg":1.826565945527147,"hasPowerMeter":false,"lowerQuartileWatts":0,"medianWatts":77,"powerZones":null,"punchFactor":null,"upperQuartileWatts":213,"variabilityIndex":1.4244642329867025,"weightedPower":182.13145010164712,"weightedWattsPerKg":2.6018778585949587},"speedData":{"avgPace":152,"genuineAvgSpeed":23.658412176059294,"lowerQuartileSpeed":17.28,"medianSpeed":23.759999999999998,"speedZones":null,"standardDeviationSpeed":11.976818155145843,"totalAvgSpeed":23.658412176059294,"upperQuartileSpeed":29.880000000000003,"varianceSpeed":143.44417312143105},"toughnessScore":null},"hasPowerMeter":false,"id":188712668,"moving_time_raw":4862,"name":"21/01/2012 Montbonnot Saint Martin, RA, France","private":false,"short_unit":"km","start_time":"2012-01-21T15:18:42+0000","trainer":false,"type":"Ride"},{"bike_id":824321,"calories":715.5186853099999,"commute":false,"display_type":"Sortie à vélo","distance_raw":32943.4,"elapsed_time_raw":4862,"elevation_gain_raw":99.0665,"elevation_unit":"m","extendedStats":{"cadenceData":null,"elevationData":{"accumulatedElevationAscent":99.05405505251002,"accumulatedElevationDescent":108.39010530010975,"ascentSpeed":{"avg":-1,"lowerQuartile":446,"median":545,"upperQuartile":648},"ascentSpeedZones":null,"avgElevation":219,"elevationZones":null,"lowerQuartileElevation":215,"medianElevation":217,"upperQuartileElevation":220},"gradeData":{"avgGrade":0.0009490520104191727,"gradeProfile":"HILLY","gradeZones":null,"lowerQuartileGrade":-1.6,"medianGrade":0,"upFlatDownDistanceData":{"down":7.866099999999993,"flat":17.36850000000002,"up":7.7087999999999886},"upFlatDownInSeconds":{"down":1126,"flat":2554,"total":4862,"up":1182},"upFlatDownMoveData":{"down":25.149165186500866,"flat":24.481832419733777,"up":23.47857868020301},"upperQuartileGrade":1.5},"heartRateData":null,"moveRatio":1,"paceData":{"avgPace":152,"lowerQuartilePace":208.33333333333331,"medianPace":151.51515151515153,"paceZones":null,"upperQuartilePace":120.48192771084338,"variancePace":25.09687163766813},"powerData":{"avgWatts":127.8596161869003,"avgWattsPerKg":1.826565945527147,"hasPowerMeter":false,"lowerQuartileWatts":0,"medianWatts":77,"powerZones":null,"punchFactor":null,"upperQuartileWatts":213,"variabilityIndex":1.4244642329867025,"weightedPower":182.13145010164712,"weightedWattsPerKg":2.6018778585949587},"speedData":{"avgPace":152,"genuineAvgSpeed":23.658412176059294,"lowerQuartileSpeed":17.28,"medianSpeed":23.759999999999998,"speedZones":null,"standardDeviationSpeed":11.976818155145843,"totalAvgSpeed":23.658412176059294,"upperQuartileSpeed":29.880000000000003,"varianceSpeed":143.44417312143105},"toughnessScore":null},"hasPowerMeter":false,"id":188712781,"moving_time_raw":4862,"name":"28/01/2012 Montbonnot Saint Martin, RA, France","private":false,"short_unit":"km","start_time":"2012-01-28T15:18:42+0000","trainer":false,"type":"Ride"},{"bike_id":824321,"calories":715.5186853099999,"commute":false,"display_type":"Sortie à vélo","distance_raw":32943.4,"elapsed_time_raw":4862,"elevation_gain_raw":99.0665,"elevation_unit":"m","extendedStats":{"cadenceData":null,"elevationData":{"accumulatedElevationAscent":99.05405505251002,"accumulatedElevationDescent":108.39010530010975,"ascentSpeed":{"avg":-1,"lowerQuartile":446,"median":545,"upperQuartile":648},"ascentSpeedZones":null,"avgElevation":219,"elevationZones":null,"lowerQuartileElevation":215,"medianElevation":217,"upperQuartileElevation":220},"gradeData":{"avgGrade":0.0009490520104191727,"gradeProfile":"HILLY","gradeZones":null,"lowerQuartileGrade":-1.6,"medianGrade":0,"upFlatDownDistanceData":{"down":7.866099999999993,"flat":17.36850000000002,"up":7.7087999999999886},"upFlatDownInSeconds":{"down":1126,"flat":2554,"total":4862,"up":1182},"upFlatDownMoveData":{"down":25.149165186500866,"flat":24.481832419733777,"up":23.47857868020301},"upperQuartileGrade":1.5},"heartRateData":null,"moveRatio":1,"paceData":{"avgPace":152,"lowerQuartilePace":208.33333333333331,"medianPace":151.51515151515153,"paceZones":null,"upperQuartilePace":120.48192771084338,"variancePace":25.09687163766813},"powerData":{"avgWatts":127.8596161869003,"avgWattsPerKg":1.826565945527147,"hasPowerMeter":false,"lowerQuartileWatts":0,"medianWatts":77,"powerZones":null,"punchFactor":null,"upperQuartileWatts":213,"variabilityIndex":1.4244642329867025,"weightedPower":182.13145010164712,"weightedWattsPerKg":2.6018778585949587},"speedData":{"avgPace":152,"genuineAvgSpeed":23.658412176059294,"lowerQuartileSpeed":17.28,"medianSpeed":23.759999999999998,"speedZones":null,"standardDeviationSpeed":11.976818155145843,"totalAvgSpeed":23.658412176059294,"upperQuartileSpeed":29.880000000000003,"varianceSpeed":143.44417312143105},"toughnessScore":null},"hasPowerMeter":false,"id":188712884,"moving_time_raw":4862,"name":"04/02/2012 Montbonnot Saint Martin, RA, France","private":false,"short_unit":"km","start_time":"2012-02-04T15:18:42+0000","trainer":false,"type":"Ride"},{"bike_id":824321,"calories":715.5186853099999,"commute":false,"display_type":"Sortie à vélo","distance_raw":32943.4,"elapsed_time_raw":4862,"elevation_gain_raw":99.0665,"elevation_unit":"m","extendedStats":{"cadenceData":null,"elevationData":{"accumulatedElevationAscent":99.05405505251002,"accumulatedElevationDescent":108.39010530010975,"ascentSpeed":{"avg":-1,"lowerQuartile":446,"median":545,"upperQuartile":648},"ascentSpeedZones":null,"avgElevation":219,"elevationZones":null,"lowerQuartileElevation":215,"medianElevation":217,"upperQuartileElevation":220},"gradeData":{"avgGrade":0.0009490520104191727,"gradeProfile":"HILLY","gradeZones":null,"lowerQuartileGrade":-1.6,"medianGrade":0,"upFlatDownDistanceData":{"down":7.866099999999993,"flat":17.36850000000002,"up":7.7087999999999886},"upFlatDownInSeconds":{"down":1126,"flat":2554,"total":4862,"up":1182},"upFlatDownMoveData":{"down":25.149165186500866,"flat":24.481832419733777,"up":23.47857868020301},"upperQuartileGrade":1.5},"heartRateData":null,"moveRatio":1,"paceData":{"avgPace":152,"lowerQuartilePace":208.33333333333331,"medianPace":151.51515151515153,"paceZones":null,"upperQuartilePace":120.48192771084338,"variancePace":25.09687163766813},"powerData":{"avgWatts":127.8596161869003,"avgWattsPerKg":1.826565945527147,"hasPowerMeter":false,"lowerQuartileWatts":0,"medianWatts":77,"powerZones":null,"punchFactor":null,"upperQuartileWatts":213,"variabilityIndex":1.4244642329867025,"weightedPower":182.13145010164712,"weightedWattsPerKg":2.6018778585949587},"speedData":{"avgPace":152,"genuineAvgSpeed":23.658412176059294,"lowerQuartileSpeed":17.28,"medianSpeed":23.759999999999998,"speedZones":null,"standardDeviationSpeed":11.976818155145843,"totalAvgSpeed":23.658412176059294,"upperQuartileSpeed":29.880000000000003,"varianceSpeed":143.44417312143105},"toughnessScore":null},"hasPowerMeter":false,"id":188712905,"moving_time_raw":4862,"name":"11/02/2012 Montbonnot Saint Martin, RA, France","private":false,"short_unit":"km","start_time":"2012-02-11T15:18:42+0000","trainer":false,"type":"Ride"},{"bike_id":824321,"calories":715.5186853099999,"commute":false,"display_type":"Sortie à vélo","distance_raw":32943.4,"elapsed_time_raw":4862,"elevation_gain_raw":99.0665,"elevation_unit":"m","extendedStats":{"cadenceData":null,"elevationData":{"accumulatedElevationAscent":99.05405505251002,"accumulatedElevationDescent":108.39010530010975,"ascentSpeed":{"avg":-1,"lowerQuartile":446,"median":545,"upperQuartile":648},"ascentSpeedZones":null,"avgElevation":219,"elevationZones":null,"lowerQuartileElevation":215,"medianElevation":217,"upperQuartileElevation":220},"gradeData":{"avgGrade":0.0009490520104191727,"gradeProfile":"HILLY","gradeZones":null,"lowerQuartileGrade":-1.6,"medianGrade":0,"upFlatDownDistanceData":{"down":7.866099999999993,"flat":17.36850000000002,"up":7.7087999999999886},"upFlatDownInSeconds":{"down":1126,"flat":2554,"total":4862,"up":1182},"upFlatDownMoveData":{"down":25.149165186500866,"flat":24.481832419733777,"up":23.47857868020301},"upperQuartileGrade":1.5},"heartRateData":null,"moveRatio":1,"paceData":{"avgPace":152,"lowerQuartilePace":208.33333333333331,"medianPace":151.51515151515153,"paceZones":null,"upperQuartilePace":120.48192771084338,"variancePace":25.09687163766813},"powerData":{"avgWatts":127.8596161869003,"avgWattsPerKg":1.826565945527147,"hasPowerMeter":false,"lowerQuartileWatts":0,"medianWatts":77,"powerZones":null,"punchFactor":null,"upperQuartileWatts":213,"variabilityIndex":1.4244642329867025,"weightedPower":182.13145010164712,"weightedWattsPerKg":2.6018778585949587},"speedData":{"avgPace":152,"genuineAvgSpeed":23.658412176059294,"lowerQuartileSpeed":17.28,"medianSpeed":23.759999999999998,"speedZones":null,"standardDeviationSpeed":11.976818155145843,"totalAvgSpeed":23.658412176059294,"upperQuartileSpeed":29.880000000000003,"varianceSpeed":143.44417312143105},"toughnessScore":null},"hasPowerMeter":false,"id":188712965,"moving_time_raw":4862,"name":"18/02/2012 Montbonnot Saint Martin, RA, France","private":false,"short_unit":"km","start_time":"2012-02-18T15:18:42+0000","trainer":false,"type":"Ride"},{"bike_id":824321,"calories":715.5186853099999,"commute":false,"display_type":"Sortie à vélo","distance_raw":32943.4,"elapsed_time_raw":4862,"elevation_gain_raw":99.0665,"elevation_unit":"m","extendedStats":{"cadenceData":null,"elevationData":{"accumulatedElevationAscent":99.05405505251002,"accumulatedElevationDescent":108.39010530010975,"ascentSpeed":{"avg":-1,"lowerQuartile":446,"median":545,"upperQuartile":648},"ascentSpeedZones":null,"avgElevation":219,"elevationZones":null,"lowerQuartileElevation":215,"medianElevation":217,"upperQuartileElevation":220},"gradeData":{"avgGrade":0.0009490520104191727,"gradeProfile":"HILLY","gradeZones":null,"lowerQuartileGrade":-1.6,"medianGrade":0,"upFlatDownDistanceData":{"down":7.866099999999993,"flat":17.36850000000002,"up":7.7087999999999886},"upFlatDownInSeconds":{"down":1126,"flat":2554,"total":4862,"up":1182},"upFlatDownMoveData":{"down":25.149165186500866,"flat":24.481832419733777,"up":23.47857868020301},"upperQuartileGrade":1.5},"heartRateData":null,"moveRatio":1,"paceData":{"avgPace":152,"lowerQuartilePace":208.33333333333331,"medianPace":151.51515151515153,"paceZones":null,"upperQuartilePace":120.48192771084338,"variancePace":25.09687163766813},"powerData":{"avgWatts":127.8596161869003,"avgWattsPerKg":1.826565945527147,"hasPowerMeter":false,"lowerQuartileWatts":0,"medianWatts":77,"powerZones":null,"punchFactor":null,"upperQuartileWatts":213,"variabilityIndex":1.4244642329867025,"weightedPower":182.13145010164712,"weightedWattsPerKg":2.6018778585949587},"speedData":{"avgPace":152,"genuineAvgSpeed":23.658412176059294,"lowerQuartileSpeed":17.28,"medianSpeed":23.759999999999998,"speedZones":null,"standardDeviationSpeed":11.976818155145843,"totalAvgSpeed":23.658412176059294,"upperQuartileSpeed":29.880000000000003,"varianceSpeed":143.44417312143105},"toughnessScore":null},"hasPowerMeter":false,"id":188713033,"moving_time_raw":4862,"name":"25/02/2012 Montbonnot Saint Martin, RA, France","private":false,"short_unit":"km","start_time":"2012-02-25T15:18:42+0000","trainer":false,"type":"Ride"},{"bike_id":824321,"calories":715.5186853099999,"commute":false,"display_type":"Sortie à vélo","distance_raw":32943.4,"elapsed_time_raw":4862,"elevation_gain_raw":99.0665,"elevation_unit":"m","extendedStats":{"cadenceData":null,"elevationData":{"accumulatedElevationAscent":99.05405505251002,"accumulatedElevationDescent":108.39010530010975,"ascentSpeed":{"avg":-1,"lowerQuartile":446,"median":545,"upperQuartile":648},"ascentSpeedZones":null,"avgElevation":219,"elevationZones":null,"lowerQuartileElevation":215,"medianElevation":217,"upperQuartileElevation":220},"gradeData":{"avgGrade":0.0009490520104191727,"gradeProfile":"HILLY","gradeZones":null,"lowerQuartileGrade":-1.6,"medianGrade":0,"upFlatDownDistanceData":{"down":7.866099999999993,"flat":17.36850000000002,"up":7.7087999999999886},"upFlatDownInSeconds":{"down":1126,"flat":2554,"total":4862,"up":1182},"upFlatDownMoveData":{"down":25.149165186500866,"flat":24.481832419733777,"up":23.47857868020301},"upperQuartileGrade":1.5},"heartRateData":null,"moveRatio":1,"paceData":{"avgPace":152,"lowerQuartilePace":208.33333333333331,"medianPace":151.51515151515153,"paceZones":null,"upperQuartilePace":120.48192771084338,"variancePace":25.09687163766813},"powerData":{"avgWatts":127.8596161869003,"avgWattsPerKg":1.826565945527147,"hasPowerMeter":false,"lowerQuartileWatts":0,"medianWatts":77,"powerZones":null,"punchFactor":null,"upperQuartileWatts":213,"variabilityIndex":1.4244642329867025,"weightedPower":182.13145010164712,"weightedWattsPerKg":2.6018778585949587},"speedData":{"avgPace":152,"genuineAvgSpeed":23.658412176059294,"lowerQuartileSpeed":17.28,"medianSpeed":23.759999999999998,"speedZones":null,"standardDeviationSpeed":11.976818155145843,"totalAvgSpeed":23.658412176059294,"upperQuartileSpeed":29.880000000000003,"varianceSpeed":143.44417312143105},"toughnessScore":null},"hasPowerMeter":false,"id":188713096,"moving_time_raw":4862,"name":"03/03/2012 Montbonnot Saint Martin, RA, France","private":false,"short_unit":"km","start_time":"2012-03-03T15:18:42+0000","trainer":false,"type":"Ride"},{"bike_id":824321,"calories":727.57080505,"commute":false,"display_type":"Sortie à vélo","distance_raw":37072.3,"elapsed_time_raw":6649,"elevation_gain_raw":150.433,"elevation_unit":"m","extendedStats":{"cadenceData":null,"elevationData":{"accumulatedElevationAscent":150.04263395434808,"accumulatedElevationDescent":154.0040594791375,"ascentSpeed":{"avg":451.38467806126937,"lowerQuartile":306,"median":457,"upperQuartile":586},"ascentSpeedZones":null,"avgElevation":223,"elevationZones":null,"lowerQuartileElevation":216,"medianElevation":219,"upperQuartileElevation":222},"gradeData":{"avgGrade":-0.0002877292188818679,"gradeProfile":"HILLY","gradeZones":null,"lowerQuartileGrade":-1.6,"medianGrade":0,"upFlatDownDistanceData":{"down":8.750799999999995,"flat":19.64590000000002,"up":8.66939999999999},"upFlatDownInSeconds":{"down":1525,"flat":3125,"total":6465,"up":1815},"upFlatDownMoveData":{"down":20.657626229508182,"flat":22.63207680000002,"up":17.195504132231388},"upperQuartileGrade":1.5},"heartRateData":null,"moveRatio":0.9723266656640096,"paceData":{"avgPace":174,"lowerQuartilePace":243.90243902439028,"medianPace":169.4915254237288,"paceZones":null,"upperQuartilePace":131.57894736842104,"variancePace":28.434665888505833},"powerData":{"avgWatts":106.42445866141732,"avgWattsPerKg":1.5203494094488188,"hasPowerMeter":false,"lowerQuartileWatts":0,"medianWatts":62,"powerZones":null,"punchFactor":null,"upperQuartileWatts":169,"variabilityIndex":1.5871009715283735,"weightedPower":168.90636173591665,"weightedWattsPerKg":2.4129480247988093},"speedData":{"avgPace":174,"genuineAvgSpeed":20.66004640371233,"lowerQuartileSpeed":14.76,"medianSpeed":21.240000000000002,"speedZones":null,"standardDeviationSpeed":11.25193424636121,"totalAvgSpeed":20.08831403218532,"upperQuartileSpeed":27.36,"varianceSpeed":126.60602428443622},"toughnessScore":null},"hasPowerMeter":false,"id":66364510,"moving_time_raw":6206,"name":"Gresivaudan-Grenoble loop","private":false,"short_unit":"km","start_time":"2012-03-10T09:15:19+0000","trainer":false,"type":"Ride"},{"bike_id":824321,"calories":715.5186853099999,"commute":false,"display_type":"Sortie à vélo","distance_raw":32943.4,"elapsed_time_raw":4862,"elevation_gain_raw":99.0665,"elevation_unit":"m","extendedStats":{"cadenceData":null,"elevationData":{"accumulatedElevationAscent":99.05405505251002,"accumulatedElevationDescent":108.39010530010975,"ascentSpeed":{"avg":-1,"lowerQuartile":446,"median":545,"upperQuartile":648},"ascentSpeedZones":null,"avgElevation":219,"elevationZones":null,"lowerQuartileElevation":215,"medianElevation":217,"upperQuartileElevation":220},"gradeData":{"avgGrade":0.0009490520104191727,"gradeProfile":"HILLY","gradeZones":null,"lowerQuartileGrade":-1.6,"medianGrade":0,"upFlatDownDistanceData":{"down":7.866099999999993,"flat":17.36850000000002,"up":7.7087999999999886},"upFlatDownInSeconds":{"down":1126,"flat":2554,"total":4862,"up":1182},"upFlatDownMoveData":{"down":25.149165186500866,"flat":24.481832419733777,"up":23.47857868020301},"upperQuartileGrade":1.5},"heartRateData":null,"moveRatio":1,"paceData":{"avgPace":152,"lowerQuartilePace":208.33333333333331,"medianPace":151.51515151515153,"paceZones":null,"upperQuartilePace":120.48192771084338,"variancePace":25.09687163766813},"powerData":{"avgWatts":127.8596161869003,"avgWattsPerKg":1.826565945527147,"hasPowerMeter":false,"lowerQuartileWatts":0,"medianWatts":77,"powerZones":null,"punchFactor":null,"upperQuartileWatts":213,"variabilityIndex":1.4244642329867025,"weightedPower":182.13145010164712,"weightedWattsPerKg":2.6018778585949587},"speedData":{"avgPace":152,"genuineAvgSpeed":23.658412176059294,"lowerQuartileSpeed":17.28,"medianSpeed":23.759999999999998,"speedZones":null,"standardDeviationSpeed":11.976818155145843,"totalAvgSpeed":23.658412176059294,"upperQuartileSpeed":29.880000000000003,"varianceSpeed":143.44417312143105},"toughnessScore":null},"hasPowerMeter":false,"id":188713127,"moving_time_raw":4862,"name":"10/03/2012 Montbonnot Saint Martin, RA, France","private":false,"short_unit":"km","start_time":"2012-03-10T15:18:42+0000","trainer":false,"type":"Ride"},{"bike_id":824321,"calories":715.5186853099999,"commute":false,"display_type":"Sortie à vélo","distance_raw":32943.4,"elapsed_time_raw":4862,"elevation_gain_raw":99.0665,"elevation_unit":"m","extendedStats":{"cadenceData":null,"elevationData":{"accumulatedElevationAscent":99.05405505251002,"accumulatedElevationDescent":108.39010530010975,"ascentSpeed":{"avg":-1,"lowerQuartile":446,"median":545,"upperQuartile":648},"ascentSpeedZones":null,"avgElevation":219,"elevationZones":null,"lowerQuartileElevation":215,"medianElevation":217,"upperQuartileElevation":220},"gradeData":{"avgGrade":0.0009490520104191727,"gradeProfile":"HILLY","gradeZones":null,"lowerQuartileGrade":-1.6,"medianGrade":0,"upFlatDownDistanceData":{"down":7.866099999999993,"flat":17.36850000000002,"up":7.7087999999999886},"upFlatDownInSeconds":{"down":1126,"flat":2554,"total":4862,"up":1182},"upFlatDownMoveData":{"down":25.149165186500866,"flat":24.481832419733777,"up":23.47857868020301},"upperQuartileGrade":1.5},"heartRateData":null,"moveRatio":1,"paceData":{"avgPace":152,"lowerQuartilePace":208.33333333333331,"medianPace":151.51515151515153,"paceZones":null,"upperQuartilePace":120.48192771084338,"variancePace":25.09687163766813},"powerData":{"avgWatts":127.8596161869003,"avgWattsPerKg":1.826565945527147,"hasPowerMeter":false,"lowerQuartileWatts":0,"medianWatts":77,"powerZones":null,"punchFactor":null,"upperQuartileWatts":213,"variabilityIndex":1.4244642329867025,"weightedPower":182.13145010164712,"weightedWattsPerKg":2.6018778585949587},"speedData":{"avgPace":152,"genuineAvgSpeed":23.658412176059294,"lowerQuartileSpeed":17.28,"medianSpeed":23.759999999999998,"speedZones":null,"standardDeviationSpeed":11.976818155145843,"totalAvgSpeed":23.658412176059294,"upperQuartileSpeed":29.880000000000003,"varianceSpeed":143.44417312143105},"toughnessScore":null},"hasPowerMeter":false,"id":188713168,"moving_time_raw":4862,"name":"17/03/2012 Montbonnot Saint Martin, RA, France","private":false,"short_unit":"km","start_time":"2012-03-17T15:18:42+0000","trainer":false,"type":"Ride"},{"bike_id":824321,"calories":715.5186853099999,"commute":false,"display_type":"Sortie à vélo","distance_raw":32943.4,"elapsed_time_raw":4862,"elevation_gain_raw":99.0665,"elevation_unit":"m","extendedStats":{"cadenceData":null,"elevationData":{"accumulatedElevationAscent":99.05405505251002,"accumulatedElevationDescent":108.39010530010975,"ascentSpeed":{"avg":-1,"lowerQuartile":446,"median":545,"upperQuartile":648},"ascentSpeedZones":null,"avgElevation":219,"elevationZones":null,"lowerQuartileElevation":215,"medianElevation":217,"upperQuartileElevation":220},"gradeData":{"avgGrade":0.0009490520104191727,"gradeProfile":"HILLY","gradeZones":null,"lowerQuartileGrade":-1.6,"medianGrade":0,"upFlatDownDistanceData":{"down":7.866099999999993,"flat":17.36850000000002,"up":7.7087999999999886},"upFlatDownInSeconds":{"down":1126,"flat":2554,"total":4862,"up":1182},"upFlatDownMoveData":{"down":25.149165186500866,"flat":24.481832419733777,"up":23.47857868020301},"upperQuartileGrade":1.5},"heartRateData":null,"moveRatio":1,"paceData":{"avgPace":152,"lowerQuartilePace":208.33333333333331,"medianPace":151.51515151515153,"paceZones":null,"upperQuartilePace":120.48192771084338,"variancePace":25.09687163766813},"powerData":{"avgWatts":127.8596161869003,"avgWattsPerKg":1.826565945527147,"hasPowerMeter":false,"lowerQuartileWatts":0,"medianWatts":77,"powerZones":null,"punchFactor":null,"upperQuartileWatts":213,"variabilityIndex":1.4244642329867025,"weightedPower":182.13145010164712,"weightedWattsPerKg":2.6018778585949587},"speedData":{"avgPace":152,"genuineAvgSpeed":23.658412176059294,"lowerQuartileSpeed":17.28,"medianSpeed":23.759999999999998,"speedZones":null,"standardDeviationSpeed":11.976818155145843,"totalAvgSpeed":23.658412176059294,"upperQuartileSpeed":29.880000000000003,"varianceSpeed":143.44417312143105},"toughnessScore":null},"hasPowerMeter":false,"id":188713187,"moving_time_raw":4862,"name":"24/03/2012 Montbonnot Saint Martin, RA, France","private":false,"short_unit":"km","start_time":"2012-03-24T15:18:42+0000","trainer":false,"type":"Ride"},{"bike_id":824321,"calories":715.5186853099999,"commute":false,"display_type":"Sortie à vélo","distance_raw":32943.4,"elapsed_time_raw":4862,"elevation_gain_raw":99.0665,"elevation_unit":"m","extendedStats":{"cadenceData":null,"elevationData":{"accumulatedElevationAscent":99.05405505251002,"accumulatedElevationDescent":108.39010530010975,"ascentSpeed":{"avg":-1,"lowerQuartile":446,"median":545,"upperQuartile":648},"ascentSpeedZones":null,"avgElevation":219,"elevationZones":null,"lowerQuartileElevation":215,"medianElevation":217,"upperQuartileElevation":220},"gradeData":{"avgGrade":0.0009490520104191727,"gradeProfile":"HILLY","gradeZones":null,"lowerQuartileGrade":-1.6,"medianGrade":0,"upFlatDownDistanceData":{"down":7.866099999999993,"flat":17.36850000000002,"up":7.7087999999999886},"upFlatDownInSeconds":{"down":1126,"flat":2554,"total":4862,"up":1182},"upFlatDownMoveData":{"down":25.149165186500866,"flat":24.481832419733777,"up":23.47857868020301},"upperQuartileGrade":1.5},"heartRateData":null,"moveRatio":1,"paceData":{"avgPace":152,"lowerQuartilePace":208.33333333333331,"medianPace":151.51515151515153,"paceZones":null,"upperQuartilePace":120.48192771084338,"variancePace":25.09687163766813},"powerData":{"avgWatts":127.8596161869003,"avgWattsPerKg":1.826565945527147,"hasPowerMeter":false,"lowerQuartileWatts":0,"medianWatts":77,"powerZones":null,"punchFactor":null,"upperQuartileWatts":213,"variabilityIndex":1.4244642329867025,"weightedPower":182.13145010164712,"weightedWattsPerKg":2.6018778585949587},"speedData":{"avgPace":152,"genuineAvgSpeed":23.658412176059294,"lowerQuartileSpeed":17.28,"medianSpeed":23.759999999999998,"speedZones":null,"standardDeviationSpeed":11.976818155145843,"totalAvgSpeed":23.658412176059294,"upperQuartileSpeed":29.880000000000003,"varianceSpeed":143.44417312143105},"toughnessScore":null},"hasPowerMeter":false,"id":188713703,"moving_time_raw":4862,"name":"01/04/2012 Montbonnot Saint Martin, RA, France","private":false,"short_unit":"km","start_time":"2012-04-01T15:18:42+0000","trainer":false,"type":"Ride"},{"bike_id":824321,"calories":715.5186853099999,"commute":false,"display_type":"Sortie à vélo","distance_raw":32943.4,"elapsed_time_raw":4862,"elevation_gain_raw":99.0665,"elevation_unit":"m","extendedStats":{"cadenceData":null,"elevationData":{"accumulatedElevationAscent":99.05405505251002,"accumulatedElevationDescent":108.39010530010975,"ascentSpeed":{"avg":-1,"lowerQuartile":446,"median":545,"upperQuartile":648},"ascentSpeedZones":null,"avgElevation":219,"elevationZones":null,"lowerQuartileElevation":215,"medianElevation":217,"upperQuartileElevation":220},"gradeData":{"avgGrade":0.0009490520104191727,"gradeProfile":"HILLY","gradeZones":null,"lowerQuartileGrade":-1.6,"medianGrade":0,"upFlatDownDistanceData":{"down":7.866099999999993,"flat":17.36850000000002,"up":7.7087999999999886},"upFlatDownInSeconds":{"down":1126,"flat":2554,"total":4862,"up":1182},"upFlatDownMoveData":{"down":25.149165186500866,"flat":24.481832419733777,"up":23.47857868020301},"upperQuartileGrade":1.5},"heartRateData":null,"moveRatio":1,"paceData":{"avgPace":152,"lowerQuartilePace":208.33333333333331,"medianPace":151.51515151515153,"paceZones":null,"upperQuartilePace":120.48192771084338,"variancePace":25.09687163766813},"powerData":{"avgWatts":127.8596161869003,"avgWattsPerKg":1.826565945527147,"hasPowerMeter":false,"lowerQuartileWatts":0,"medianWatts":77,"powerZones":null,"punchFactor":null,"upperQuartileWatts":213,"variabilityIndex":1.4244642329867025,"weightedPower":182.13145010164712,"weightedWattsPerKg":2.6018778585949587},"speedData":{"avgPace":152,"genuineAvgSpeed":23.658412176059294,"lowerQuartileSpeed":17.28,"medianSpeed":23.759999999999998,"speedZones":null,"standardDeviationSpeed":11.976818155145843,"totalAvgSpeed":23.658412176059294,"upperQuartileSpeed":29.880000000000003,"varianceSpeed":143.44417312143105},"toughnessScore":null},"hasPowerMeter":false,"id":188713761,"moving_time_raw":4862,"name":"08/04/2012 Montbonnot Saint Martin, RA, France","private":false,"short_unit":"km","start_time":"2012-04-08T15:18:42+0000","trainer":false,"type":"Ride"},{"bike_id":824321,"calories":715.5186853099999,"commute":false,"display_type":"Sortie à vélo","distance_raw":32943.4,"elapsed_time_raw":4862,"elevation_gain_raw":99.0665,"elevation_unit":"m","extendedStats":{"cadenceData":null,"elevationData":{"accumulatedElevationAscent":99.05405505251002,"accumulatedElevationDescent":108.39010530010975,"ascentSpeed":{"avg":-1,"lowerQuartile":446,"median":545,"upperQuartile":648},"ascentSpeedZones":null,"avgElevation":219,"elevationZones":null,"lowerQuartileElevation":215,"medianElevation":217,"upperQuartileElevation":220},"gradeData":{"avgGrade":0.0009490520104191727,"gradeProfile":"HILLY","gradeZones":null,"lowerQuartileGrade":-1.6,"medianGrade":0,"upFlatDownDistanceData":{"down":7.866099999999993,"flat":17.36850000000002,"up":7.7087999999999886},"upFlatDownInSeconds":{"down":1126,"flat":2554,"total":4862,"up":1182},"upFlatDownMoveData":{"down":25.149165186500866,"flat":24.481832419733777,"up":23.47857868020301},"upperQuartileGrade":1.5},"heartRateData":null,"moveRatio":1,"paceData":{"avgPace":152,"lowerQuartilePace":208.33333333333331,"medianPace":151.51515151515153,"paceZones":null,"upperQuartilePace":120.48192771084338,"variancePace":25.09687163766813},"powerData":{"avgWatts":127.8596161869003,"avgWattsPerKg":1.826565945527147,"hasPowerMeter":false,"lowerQuartileWatts":0,"medianWatts":77,"powerZones":null,"punchFactor":null,"upperQuartileWatts":213,"variabilityIndex":1.4244642329867025,"weightedPower":182.13145010164712,"weightedWattsPerKg":2.6018778585949587},"speedData":{"avgPace":152,"genuineAvgSpeed":23.658412176059294,"lowerQuartileSpeed":17.28,"medianSpeed":23.759999999999998,"speedZones":null,"standardDeviationSpeed":11.976818155145843,"totalAvgSpeed":23.658412176059294,"upperQuartileSpeed":29.880000000000003,"varianceSpeed":143.44417312143105},"toughnessScore":null},"hasPowerMeter":false,"id":188713804,"moving_time_raw":4862,"name":"15/04/2012 Montbonnot Saint Martin, RA, France","private":false,"short_unit":"km","start_time":"2012-04-15T15:18:42+0000","trainer":false,"type":"Ride"},{"bike_id":824321,"calories":715.5186853099999,"commute":false,"display_type":"Sortie à vélo","distance_raw":32943.4,"elapsed_time_raw":4862,"elevation_gain_raw":99.0665,"elevation_unit":"m","extendedStats":{"cadenceData":null,"elevationData":{"accumulatedElevationAscent":99.05405505251002,"accumulatedElevationDescent":108.39010530010975,"ascentSpeed":{"avg":-1,"lowerQuartile":446,"median":545,"upperQuartile":648},"ascentSpeedZones":null,"avgElevation":219,"elevationZones":null,"lowerQuartileElevation":215,"medianElevation":217,"upperQuartileElevation":220},"gradeData":{"avgGrade":0.0009490520104191727,"gradeProfile":"HILLY","gradeZones":null,"lowerQuartileGrade":-1.6,"medianGrade":0,"upFlatDownDistanceData":{"down":7.866099999999993,"flat":17.36850000000002,"up":7.7087999999999886},"upFlatDownInSeconds":{"down":1126,"flat":2554,"total":4862,"up":1182},"upFlatDownMoveData":{"down":25.149165186500866,"flat":24.481832419733777,"up":23.47857868020301},"upperQuartileGrade":1.5},"heartRateData":null,"moveRatio":1,"paceData":{"avgPace":152,"lowerQuartilePace":208.33333333333331,"medianPace":151.51515151515153,"paceZones":null,"upperQuartilePace":120.48192771084338,"variancePace":25.09687163766813},"powerData":{"avgWatts":127.8596161869003,"avgWattsPerKg":1.826565945527147,"hasPowerMeter":false,"lowerQuartileWatts":0,"medianWatts":77,"powerZones":null,"punchFactor":null,"upperQuartileWatts":213,"variabilityIndex":1.4244642329867025,"weightedPower":182.13145010164712,"weightedWattsPerKg":2.6018778585949587},"speedData":{"avgPace":152,"genuineAvgSpeed":23.658412176059294,"lowerQuartileSpeed":17.28,"medianSpeed":23.759999999999998,"speedZones":null,"standardDeviationSpeed":11.976818155145843,"totalAvgSpeed":23.658412176059294,"upperQuartileSpeed":29.880000000000003,"varianceSpeed":143.44417312143105},"toughnessScore":null},"hasPowerMeter":false,"id":188713877,"moving_time_raw":4862,"name":"22/04/2012 Montbonnot Saint Martin, RA, France","private":false,"short_unit":"km","start_time":"2012-04-22T15:18:42+0000","trainer":false,"type":"Ride"},{"bike_id":824321,"calories":715.5186853099999,"commute":false,"display_type":"Sortie à vélo","distance_raw":32943.4,"elapsed_time_raw":4862,"elevation_gain_raw":99.0665,"elevation_unit":"m","extendedStats":{"cadenceData":null,"elevationData":{"accumulatedElevationAscent":99.05405505251002,"accumulatedElevationDescent":108.39010530010975,"ascentSpeed":{"avg":-1,"lowerQuartile":446,"median":545,"upperQuartile":648},"ascentSpeedZones":null,"avgElevation":219,"elevationZones":null,"lowerQuartileElevation":215,"medianElevation":217,"upperQuartileElevation":220},"gradeData":{"avgGrade":0.0009490520104191727,"gradeProfile":"HILLY","gradeZones":null,"lowerQuartileGrade":-1.6,"medianGrade":0,"upFlatDownDistanceData":{"down":7.866099999999993,"flat":17.36850000000002,"up":7.7087999999999886},"upFlatDownInSeconds":{"down":1126,"flat":2554,"total":4862,"up":1182},"upFlatDownMoveData":{"down":25.149165186500866,"flat":24.481832419733777,"up":23.47857868020301},"upperQuartileGrade":1.5},"heartRateData":null,"moveRatio":1,"paceData":{"avgPace":152,"lowerQuartilePace":208.33333333333331,"medianPace":151.51515151515153,"paceZones":null,"upperQuartilePace":120.48192771084338,"variancePace":25.09687163766813},"powerData":{"avgWatts":127.8596161869003,"avgWattsPerKg":1.826565945527147,"hasPowerMeter":false,"lowerQuartileWatts":0,"medianWatts":77,"powerZones":null,"punchFactor":null,"upperQuartileWatts":213,"variabilityIndex":1.4244642329867025,"weightedPower":182.13145010164712,"weightedWattsPerKg":2.6018778585949587},"speedData":{"avgPace":152,"genuineAvgSpeed":23.658412176059294,"lowerQuartileSpeed":17.28,"medianSpeed":23.759999999999998,"speedZones":null,"standardDeviationSpeed":11.976818155145843,"totalAvgSpeed":23.658412176059294,"upperQuartileSpeed":29.880000000000003,"varianceSpeed":143.44417312143105},"toughnessScore":null},"hasPowerMeter":false,"id":188716686,"moving_time_raw":4862,"name":"29/04/2012 Montbonnot Saint Martin, RA, France","private":false,"short_unit":"km","start_time":"2012-04-29T15:18:42+0000","trainer":false,"type":"Ride"},{"bike_id":824321,"calories":715.5186853099999,"commute":false,"display_type":"Sortie à vélo","distance_raw":32943.4,"elapsed_time_raw":4862,"elevation_gain_raw":99.0665,"elevation_unit":"m","extendedStats":{"cadenceData":null,"elevationData":{"accumulatedElevationAscent":99.05405505251002,"accumulatedElevationDescent":108.39010530010975,"ascentSpeed":{"avg":-1,"lowerQuartile":446,"median":545,"upperQuartile":648},"ascentSpeedZones":null,"avgElevation":219,"elevationZones":null,"lowerQuartileElevation":215,"medianElevation":217,"upperQuartileElevation":220},"gradeData":{"avgGrade":0.0009490520104191727,"gradeProfile":"HILLY","gradeZones":null,"lowerQuartileGrade":-1.6,"medianGrade":0,"upFlatDownDistanceData":{"down":7.866099999999993,"flat":17.36850000000002,"up":7.7087999999999886},"upFlatDownInSeconds":{"down":1126,"flat":2554,"total":4862,"up":1182},"upFlatDownMoveData":{"down":25.149165186500866,"flat":24.481832419733777,"up":23.47857868020301},"upperQuartileGrade":1.5},"heartRateData":null,"moveRatio":1,"paceData":{"avgPace":152,"lowerQuartilePace":208.33333333333331,"medianPace":151.51515151515153,"paceZones":null,"upperQuartilePace":120.48192771084338,"variancePace":25.09687163766813},"powerData":{"avgWatts":127.8596161869003,"avgWattsPerKg":1.826565945527147,"hasPowerMeter":false,"lowerQuartileWatts":0,"medianWatts":77,"powerZones":null,"punchFactor":null,"upperQuartileWatts":213,"variabilityIndex":1.4244642329867025,"weightedPower":182.13145010164712,"weightedWattsPerKg":2.6018778585949587},"speedData":{"avgPace":152,"genuineAvgSpeed":23.658412176059294,"lowerQuartileSpeed":17.28,"medianSpeed":23.759999999999998,"speedZones":null,"standardDeviationSpeed":11.976818155145843,"totalAvgSpeed":23.658412176059294,"upperQuartileSpeed":29.880000000000003,"varianceSpeed":143.44417312143105},"toughnessScore":null},"hasPowerMeter":false,"id":188716779,"moving_time_raw":4862,"name":"06/05/2012 Montbonnot Saint Martin, RA, France","private":false,"short_unit":"km","start_time":"2012-05-06T15:18:42+0000","trainer":false,"type":"Ride"},{"bike_id":824321,"calories":715.5186853099999,"commute":false,"display_type":"Sortie à vélo","distance_raw":32943.4,"elapsed_time_raw":4862,"elevation_gain_raw":99.0665,"elevation_unit":"m","extendedStats":{"cadenceData":null,"elevationData":{"accumulatedElevationAscent":99.05405505251002,"accumulatedElevationDescent":108.39010530010975,"ascentSpeed":{"avg":-1,"lowerQuartile":446,"median":545,"upperQuartile":648},"ascentSpeedZones":null,"avgElevation":219,"elevationZones":null,"lowerQuartileElevation":215,"medianElevation":217,"upperQuartileElevation":220},"gradeData":{"avgGrade":0.0009490520104191727,"gradeProfile":"HILLY","gradeZones":null,"lowerQuartileGrade":-1.6,"medianGrade":0,"upFlatDownDistanceData":{"down":7.866099999999993,"flat":17.36850000000002,"up":7.7087999999999886},"upFlatDownInSeconds":{"down":1126,"flat":2554,"total":4862,"up":1182},"upFlatDownMoveData":{"down":25.149165186500866,"flat":24.481832419733777,"up":23.47857868020301},"upperQuartileGrade":1.5},"heartRateData":null,"moveRatio":1,"paceData":{"avgPace":152,"lowerQuartilePace":208.33333333333331,"medianPace":151.51515151515153,"paceZones":null,"upperQuartilePace":120.48192771084338,"variancePace":25.09687163766813},"powerData":{"avgWatts":127.8596161869003,"avgWattsPerKg":1.826565945527147,"hasPowerMeter":false,"lowerQuartileWatts":0,"medianWatts":77,"powerZones":null,"punchFactor":null,"upperQuartileWatts":213,"variabilityIndex":1.4244642329867025,"weightedPower":182.13145010164712,"weightedWattsPerKg":2.6018778585949587},"speedData":{"avgPace":152,"genuineAvgSpeed":23.658412176059294,"lowerQuartileSpeed":17.28,"medianSpeed":23.759999999999998,"speedZones":null,"standardDeviationSpeed":11.976818155145843,"totalAvgSpeed":23.658412176059294,"upperQuartileSpeed":29.880000000000003,"varianceSpeed":143.44417312143105},"toughnessScore":null},"hasPowerMeter":false,"id":188716810,"moving_time_raw":4862,"name":"13/05/2012 Montbonnot Saint Martin, RA, France","private":false,"short_unit":"km","start_time":"2012-05-13T15:18:42+0000","trainer":false,"type":"Ride"},{"bike_id":824321,"calories":715.5186853099999,"commute":false,"display_type":"Sortie à vélo","distance_raw":32943.4,"elapsed_time_raw":4862,"elevation_gain_raw":99.0665,"elevation_unit":"m","extendedStats":{"cadenceData":null,"elevationData":{"accumulatedElevationAscent":99.05405505251002,"accumulatedElevationDescent":108.39010530010975,"ascentSpeed":{"avg":-1,"lowerQuartile":446,"median":545,"upperQuartile":648},"ascentSpeedZones":null,"avgElevation":219,"elevationZones":null,"lowerQuartileElevation":215,"medianElevation":217,"upperQuartileElevation":220},"gradeData":{"avgGrade":0.0009490520104191727,"gradeProfile":"HILLY","gradeZones":null,"lowerQuartileGrade":-1.6,"medianGrade":0,"upFlatDownDistanceData":{"down":7.866099999999993,"flat":17.36850000000002,"up":7.7087999999999886},"upFlatDownInSeconds":{"down":1126,"flat":2554,"total":4862,"up":1182},"upFlatDownMoveData":{"down":25.149165186500866,"flat":24.481832419733777,"up":23.47857868020301},"upperQuartileGrade":1.5},"heartRateData":null,"moveRatio":1,"paceData":{"avgPace":152,"lowerQuartilePace":208.33333333333331,"medianPace":151.51515151515153,"paceZones":null,"upperQuartilePace":120.48192771084338,"variancePace":25.09687163766813},"powerData":{"avgWatts":127.8596161869003,"avgWattsPerKg":1.826565945527147,"hasPowerMeter":false,"lowerQuartileWatts":0,"medianWatts":77,"powerZones":null,"punchFactor":null,"upperQuartileWatts":213,"variabilityIndex":1.4244642329867025,"weightedPower":182.13145010164712,"weightedWattsPerKg":2.6018778585949587},"speedData":{"avgPace":152,"genuineAvgSpeed":23.658412176059294,"lowerQuartileSpeed":17.28,"medianSpeed":23.759999999999998,"speedZones":null,"standardDeviationSpeed":11.976818155145843,"totalAvgSpeed":23.658412176059294,"upperQuartileSpeed":29.880000000000003,"varianceSpeed":143.44417312143105},"toughnessScore":null},"hasPowerMeter":false,"id":188716857,"moving_time_raw":4862,"name":"20/05/2012 Montbonnot Saint Martin, RA, France","private":false,"short_unit":"km","start_time":"2012-05-20T15:18:42+0000","trainer":false,"type":"Ride"},{"bike_id":824321,"calories":715.5186853099999,"commute":false,"display_type":"Sortie à vélo","distance_raw":32943.4,"elapsed_time_raw":4862,"elevation_gain_raw":99.0665,"elevation_unit":"m","extendedStats":{"cadenceData":null,"elevationData":{"accumulatedElevationAscent":99.05405505251002,"accumulatedElevationDescent":108.39010530010975,"ascentSpeed":{"avg":-1,"lowerQuartile":446,"median":545,"upperQuartile":648},"ascentSpeedZones":null,"avgElevation":219,"elevationZones":null,"lowerQuartileElevation":215,"medianElevation":217,"upperQuartileElevation":220},"gradeData":{"avgGrade":0.0009490520104191727,"gradeProfile":"HILLY","gradeZones":null,"lowerQuartileGrade":-1.6,"medianGrade":0,"upFlatDownDistanceData":{"down":7.866099999999993,"flat":17.36850000000002,"up":7.7087999999999886},"upFlatDownInSeconds":{"down":1126,"flat":2554,"total":4862,"up":1182},"upFlatDownMoveData":{"down":25.149165186500866,"flat":24.481832419733777,"up":23.47857868020301},"upperQuartileGrade":1.5},"heartRateData":null,"moveRatio":1,"paceData":{"avgPace":152,"lowerQuartilePace":208.33333333333331,"medianPace":151.51515151515153,"paceZones":null,"upperQuartilePace":120.48192771084338,"variancePace":25.09687163766813},"powerData":{"avgWatts":127.8596161869003,"avgWattsPerKg":1.826565945527147,"hasPowerMeter":false,"lowerQuartileWatts":0,"medianWatts":77,"powerZones":null,"punchFactor":null,"upperQuartileWatts":213,"variabilityIndex":1.4244642329867025,"weightedPower":182.13145010164712,"weightedWattsPerKg":2.6018778585949587},"speedData":{"avgPace":152,"genuineAvgSpeed":23.658412176059294,"lowerQuartileSpeed":17.28,"medianSpeed":23.759999999999998,"speedZones":null,"standardDeviationSpeed":11.976818155145843,"totalAvgSpeed":23.658412176059294,"upperQuartileSpeed":29.880000000000003,"varianceSpeed":143.44417312143105},"toughnessScore":null},"hasPowerMeter":false,"id":188716938,"moving_time_raw":4862,"name":"27/05/2012 Montbonnot Saint Martin, RA, France","private":false,"short_unit":"km","start_time":"2012-05-27T15:18:42+0000","trainer":false,"type":"Ride"},{"bike_id":824321,"calories":715.5186853099999,"commute":false,"display_type":"Sortie à vélo","distance_raw":32943.4,"elapsed_time_raw":4862,"elevation_gain_raw":99.0665,"elevation_unit":"m","extendedStats":{"cadenceData":null,"elevationData":{"accumulatedElevationAscent":99.05405505251002,"accumulatedElevationDescent":108.39010530010975,"ascentSpeed":{"avg":-1,"lowerQuartile":446,"median":545,"upperQuartile":648},"ascentSpeedZones":null,"avgElevation":219,"elevationZones":null,"lowerQuartileElevation":215,"medianElevation":217,"upperQuartileElevation":220},"gradeData":{"avgGrade":0.0009490520104191727,"gradeProfile":"HILLY","gradeZones":null,"lowerQuartileGrade":-1.6,"medianGrade":0,"upFlatDownDistanceData":{"down":7.866099999999993,"flat":17.36850000000002,"up":7.7087999999999886},"upFlatDownInSeconds":{"down":1126,"flat":2554,"total":4862,"up":1182},"upFlatDownMoveData":{"down":25.149165186500866,"flat":24.481832419733777,"up":23.47857868020301},"upperQuartileGrade":1.5},"heartRateData":null,"moveRatio":1,"paceData":{"avgPace":152,"lowerQuartilePace":208.33333333333331,"medianPace":151.51515151515153,"paceZones":null,"upperQuartilePace":120.48192771084338,"variancePace":25.09687163766813},"powerData":{"avgWatts":127.8596161869003,"avgWattsPerKg":1.826565945527147,"hasPowerMeter":false,"lowerQuartileWatts":0,"medianWatts":77,"powerZones":null,"punchFactor":null,"upperQuartileWatts":213,"variabilityIndex":1.4244642329867025,"weightedPower":182.13145010164712,"weightedWattsPerKg":2.6018778585949587},"speedData":{"avgPace":152,"genuineAvgSpeed":23.658412176059294,"lowerQuartileSpeed":17.28,"medianSpeed":23.759999999999998,"speedZones":null,"standardDeviationSpeed":11.976818155145843,"totalAvgSpeed":23.658412176059294,"upperQuartileSpeed":29.880000000000003,"varianceSpeed":143.44417312143105},"toughnessScore":null},"hasPowerMeter":false,"id":188717000,"moving_time_raw":4862,"name":"03/06/2012 Montbonnot Saint Martin, RA, France","private":false,"short_unit":"km","start_time":"2012-06-03T15:18:42+0000","trainer":false,"type":"Ride"},{"bike_id":824321,"calories":715.5186853099999,"commute":false,"display_type":"Sortie à vélo","distance_raw":32943.4,"elapsed_time_raw":4862,"elevation_gain_raw":99.0665,"elevation_unit":"m","extendedStats":{"cadenceData":null,"elevationData":{"accumulatedElevationAscent":99.05405505251002,"accumulatedElevationDescent":108.39010530010975,"ascentSpeed":{"avg":-1,"lowerQuartile":446,"median":545,"upperQuartile":648},"ascentSpeedZones":null,"avgElevation":219,"elevationZones":null,"lowerQuartileElevation":215,"medianElevation":217,"upperQuartileElevation":220},"gradeData":{"avgGrade":0.0009490520104191727,"gradeProfile":"HILLY","gradeZones":null,"lowerQuartileGrade":-1.6,"medianGrade":0,"upFlatDownDistanceData":{"down":7.866099999999993,"flat":17.36850000000002,"up":7.7087999999999886},"upFlatDownInSeconds":{"down":1126,"flat":2554,"total":4862,"up":1182},"upFlatDownMoveData":{"down":25.149165186500866,"flat":24.481832419733777,"up":23.47857868020301},"upperQuartileGrade":1.5},"heartRateData":null,"moveRatio":1,"paceData":{"avgPace":152,"lowerQuartilePace":208.33333333333331,"medianPace":151.51515151515153,"paceZones":null,"upperQuartilePace":120.48192771084338,"variancePace":25.09687163766813},"powerData":{"avgWatts":127.8596161869003,"avgWattsPerKg":1.826565945527147,"hasPowerMeter":false,"lowerQuartileWatts":0,"medianWatts":77,"powerZones":null,"punchFactor":null,"upperQuartileWatts":213,"variabilityIndex":1.4244642329867025,"weightedPower":182.13145010164712,"weightedWattsPerKg":2.6018778585949587},"speedData":{"avgPace":152,"genuineAvgSpeed":23.658412176059294,"lowerQuartileSpeed":17.28,"medianSpeed":23.759999999999998,"speedZones":null,"standardDeviationSpeed":11.976818155145843,"totalAvgSpeed":23.658412176059294,"upperQuartileSpeed":29.880000000000003,"varianceSpeed":143.44417312143105},"toughnessScore":null},"hasPowerMeter":false,"id":188717044,"moving_time_raw":4862,"name":"10/06/2012 Montbonnot Saint Martin, RA, France","private":false,"short_unit":"km","start_time":"2012-06-10T15:18:42+0000","trainer":false,"type":"Ride"},{"bike_id":824321,"calories":715.5186853099999,"commute":false,"display_type":"Sortie à vélo","distance_raw":32943.4,"elapsed_time_raw":4862,"elevation_gain_raw":99.0665,"elevation_unit":"m","extendedStats":{"cadenceData":null,"elevationData":{"accumulatedElevationAscent":99.05405505251002,"accumulatedElevationDescent":108.39010530010975,"ascentSpeed":{"avg":-1,"lowerQuartile":446,"median":545,"upperQuartile":648},"ascentSpeedZones":null,"avgElevation":219,"elevationZones":null,"lowerQuartileElevation":215,"medianElevation":217,"upperQuartileElevation":220},"gradeData":{"avgGrade":0.0009490520104191727,"gradeProfile":"HILLY","gradeZones":null,"lowerQuartileGrade":-1.6,"medianGrade":0,"upFlatDownDistanceData":{"down":7.866099999999993,"flat":17.36850000000002,"up":7.7087999999999886},"upFlatDownInSeconds":{"down":1126,"flat":2554,"total":4862,"up":1182},"upFlatDownMoveData":{"down":25.149165186500866,"flat":24.481832419733777,"up":23.47857868020301},"upperQuartileGrade":1.5},"heartRateData":null,"moveRatio":1,"paceData":{"avgPace":152,"lowerQuartilePace":208.33333333333331,"medianPace":151.51515151515153,"paceZones":null,"upperQuartilePace":120.48192771084338,"variancePace":25.09687163766813},"powerData":{"avgWatts":127.8596161869003,"avgWattsPerKg":1.826565945527147,"hasPowerMeter":false,"lowerQuartileWatts":0,"medianWatts":77,"powerZones":null,"punchFactor":null,"upperQuartileWatts":213,"variabilityIndex":1.4244642329867025,"weightedPower":182.13145010164712,"weightedWattsPerKg":2.6018778585949587},"speedData":{"avgPace":152,"genuineAvgSpeed":23.658412176059294,"lowerQuartileSpeed":17.28,"medianSpeed":23.759999999999998,"speedZones":null,"standardDeviationSpeed":11.976818155145843,"totalAvgSpeed":23.658412176059294,"upperQuartileSpeed":29.880000000000003,"varianceSpeed":143.44417312143105},"toughnessScore":null},"hasPowerMeter":false,"id":188717205,"moving_time_raw":4862,"name":"17/06/2012 Montbonnot Saint Martin, RA, France","private":false,"short_unit":"km","start_time":"2012-06-17T15:18:42+0000","trainer":false,"type":"Ride"},{"bike_id":824321,"calories":715.5186853099999,"commute":false,"display_type":"Sortie à vélo","distance_raw":32943.4,"elapsed_time_raw":4862,"elevation_gain_raw":99.0665,"elevation_unit":"m","extendedStats":{"cadenceData":null,"elevationData":{"accumulatedElevationAscent":99.05405505251002,"accumulatedElevationDescent":108.39010530010975,"ascentSpeed":{"avg":-1,"lowerQuartile":446,"median":545,"upperQuartile":648},"ascentSpeedZones":null,"avgElevation":219,"elevationZones":null,"lowerQuartileElevation":215,"medianElevation":217,"upperQuartileElevation":220},"gradeData":{"avgGrade":0.0009490520104191727,"gradeProfile":"HILLY","gradeZones":null,"lowerQuartileGrade":-1.6,"medianGrade":0,"upFlatDownDistanceData":{"down":7.866099999999993,"flat":17.36850000000002,"up":7.7087999999999886},"upFlatDownInSeconds":{"down":1126,"flat":2554,"total":4862,"up":1182},"upFlatDownMoveData":{"down":25.149165186500866,"flat":24.481832419733777,"up":23.47857868020301},"upperQuartileGrade":1.5},"heartRateData":null,"moveRatio":1,"paceData":{"avgPace":152,"lowerQuartilePace":208.33333333333331,"medianPace":151.51515151515153,"paceZones":null,"upperQuartilePace":120.48192771084338,"variancePace":25.09687163766813},"powerData":{"avgWatts":127.8596161869003,"avgWattsPerKg":1.826565945527147,"hasPowerMeter":false,"lowerQuartileWatts":0,"medianWatts":77,"powerZones":null,"punchFactor":null,"upperQuartileWatts":213,"variabilityIndex":1.4244642329867025,"weightedPower":182.13145010164712,"weightedWattsPerKg":2.6018778585949587},"speedData":{"avgPace":152,"genuineAvgSpeed":23.658412176059294,"lowerQuartileSpeed":17.28,"medianSpeed":23.759999999999998,"speedZones":null,"standardDeviationSpeed":11.976818155145843,"totalAvgSpeed":23.658412176059294,"upperQuartileSpeed":29.880000000000003,"varianceSpeed":143.44417312143105},"toughnessScore":null},"hasPowerMeter":false,"id":188717285,"moving_time_raw":4862,"name":"24/06/2012 Montbonnot Saint Martin, RA, France","private":false,"short_unit":"km","start_time":"2012-06-24T15:18:42+0000","trainer":false,"type":"Ride"},{"bike_id":824321,"calories":715.5186853099999,"commute":false,"display_type":"Sortie à vélo","distance_raw":32943.4,"elapsed_time_raw":4862,"elevation_gain_raw":99.0665,"elevation_unit":"m","extendedStats":{"cadenceData":null,"elevationData":{"accumulatedElevationAscent":99.05405505251002,"accumulatedElevationDescent":108.39010530010975,"ascentSpeed":{"avg":-1,"lowerQuartile":446,"median":545,"upperQuartile":648},"ascentSpeedZones":null,"avgElevation":219,"elevationZones":null,"lowerQuartileElevation":215,"medianElevation":217,"upperQuartileElevation":220},"gradeData":{"avgGrade":0.0009490520104191727,"gradeProfile":"HILLY","gradeZones":null,"lowerQuartileGrade":-1.6,"medianGrade":0,"upFlatDownDistanceData":{"down":7.866099999999993,"flat":17.36850000000002,"up":7.7087999999999886},"upFlatDownInSeconds":{"down":1126,"flat":2554,"total":4862,"up":1182},"upFlatDownMoveData":{"down":25.149165186500866,"flat":24.481832419733777,"up":23.47857868020301},"upperQuartileGrade":1.5},"heartRateData":null,"moveRatio":1,"paceData":{"avgPace":152,"lowerQuartilePace":208.33333333333331,"medianPace":151.51515151515153,"paceZones":null,"upperQuartilePace":120.48192771084338,"variancePace":25.09687163766813},"powerData":{"avgWatts":127.8596161869003,"avgWattsPerKg":1.826565945527147,"hasPowerMeter":false,"lowerQuartileWatts":0,"medianWatts":77,"powerZones":null,"punchFactor":null,"upperQuartileWatts":213,"variabilityIndex":1.4244642329867025,"weightedPower":182.13145010164712,"weightedWattsPerKg":2.6018778585949587},"speedData":{"avgPace":152,"genuineAvgSpeed":23.658412176059294,"lowerQuartileSpeed":17.28,"medianSpeed":23.759999999999998,"speedZones":null,"standardDeviationSpeed":11.976818155145843,"totalAvgSpeed":23.658412176059294,"upperQuartileSpeed":29.880000000000003,"varianceSpeed":143.44417312143105},"toughnessScore":null},"hasPowerMeter":false,"id":188717378,"moving_time_raw":4862,"name":"01/07/2012 Montbonnot Saint Martin, RA, France","private":false,"short_unit":"km","start_time":"2012-07-01T15:18:42+0000","trainer":false,"type":"Ride"},{"bike_id":824321,"calories":715.5186853099999,"commute":false,"display_type":"Sortie à vélo","distance_raw":32943.4,"elapsed_time_raw":4862,"elevation_gain_raw":99.0665,"elevation_unit":"m","extendedStats":{"cadenceData":null,"elevationData":{"accumulatedElevationAscent":99.05405505251002,"accumulatedElevationDescent":108.39010530010975,"ascentSpeed":{"avg":-1,"lowerQuartile":446,"median":545,"upperQuartile":648},"ascentSpeedZones":null,"avgElevation":219,"elevationZones":null,"lowerQuartileElevation":215,"medianElevation":217,"upperQuartileElevation":220},"gradeData":{"avgGrade":0.0009490520104191727,"gradeProfile":"HILLY","gradeZones":null,"lowerQuartileGrade":-1.6,"medianGrade":0,"upFlatDownDistanceData":{"down":7.866099999999993,"flat":17.36850000000002,"up":7.7087999999999886},"upFlatDownInSeconds":{"down":1126,"flat":2554,"total":4862,"up":1182},"upFlatDownMoveData":{"down":25.149165186500866,"flat":24.481832419733777,"up":23.47857868020301},"upperQuartileGrade":1.5},"heartRateData":null,"moveRatio":1,"paceData":{"avgPace":152,"lowerQuartilePace":208.33333333333331,"medianPace":151.51515151515153,"paceZones":null,"upperQuartilePace":120.48192771084338,"variancePace":25.09687163766813},"powerData":{"avgWatts":127.8596161869003,"avgWattsPerKg":1.826565945527147,"hasPowerMeter":false,"lowerQuartileWatts":0,"medianWatts":77,"powerZones":null,"punchFactor":null,"upperQuartileWatts":213,"variabilityIndex":1.4244642329867025,"weightedPower":182.13145010164712,"weightedWattsPerKg":2.6018778585949587},"speedData":{"avgPace":152,"genuineAvgSpeed":23.658412176059294,"lowerQuartileSpeed":17.28,"medianSpeed":23.759999999999998,"speedZones":null,"standardDeviationSpeed":11.976818155145843,"totalAvgSpeed":23.658412176059294,"upperQuartileSpeed":29.880000000000003,"varianceSpeed":143.44417312143105},"toughnessScore":null},"hasPowerMeter":false,"id":188717561,"moving_time_raw":4862,"name":"08/07/2012 Montbonnot Saint Martin, RA, France","private":false,"short_unit":"km","start_time":"2012-07-08T15:18:42+0000","trainer":false,"type":"Ride"},{"bike_id":824321,"calories":715.5186853099999,"commute":false,"display_type":"Sortie à vélo","distance_raw":32943.4,"elapsed_time_raw":4862,"elevation_gain_raw":99.0665,"elevation_unit":"m","extendedStats":{"cadenceData":null,"elevationData":{"accumulatedElevationAscent":99.05405505251002,"accumulatedElevationDescent":108.39010530010975,"ascentSpeed":{"avg":-1,"lowerQuartile":446,"median":545,"upperQuartile":648},"ascentSpeedZones":null,"avgElevation":219,"elevationZones":null,"lowerQuartileElevation":215,"medianElevation":217,"upperQuartileElevation":220},"gradeData":{"avgGrade":0.0009490520104191727,"gradeProfile":"HILLY","gradeZones":null,"lowerQuartileGrade":-1.6,"medianGrade":0,"upFlatDownDistanceData":{"down":7.866099999999993,"flat":17.36850000000002,"up":7.7087999999999886},"upFlatDownInSeconds":{"down":1126,"flat":2554,"total":4862,"up":1182},"upFlatDownMoveData":{"down":25.149165186500866,"flat":24.481832419733777,"up":23.47857868020301},"upperQuartileGrade":1.5},"heartRateData":null,"moveRatio":1,"paceData":{"avgPace":152,"lowerQuartilePace":208.33333333333331,"medianPace":151.51515151515153,"paceZones":null,"upperQuartilePace":120.48192771084338,"variancePace":25.09687163766813},"powerData":{"avgWatts":127.8596161869003,"avgWattsPerKg":1.826565945527147,"hasPowerMeter":false,"lowerQuartileWatts":0,"medianWatts":77,"powerZones":null,"punchFactor":null,"upperQuartileWatts":213,"variabilityIndex":1.4244642329867025,"weightedPower":182.13145010164712,"weightedWattsPerKg":2.6018778585949587},"speedData":{"avgPace":152,"genuineAvgSpeed":23.658412176059294,"lowerQuartileSpeed":17.28,"medianSpeed":23.759999999999998,"speedZones":null,"standardDeviationSpeed":11.976818155145843,"totalAvgSpeed":23.658412176059294,"upperQuartileSpeed":29.880000000000003,"varianceSpeed":143.44417312143105},"toughnessScore":null},"hasPowerMeter":false,"id":188717617,"moving_time_raw":4862,"name":"15/07/2012 Montbonnot Saint Martin, RA, France","private":false,"short_unit":"km","start_time":"2012-07-15T15:18:42+0000","trainer":false,"type":"Ride"},{"bike_id":824321,"calories":715.5186853099999,"commute":false,"display_type":"Sortie à vélo","distance_raw":32943.4,"elapsed_time_raw":4862,"elevation_gain_raw":99.0665,"elevation_unit":"m","extendedStats":{"cadenceData":null,"elevationData":{"accumulatedElevationAscent":99.05405505251002,"accumulatedElevationDescent":108.39010530010975,"ascentSpeed":{"avg":-1,"lowerQuartile":446,"median":545,"upperQuartile":648},"ascentSpeedZones":null,"avgElevation":219,"elevationZones":null,"lowerQuartileElevation":215,"medianElevation":217,"upperQuartileElevation":220},"gradeData":{"avgGrade":0.0009490520104191727,"gradeProfile":"HILLY","gradeZones":null,"lowerQuartileGrade":-1.6,"medianGrade":0,"upFlatDownDistanceData":{"down":7.866099999999993,"flat":17.36850000000002,"up":7.7087999999999886},"upFlatDownInSeconds":{"down":1126,"flat":2554,"total":4862,"up":1182},"upFlatDownMoveData":{"down":25.149165186500866,"flat":24.481832419733777,"up":23.47857868020301},"upperQuartileGrade":1.5},"heartRateData":null,"moveRatio":1,"paceData":{"avgPace":152,"lowerQuartilePace":208.33333333333331,"medianPace":151.51515151515153,"paceZones":null,"upperQuartilePace":120.48192771084338,"variancePace":25.09687163766813},"powerData":{"avgWatts":127.8596161869003,"avgWattsPerKg":1.826565945527147,"hasPowerMeter":false,"lowerQuartileWatts":0,"medianWatts":77,"powerZones":null,"punchFactor":null,"upperQuartileWatts":213,"variabilityIndex":1.4244642329867025,"weightedPower":182.13145010164712,"weightedWattsPerKg":2.6018778585949587},"speedData":{"avgPace":152,"genuineAvgSpeed":23.658412176059294,"lowerQuartileSpeed":17.28,"medianSpeed":23.759999999999998,"speedZones":null,"standardDeviationSpeed":11.976818155145843,"totalAvgSpeed":23.658412176059294,"upperQuartileSpeed":29.880000000000003,"varianceSpeed":143.44417312143105},"toughnessScore":null},"hasPowerMeter":false,"id":188718081,"moving_time_raw":4862,"name":"22/07/2012 Montbonnot Saint Martin, RA, France","private":false,"short_unit":"km","start_time":"2012-07-22T15:18:42+0000","trainer":false,"type":"Ride"},{"bike_id":824321,"calories":715.5186853099999,"commute":false,"display_type":"Sortie à vélo","distance_raw":32943.4,"elapsed_time_raw":4862,"elevation_gain_raw":99.0665,"elevation_unit":"m","extendedStats":{"cadenceData":null,"elevationData":{"accumulatedElevationAscent":99.05405505251002,"accumulatedElevationDescent":108.39010530010975,"ascentSpeed":{"avg":-1,"lowerQuartile":446,"median":545,"upperQuartile":648},"ascentSpeedZones":null,"avgElevation":219,"elevationZones":null,"lowerQuartileElevation":215,"medianElevation":217,"upperQuartileElevation":220},"gradeData":{"avgGrade":0.0009490520104191727,"gradeProfile":"HILLY","gradeZones":null,"lowerQuartileGrade":-1.6,"medianGrade":0,"upFlatDownDistanceData":{"down":7.866099999999993,"flat":17.36850000000002,"up":7.7087999999999886},"upFlatDownInSeconds":{"down":1126,"flat":2554,"total":4862,"up":1182},"upFlatDownMoveData":{"down":25.149165186500866,"flat":24.481832419733777,"up":23.47857868020301},"upperQuartileGrade":1.5},"heartRateData":null,"moveRatio":1,"paceData":{"avgPace":152,"lowerQuartilePace":208.33333333333331,"medianPace":151.51515151515153,"paceZones":null,"upperQuartilePace":120.48192771084338,"variancePace":25.09687163766813},"powerData":{"avgWatts":127.8596161869003,"avgWattsPerKg":1.826565945527147,"hasPowerMeter":false,"lowerQuartileWatts":0,"medianWatts":77,"powerZones":null,"punchFactor":null,"upperQuartileWatts":213,"variabilityIndex":1.4244642329867025,"weightedPower":182.13145010164712,"weightedWattsPerKg":2.6018778585949587},"speedData":{"avgPace":152,"genuineAvgSpeed":23.658412176059294,"lowerQuartileSpeed":17.28,"medianSpeed":23.759999999999998,"speedZones":null,"standardDeviationSpeed":11.976818155145843,"totalAvgSpeed":23.658412176059294,"upperQuartileSpeed":29.880000000000003,"varianceSpeed":143.44417312143105},"toughnessScore":null},"hasPowerMeter":false,"id":188718121,"moving_time_raw":4862,"name":"29/07/2012 Montbonnot Saint Martin, RA, France","private":false,"short_unit":"km","start_time":"2012-07-29T15:18:42+0000","trainer":false,"type":"Ride"},{"bike_id":824321,"calories":359.66975355000005,"commute":false,"display_type":"Sortie à vélo","distance_raw":11540.1,"elapsed_time_raw":3771,"elevation_gain_raw":299.593,"elevation_unit":"m","extendedStats":{"cadenceData":null,"elevationData":{"accumulatedElevationAscent":299.67113417816967,"accumulatedElevationDescent":301.8799422296474,"ascentSpeed":{"avg":874.0264537476882,"lowerQuartile":594,"median":895,"upperQuartile":1073},"ascentSpeedZones":null,"avgElevation":351,"elevationZones":null,"lowerQuartileElevation":307,"medianElevation":365,"upperQuartileElevation":387},"gradeData":{"avgGrade":0.0038307884292069737,"gradeProfile":"HILLY","gradeZones":null,"lowerQuartileGrade":-4.5,"medianGrade":-0.4,"upFlatDownDistanceData":{"down":4.803799999999993,"flat":2.3605000000000085,"up":4.375099999999999},"upFlatDownInSeconds":{"down":1485,"flat":705,"total":3725,"up":1535},"upFlatDownMoveData":{"down":11.64557575757574,"flat":12.05361702127664,"up":10.260820846905535},"upperQuartileGrade":4.8},"heartRateData":null,"moveRatio":0.9878016441262265,"paceData":{"avgPace":323,"lowerQuartilePace":1666.6666666666665,"medianPace":344.82758620689657,"paceZones":null,"upperQuartilePace":208.33333333333331,"variancePace":25.770247186858892},"powerData":{"avgWatts":115.81746330447874,"avgWattsPerKg":1.654535190063982,"hasPowerMeter":false,"lowerQuartileWatts":0,"medianWatts":61,"powerZones":null,"punchFactor":null,"upperQuartileWatts":227,"variabilityIndex":1.7523680804387494,"weightedPower":202.9548258521547,"weightedWattsPerKg":2.8993546550307814},"speedData":{"avgPace":323,"genuineAvgSpeed":11.136273825503363,"lowerQuartileSpeed":2.16,"medianSpeed":10.44,"speedZones":null,"standardDeviationSpeed":11.81930549984214,"totalAvgSpeed":11.000429594272084,"upperQuartileSpeed":17.28,"varianceSpeed":139.69598249859862},"toughnessScore":null},"hasPowerMeter":false,"id":66331493,"moving_time_raw":3085,"name":"Reco tour d'arces","private":false,"short_unit":"km","start_time":"2012-08-01T16:26:04+0000","trainer":false,"type":"Ride"},{"bike_id":824321,"calories":455.86468598,"commute":false,"display_type":"Sortie à vélo","distance_raw":21236.9,"elapsed_time_raw":5415,"elevation_gain_raw":70.3552,"elevation_unit":"m","extendedStats":{"cadenceData":null,"elevationData":{"accumulatedElevationAscent":69.96379891913776,"accumulatedElevationDescent":76.15183087666045,"ascentSpeed":{"avg":492.75475292623406,"lowerQuartile":409,"median":455,"upperQuartile":505},"ascentSpeedZones":null,"avgElevation":220,"elevationZones":null,"lowerQuartileElevation":216,"medianElevation":218,"upperQuartileElevation":221},"gradeData":{"avgGrade":-0.004009254847946362,"gradeProfile":"FLAT","gradeZones":null,"lowerQuartileGrade":-1.4,"medianGrade":0,"upFlatDownDistanceData":{"down":4.169900000000007,"flat":12.425599999999996,"up":4.604199999999999},"upFlatDownInSeconds":{"down":576,"flat":2523,"total":4075,"up":976},"upFlatDownMoveData":{"down":26.061875000000043,"flat":17.729750297265152,"up":16.98270491803278},"upperQuartileGrade":1.4},"heartRateData":null,"moveRatio":0.752539242843952,"paceData":{"avgPace":192,"lowerQuartilePace":2499.9999999999995,"medianPace":158.73015873015873,"paceZones":null,"upperQuartilePace":117.64705882352942,"variancePace":7.867798086891726},"powerData":{"avgWatts":142.3708142403948,"avgWattsPerKg":2.033868774862783,"hasPowerMeter":false,"lowerQuartileWatts":0,"medianWatts":101,"powerZones":null,"punchFactor":null,"upperQuartileWatts":216,"variabilityIndex":1.5786432765765392,"weightedPower":224.75272868132666,"weightedWattsPerKg":3.210753266876095},"speedData":{"avgPace":192,"genuineAvgSpeed":18.78413742331293,"lowerQuartileSpeed":1.4400000000000002,"medianSpeed":22.68,"speedZones":null,"standardDeviationSpeed":21.390682786424524,"totalAvgSpeed":14.135800554016656,"upperQuartileSpeed":30.6,"varianceSpeed":457.56131006943843},"toughnessScore":null},"hasPowerMeter":false,"id":66332861,"moving_time_raw":3124,"name":"Gresivaudan Loop","private":false,"short_unit":"km","start_time":"2012-08-03T16:02:43+0000","trainer":false,"type":"Ride"},{"bike_id":824309,"calories":218.7809520575,"commute":false,"display_type":"Sortie à vélo","distance_raw":9035.1,"elapsed_time_raw":2470,"elevation_gain_raw":123.865,"elevation_unit":"m","extendedStats":{"cadenceData":null,"elevationData":{"accumulatedElevationAscent":124.24250008853318,"accumulatedElevationDescent":410.3371041609664,"ascentSpeed":{"avg":644.6303887351327,"lowerQuartile":388,"median":535,"upperQuartile":712},"ascentSpeedZones":null,"avgElevation":322,"elevationZones":null,"lowerQuartileElevation":265,"medianElevation":291,"upperQuartileElevation":323},"gradeData":{"avgGrade":-3.138768681933499,"gradeProfile":"HILLY","gradeZones":null,"lowerQuartileGrade":-5.9,"medianGrade":-1.6,"upFlatDownDistanceData":{"down":4.5029,"flat":1.727,"up":2.7962},"upFlatDownInSeconds":{"down":1208,"flat":368,"total":2273,"up":697},"upFlatDownMoveData":{"down":13.419238410596028,"flat":16.894565217391303,"up":14.442352941176472},"upperQuartileGrade":3},"heartRateData":null,"moveRatio":0.9202429149797571,"paceData":{"avgPace":252,"lowerQuartilePace":370.3703703703703,"medianPace":243.90243902439028,"paceZones":null,"upperQuartilePace":196.07843137254903,"variancePace":29.266711948806833},"powerData":{"avgWatts":98.26186830015314,"avgWattsPerKg":1.4037409757164734,"hasPowerMeter":false,"lowerQuartileWatts":0,"medianWatts":12,"powerZones":null,"punchFactor":null,"upperQuartileWatts":154,"variabilityIndex":2.8085093838012622,"weightedPower":275.9693791908239,"weightedWattsPerKg":3.9424197027260552},"speedData":{"avgPace":252,"genuineAvgSpeed":14.290004399472066,"lowerQuartileSpeed":9.72,"medianSpeed":14.76,"speedZones":null,"standardDeviationSpeed":11.090836009694602,"totalAvgSpeed":13.150275303643728,"upperQuartileSpeed":18.36,"varianceSpeed":123.00664339393848},"toughnessScore":null},"hasPowerMeter":false,"id":66333687,"moving_time_raw":2191,"name":"DH Only Bastille","private":false,"short_unit":"km","start_time":"2012-08-04T15:21:39+0000","trainer":false,"type":"Ride"},{"bike_id":824321,"calories":715.5186853099999,"commute":false,"display_type":"Sortie à vélo","distance_raw":32943.4,"elapsed_time_raw":4862,"elevation_gain_raw":99.0665,"elevation_unit":"m","extendedStats":{"cadenceData":null,"elevationData":{"accumulatedElevationAscent":99.05405505251002,"accumulatedElevationDescent":108.39010530010975,"ascentSpeed":{"avg":-1,"lowerQuartile":446,"median":545,"upperQuartile":648},"ascentSpeedZones":null,"avgElevation":219,"elevationZones":null,"lowerQuartileElevation":215,"medianElevation":217,"upperQuartileElevation":220},"gradeData":{"avgGrade":0.0009490520104191727,"gradeProfile":"HILLY","gradeZones":null,"lowerQuartileGrade":-1.6,"medianGrade":0,"upFlatDownDistanceData":{"down":7.866099999999993,"flat":17.36850000000002,"up":7.7087999999999886},"upFlatDownInSeconds":{"down":1126,"flat":2554,"total":4862,"up":1182},"upFlatDownMoveData":{"down":25.149165186500866,"flat":24.481832419733777,"up":23.47857868020301},"upperQuartileGrade":1.5},"heartRateData":null,"moveRatio":1,"paceData":{"avgPace":152,"lowerQuartilePace":208.33333333333331,"medianPace":151.51515151515153,"paceZones":null,"upperQuartilePace":120.48192771084338,"variancePace":25.09687163766813},"powerData":{"avgWatts":127.8596161869003,"avgWattsPerKg":1.826565945527147,"hasPowerMeter":false,"lowerQuartileWatts":0,"medianWatts":77,"powerZones":null,"punchFactor":null,"upperQuartileWatts":213,"variabilityIndex":1.4244642329867025,"weightedPower":182.13145010164712,"weightedWattsPerKg":2.6018778585949587},"speedData":{"avgPace":152,"genuineAvgSpeed":23.658412176059294,"lowerQuartileSpeed":17.28,"medianSpeed":23.759999999999998,"speedZones":null,"standardDeviationSpeed":11.976818155145843,"totalAvgSpeed":23.658412176059294,"upperQuartileSpeed":29.880000000000003,"varianceSpeed":143.44417312143105},"toughnessScore":null},"hasPowerMeter":false,"id":188718184,"moving_time_raw":4862,"name":"05/08/2012 Montbonnot Saint Martin, RA, France","private":false,"short_unit":"km","start_time":"2012-08-05T15:18:42+0000","trainer":false,"type":"Ride"},{"bike_id":824321,"calories":715.5186853099999,"commute":false,"display_type":"Sortie à vélo","distance_raw":32943.4,"elapsed_time_raw":4862,"elevation_gain_raw":99.0665,"elevation_unit":"m","extendedStats":{"cadenceData":null,"elevationData":{"accumulatedElevationAscent":99.05405505251002,"accumulatedElevationDescent":108.39010530010975,"ascentSpeed":{"avg":-1,"lowerQuartile":446,"median":545,"upperQuartile":648},"ascentSpeedZones":null,"avgElevation":219,"elevationZones":null,"lowerQuartileElevation":215,"medianElevation":217,"upperQuartileElevation":220},"gradeData":{"avgGrade":0.0009490520104191727,"gradeProfile":"HILLY","gradeZones":null,"lowerQuartileGrade":-1.6,"medianGrade":0,"upFlatDownDistanceData":{"down":7.866099999999993,"flat":17.36850000000002,"up":7.7087999999999886},"upFlatDownInSeconds":{"down":1126,"flat":2554,"total":4862,"up":1182},"upFlatDownMoveData":{"down":25.149165186500866,"flat":24.481832419733777,"up":23.47857868020301},"upperQuartileGrade":1.5},"heartRateData":null,"moveRatio":1,"paceData":{"avgPace":152,"lowerQuartilePace":208.33333333333331,"medianPace":151.51515151515153,"paceZones":null,"upperQuartilePace":120.48192771084338,"variancePace":25.09687163766813},"powerData":{"avgWatts":127.8596161869003,"avgWattsPerKg":1.826565945527147,"hasPowerMeter":false,"lowerQuartileWatts":0,"medianWatts":77,"powerZones":null,"punchFactor":null,"upperQuartileWatts":213,"variabilityIndex":1.4244642329867025,"weightedPower":182.13145010164712,"weightedWattsPerKg":2.6018778585949587},"speedData":{"avgPace":152,"genuineAvgSpeed":23.658412176059294,"lowerQuartileSpeed":17.28,"medianSpeed":23.759999999999998,"speedZones":null,"standardDeviationSpeed":11.976818155145843,"totalAvgSpeed":23.658412176059294,"upperQuartileSpeed":29.880000000000003,"varianceSpeed":143.44417312143105},"toughnessScore":null},"hasPowerMeter":false,"id":188718244,"moving_time_raw":4862,"name":"12/08/2012 Montbonnot Saint Martin, RA, France","private":false,"short_unit":"km","start_time":"2012-08-12T15:18:42+0000","trainer":false,"type":"Ride"},{"bike_id":824309,"calories":58.02125366199999,"commute":false,"display_type":"Sortie à vélo","distance_raw":2461.4,"elapsed_time_raw":801,"elevation_gain_raw":33.4667,"elevation_unit":"m","extendedStats":{"cadenceData":null,"elevationData":{"accumulatedElevationAscent":33.0016870962063,"accumulatedElevationDescent":3.920937765257179,"ascentSpeed":{"avg":490.8958238084207,"lowerQuartile":313,"median":414,"upperQuartile":545},"ascentSpeedZones":null,"avgElevation":227,"elevationZones":null,"lowerQuartileElevation":221,"medianElevation":222,"upperQuartileElevation":233},"gradeData":{"avgGrade":1.2705107252298262,"gradeProfile":"FLAT","gradeZones":null,"lowerQuartileGrade":-0.4,"medianGrade":0.8,"upFlatDownDistanceData":{"down":0.1467,"flat":1.4567000000000005,"up":0.8440999999999996},"upFlatDownInSeconds":{"down":61,"flat":502,"total":799,"up":236},"upFlatDownMoveData":{"down":8.657704918032787,"flat":10.446454183266935,"up":12.87610169491525},"upperQuartileGrade":2.4},"heartRateData":null,"moveRatio":0.9975031210986267,"paceData":{"avgPace":311,"lowerQuartilePace":1249.9999999999998,"medianPace":303.03030303030306,"paceZones":null,"upperQuartilePace":227.27272727272722,"variancePace":23.112697131220443},"powerData":{"avgWatts":90.20477815699658,"avgWattsPerKg":1.288639687957094,"hasPowerMeter":false,"lowerQuartileWatts":1,"medianWatts":57,"powerZones":null,"punchFactor":null,"upperQuartileWatts":150,"variabilityIndex":1.598233547318765,"weightedPower":144.1683025789589,"weightedWattsPerKg":2.059547179699413},"speedData":{"avgPace":311,"genuineAvgSpeed":11.590513141426788,"lowerQuartileSpeed":2.8800000000000003,"medianSpeed":11.879999999999999,"speedZones":null,"standardDeviationSpeed":12.480326185792519,"totalAvgSpeed":11.56157303370787,"upperQuartileSpeed":15.840000000000002,"varianceSpeed":155.75854170377846},"toughnessScore":null},"hasPowerMeter":false,"id":66334090,"moving_time_raw":691,"name":"Work 2 Tartaix","private":false,"short_unit":"km","start_time":"2012-08-16T14:35:33+0000","trainer":false,"type":"Ride"},{"bike_id":824321,"calories":715.5186853099999,"commute":false,"display_type":"Sortie à vélo","distance_raw":32943.4,"elapsed_time_raw":4862,"elevation_gain_raw":99.0665,"elevation_unit":"m","extendedStats":{"cadenceData":null,"elevationData":{"accumulatedElevationAscent":99.05405505251002,"accumulatedElevationDescent":108.39010530010975,"ascentSpeed":{"avg":-1,"lowerQuartile":446,"median":545,"upperQuartile":648},"ascentSpeedZones":null,"avgElevation":219,"elevationZones":null,"lowerQuartileElevation":215,"medianElevation":217,"upperQuartileElevation":220},"gradeData":{"avgGrade":0.0009490520104191727,"gradeProfile":"HILLY","gradeZones":null,"lowerQuartileGrade":-1.6,"medianGrade":0,"upFlatDownDistanceData":{"down":7.866099999999993,"flat":17.36850000000002,"up":7.7087999999999886},"upFlatDownInSeconds":{"down":1126,"flat":2554,"total":4862,"up":1182},"upFlatDownMoveData":{"down":25.149165186500866,"flat":24.481832419733777,"up":23.47857868020301},"upperQuartileGrade":1.5},"heartRateData":null,"moveRatio":1,"paceData":{"avgPace":152,"lowerQuartilePace":208.33333333333331,"medianPace":151.51515151515153,"paceZones":null,"upperQuartilePace":120.48192771084338,"variancePace":25.09687163766813},"powerData":{"avgWatts":127.8596161869003,"avgWattsPerKg":1.826565945527147,"hasPowerMeter":false,"lowerQuartileWatts":0,"medianWatts":77,"powerZones":null,"punchFactor":null,"upperQuartileWatts":213,"variabilityIndex":1.4244642329867025,"weightedPower":182.13145010164712,"weightedWattsPerKg":2.6018778585949587},"speedData":{"avgPace":152,"genuineAvgSpeed":23.658412176059294,"lowerQuartileSpeed":17.28,"medianSpeed":23.759999999999998,"speedZones":null,"standardDeviationSpeed":11.976818155145843,"totalAvgSpeed":23.658412176059294,"upperQuartileSpeed":29.880000000000003,"varianceSpeed":143.44417312143105},"toughnessScore":null},"hasPowerMeter":false,"id":188718314,"moving_time_raw":4862,"name":"19/08/2012 Montbonnot Saint Martin, RA, France","private":false,"short_unit":"km","start_time":"2012-08-19T15:18:42+0000","trainer":false,"type":"Ride"},{"bike_id":824309,"calories":471.591772353,"commute":false,"display_type":"Sortie à vélo","distance_raw":23667.8,"elapsed_time_raw":5807,"elevation_gain_raw":128.831,"elevation_unit":"m","extendedStats":{"cadenceData":null,"elevationData":{"accumulatedElevationAscent":128.92640041296752,"accumulatedElevationDescent":133.629581466256,"ascentSpeed":{"avg":476.9759912154438,"lowerQuartile":370,"median":447,"upperQuartile":526},"ascentSpeedZones":null,"avgElevation":229,"elevationZones":null,"lowerQuartileElevation":221,"medianElevation":225,"upperQuartileElevation":231},"gradeData":{"avgGrade":0.003664049890567867,"gradeProfile":"HILLY","gradeZones":null,"lowerQuartileGrade":-1.9,"medianGrade":0,"upFlatDownDistanceData":{"down":6.581199999999987,"flat":10.18750000000001,"up":6.8991000000000025},"upFlatDownInSeconds":{"down":1485,"flat":2674,"total":5807,"up":1648},"upFlatDownMoveData":{"down":15.954424242424208,"flat":13.71540762902021,"up":15.070849514563111},"upperQuartileGrade":1.9},"heartRateData":null,"moveRatio":1,"paceData":{"avgPace":241,"lowerQuartilePace":434.7826086956522,"medianPace":232.5581395348837,"paceZones":null,"upperQuartilePace":175.43859649122808,"variancePace":20.636882710616426},"powerData":{"avgWatts":85.00431207380666,"avgWattsPerKg":1.2143473153400952,"hasPowerMeter":false,"lowerQuartileWatts":0,"medianWatts":34,"powerZones":null,"punchFactor":null,"upperQuartileWatts":135,"variabilityIndex":1.841144823763233,"weightedPower":156.50524917224362,"weightedWattsPerKg":2.2357892738891945},"speedData":{"avgPace":241,"genuineAvgSpeed":14.926950232478024,"lowerQuartileSpeed":8.28,"medianSpeed":15.48,"speedZones":null,"standardDeviationSpeed":13.207761026277959,"totalAvgSpeed":14.926950232478024,"upperQuartileSpeed":20.52,"varianceSpeed":174.444951327267},"toughnessScore":null},"hasPowerMeter":false,"id":66334694,"moving_time_raw":5238,"name":"Gresivaudan MTB Loop","private":false,"short_unit":"km","start_time":"2012-08-21T15:37:53+0000","trainer":false,"type":"Ride"},{"bike_id":824309,"calories":343.70946749149994,"commute":false,"display_type":"Sortie à vélo","distance_raw":18769,"elapsed_time_raw":5003,"elevation_gain_raw":112.3,"elevation_unit":"m","extendedStats":{"cadenceData":null,"elevationData":{"accumulatedElevationAscent":112.09640118648105,"accumulatedElevationDescent":292.3232889577055,"ascentSpeed":{"avg":444.90727224025056,"lowerQuartile":348,"median":422,"upperQuartile":531},"ascentSpeedZones":null,"avgElevation":236,"elevationZones":null,"lowerQuartileElevation":219,"medianElevation":221,"upperQuartileElevation":228},"gradeData":{"avgGrade":-1.0560408768309528,"gradeProfile":"HILLY","gradeZones":null,"lowerQuartileGrade":-2,"medianGrade":0,"upFlatDownDistanceData":{"down":5.45520000000001,"flat":8.325199999999993,"up":4.973499999999996},"upFlatDownInSeconds":{"down":1393,"flat":2040,"total":4640,"up":1207},"upFlatDownMoveData":{"down":14.09814788226851,"flat":14.691529411764694,"up":14.833968516984248},"upperQuartileGrade":1.8},"heartRateData":null,"moveRatio":0.9274435338796722,"paceData":{"avgPace":245,"lowerQuartilePace":357.1428571428571,"medianPace":222.22222222222223,"paceZones":null,"upperQuartilePace":178.57142857142856,"variancePace":23.410602019551092},"powerData":{"avgWatts":80.0370128171593,"avgWattsPerKg":1.14338589738799,"hasPowerMeter":false,"lowerQuartileWatts":0,"medianWatts":42,"powerZones":null,"punchFactor":null,"upperQuartileWatts":126,"variabilityIndex":1.5944840637708382,"weightedPower":127.61774144878281,"weightedWattsPerKg":1.8231105921254687},"speedData":{"avgPace":245,"genuineAvgSpeed":14.715737068965563,"lowerQuartileSpeed":10.08,"medianSpeed":16.2,"speedZones":null,"standardDeviationSpeed":12.400664544400565,"totalAvgSpeed":13.648015190885511,"upperQuartileSpeed":20.16,"varianceSpeed":153.77648114275325},"toughnessScore":null},"hasPowerMeter":false,"id":64333836,"moving_time_raw":4169,"name":"DH Frange verte","private":false,"short_unit":"km","start_time":"2012-08-25T14:34:15+0000","trainer":false,"type":"Ride"},{"bike_id":824321,"calories":715.5186853099999,"commute":false,"display_type":"Sortie à vélo","distance_raw":32943.4,"elapsed_time_raw":4862,"elevation_gain_raw":99.0665,"elevation_unit":"m","extendedStats":{"cadenceData":null,"elevationData":{"accumulatedElevationAscent":99.05405505251002,"accumulatedElevationDescent":108.39010530010975,"ascentSpeed":{"avg":-1,"lowerQuartile":446,"median":545,"upperQuartile":648},"ascentSpeedZones":null,"avgElevation":219,"elevationZones":null,"lowerQuartileElevation":215,"medianElevation":217,"upperQuartileElevation":220},"gradeData":{"avgGrade":0.0009490520104191727,"gradeProfile":"HILLY","gradeZones":null,"lowerQuartileGrade":-1.6,"medianGrade":0,"upFlatDownDistanceData":{"down":7.866099999999993,"flat":17.36850000000002,"up":7.7087999999999886},"upFlatDownInSeconds":{"down":1126,"flat":2554,"total":4862,"up":1182},"upFlatDownMoveData":{"down":25.149165186500866,"flat":24.481832419733777,"up":23.47857868020301},"upperQuartileGrade":1.5},"heartRateData":null,"moveRatio":1,"paceData":{"avgPace":152,"lowerQuartilePace":208.33333333333331,"medianPace":151.51515151515153,"paceZones":null,"upperQuartilePace":120.48192771084338,"variancePace":25.09687163766813},"powerData":{"avgWatts":127.8596161869003,"avgWattsPerKg":1.826565945527147,"hasPowerMeter":false,"lowerQuartileWatts":0,"medianWatts":77,"powerZones":null,"punchFactor":null,"upperQuartileWatts":213,"variabilityIndex":1.4244642329867025,"weightedPower":182.13145010164712,"weightedWattsPerKg":2.6018778585949587},"speedData":{"avgPace":152,"genuineAvgSpeed":23.658412176059294,"lowerQuartileSpeed":17.28,"medianSpeed":23.759999999999998,"speedZones":null,"standardDeviationSpeed":11.976818155145843,"totalAvgSpeed":23.658412176059294,"upperQuartileSpeed":29.880000000000003,"varianceSpeed":143.44417312143105},"toughnessScore":null},"hasPowerMeter":false,"id":188718436,"moving_time_raw":4862,"name":"26/08/2012 Montbonnot Saint Martin, RA, France","private":false,"short_unit":"km","start_time":"2012-08-26T15:18:42+0000","trainer":false,"type":"Ride"},{"bike_id":824309,"calories":null,"commute":false,"display_type":"Sortie à vélo","distance_raw":15832.4,"elapsed_time_raw":8348,"elevation_gain_raw":513.135,"elevation_unit":"m","extendedStats":{"cadenceData":null,"elevationData":{"accumulatedElevationAscent":512.9082028862606,"accumulatedElevationDescent":449.8538034816759,"ascentSpeed":{"avg":664.4876491040607,"lowerQuartile":417,"median":609,"upperQuartile":803},"ascentSpeedZones":null,"avgElevation":474,"elevationZones":null,"lowerQuartileElevation":390,"medianElevation":421,"upperQuartileElevation":554},"gradeData":{"avgGrade":-0.03104249352753649,"gradeProfile":"HILLY","gradeZones":null,"lowerQuartileGrade":-4.2,"medianGrade":0,"upFlatDownDistanceData":{"down":5.8058,"flat":3.235499999999998,"up":6.756400000000005},"upFlatDownInSeconds":{"down":2722,"flat":927,"total":7147,"up":3498},"upFlatDownMoveData":{"down":7.6785011021307845,"flat":12.565048543689311,"up":6.953413379073761},"upperQuartileGrade":7.1},"heartRateData":null,"moveRatio":0.8561332055582176,"paceData":{"avgPace":436,"lowerQuartilePace":1666.6666666666665,"medianPace":476.19047619047615,"paceZones":null,"upperQuartilePace":322.5806451612903,"variancePace":25.843295439124375},"powerData":null,"speedData":{"avgPace":436,"genuineAvgSpeed":8.258567231006031,"lowerQuartileSpeed":2.16,"medianSpeed":7.5600000000000005,"speedZones":null,"standardDeviationSpeed":11.802589547741974,"totalAvgSpeed":7.070433636799247,"upperQuartileSpeed":11.16,"varianceSpeed":139.3011200324681},"toughnessScore":null},"hasPowerMeter":false,"id":64333931,"moving_time_raw":5738,"name":"Enduro Bois mollard / Fort bourcet","private":false,"short_unit":"km","start_time":"2012-08-27T14:56:52+0000","trainer":false,"type":"Ride"},{"bike_id":824321,"calories":715.5186853099999,"commute":false,"display_type":"Sortie à vélo","distance_raw":32943.4,"elapsed_time_raw":4862,"elevation_gain_raw":99.0665,"elevation_unit":"m","extendedStats":{"cadenceData":null,"elevationData":{"accumulatedElevationAscent":99.05405505251002,"accumulatedElevationDescent":108.39010530010975,"ascentSpeed":{"avg":-1,"lowerQuartile":446,"median":545,"upperQuartile":648},"ascentSpeedZones":null,"avgElevation":219,"elevationZones":null,"lowerQuartileElevation":215,"medianElevation":217,"upperQuartileElevation":220},"gradeData":{"avgGrade":0.0009490520104191727,"gradeProfile":"HILLY","gradeZones":null,"lowerQuartileGrade":-1.6,"medianGrade":0,"upFlatDownDistanceData":{"down":7.866099999999993,"flat":17.36850000000002,"up":7.7087999999999886},"upFlatDownInSeconds":{"down":1126,"flat":2554,"total":4862,"up":1182},"upFlatDownMoveData":{"down":25.149165186500866,"flat":24.481832419733777,"up":23.47857868020301},"upperQuartileGrade":1.5},"heartRateData":null,"moveRatio":1,"paceData":{"avgPace":152,"lowerQuartilePace":208.33333333333331,"medianPace":151.51515151515153,"paceZones":null,"upperQuartilePace":120.48192771084338,"variancePace":25.09687163766813},"powerData":{"avgWatts":127.8596161869003,"avgWattsPerKg":1.826565945527147,"hasPowerMeter":false,"lowerQuartileWatts":0,"medianWatts":77,"powerZones":null,"punchFactor":null,"upperQuartileWatts":213,"variabilityIndex":1.4244642329867025,"weightedPower":182.13145010164712,"weightedWattsPerKg":2.6018778585949587},"speedData":{"avgPace":152,"genuineAvgSpeed":23.658412176059294,"lowerQuartileSpeed":17.28,"medianSpeed":23.759999999999998,"speedZones":null,"standardDeviationSpeed":11.976818155145843,"totalAvgSpeed":23.658412176059294,"upperQuartileSpeed":29.880000000000003,"varianceSpeed":143.44417312143105},"toughnessScore":null},"hasPowerMeter":false,"id":188718911,"moving_time_raw":4862,"name":"02/09/2012 Montbonnot Saint Martin, RA, France","private":false,"short_unit":"km","start_time":"2012-09-02T15:18:42+0000","trainer":false,"type":"Ride"},{"bike_id":824309,"calories":1253.4857863849998,"commute":false,"display_type":"Sortie à vélo","distance_raw":26931.1,"elapsed_time_raw":8889,"elevation_gain_raw":1010.95,"elevation_unit":"m","extendedStats":{"cadenceData":null,"elevationData":{"accumulatedElevationAscent":466.811463108012,"accumulatedElevationDescent":457.6989293399538,"ascentSpeed":{"avg":528.2527966784353,"lowerQuartile":308,"median":466,"upperQuartile":649},"ascentSpeedZones":null,"avgElevation":390,"elevationZones":null,"lowerQuartileElevation":269,"medianElevation":445,"upperQuartileElevation":476},"gradeData":{"avgGrade":-0.008331445800589385,"gradeProfile":"HILLY","gradeZones":null,"lowerQuartileGrade":-6.2,"medianGrade":0.5,"upFlatDownDistanceData":{"down":10.91159999999999,"flat":3.767900000000002,"up":12.251600000000007},"upFlatDownInSeconds":{"down":2686,"flat":1376,"total":8889,"up":4827},"upFlatDownMoveData":{"down":14.624631422189115,"flat":9.85787790697675,"up":9.137302672467376},"upperQuartileGrade":6},"heartRateData":null,"moveRatio":1,"paceData":{"avgPace":316,"lowerQuartilePace":769.230769230769,"medianPace":416.66666666666663,"paceZones":null,"upperQuartilePace":222.22222222222223,"variancePace":17.157042969392144},"powerData":{"avgWatts":161.1189452565205,"avgWattsPerKg":2.301699217950293,"hasPowerMeter":false,"lowerQuartileWatts":0,"medianWatts":93,"powerZones":null,"punchFactor":null,"upperQuartileWatts":216,"variabilityIndex":1.8431602724950218,"weightedPower":296.96803904311884,"weightedWattsPerKg":4.242400557758841},"speedData":{"avgPace":316,"genuineAvgSpeed":11.38740465744176,"lowerQuartileSpeed":4.680000000000001,"medianSpeed":8.64,"speedZones":null,"standardDeviationSpeed":14.485384610259285,"totalAvgSpeed":11.38740465744176,"upperQuartileSpeed":16.2,"varianceSpeed":209.82636730713654},"toughnessScore":null},"hasPowerMeter":false,"id":64331103,"moving_time_raw":7583,"name":"Enduro C2S","private":false,"short_unit":"km","start_time":"2012-09-08T06:14:32+0000","trainer":false,"type":"Ride"},{"bike_id":824321,"calories":715.5186853099999,"commute":false,"display_type":"Sortie à vélo","distance_raw":32943.4,"elapsed_time_raw":4862,"elevation_gain_raw":99.0665,"elevation_unit":"m","extendedStats":{"cadenceData":null,"elevationData":{"accumulatedElevationAscent":99.05405505251002,"accumulatedElevationDescent":108.39010530010975,"ascentSpeed":{"avg":-1,"lowerQuartile":446,"median":545,"upperQuartile":648},"ascentSpeedZones":null,"avgElevation":219,"elevationZones":null,"lowerQuartileElevation":215,"medianElevation":217,"upperQuartileElevation":220},"gradeData":{"avgGrade":0.0009490520104191727,"gradeProfile":"HILLY","gradeZones":null,"lowerQuartileGrade":-1.6,"medianGrade":0,"upFlatDownDistanceData":{"down":7.866099999999993,"flat":17.36850000000002,"up":7.7087999999999886},"upFlatDownInSeconds":{"down":1126,"flat":2554,"total":4862,"up":1182},"upFlatDownMoveData":{"down":25.149165186500866,"flat":24.481832419733777,"up":23.47857868020301},"upperQuartileGrade":1.5},"heartRateData":null,"moveRatio":1,"paceData":{"avgPace":152,"lowerQuartilePace":208.33333333333331,"medianPace":151.51515151515153,"paceZones":null,"upperQuartilePace":120.48192771084338,"variancePace":25.09687163766813},"powerData":{"avgWatts":127.8596161869003,"avgWattsPerKg":1.826565945527147,"hasPowerMeter":false,"lowerQuartileWatts":0,"medianWatts":77,"powerZones":null,"punchFactor":null,"upperQuartileWatts":213,"variabilityIndex":1.4244642329867025,"weightedPower":182.13145010164712,"weightedWattsPerKg":2.6018778585949587},"speedData":{"avgPace":152,"genuineAvgSpeed":23.658412176059294,"lowerQuartileSpeed":17.28,"medianSpeed":23.759999999999998,"speedZones":null,"standardDeviationSpeed":11.976818155145843,"totalAvgSpeed":23.658412176059294,"upperQuartileSpeed":29.880000000000003,"varianceSpeed":143.44417312143105},"toughnessScore":null},"hasPowerMeter":false,"id":188718960,"moving_time_raw":4862,"name":"09/09/2012 Montbonnot Saint Martin, RA, France","private":false,"short_unit":"km","start_time":"2012-09-09T15:18:42+0000","trainer":false,"type":"Ride"},{"bike_id":824321,"calories":715.5186853099999,"commute":false,"display_type":"Sortie à vélo","distance_raw":32943.4,"elapsed_time_raw":4862,"elevation_gain_raw":99.0665,"elevation_unit":"m","extendedStats":{"cadenceData":null,"elevationData":{"accumulatedElevationAscent":99.05405505251002,"accumulatedElevationDescent":108.39010530010975,"ascentSpeed":{"avg":-1,"lowerQuartile":446,"median":545,"upperQuartile":648},"ascentSpeedZones":null,"avgElevation":219,"elevationZones":null,"lowerQuartileElevation":215,"medianElevation":217,"upperQuartileElevation":220},"gradeData":{"avgGrade":0.0009490520104191727,"gradeProfile":"HILLY","gradeZones":null,"lowerQuartileGrade":-1.6,"medianGrade":0,"upFlatDownDistanceData":{"down":7.866099999999993,"flat":17.36850000000002,"up":7.7087999999999886},"upFlatDownInSeconds":{"down":1126,"flat":2554,"total":4862,"up":1182},"upFlatDownMoveData":{"down":25.149165186500866,"flat":24.481832419733777,"up":23.47857868020301},"upperQuartileGrade":1.5},"heartRateData":null,"moveRatio":1,"paceData":{"avgPace":152,"lowerQuartilePace":208.33333333333331,"medianPace":151.51515151515153,"paceZones":null,"upperQuartilePace":120.48192771084338,"variancePace":25.09687163766813},"powerData":{"avgWatts":127.8596161869003,"avgWattsPerKg":1.826565945527147,"hasPowerMeter":false,"lowerQuartileWatts":0,"medianWatts":77,"powerZones":null,"punchFactor":null,"upperQuartileWatts":213,"variabilityIndex":1.4244642329867025,"weightedPower":182.13145010164712,"weightedWattsPerKg":2.6018778585949587},"speedData":{"avgPace":152,"genuineAvgSpeed":23.658412176059294,"lowerQuartileSpeed":17.28,"medianSpeed":23.759999999999998,"speedZones":null,"standardDeviationSpeed":11.976818155145843,"totalAvgSpeed":23.658412176059294,"upperQuartileSpeed":29.880000000000003,"varianceSpeed":143.44417312143105},"toughnessScore":null},"hasPowerMeter":false,"id":188719173,"moving_time_raw":4862,"name":"16/09/2012 Montbonnot Saint Martin, RA, France","private":false,"short_unit":"km","start_time":"2012-09-16T15:18:42+0000","trainer":false,"type":"Ride"},{"bike_id":824321,"calories":715.5186853099999,"commute":false,"display_type":"Sortie à vélo","distance_raw":32943.4,"elapsed_time_raw":4862,"elevation_gain_raw":99.0665,"elevation_unit":"m","extendedStats":{"cadenceData":null,"elevationData":{"accumulatedElevationAscent":99.05405505251002,"accumulatedElevationDescent":108.39010530010975,"ascentSpeed":{"avg":-1,"lowerQuartile":446,"median":545,"upperQuartile":648},"ascentSpeedZones":null,"avgElevation":219,"elevationZones":null,"lowerQuartileElevation":215,"medianElevation":217,"upperQuartileElevation":220},"gradeData":{"avgGrade":0.0009490520104191727,"gradeProfile":"HILLY","gradeZones":null,"lowerQuartileGrade":-1.6,"medianGrade":0,"upFlatDownDistanceData":{"down":7.866099999999993,"flat":17.36850000000002,"up":7.7087999999999886},"upFlatDownInSeconds":{"down":1126,"flat":2554,"total":4862,"up":1182},"upFlatDownMoveData":{"down":25.149165186500866,"flat":24.481832419733777,"up":23.47857868020301},"upperQuartileGrade":1.5},"heartRateData":null,"moveRatio":1,"paceData":{"avgPace":152,"lowerQuartilePace":208.33333333333331,"medianPace":151.51515151515153,"paceZones":null,"upperQuartilePace":120.48192771084338,"variancePace":25.09687163766813},"powerData":{"avgWatts":127.8596161869003,"avgWattsPerKg":1.826565945527147,"hasPowerMeter":false,"lowerQuartileWatts":0,"medianWatts":77,"powerZones":null,"punchFactor":null,"upperQuartileWatts":213,"variabilityIndex":1.4244642329867025,"weightedPower":182.13145010164712,"weightedWattsPerKg":2.6018778585949587},"speedData":{"avgPace":152,"genuineAvgSpeed":23.658412176059294,"lowerQuartileSpeed":17.28,"medianSpeed":23.759999999999998,"speedZones":null,"standardDeviationSpeed":11.976818155145843,"totalAvgSpeed":23.658412176059294,"upperQuartileSpeed":29.880000000000003,"varianceSpeed":143.44417312143105},"toughnessScore":null},"hasPowerMeter":false,"id":188719380,"moving_time_raw":4862,"name":"23/09/2012 Montbonnot Saint Martin, RA, France","private":false,"short_unit":"km","start_time":"2012-09-23T15:18:42+0000","trainer":false,"type":"Ride"},{"bike_id":824321,"calories":715.5186853099999,"commute":false,"display_type":"Sortie à vélo","distance_raw":32943.4,"elapsed_time_raw":4862,"elevation_gain_raw":99.0665,"elevation_unit":"m","extendedStats":{"cadenceData":null,"elevationData":{"accumulatedElevationAscent":99.05405505251002,"accumulatedElevationDescent":108.39010530010975,"ascentSpeed":{"avg":-1,"lowerQuartile":446,"median":545,"upperQuartile":648},"ascentSpeedZones":null,"avgElevation":219,"elevationZones":null,"lowerQuartileElevation":215,"medianElevation":217,"upperQuartileElevation":220},"gradeData":{"avgGrade":0.0009490520104191727,"gradeProfile":"HILLY","gradeZones":null,"lowerQuartileGrade":-1.6,"medianGrade":0,"upFlatDownDistanceData":{"down":7.866099999999993,"flat":17.36850000000002,"up":7.7087999999999886},"upFlatDownInSeconds":{"down":1126,"flat":2554,"total":4862,"up":1182},"upFlatDownMoveData":{"down":25.149165186500866,"flat":24.481832419733777,"up":23.47857868020301},"upperQuartileGrade":1.5},"heartRateData":null,"moveRatio":1,"paceData":{"avgPace":152,"lowerQuartilePace":208.33333333333331,"medianPace":151.51515151515153,"paceZones":null,"upperQuartilePace":120.48192771084338,"variancePace":25.09687163766813},"powerData":{"avgWatts":127.8596161869003,"avgWattsPerKg":1.826565945527147,"hasPowerMeter":false,"lowerQuartileWatts":0,"medianWatts":77,"powerZones":null,"punchFactor":null,"upperQuartileWatts":213,"variabilityIndex":1.4244642329867025,"weightedPower":182.13145010164712,"weightedWattsPerKg":2.6018778585949587},"speedData":{"avgPace":152,"genuineAvgSpeed":23.658412176059294,"lowerQuartileSpeed":17.28,"medianSpeed":23.759999999999998,"speedZones":null,"standardDeviationSpeed":11.976818155145843,"totalAvgSpeed":23.658412176059294,"upperQuartileSpeed":29.880000000000003,"varianceSpeed":143.44417312143105},"toughnessScore":null},"hasPowerMeter":false,"id":188719413,"moving_time_raw":4862,"name":"30/09/2012 Montbonnot Saint Martin, RA, France","private":false,"short_unit":"km","start_time":"2012-09-30T15:18:42+0000","trainer":false,"type":"Ride"},{"bike_id":824321,"calories":1300.18425095,"commute":false,"display_type":"Sortie à vélo","distance_raw":36377.8,"elapsed_time_raw":6389,"elevation_gain_raw":974.73,"elevation_unit":"m","extendedStats":{"cadenceData":null,"elevationData":{"accumulatedElevationAscent":973.998027147695,"accumulatedElevationDescent":973.4856738169693,"ascentSpeed":{"avg":1293.613798291242,"lowerQuartile":597,"median":947,"upperQuartile":1521},"ascentSpeedZones":null,"avgElevation":385,"elevationZones":null,"lowerQuartileElevation":222,"medianElevation":350,"upperQuartileElevation":553},"gradeData":{"avgGrade":-0.07501992973736506,"gradeProfile":"HILLY","gradeZones":null,"lowerQuartileGrade":-4.8,"medianGrade":-0.3,"upFlatDownDistanceData":{"down":14.446899999999987,"flat":9.253599999999995,"up":12.677300000000018},"upFlatDownInSeconds":{"down":2070,"flat":1619,"total":6356,"up":2667},"upFlatDownMoveData":{"down":25.125043478260846,"flat":20.576256948733775,"up":17.1122159730034},"upperQuartileGrade":3.4},"heartRateData":null,"moveRatio":0.9948348724370011,"paceData":{"avgPace":173,"lowerQuartilePace":322.5806451612903,"medianPace":227.27272727272722,"paceZones":null,"upperQuartilePace":121.95121951219514,"variancePace":16.933886870865045},"powerData":{"avgWatts":204.46151827881755,"avgWattsPerKg":2.9208788325545365,"hasPowerMeter":false,"lowerQuartileWatts":0,"medianWatts":115,"powerZones":null,"punchFactor":null,"upperQuartileWatts":311,"variabilityIndex":1.7202424352156318,"weightedPower":351.72338011183854,"weightedWattsPerKg":5.024619715883408},"speedData":{"avgPace":173,"genuineAvgSpeed":20.767117684077984,"lowerQuartileSpeed":11.16,"medianSpeed":15.840000000000002,"speedZones":null,"standardDeviationSpeed":14.580516991739783,"totalAvgSpeed":20.65985287212391,"upperQuartileSpeed":29.52,"varianceSpeed":212.59147574641253},"toughnessScore":null},"hasPowerMeter":false,"id":64333248,"moving_time_raw":5890,"name":"Revel 40km loop","private":false,"short_unit":"km","start_time":"2012-10-06T13:10:05+0000","trainer":false,"type":"Ride"},{"bike_id":824321,"calories":715.5186853099999,"commute":false,"display_type":"Sortie à vélo","distance_raw":32943.4,"elapsed_time_raw":4862,"elevation_gain_raw":99.0665,"elevation_unit":"m","extendedStats":{"cadenceData":null,"elevationData":{"accumulatedElevationAscent":99.05405505251002,"accumulatedElevationDescent":108.39010530010975,"ascentSpeed":{"avg":-1,"lowerQuartile":446,"median":545,"upperQuartile":648},"ascentSpeedZones":null,"avgElevation":219,"elevationZones":null,"lowerQuartileElevation":215,"medianElevation":217,"upperQuartileElevation":220},"gradeData":{"avgGrade":0.0009490520104191727,"gradeProfile":"HILLY","gradeZones":null,"lowerQuartileGrade":-1.6,"medianGrade":0,"upFlatDownDistanceData":{"down":7.866099999999993,"flat":17.36850000000002,"up":7.7087999999999886},"upFlatDownInSeconds":{"down":1126,"flat":2554,"total":4862,"up":1182},"upFlatDownMoveData":{"down":25.149165186500866,"flat":24.481832419733777,"up":23.47857868020301},"upperQuartileGrade":1.5},"heartRateData":null,"moveRatio":1,"paceData":{"avgPace":152,"lowerQuartilePace":208.33333333333331,"medianPace":151.51515151515153,"paceZones":null,"upperQuartilePace":120.48192771084338,"variancePace":25.09687163766813},"powerData":{"avgWatts":127.8596161869003,"avgWattsPerKg":1.826565945527147,"hasPowerMeter":false,"lowerQuartileWatts":0,"medianWatts":77,"powerZones":null,"punchFactor":null,"upperQuartileWatts":213,"variabilityIndex":1.4244642329867025,"weightedPower":182.13145010164712,"weightedWattsPerKg":2.6018778585949587},"speedData":{"avgPace":152,"genuineAvgSpeed":23.658412176059294,"lowerQuartileSpeed":17.28,"medianSpeed":23.759999999999998,"speedZones":null,"standardDeviationSpeed":11.976818155145843,"totalAvgSpeed":23.658412176059294,"upperQuartileSpeed":29.880000000000003,"varianceSpeed":143.44417312143105},"toughnessScore":null},"hasPowerMeter":false,"id":188719436,"moving_time_raw":4862,"name":"07/10/2012 Montbonnot Saint Martin, RA, France","private":false,"short_unit":"km","start_time":"2012-10-07T15:18:42+0000","trainer":false,"type":"Ride"},{"bike_id":824321,"calories":715.5186853099999,"commute":false,"display_type":"Sortie à vélo","distance_raw":32943.4,"elapsed_time_raw":4862,"elevation_gain_raw":99.0665,"elevation_unit":"m","extendedStats":{"cadenceData":null,"elevationData":{"accumulatedElevationAscent":99.05405505251002,"accumulatedElevationDescent":108.39010530010975,"ascentSpeed":{"avg":-1,"lowerQuartile":446,"median":545,"upperQuartile":648},"ascentSpeedZones":null,"avgElevation":219,"elevationZones":null,"lowerQuartileElevation":215,"medianElevation":217,"upperQuartileElevation":220},"gradeData":{"avgGrade":0.0009490520104191727,"gradeProfile":"HILLY","gradeZones":null,"lowerQuartileGrade":-1.6,"medianGrade":0,"upFlatDownDistanceData":{"down":7.866099999999993,"flat":17.36850000000002,"up":7.7087999999999886},"upFlatDownInSeconds":{"down":1126,"flat":2554,"total":4862,"up":1182},"upFlatDownMoveData":{"down":25.149165186500866,"flat":24.481832419733777,"up":23.47857868020301},"upperQuartileGrade":1.5},"heartRateData":null,"moveRatio":1,"paceData":{"avgPace":152,"lowerQuartilePace":208.33333333333331,"medianPace":151.51515151515153,"paceZones":null,"upperQuartilePace":120.48192771084338,"variancePace":25.09687163766813},"powerData":{"avgWatts":127.8596161869003,"avgWattsPerKg":1.826565945527147,"hasPowerMeter":false,"lowerQuartileWatts":0,"medianWatts":77,"powerZones":null,"punchFactor":null,"upperQuartileWatts":213,"variabilityIndex":1.4244642329867025,"weightedPower":182.13145010164712,"weightedWattsPerKg":2.6018778585949587},"speedData":{"avgPace":152,"genuineAvgSpeed":23.658412176059294,"lowerQuartileSpeed":17.28,"medianSpeed":23.759999999999998,"speedZones":null,"standardDeviationSpeed":11.976818155145843,"totalAvgSpeed":23.658412176059294,"upperQuartileSpeed":29.880000000000003,"varianceSpeed":143.44417312143105},"toughnessScore":null},"hasPowerMeter":false,"id":188719521,"moving_time_raw":4862,"name":"14/10/2012 Montbonnot Saint Martin, RA, France","private":false,"short_unit":"km","start_time":"2012-10-14T15:18:42+0000","trainer":false,"type":"Ride"},{"bike_id":824321,"calories":715.5186853099999,"commute":false,"display_type":"Sortie à vélo","distance_raw":32943.4,"elapsed_time_raw":4862,"elevation_gain_raw":99.0665,"elevation_unit":"m","extendedStats":{"cadenceData":null,"elevationData":{"accumulatedElevationAscent":99.05405505251002,"accumulatedElevationDescent":108.39010530010975,"ascentSpeed":{"avg":-1,"lowerQuartile":446,"median":545,"upperQuartile":648},"ascentSpeedZones":null,"avgElevation":219,"elevationZones":null,"lowerQuartileElevation":215,"medianElevation":217,"upperQuartileElevation":220},"gradeData":{"avgGrade":0.0009490520104191727,"gradeProfile":"HILLY","gradeZones":null,"lowerQuartileGrade":-1.6,"medianGrade":0,"upFlatDownDistanceData":{"down":7.866099999999993,"flat":17.36850000000002,"up":7.7087999999999886},"upFlatDownInSeconds":{"down":1126,"flat":2554,"total":4862,"up":1182},"upFlatDownMoveData":{"down":25.149165186500866,"flat":24.481832419733777,"up":23.47857868020301},"upperQuartileGrade":1.5},"heartRateData":null,"moveRatio":1,"paceData":{"avgPace":152,"lowerQuartilePace":208.33333333333331,"medianPace":151.51515151515153,"paceZones":null,"upperQuartilePace":120.48192771084338,"variancePace":25.09687163766813},"powerData":{"avgWatts":127.8596161869003,"avgWattsPerKg":1.826565945527147,"hasPowerMeter":false,"lowerQuartileWatts":0,"medianWatts":77,"powerZones":null,"punchFactor":null,"upperQuartileWatts":213,"variabilityIndex":1.4244642329867025,"weightedPower":182.13145010164712,"weightedWattsPerKg":2.6018778585949587},"speedData":{"avgPace":152,"genuineAvgSpeed":23.658412176059294,"lowerQuartileSpeed":17.28,"medianSpeed":23.759999999999998,"speedZones":null,"standardDeviationSpeed":11.976818155145843,"totalAvgSpeed":23.658412176059294,"upperQuartileSpeed":29.880000000000003,"varianceSpeed":143.44417312143105},"toughnessScore":null},"hasPowerMeter":false,"id":188719646,"moving_time_raw":4862,"name":"21/10/2012 Montbonnot Saint Martin, RA, France","private":false,"short_unit":"km","start_time":"2012-10-21T15:18:42+0000","trainer":false,"type":"Ride"},{"bike_id":824321,"calories":715.5186853099999,"commute":false,"display_type":"Sortie à vélo","distance_raw":32943.4,"elapsed_time_raw":4862,"elevation_gain_raw":99.0665,"elevation_unit":"m","extendedStats":{"cadenceData":null,"elevationData":{"accumulatedElevationAscent":99.05405505251002,"accumulatedElevationDescent":108.39010530010975,"ascentSpeed":{"avg":-1,"lowerQuartile":446,"median":545,"upperQuartile":648},"ascentSpeedZones":null,"avgElevation":219,"elevationZones":null,"lowerQuartileElevation":215,"medianElevation":217,"upperQuartileElevation":220},"gradeData":{"avgGrade":0.0009490520104191727,"gradeProfile":"HILLY","gradeZones":null,"lowerQuartileGrade":-1.6,"medianGrade":0,"upFlatDownDistanceData":{"down":7.866099999999993,"flat":17.36850000000002,"up":7.7087999999999886},"upFlatDownInSeconds":{"down":1126,"flat":2554,"total":4862,"up":1182},"upFlatDownMoveData":{"down":25.149165186500866,"flat":24.481832419733777,"up":23.47857868020301},"upperQuartileGrade":1.5},"heartRateData":null,"moveRatio":1,"paceData":{"avgPace":152,"lowerQuartilePace":208.33333333333331,"medianPace":151.51515151515153,"paceZones":null,"upperQuartilePace":120.48192771084338,"variancePace":25.09687163766813},"powerData":{"avgWatts":127.8596161869003,"avgWattsPerKg":1.826565945527147,"hasPowerMeter":false,"lowerQuartileWatts":0,"medianWatts":77,"powerZones":null,"punchFactor":null,"upperQuartileWatts":213,"variabilityIndex":1.4244642329867025,"weightedPower":182.13145010164712,"weightedWattsPerKg":2.6018778585949587},"speedData":{"avgPace":152,"genuineAvgSpeed":23.658412176059294,"lowerQuartileSpeed":17.28,"medianSpeed":23.759999999999998,"speedZones":null,"standardDeviationSpeed":11.976818155145843,"totalAvgSpeed":23.658412176059294,"upperQuartileSpeed":29.880000000000003,"varianceSpeed":143.44417312143105},"toughnessScore":null},"hasPowerMeter":false,"id":188719704,"moving_time_raw":4862,"name":"28/10/2012 Montbonnot Saint Martin, RA, France","private":false,"short_unit":"km","start_time":"2012-10-28T15:18:42+0000","trainer":false,"type":"Ride"},{"bike_id":824321,"calories":715.5186853099999,"commute":false,"display_type":"Sortie à vélo","distance_raw":32943.4,"elapsed_time_raw":4862,"elevation_gain_raw":99.0665,"elevation_unit":"m","extendedStats":{"cadenceData":null,"elevationData":{"accumulatedElevationAscent":99.05405505251002,"accumulatedElevationDescent":108.39010530010975,"ascentSpeed":{"avg":-1,"lowerQuartile":446,"median":545,"upperQuartile":648},"ascentSpeedZones":null,"avgElevation":219,"elevationZones":null,"lowerQuartileElevation":215,"medianElevation":217,"upperQuartileElevation":220},"gradeData":{"avgGrade":0.0009490520104191727,"gradeProfile":"HILLY","gradeZones":null,"lowerQuartileGrade":-1.6,"medianGrade":0,"upFlatDownDistanceData":{"down":7.866099999999993,"flat":17.36850000000002,"up":7.7087999999999886},"upFlatDownInSeconds":{"down":1126,"flat":2554,"total":4862,"up":1182},"upFlatDownMoveData":{"down":25.149165186500866,"flat":24.481832419733777,"up":23.47857868020301},"upperQuartileGrade":1.5},"heartRateData":null,"moveRatio":1,"paceData":{"avgPace":152,"lowerQuartilePace":208.33333333333331,"medianPace":151.51515151515153,"paceZones":null,"upperQuartilePace":120.48192771084338,"variancePace":25.09687163766813},"powerData":{"avgWatts":127.8596161869003,"avgWattsPerKg":1.826565945527147,"hasPowerMeter":false,"lowerQuartileWatts":0,"medianWatts":77,"powerZones":null,"punchFactor":null,"upperQuartileWatts":213,"variabilityIndex":1.4244642329867025,"weightedPower":182.13145010164712,"weightedWattsPerKg":2.6018778585949587},"speedData":{"avgPace":152,"genuineAvgSpeed":23.658412176059294,"lowerQuartileSpeed":17.28,"medianSpeed":23.759999999999998,"speedZones":null,"standardDeviationSpeed":11.976818155145843,"totalAvgSpeed":23.658412176059294,"upperQuartileSpeed":29.880000000000003,"varianceSpeed":143.44417312143105},"toughnessScore":null},"hasPowerMeter":false,"id":188719793,"moving_time_raw":4862,"name":"03/11/2012 Montbonnot Saint Martin, RA, France","private":false,"short_unit":"km","start_time":"2012-11-03T15:18:42+0000","trainer":false,"type":"Ride"},{"bike_id":824321,"calories":715.5186853099999,"commute":false,"display_type":"Sortie à vélo","distance_raw":32943.4,"elapsed_time_raw":4862,"elevation_gain_raw":99.0665,"elevation_unit":"m","extendedStats":{"cadenceData":null,"elevationData":{"accumulatedElevationAscent":99.05405505251002,"accumulatedElevationDescent":108.39010530010975,"ascentSpeed":{"avg":-1,"lowerQuartile":446,"median":545,"upperQuartile":648},"ascentSpeedZones":null,"avgElevation":219,"elevationZones":null,"lowerQuartileElevation":215,"medianElevation":217,"upperQuartileElevation":220},"gradeData":{"avgGrade":0.0009490520104191727,"gradeProfile":"HILLY","gradeZones":null,"lowerQuartileGrade":-1.6,"medianGrade":0,"upFlatDownDistanceData":{"down":7.866099999999993,"flat":17.36850000000002,"up":7.7087999999999886},"upFlatDownInSeconds":{"down":1126,"flat":2554,"total":4862,"up":1182},"upFlatDownMoveData":{"down":25.149165186500866,"flat":24.481832419733777,"up":23.47857868020301},"upperQuartileGrade":1.5},"heartRateData":null,"moveRatio":1,"paceData":{"avgPace":152,"lowerQuartilePace":208.33333333333331,"medianPace":151.51515151515153,"paceZones":null,"upperQuartilePace":120.48192771084338,"variancePace":25.09687163766813},"powerData":{"avgWatts":127.8596161869003,"avgWattsPerKg":1.826565945527147,"hasPowerMeter":false,"lowerQuartileWatts":0,"medianWatts":77,"powerZones":null,"punchFactor":null,"upperQuartileWatts":213,"variabilityIndex":1.4244642329867025,"weightedPower":182.13145010164712,"weightedWattsPerKg":2.6018778585949587},"speedData":{"avgPace":152,"genuineAvgSpeed":23.658412176059294,"lowerQuartileSpeed":17.28,"medianSpeed":23.759999999999998,"speedZones":null,"standardDeviationSpeed":11.976818155145843,"totalAvgSpeed":23.658412176059294,"upperQuartileSpeed":29.880000000000003,"varianceSpeed":143.44417312143105},"toughnessScore":null},"hasPowerMeter":false,"id":188719878,"moving_time_raw":4862,"name":"10/11/2012 Montbonnot Saint Martin, RA, France","private":false,"short_unit":"km","start_time":"2012-11-10T15:18:42+0000","trainer":false,"type":"Ride"},{"bike_id":824321,"calories":715.5186853099999,"commute":false,"display_type":"Sortie à vélo","distance_raw":32943.4,"elapsed_time_raw":4862,"elevation_gain_raw":99.0665,"elevation_unit":"m","extendedStats":{"cadenceData":null,"elevationData":{"accumulatedElevationAscent":99.05405505251002,"accumulatedElevationDescent":108.39010530010975,"ascentSpeed":{"avg":-1,"lowerQuartile":446,"median":545,"upperQuartile":648},"ascentSpeedZones":null,"avgElevation":219,"elevationZones":null,"lowerQuartileElevation":215,"medianElevation":217,"upperQuartileElevation":220},"gradeData":{"avgGrade":0.0009490520104191727,"gradeProfile":"HILLY","gradeZones":null,"lowerQuartileGrade":-1.6,"medianGrade":0,"upFlatDownDistanceData":{"down":7.866099999999993,"flat":17.36850000000002,"up":7.7087999999999886},"upFlatDownInSeconds":{"down":1126,"flat":2554,"total":4862,"up":1182},"upFlatDownMoveData":{"down":25.149165186500866,"flat":24.481832419733777,"up":23.47857868020301},"upperQuartileGrade":1.5},"heartRateData":null,"moveRatio":1,"paceData":{"avgPace":152,"lowerQuartilePace":208.33333333333331,"medianPace":151.51515151515153,"paceZones":null,"upperQuartilePace":120.48192771084338,"variancePace":25.09687163766813},"powerData":{"avgWatts":127.8596161869003,"avgWattsPerKg":1.826565945527147,"hasPowerMeter":false,"lowerQuartileWatts":0,"medianWatts":77,"powerZones":null,"punchFactor":null,"upperQuartileWatts":213,"variabilityIndex":1.4244642329867025,"weightedPower":182.13145010164712,"weightedWattsPerKg":2.6018778585949587},"speedData":{"avgPace":152,"genuineAvgSpeed":23.658412176059294,"lowerQuartileSpeed":17.28,"medianSpeed":23.759999999999998,"speedZones":null,"standardDeviationSpeed":11.976818155145843,"totalAvgSpeed":23.658412176059294,"upperQuartileSpeed":29.880000000000003,"varianceSpeed":143.44417312143105},"toughnessScore":null},"hasPowerMeter":false,"id":188720595,"moving_time_raw":4862,"name":"17/11/2012 Montbonnot Saint Martin, RA, France","private":false,"short_unit":"km","start_time":"2012-11-17T15:18:42+0000","trainer":false,"type":"Ride"},{"bike_id":824321,"calories":715.5186853099999,"commute":false,"display_type":"Sortie à vélo","distance_raw":32943.4,"elapsed_time_raw":4862,"elevation_gain_raw":99.0665,"elevation_unit":"m","extendedStats":{"cadenceData":null,"elevationData":{"accumulatedElevationAscent":99.05405505251002,"accumulatedElevationDescent":108.39010530010975,"ascentSpeed":{"avg":-1,"lowerQuartile":446,"median":545,"upperQuartile":648},"ascentSpeedZones":null,"avgElevation":219,"elevationZones":null,"lowerQuartileElevation":215,"medianElevation":217,"upperQuartileElevation":220},"gradeData":{"avgGrade":0.0009490520104191727,"gradeProfile":"HILLY","gradeZones":null,"lowerQuartileGrade":-1.6,"medianGrade":0,"upFlatDownDistanceData":{"down":7.866099999999993,"flat":17.36850000000002,"up":7.7087999999999886},"upFlatDownInSeconds":{"down":1126,"flat":2554,"total":4862,"up":1182},"upFlatDownMoveData":{"down":25.149165186500866,"flat":24.481832419733777,"up":23.47857868020301},"upperQuartileGrade":1.5},"heartRateData":null,"moveRatio":1,"paceData":{"avgPace":152,"lowerQuartilePace":208.33333333333331,"medianPace":151.51515151515153,"paceZones":null,"upperQuartilePace":120.48192771084338,"variancePace":25.09687163766813},"powerData":{"avgWatts":127.8596161869003,"avgWattsPerKg":1.826565945527147,"hasPowerMeter":false,"lowerQuartileWatts":0,"medianWatts":77,"powerZones":null,"punchFactor":null,"upperQuartileWatts":213,"variabilityIndex":1.4244642329867025,"weightedPower":182.13145010164712,"weightedWattsPerKg":2.6018778585949587},"speedData":{"avgPace":152,"genuineAvgSpeed":23.658412176059294,"lowerQuartileSpeed":17.28,"medianSpeed":23.759999999999998,"speedZones":null,"standardDeviationSpeed":11.976818155145843,"totalAvgSpeed":23.658412176059294,"upperQuartileSpeed":29.880000000000003,"varianceSpeed":143.44417312143105},"toughnessScore":null},"hasPowerMeter":false,"id":188720694,"moving_time_raw":4862,"name":"24/11/2012 Montbonnot Saint Martin, RA, France","private":false,"short_unit":"km","start_time":"2012-11-24T15:18:42+0000","trainer":false,"type":"Ride"},{"bike_id":824321,"calories":715.5186853099999,"commute":false,"display_type":"Sortie à vélo","distance_raw":32943.4,"elapsed_time_raw":4862,"elevation_gain_raw":99.0665,"elevation_unit":"m","extendedStats":{"cadenceData":null,"elevationData":{"accumulatedElevationAscent":99.05405505251002,"accumulatedElevationDescent":108.39010530010975,"ascentSpeed":{"avg":-1,"lowerQuartile":446,"median":545,"upperQuartile":648},"ascentSpeedZones":null,"avgElevation":219,"elevationZones":null,"lowerQuartileElevation":215,"medianElevation":217,"upperQuartileElevation":220},"gradeData":{"avgGrade":0.0009490520104191727,"gradeProfile":"HILLY","gradeZones":null,"lowerQuartileGrade":-1.6,"medianGrade":0,"upFlatDownDistanceData":{"down":7.866099999999993,"flat":17.36850000000002,"up":7.7087999999999886},"upFlatDownInSeconds":{"down":1126,"flat":2554,"total":4862,"up":1182},"upFlatDownMoveData":{"down":25.149165186500866,"flat":24.481832419733777,"up":23.47857868020301},"upperQuartileGrade":1.5},"heartRateData":null,"moveRatio":1,"paceData":{"avgPace":152,"lowerQuartilePace":208.33333333333331,"medianPace":151.51515151515153,"paceZones":null,"upperQuartilePace":120.48192771084338,"variancePace":25.09687163766813},"powerData":{"avgWatts":127.8596161869003,"avgWattsPerKg":1.826565945527147,"hasPowerMeter":false,"lowerQuartileWatts":0,"medianWatts":77,"powerZones":null,"punchFactor":null,"upperQuartileWatts":213,"variabilityIndex":1.4244642329867025,"weightedPower":182.13145010164712,"weightedWattsPerKg":2.6018778585949587},"speedData":{"avgPace":152,"genuineAvgSpeed":23.658412176059294,"lowerQuartileSpeed":17.28,"medianSpeed":23.759999999999998,"speedZones":null,"standardDeviationSpeed":11.976818155145843,"totalAvgSpeed":23.658412176059294,"upperQuartileSpeed":29.880000000000003,"varianceSpeed":143.44417312143105},"toughnessScore":null},"hasPowerMeter":false,"id":188720749,"moving_time_raw":4862,"name":"01/12/2012 Montbonnot Saint Martin, RA, France","private":false,"short_unit":"km","start_time":"2012-12-01T15:18:42+0000","trainer":false,"type":"Ride"},{"bike_id":824321,"calories":715.5186853099999,"commute":false,"display_type":"Sortie à vélo","distance_raw":32943.4,"elapsed_time_raw":4862,"elevation_gain_raw":99.0665,"elevation_unit":"m","extendedStats":{"cadenceData":null,"elevationData":{"accumulatedElevationAscent":99.05405505251002,"accumulatedElevationDescent":108.39010530010975,"ascentSpeed":{"avg":-1,"lowerQuartile":446,"median":545,"upperQuartile":648},"ascentSpeedZones":null,"avgElevation":219,"elevationZones":null,"lowerQuartileElevation":215,"medianElevation":217,"upperQuartileElevation":220},"gradeData":{"avgGrade":0.0009490520104191727,"gradeProfile":"HILLY","gradeZones":null,"lowerQuartileGrade":-1.6,"medianGrade":0,"upFlatDownDistanceData":{"down":7.866099999999993,"flat":17.36850000000002,"up":7.7087999999999886},"upFlatDownInSeconds":{"down":1126,"flat":2554,"total":4862,"up":1182},"upFlatDownMoveData":{"down":25.149165186500866,"flat":24.481832419733777,"up":23.47857868020301},"upperQuartileGrade":1.5},"heartRateData":null,"moveRatio":1,"paceData":{"avgPace":152,"lowerQuartilePace":208.33333333333331,"medianPace":151.51515151515153,"paceZones":null,"upperQuartilePace":120.48192771084338,"variancePace":25.09687163766813},"powerData":{"avgWatts":127.8596161869003,"avgWattsPerKg":1.826565945527147,"hasPowerMeter":false,"lowerQuartileWatts":0,"medianWatts":77,"powerZones":null,"punchFactor":null,"upperQuartileWatts":213,"variabilityIndex":1.4244642329867025,"weightedPower":182.13145010164712,"weightedWattsPerKg":2.6018778585949587},"speedData":{"avgPace":152,"genuineAvgSpeed":23.658412176059294,"lowerQuartileSpeed":17.28,"medianSpeed":23.759999999999998,"speedZones":null,"standardDeviationSpeed":11.976818155145843,"totalAvgSpeed":23.658412176059294,"upperQuartileSpeed":29.880000000000003,"varianceSpeed":143.44417312143105},"toughnessScore":null},"hasPowerMeter":false,"id":188720779,"moving_time_raw":4862,"name":"08/12/2012 Montbonnot Saint Martin, RA, France","private":false,"short_unit":"km","start_time":"2012-12-08T15:18:42+0000","trainer":false,"type":"Ride"},{"bike_id":824321,"calories":715.5186853099999,"commute":false,"display_type":"Sortie à vélo","distance_raw":32943.4,"elapsed_time_raw":4862,"elevation_gain_raw":99.0665,"elevation_unit":"m","extendedStats":{"cadenceData":null,"elevationData":{"accumulatedElevationAscent":99.05405505251002,"accumulatedElevationDescent":108.39010530010975,"ascentSpeed":{"avg":-1,"lowerQuartile":446,"median":545,"upperQuartile":648},"ascentSpeedZones":null,"avgElevation":219,"elevationZones":null,"lowerQuartileElevation":215,"medianElevation":217,"upperQuartileElevation":220},"gradeData":{"avgGrade":0.0009490520104191727,"gradeProfile":"HILLY","gradeZones":null,"lowerQuartileGrade":-1.6,"medianGrade":0,"upFlatDownDistanceData":{"down":7.866099999999993,"flat":17.36850000000002,"up":7.7087999999999886},"upFlatDownInSeconds":{"down":1126,"flat":2554,"total":4862,"up":1182},"upFlatDownMoveData":{"down":25.149165186500866,"flat":24.481832419733777,"up":23.47857868020301},"upperQuartileGrade":1.5},"heartRateData":null,"moveRatio":1,"paceData":{"avgPace":152,"lowerQuartilePace":208.33333333333331,"medianPace":151.51515151515153,"paceZones":null,"upperQuartilePace":120.48192771084338,"variancePace":25.09687163766813},"powerData":{"avgWatts":127.8596161869003,"avgWattsPerKg":1.826565945527147,"hasPowerMeter":false,"lowerQuartileWatts":0,"medianWatts":77,"powerZones":null,"punchFactor":null,"upperQuartileWatts":213,"variabilityIndex":1.4244642329867025,"weightedPower":182.13145010164712,"weightedWattsPerKg":2.6018778585949587},"speedData":{"avgPace":152,"genuineAvgSpeed":23.658412176059294,"lowerQuartileSpeed":17.28,"medianSpeed":23.759999999999998,"speedZones":null,"standardDeviationSpeed":11.976818155145843,"totalAvgSpeed":23.658412176059294,"upperQuartileSpeed":29.880000000000003,"varianceSpeed":143.44417312143105},"toughnessScore":null},"hasPowerMeter":false,"id":188720788,"moving_time_raw":4862,"name":"15/12/2012 Montbonnot Saint Martin, RA, France","private":false,"short_unit":"km","start_time":"2012-12-15T15:18:42+0000","trainer":false,"type":"Ride"},{"bike_id":824321,"calories":715.5186853099999,"commute":false,"display_type":"Sortie à vélo","distance_raw":32943.4,"elapsed_time_raw":4862,"elevation_gain_raw":99.0665,"elevation_unit":"m","extendedStats":{"cadenceData":null,"elevationData":{"accumulatedElevationAscent":99.05405505251002,"accumulatedElevationDescent":108.39010530010975,"ascentSpeed":{"avg":-1,"lowerQuartile":446,"median":545,"upperQuartile":648},"ascentSpeedZones":null,"avgElevation":219,"elevationZones":null,"lowerQuartileElevation":215,"medianElevation":217,"upperQuartileElevation":220},"gradeData":{"avgGrade":0.0009490520104191727,"gradeProfile":"HILLY","gradeZones":null,"lowerQuartileGrade":-1.6,"medianGrade":0,"upFlatDownDistanceData":{"down":7.866099999999993,"flat":17.36850000000002,"up":7.7087999999999886},"upFlatDownInSeconds":{"down":1126,"flat":2554,"total":4862,"up":1182},"upFlatDownMoveData":{"down":25.149165186500866,"flat":24.481832419733777,"up":23.47857868020301},"upperQuartileGrade":1.5},"heartRateData":null,"moveRatio":1,"paceData":{"avgPace":152,"lowerQuartilePace":208.33333333333331,"medianPace":151.51515151515153,"paceZones":null,"upperQuartilePace":120.48192771084338,"variancePace":25.09687163766813},"powerData":{"avgWatts":127.8596161869003,"avgWattsPerKg":1.826565945527147,"hasPowerMeter":false,"lowerQuartileWatts":0,"medianWatts":77,"powerZones":null,"punchFactor":null,"upperQuartileWatts":213,"variabilityIndex":1.4244642329867025,"weightedPower":182.13145010164712,"weightedWattsPerKg":2.6018778585949587},"speedData":{"avgPace":152,"genuineAvgSpeed":23.658412176059294,"lowerQuartileSpeed":17.28,"medianSpeed":23.759999999999998,"speedZones":null,"standardDeviationSpeed":11.976818155145843,"totalAvgSpeed":23.658412176059294,"upperQuartileSpeed":29.880000000000003,"varianceSpeed":143.44417312143105},"toughnessScore":null},"hasPowerMeter":false,"id":188720814,"moving_time_raw":4862,"name":"22/12/2012 Montbonnot Saint Martin, RA, France","private":false,"short_unit":"km","start_time":"2012-12-22T15:18:42+0000","trainer":false,"type":"Ride"},{"bike_id":824321,"calories":715.5186853099999,"commute":false,"display_type":"Sortie à vélo","distance_raw":32943.4,"elapsed_time_raw":4862,"elevation_gain_raw":99.0665,"elevation_unit":"m","extendedStats":{"cadenceData":null,"elevationData":{"accumulatedElevationAscent":99.05405505251002,"accumulatedElevationDescent":108.39010530010975,"ascentSpeed":{"avg":-1,"lowerQuartile":446,"median":545,"upperQuartile":648},"ascentSpeedZones":null,"avgElevation":219,"elevationZones":null,"lowerQuartileElevation":215,"medianElevation":217,"upperQuartileElevation":220},"gradeData":{"avgGrade":0.0009490520104191727,"gradeProfile":"HILLY","gradeZones":null,"lowerQuartileGrade":-1.6,"medianGrade":0,"upFlatDownDistanceData":{"down":7.866099999999993,"flat":17.36850000000002,"up":7.7087999999999886},"upFlatDownInSeconds":{"down":1126,"flat":2554,"total":4862,"up":1182},"upFlatDownMoveData":{"down":25.149165186500866,"flat":24.481832419733777,"up":23.47857868020301},"upperQuartileGrade":1.5},"heartRateData":null,"moveRatio":1,"paceData":{"avgPace":152,"lowerQuartilePace":208.33333333333331,"medianPace":151.51515151515153,"paceZones":null,"upperQuartilePace":120.48192771084338,"variancePace":25.09687163766813},"powerData":{"avgWatts":127.8596161869003,"avgWattsPerKg":1.826565945527147,"hasPowerMeter":false,"lowerQuartileWatts":0,"medianWatts":77,"powerZones":null,"punchFactor":null,"upperQuartileWatts":213,"variabilityIndex":1.4244642329867025,"weightedPower":182.13145010164712,"weightedWattsPerKg":2.6018778585949587},"speedData":{"avgPace":152,"genuineAvgSpeed":23.658412176059294,"lowerQuartileSpeed":17.28,"medianSpeed":23.759999999999998,"speedZones":null,"standardDeviationSpeed":11.976818155145843,"totalAvgSpeed":23.658412176059294,"upperQuartileSpeed":29.880000000000003,"varianceSpeed":143.44417312143105},"toughnessScore":null},"hasPowerMeter":false,"id":188720821,"moving_time_raw":4862,"name":"29/12/2012 Montbonnot Saint Martin, RA, France","private":false,"short_unit":"km","start_time":"2012-12-29T15:18:42+0000","trainer":false,"type":"Ride"},{"bike_id":824321,"calories":715.5186853099999,"commute":false,"display_type":"Sortie à vélo","distance_raw":32943.4,"elapsed_time_raw":4862,"elevation_gain_raw":99.0665,"elevation_unit":"m","extendedStats":{"cadenceData":null,"elevationData":{"accumulatedElevationAscent":99.05405505251002,"accumulatedElevationDescent":108.39010530010975,"ascentSpeed":{"avg":-1,"lowerQuartile":446,"median":545,"upperQuartile":648},"ascentSpeedZones":null,"avgElevation":219,"elevationZones":null,"lowerQuartileElevation":215,"medianElevation":217,"upperQuartileElevation":220},"gradeData":{"avgGrade":0.0009490520104191727,"gradeProfile":"HILLY","gradeZones":null,"lowerQuartileGrade":-1.6,"medianGrade":0,"upFlatDownDistanceData":{"down":7.866099999999993,"flat":17.36850000000002,"up":7.7087999999999886},"upFlatDownInSeconds":{"down":1126,"flat":2554,"total":4862,"up":1182},"upFlatDownMoveData":{"down":25.149165186500866,"flat":24.481832419733777,"up":23.47857868020301},"upperQuartileGrade":1.5},"heartRateData":null,"moveRatio":1,"paceData":{"avgPace":152,"lowerQuartilePace":208.33333333333331,"medianPace":151.51515151515153,"paceZones":null,"upperQuartilePace":120.48192771084338,"variancePace":25.09687163766813},"powerData":{"avgWatts":127.8596161869003,"avgWattsPerKg":1.826565945527147,"hasPowerMeter":false,"lowerQuartileWatts":0,"medianWatts":77,"powerZones":null,"punchFactor":null,"upperQuartileWatts":213,"variabilityIndex":1.4244642329867025,"weightedPower":182.13145010164712,"weightedWattsPerKg":2.6018778585949587},"speedData":{"avgPace":152,"genuineAvgSpeed":23.658412176059294,"lowerQuartileSpeed":17.28,"medianSpeed":23.759999999999998,"speedZones":null,"standardDeviationSpeed":11.976818155145843,"totalAvgSpeed":23.658412176059294,"upperQuartileSpeed":29.880000000000003,"varianceSpeed":143.44417312143105},"toughnessScore":null},"hasPowerMeter":false,"id":188721814,"moving_time_raw":4862,"name":"05/01/2013 Montbonnot Saint Martin, RA, France","private":false,"short_unit":"km","start_time":"2013-01-05T15:18:42+0000","trainer":false,"type":"Ride"},{"bike_id":824321,"calories":715.5186853099999,"commute":false,"display_type":"Sortie à vélo","distance_raw":32943.4,"elapsed_time_raw":4862,"elevation_gain_raw":99.0665,"elevation_unit":"m","extendedStats":{"cadenceData":null,"elevationData":{"accumulatedElevationAscent":99.05405505251002,"accumulatedElevationDescent":108.39010530010975,"ascentSpeed":{"avg":-1,"lowerQuartile":446,"median":545,"upperQuartile":648},"ascentSpeedZones":null,"avgElevation":219,"elevationZones":null,"lowerQuartileElevation":215,"medianElevation":217,"upperQuartileElevation":220},"gradeData":{"avgGrade":0.0009490520104191727,"gradeProfile":"HILLY","gradeZones":null,"lowerQuartileGrade":-1.6,"medianGrade":0,"upFlatDownDistanceData":{"down":7.866099999999993,"flat":17.36850000000002,"up":7.7087999999999886},"upFlatDownInSeconds":{"down":1126,"flat":2554,"total":4862,"up":1182},"upFlatDownMoveData":{"down":25.149165186500866,"flat":24.481832419733777,"up":23.47857868020301},"upperQuartileGrade":1.5},"heartRateData":null,"moveRatio":1,"paceData":{"avgPace":152,"lowerQuartilePace":208.33333333333331,"medianPace":151.51515151515153,"paceZones":null,"upperQuartilePace":120.48192771084338,"variancePace":25.09687163766813},"powerData":{"avgWatts":127.8596161869003,"avgWattsPerKg":1.826565945527147,"hasPowerMeter":false,"lowerQuartileWatts":0,"medianWatts":77,"powerZones":null,"punchFactor":null,"upperQuartileWatts":213,"variabilityIndex":1.4244642329867025,"weightedPower":182.13145010164712,"weightedWattsPerKg":2.6018778585949587},"speedData":{"avgPace":152,"genuineAvgSpeed":23.658412176059294,"lowerQuartileSpeed":17.28,"medianSpeed":23.759999999999998,"speedZones":null,"standardDeviationSpeed":11.976818155145843,"totalAvgSpeed":23.658412176059294,"upperQuartileSpeed":29.880000000000003,"varianceSpeed":143.44417312143105},"toughnessScore":null},"hasPowerMeter":false,"id":188722029,"moving_time_raw":4862,"name":"12/01/2013 Montbonnot Saint Martin, RA, France","private":false,"short_unit":"km","start_time":"2013-01-12T15:18:42+0000","trainer":false,"type":"Ride"},{"bike_id":824321,"calories":715.5186853099999,"commute":false,"display_type":"Sortie à vélo","distance_raw":32943.4,"elapsed_time_raw":4862,"elevation_gain_raw":99.0665,"elevation_unit":"m","extendedStats":{"cadenceData":null,"elevationData":{"accumulatedElevationAscent":99.05405505251002,"accumulatedElevationDescent":108.39010530010975,"ascentSpeed":{"avg":-1,"lowerQuartile":446,"median":545,"upperQuartile":648},"ascentSpeedZones":null,"avgElevation":219,"elevationZones":null,"lowerQuartileElevation":215,"medianElevation":217,"upperQuartileElevation":220},"gradeData":{"avgGrade":0.0009490520104191727,"gradeProfile":"HILLY","gradeZones":null,"lowerQuartileGrade":-1.6,"medianGrade":0,"upFlatDownDistanceData":{"down":7.866099999999993,"flat":17.36850000000002,"up":7.7087999999999886},"upFlatDownInSeconds":{"down":1126,"flat":2554,"total":4862,"up":1182},"upFlatDownMoveData":{"down":25.149165186500866,"flat":24.481832419733777,"up":23.47857868020301},"upperQuartileGrade":1.5},"heartRateData":null,"moveRatio":1,"paceData":{"avgPace":152,"lowerQuartilePace":208.33333333333331,"medianPace":151.51515151515153,"paceZones":null,"upperQuartilePace":120.48192771084338,"variancePace":25.09687163766813},"powerData":{"avgWatts":127.8596161869003,"avgWattsPerKg":1.826565945527147,"hasPowerMeter":false,"lowerQuartileWatts":0,"medianWatts":77,"powerZones":null,"punchFactor":null,"upperQuartileWatts":213,"variabilityIndex":1.4244642329867025,"weightedPower":182.13145010164712,"weightedWattsPerKg":2.6018778585949587},"speedData":{"avgPace":152,"genuineAvgSpeed":23.658412176059294,"lowerQuartileSpeed":17.28,"medianSpeed":23.759999999999998,"speedZones":null,"standardDeviationSpeed":11.976818155145843,"totalAvgSpeed":23.658412176059294,"upperQuartileSpeed":29.880000000000003,"varianceSpeed":143.44417312143105},"toughnessScore":null},"hasPowerMeter":false,"id":188722095,"moving_time_raw":4862,"name":"19/01/2013 Montbonnot Saint Martin, RA, France","private":false,"short_unit":"km","start_time":"2013-01-19T15:18:42+0000","trainer":false,"type":"Ride"},{"bike_id":824321,"calories":715.5186853099999,"commute":false,"display_type":"Sortie à vélo","distance_raw":32943.4,"elapsed_time_raw":4862,"elevation_gain_raw":99.0665,"elevation_unit":"m","extendedStats":{"cadenceData":null,"elevationData":{"accumulatedElevationAscent":99.05405505251002,"accumulatedElevationDescent":108.39010530010975,"ascentSpeed":{"avg":-1,"lowerQuartile":446,"median":545,"upperQuartile":648},"ascentSpeedZones":null,"avgElevation":219,"elevationZones":null,"lowerQuartileElevation":215,"medianElevation":217,"upperQuartileElevation":220},"gradeData":{"avgGrade":0.0009490520104191727,"gradeProfile":"HILLY","gradeZones":null,"lowerQuartileGrade":-1.6,"medianGrade":0,"upFlatDownDistanceData":{"down":7.866099999999993,"flat":17.36850000000002,"up":7.7087999999999886},"upFlatDownInSeconds":{"down":1126,"flat":2554,"total":4862,"up":1182},"upFlatDownMoveData":{"down":25.149165186500866,"flat":24.481832419733777,"up":23.47857868020301},"upperQuartileGrade":1.5},"heartRateData":null,"moveRatio":1,"paceData":{"avgPace":152,"lowerQuartilePace":208.33333333333331,"medianPace":151.51515151515153,"paceZones":null,"upperQuartilePace":120.48192771084338,"variancePace":25.09687163766813},"powerData":{"avgWatts":127.8596161869003,"avgWattsPerKg":1.826565945527147,"hasPowerMeter":false,"lowerQuartileWatts":0,"medianWatts":77,"powerZones":null,"punchFactor":null,"upperQuartileWatts":213,"variabilityIndex":1.4244642329867025,"weightedPower":182.13145010164712,"weightedWattsPerKg":2.6018778585949587},"speedData":{"avgPace":152,"genuineAvgSpeed":23.658412176059294,"lowerQuartileSpeed":17.28,"medianSpeed":23.759999999999998,"speedZones":null,"standardDeviationSpeed":11.976818155145843,"totalAvgSpeed":23.658412176059294,"upperQuartileSpeed":29.880000000000003,"varianceSpeed":143.44417312143105},"toughnessScore":null},"hasPowerMeter":false,"id":188722134,"moving_time_raw":4862,"name":"26/01/2013 Montbonnot Saint Martin, RA, France","private":false,"short_unit":"km","start_time":"2013-01-26T15:18:42+0000","trainer":false,"type":"Ride"},{"bike_id":824321,"calories":715.5186853099999,"commute":false,"display_type":"Sortie à vélo","distance_raw":32943.4,"elapsed_time_raw":4862,"elevation_gain_raw":99.0665,"elevation_unit":"m","extendedStats":{"cadenceData":null,"elevationData":{"accumulatedElevationAscent":99.05405505251002,"accumulatedElevationDescent":108.39010530010975,"ascentSpeed":{"avg":-1,"lowerQuartile":446,"median":545,"upperQuartile":648},"ascentSpeedZones":null,"avgElevation":219,"elevationZones":null,"lowerQuartileElevation":215,"medianElevation":217,"upperQuartileElevation":220},"gradeData":{"avgGrade":0.0009490520104191727,"gradeProfile":"HILLY","gradeZones":null,"lowerQuartileGrade":-1.6,"medianGrade":0,"upFlatDownDistanceData":{"down":7.866099999999993,"flat":17.36850000000002,"up":7.7087999999999886},"upFlatDownInSeconds":{"down":1126,"flat":2554,"total":4862,"up":1182},"upFlatDownMoveData":{"down":25.149165186500866,"flat":24.481832419733777,"up":23.47857868020301},"upperQuartileGrade":1.5},"heartRateData":null,"moveRatio":1,"paceData":{"avgPace":152,"lowerQuartilePace":208.33333333333331,"medianPace":151.51515151515153,"paceZones":null,"upperQuartilePace":120.48192771084338,"variancePace":25.09687163766813},"powerData":{"avgWatts":127.8596161869003,"avgWattsPerKg":1.826565945527147,"hasPowerMeter":false,"lowerQuartileWatts":0,"medianWatts":77,"powerZones":null,"punchFactor":null,"upperQuartileWatts":213,"variabilityIndex":1.4244642329867025,"weightedPower":182.13145010164712,"weightedWattsPerKg":2.6018778585949587},"speedData":{"avgPace":152,"genuineAvgSpeed":23.658412176059294,"lowerQuartileSpeed":17.28,"medianSpeed":23.759999999999998,"speedZones":null,"standardDeviationSpeed":11.976818155145843,"totalAvgSpeed":23.658412176059294,"upperQuartileSpeed":29.880000000000003,"varianceSpeed":143.44417312143105},"toughnessScore":null},"hasPowerMeter":false,"id":188722265,"moving_time_raw":4862,"name":"02/02/2013 Montbonnot Saint Martin, RA, France","private":false,"short_unit":"km","start_time":"2013-02-02T15:18:42+0000","trainer":false,"type":"Ride"},{"bike_id":824321,"calories":715.5186853099999,"commute":false,"display_type":"Sortie à vélo","distance_raw":32943.4,"elapsed_time_raw":4862,"elevation_gain_raw":99.0665,"elevation_unit":"m","extendedStats":{"cadenceData":null,"elevationData":{"accumulatedElevationAscent":99.05405505251002,"accumulatedElevationDescent":108.39010530010975,"ascentSpeed":{"avg":-1,"lowerQuartile":446,"median":545,"upperQuartile":648},"ascentSpeedZones":null,"avgElevation":219,"elevationZones":null,"lowerQuartileElevation":215,"medianElevation":217,"upperQuartileElevation":220},"gradeData":{"avgGrade":0.0009490520104191727,"gradeProfile":"HILLY","gradeZones":null,"lowerQuartileGrade":-1.6,"medianGrade":0,"upFlatDownDistanceData":{"down":7.866099999999993,"flat":17.36850000000002,"up":7.7087999999999886},"upFlatDownInSeconds":{"down":1126,"flat":2554,"total":4862,"up":1182},"upFlatDownMoveData":{"down":25.149165186500866,"flat":24.481832419733777,"up":23.47857868020301},"upperQuartileGrade":1.5},"heartRateData":null,"moveRatio":1,"paceData":{"avgPace":152,"lowerQuartilePace":208.33333333333331,"medianPace":151.51515151515153,"paceZones":null,"upperQuartilePace":120.48192771084338,"variancePace":25.09687163766813},"powerData":{"avgWatts":127.8596161869003,"avgWattsPerKg":1.826565945527147,"hasPowerMeter":false,"lowerQuartileWatts":0,"medianWatts":77,"powerZones":null,"punchFactor":null,"upperQuartileWatts":213,"variabilityIndex":1.4244642329867025,"weightedPower":182.13145010164712,"weightedWattsPerKg":2.6018778585949587},"speedData":{"avgPace":152,"genuineAvgSpeed":23.658412176059294,"lowerQuartileSpeed":17.28,"medianSpeed":23.759999999999998,"speedZones":null,"standardDeviationSpeed":11.976818155145843,"totalAvgSpeed":23.658412176059294,"upperQuartileSpeed":29.880000000000003,"varianceSpeed":143.44417312143105},"toughnessScore":null},"hasPowerMeter":false,"id":188722319,"moving_time_raw":4862,"name":"09/02/2013 Montbonnot Saint Martin, RA, France","private":false,"short_unit":"km","start_time":"2013-02-09T15:18:42+0000","trainer":false,"type":"Ride"},{"bike_id":null,"calories":null,"commute":null,"display_type":"Ski alpin","distance_raw":34561.6,"elapsed_time_raw":10369,"elevation_gain_raw":3838.39,"elevation_unit":"m","extendedStats":{"cadenceData":null,"elevationData":{"accumulatedElevationAscent":2393.32392310833,"accumulatedElevationDescent":2178.4820407631887,"ascentSpeed":{"avg":2748.00192676059,"lowerQuartile":1072,"median":2623,"upperQuartile":4604},"ascentSpeedZones":null,"avgElevation":1780,"elevationZones":null,"lowerQuartileElevation":1643,"medianElevation":1823,"upperQuartileElevation":1935},"gradeData":{"avgGrade":-0.3734965110006332,"gradeProfile":"HILLY","gradeZones":null,"lowerQuartileGrade":-20.5,"medianGrade":-8.6,"upFlatDownDistanceData":{"down":20.157599999999995,"flat":0.9601000000000162,"up":13.362099999999991},"upFlatDownInSeconds":{"down":3753,"flat":432,"total":8540,"up":4355},"upFlatDownMoveData":{"down":19.33582733812949,"flat":8.00083333333347,"up":11.045593570608489},"upperQuartileGrade":22.7},"heartRateData":null,"moveRatio":0.8236088340244961,"paceData":{"avgPace":243,"lowerQuartilePace":666.6666666666666,"medianPace":270.27027027027026,"paceZones":null,"upperQuartilePace":192.30769230769226,"variancePace":15.78002908783578},"powerData":null,"speedData":{"avgPace":243,"genuineAvgSpeed":14.807381733021012,"lowerQuartileSpeed":5.4,"medianSpeed":13.32,"speedZones":null,"standardDeviationSpeed":15.10418688964143,"totalAvgSpeed":12.195490404089059,"upperQuartileSpeed":18.720000000000002,"varianceSpeed":228.13646159721605},"toughnessScore":null},"hasPowerMeter":false,"id":76663966,"moving_time_raw":7452,"name":"Big Pow Day at Les 7 Laux","private":false,"short_unit":"km","start_time":"2013-02-13T13:05:05+0000","trainer":false,"type":"AlpineSki"},{"bike_id":824321,"calories":715.5186853099999,"commute":false,"display_type":"Sortie à vélo","distance_raw":32943.4,"elapsed_time_raw":4862,"elevation_gain_raw":99.0665,"elevation_unit":"m","extendedStats":{"cadenceData":null,"elevationData":{"accumulatedElevationAscent":99.05405505251002,"accumulatedElevationDescent":108.39010530010975,"ascentSpeed":{"avg":-1,"lowerQuartile":446,"median":545,"upperQuartile":648},"ascentSpeedZones":null,"avgElevation":219,"elevationZones":null,"lowerQuartileElevation":215,"medianElevation":217,"upperQuartileElevation":220},"gradeData":{"avgGrade":0.0009490520104191727,"gradeProfile":"HILLY","gradeZones":null,"lowerQuartileGrade":-1.6,"medianGrade":0,"upFlatDownDistanceData":{"down":7.866099999999993,"flat":17.36850000000002,"up":7.7087999999999886},"upFlatDownInSeconds":{"down":1126,"flat":2554,"total":4862,"up":1182},"upFlatDownMoveData":{"down":25.149165186500866,"flat":24.481832419733777,"up":23.47857868020301},"upperQuartileGrade":1.5},"heartRateData":null,"moveRatio":1,"paceData":{"avgPace":152,"lowerQuartilePace":208.33333333333331,"medianPace":151.51515151515153,"paceZones":null,"upperQuartilePace":120.48192771084338,"variancePace":25.09687163766813},"powerData":{"avgWatts":127.8596161869003,"avgWattsPerKg":1.826565945527147,"hasPowerMeter":false,"lowerQuartileWatts":0,"medianWatts":77,"powerZones":null,"punchFactor":null,"upperQuartileWatts":213,"variabilityIndex":1.4244642329867025,"weightedPower":182.13145010164712,"weightedWattsPerKg":2.6018778585949587},"speedData":{"avgPace":152,"genuineAvgSpeed":23.658412176059294,"lowerQuartileSpeed":17.28,"medianSpeed":23.759999999999998,"speedZones":null,"standardDeviationSpeed":11.976818155145843,"totalAvgSpeed":23.658412176059294,"upperQuartileSpeed":29.880000000000003,"varianceSpeed":143.44417312143105},"toughnessScore":null},"hasPowerMeter":false,"id":188722406,"moving_time_raw":4862,"name":"16/02/2013 Montbonnot Saint Martin, RA, France","private":false,"short_unit":"km","start_time":"2013-02-16T15:18:42+0000","trainer":false,"type":"Ride"},{"bike_id":null,"calories":null,"commute":null,"display_type":"Ski alpin","distance_raw":129429,"elapsed_time_raw":28641,"elevation_gain_raw":14218.6,"elevation_unit":"m","extendedStats":{"cadenceData":null,"elevationData":{"accumulatedElevationAscent":10137.192784022927,"accumulatedElevationDescent":11232.250393688977,"ascentSpeed":{"avg":3268.6203032918047,"lowerQuartile":1644,"median":3005,"upperQuartile":4262},"ascentSpeedZones":null,"avgElevation":2536,"elevationZones":null,"lowerQuartileElevation":2388,"medianElevation":2536,"upperQuartileElevation":2715},"gradeData":{"avgGrade":-1.5214757948577564,"gradeProfile":"HILLY","gradeZones":null,"lowerQuartileGrade":-21.2,"medianGrade":-9,"upFlatDownDistanceData":{"down":75.3849,"flat":2.4889999999999604,"up":51.43540000000004},"upFlatDownInSeconds":{"down":9831,"flat":1161,"total":25141,"up":14149},"upFlatDownMoveData":{"down":27.605090021361004,"flat":7.7178294573642185,"up":13.08696303625699},"upperQuartileGrade":22.2},"heartRateData":null,"moveRatio":0.877797562934255,"paceData":{"avgPace":196,"lowerQuartilePace":1428.5714285714284,"medianPace":250.00000000000003,"paceZones":null,"upperQuartilePace":169.4915254237288,"variancePace":6.676031968266493},"powerData":null,"speedData":{"avgPace":196,"genuineAvgSpeed":18.340325364941595,"lowerQuartileSpeed":2.52,"medianSpeed":14.4,"speedZones":null,"standardDeviationSpeed":23.221595008489317,"totalAvgSpeed":16.099092908767034,"upperQuartileSpeed":21.240000000000002,"varianceSpeed":539.2424747382959},"toughnessScore":null},"hasPowerMeter":false,"id":81275611,"moving_time_raw":20304,"name":"Val thorens","private":false,"short_unit":"km","start_time":"2013-02-17T07:58:50+0000","trainer":false,"type":"AlpineSki"},{"bike_id":824321,"calories":715.5186853099999,"commute":false,"display_type":"Sortie à vélo","distance_raw":32943.4,"elapsed_time_raw":4862,"elevation_gain_raw":99.0665,"elevation_unit":"m","extendedStats":{"cadenceData":null,"elevationData":{"accumulatedElevationAscent":99.05405505251002,"accumulatedElevationDescent":108.39010530010975,"ascentSpeed":{"avg":-1,"lowerQuartile":446,"median":545,"upperQuartile":648},"ascentSpeedZones":null,"avgElevation":219,"elevationZones":null,"lowerQuartileElevation":215,"medianElevation":217,"upperQuartileElevation":220},"gradeData":{"avgGrade":0.0009490520104191727,"gradeProfile":"HILLY","gradeZones":null,"lowerQuartileGrade":-1.6,"medianGrade":0,"upFlatDownDistanceData":{"down":7.866099999999993,"flat":17.36850000000002,"up":7.7087999999999886},"upFlatDownInSeconds":{"down":1126,"flat":2554,"total":4862,"up":1182},"upFlatDownMoveData":{"down":25.149165186500866,"flat":24.481832419733777,"up":23.47857868020301},"upperQuartileGrade":1.5},"heartRateData":null,"moveRatio":1,"paceData":{"avgPace":152,"lowerQuartilePace":208.33333333333331,"medianPace":151.51515151515153,"paceZones":null,"upperQuartilePace":120.48192771084338,"variancePace":25.09687163766813},"powerData":{"avgWatts":127.8596161869003,"avgWattsPerKg":1.826565945527147,"hasPowerMeter":false,"lowerQuartileWatts":0,"medianWatts":77,"powerZones":null,"punchFactor":null,"upperQuartileWatts":213,"variabilityIndex":1.4244642329867025,"weightedPower":182.13145010164712,"weightedWattsPerKg":2.6018778585949587},"speedData":{"avgPace":152,"genuineAvgSpeed":23.658412176059294,"lowerQuartileSpeed":17.28,"medianSpeed":23.759999999999998,"speedZones":null,"standardDeviationSpeed":11.976818155145843,"totalAvgSpeed":23.658412176059294,"upperQuartileSpeed":29.880000000000003,"varianceSpeed":143.44417312143105},"toughnessScore":null},"hasPowerMeter":false,"id":188723695,"moving_time_raw":4862,"name":"23/02/2013 Montbonnot Saint Martin, RA, France","private":false,"short_unit":"km","start_time":"2013-02-23T15:18:42+0000","trainer":false,"type":"Ride"},{"bike_id":824321,"calories":715.5186853099999,"commute":false,"display_type":"Sortie à vélo","distance_raw":32943.4,"elapsed_time_raw":4862,"elevation_gain_raw":99.0665,"elevation_unit":"m","extendedStats":{"cadenceData":null,"elevationData":{"accumulatedElevationAscent":99.05405505251002,"accumulatedElevationDescent":108.39010530010975,"ascentSpeed":{"avg":-1,"lowerQuartile":446,"median":545,"upperQuartile":648},"ascentSpeedZones":null,"avgElevation":219,"elevationZones":null,"lowerQuartileElevation":215,"medianElevation":217,"upperQuartileElevation":220},"gradeData":{"avgGrade":0.0009490520104191727,"gradeProfile":"HILLY","gradeZones":null,"lowerQuartileGrade":-1.6,"medianGrade":0,"upFlatDownDistanceData":{"down":7.866099999999993,"flat":17.36850000000002,"up":7.7087999999999886},"upFlatDownInSeconds":{"down":1126,"flat":2554,"total":4862,"up":1182},"upFlatDownMoveData":{"down":25.149165186500866,"flat":24.481832419733777,"up":23.47857868020301},"upperQuartileGrade":1.5},"heartRateData":null,"moveRatio":1,"paceData":{"avgPace":152,"lowerQuartilePace":208.33333333333331,"medianPace":151.51515151515153,"paceZones":null,"upperQuartilePace":120.48192771084338,"variancePace":25.09687163766813},"powerData":{"avgWatts":127.8596161869003,"avgWattsPerKg":1.826565945527147,"hasPowerMeter":false,"lowerQuartileWatts":0,"medianWatts":77,"powerZones":null,"punchFactor":null,"upperQuartileWatts":213,"variabilityIndex":1.4244642329867025,"weightedPower":182.13145010164712,"weightedWattsPerKg":2.6018778585949587},"speedData":{"avgPace":152,"genuineAvgSpeed":23.658412176059294,"lowerQuartileSpeed":17.28,"medianSpeed":23.759999999999998,"speedZones":null,"standardDeviationSpeed":11.976818155145843,"totalAvgSpeed":23.658412176059294,"upperQuartileSpeed":29.880000000000003,"varianceSpeed":143.44417312143105},"toughnessScore":null},"hasPowerMeter":false,"id":188723960,"moving_time_raw":4862,"name":"02/03/2013 Montbonnot Saint Martin, RA, France","private":false,"short_unit":"km","start_time":"2013-03-02T15:18:42+0000","trainer":false,"type":"Ride"},{"bike_id":824321,"calories":715.5186853099999,"commute":false,"display_type":"Sortie à vélo","distance_raw":32943.4,"elapsed_time_raw":4862,"elevation_gain_raw":99.0665,"elevation_unit":"m","extendedStats":{"cadenceData":null,"elevationData":{"accumulatedElevationAscent":99.05405505251002,"accumulatedElevationDescent":108.39010530010975,"ascentSpeed":{"avg":-1,"lowerQuartile":446,"median":545,"upperQuartile":648},"ascentSpeedZones":null,"avgElevation":219,"elevationZones":null,"lowerQuartileElevation":215,"medianElevation":217,"upperQuartileElevation":220},"gradeData":{"avgGrade":0.0009490520104191727,"gradeProfile":"HILLY","gradeZones":null,"lowerQuartileGrade":-1.6,"medianGrade":0,"upFlatDownDistanceData":{"down":7.866099999999993,"flat":17.36850000000002,"up":7.7087999999999886},"upFlatDownInSeconds":{"down":1126,"flat":2554,"total":4862,"up":1182},"upFlatDownMoveData":{"down":25.149165186500866,"flat":24.481832419733777,"up":23.47857868020301},"upperQuartileGrade":1.5},"heartRateData":null,"moveRatio":1,"paceData":{"avgPace":152,"lowerQuartilePace":208.33333333333331,"medianPace":151.51515151515153,"paceZones":null,"upperQuartilePace":120.48192771084338,"variancePace":25.09687163766813},"powerData":{"avgWatts":127.8596161869003,"avgWattsPerKg":1.826565945527147,"hasPowerMeter":false,"lowerQuartileWatts":0,"medianWatts":77,"powerZones":null,"punchFactor":null,"upperQuartileWatts":213,"variabilityIndex":1.4244642329867025,"weightedPower":182.13145010164712,"weightedWattsPerKg":2.6018778585949587},"speedData":{"avgPace":152,"genuineAvgSpeed":23.658412176059294,"lowerQuartileSpeed":17.28,"medianSpeed":23.759999999999998,"speedZones":null,"standardDeviationSpeed":11.976818155145843,"totalAvgSpeed":23.658412176059294,"upperQuartileSpeed":29.880000000000003,"varianceSpeed":143.44417312143105},"toughnessScore":null},"hasPowerMeter":false,"id":188723992,"moving_time_raw":4862,"name":"09/03/2013 Montbonnot Saint Martin, RA, France","private":false,"short_unit":"km","start_time":"2013-03-09T15:18:42+0000","trainer":false,"type":"Ride"},{"bike_id":824321,"calories":715.5186853099999,"commute":false,"display_type":"Sortie à vélo","distance_raw":32943.4,"elapsed_time_raw":4862,"elevation_gain_raw":99.0665,"elevation_unit":"m","extendedStats":{"cadenceData":null,"elevationData":{"accumulatedElevationAscent":99.05405505251002,"accumulatedElevationDescent":108.39010530010975,"ascentSpeed":{"avg":-1,"lowerQuartile":446,"median":545,"upperQuartile":648},"ascentSpeedZones":null,"avgElevation":219,"elevationZones":null,"lowerQuartileElevation":215,"medianElevation":217,"upperQuartileElevation":220},"gradeData":{"avgGrade":0.0009490520104191727,"gradeProfile":"HILLY","gradeZones":null,"lowerQuartileGrade":-1.6,"medianGrade":0,"upFlatDownDistanceData":{"down":7.866099999999993,"flat":17.36850000000002,"up":7.7087999999999886},"upFlatDownInSeconds":{"down":1126,"flat":2554,"total":4862,"up":1182},"upFlatDownMoveData":{"down":25.149165186500866,"flat":24.481832419733777,"up":23.47857868020301},"upperQuartileGrade":1.5},"heartRateData":null,"moveRatio":1,"paceData":{"avgPace":152,"lowerQuartilePace":208.33333333333331,"medianPace":151.51515151515153,"paceZones":null,"upperQuartilePace":120.48192771084338,"variancePace":25.09687163766813},"powerData":{"avgWatts":127.8596161869003,"avgWattsPerKg":1.826565945527147,"hasPowerMeter":false,"lowerQuartileWatts":0,"medianWatts":77,"powerZones":null,"punchFactor":null,"upperQuartileWatts":213,"variabilityIndex":1.4244642329867025,"weightedPower":182.13145010164712,"weightedWattsPerKg":2.6018778585949587},"speedData":{"avgPace":152,"genuineAvgSpeed":23.658412176059294,"lowerQuartileSpeed":17.28,"medianSpeed":23.759999999999998,"speedZones":null,"standardDeviationSpeed":11.976818155145843,"totalAvgSpeed":23.658412176059294,"upperQuartileSpeed":29.880000000000003,"varianceSpeed":143.44417312143105},"toughnessScore":null},"hasPowerMeter":false,"id":188724343,"moving_time_raw":4862,"name":"16/03/2013 Montbonnot Saint Martin, RA, France","private":false,"short_unit":"km","start_time":"2013-03-16T15:18:42+0000","trainer":false,"type":"Ride"},{"bike_id":824321,"calories":715.5186853099999,"commute":false,"display_type":"Sortie à vélo","distance_raw":32943.4,"elapsed_time_raw":4862,"elevation_gain_raw":99.0665,"elevation_unit":"m","extendedStats":{"cadenceData":null,"elevationData":{"accumulatedElevationAscent":99.05405505251002,"accumulatedElevationDescent":108.39010530010975,"ascentSpeed":{"avg":-1,"lowerQuartile":446,"median":545,"upperQuartile":648},"ascentSpeedZones":null,"avgElevation":219,"elevationZones":null,"lowerQuartileElevation":215,"medianElevation":217,"upperQuartileElevation":220},"gradeData":{"avgGrade":0.0009490520104191727,"gradeProfile":"HILLY","gradeZones":null,"lowerQuartileGrade":-1.6,"medianGrade":0,"upFlatDownDistanceData":{"down":7.866099999999993,"flat":17.36850000000002,"up":7.7087999999999886},"upFlatDownInSeconds":{"down":1126,"flat":2554,"total":4862,"up":1182},"upFlatDownMoveData":{"down":25.149165186500866,"flat":24.481832419733777,"up":23.47857868020301},"upperQuartileGrade":1.5},"heartRateData":null,"moveRatio":1,"paceData":{"avgPace":152,"lowerQuartilePace":208.33333333333331,"medianPace":151.51515151515153,"paceZones":null,"upperQuartilePace":120.48192771084338,"variancePace":25.09687163766813},"powerData":{"avgWatts":127.8596161869003,"avgWattsPerKg":1.826565945527147,"hasPowerMeter":false,"lowerQuartileWatts":0,"medianWatts":77,"powerZones":null,"punchFactor":null,"upperQuartileWatts":213,"variabilityIndex":1.4244642329867025,"weightedPower":182.13145010164712,"weightedWattsPerKg":2.6018778585949587},"speedData":{"avgPace":152,"genuineAvgSpeed":23.658412176059294,"lowerQuartileSpeed":17.28,"medianSpeed":23.759999999999998,"speedZones":null,"standardDeviationSpeed":11.976818155145843,"totalAvgSpeed":23.658412176059294,"upperQuartileSpeed":29.880000000000003,"varianceSpeed":143.44417312143105},"toughnessScore":null},"hasPowerMeter":false,"id":188724374,"moving_time_raw":4862,"name":"23/03/2013 Montbonnot Saint Martin, RA, France","private":false,"short_unit":"km","start_time":"2013-03-23T15:18:42+0000","trainer":false,"type":"Ride"},{"bike_id":824321,"calories":715.5186853099999,"commute":false,"display_type":"Sortie à vélo","distance_raw":32943.4,"elapsed_time_raw":4862,"elevation_gain_raw":99.0665,"elevation_unit":"m","extendedStats":{"cadenceData":null,"elevationData":{"accumulatedElevationAscent":99.05405505251002,"accumulatedElevationDescent":108.39010530010975,"ascentSpeed":{"avg":-1,"lowerQuartile":446,"median":545,"upperQuartile":648},"ascentSpeedZones":null,"avgElevation":219,"elevationZones":null,"lowerQuartileElevation":215,"medianElevation":217,"upperQuartileElevation":220},"gradeData":{"avgGrade":0.0009490520104191727,"gradeProfile":"HILLY","gradeZones":null,"lowerQuartileGrade":-1.6,"medianGrade":0,"upFlatDownDistanceData":{"down":7.866099999999993,"flat":17.36850000000002,"up":7.7087999999999886},"upFlatDownInSeconds":{"down":1126,"flat":2554,"total":4862,"up":1182},"upFlatDownMoveData":{"down":25.149165186500866,"flat":24.481832419733777,"up":23.47857868020301},"upperQuartileGrade":1.5},"heartRateData":null,"moveRatio":1,"paceData":{"avgPace":152,"lowerQuartilePace":208.33333333333331,"medianPace":151.51515151515153,"paceZones":null,"upperQuartilePace":120.48192771084338,"variancePace":25.09687163766813},"powerData":{"avgWatts":127.8596161869003,"avgWattsPerKg":1.826565945527147,"hasPowerMeter":false,"lowerQuartileWatts":0,"medianWatts":77,"powerZones":null,"punchFactor":null,"upperQuartileWatts":213,"variabilityIndex":1.4244642329867025,"weightedPower":182.13145010164712,"weightedWattsPerKg":2.6018778585949587},"speedData":{"avgPace":152,"genuineAvgSpeed":23.658412176059294,"lowerQuartileSpeed":17.28,"medianSpeed":23.759999999999998,"speedZones":null,"standardDeviationSpeed":11.976818155145843,"totalAvgSpeed":23.658412176059294,"upperQuartileSpeed":29.880000000000003,"varianceSpeed":143.44417312143105},"toughnessScore":null},"hasPowerMeter":false,"id":188724410,"moving_time_raw":4862,"name":"30/03/2013 Montbonnot Saint Martin, RA, France","private":false,"short_unit":"km","start_time":"2013-03-30T15:18:42+0000","trainer":false,"type":"Ride"},{"bike_id":824321,"calories":715.5186853099999,"commute":false,"display_type":"Sortie à vélo","distance_raw":32943.4,"elapsed_time_raw":4862,"elevation_gain_raw":99.0665,"elevation_unit":"m","extendedStats":{"cadenceData":null,"elevationData":{"accumulatedElevationAscent":99.05405505251002,"accumulatedElevationDescent":108.39010530010975,"ascentSpeed":{"avg":-1,"lowerQuartile":446,"median":545,"upperQuartile":648},"ascentSpeedZones":null,"avgElevation":219,"elevationZones":null,"lowerQuartileElevation":215,"medianElevation":217,"upperQuartileElevation":220},"gradeData":{"avgGrade":0.0009490520104191727,"gradeProfile":"HILLY","gradeZones":null,"lowerQuartileGrade":-1.6,"medianGrade":0,"upFlatDownDistanceData":{"down":7.866099999999993,"flat":17.36850000000002,"up":7.7087999999999886},"upFlatDownInSeconds":{"down":1126,"flat":2554,"total":4862,"up":1182},"upFlatDownMoveData":{"down":25.149165186500866,"flat":24.481832419733777,"up":23.47857868020301},"upperQuartileGrade":1.5},"heartRateData":null,"moveRatio":1,"paceData":{"avgPace":152,"lowerQuartilePace":208.33333333333331,"medianPace":151.51515151515153,"paceZones":null,"upperQuartilePace":120.48192771084338,"variancePace":25.09687163766813},"powerData":{"avgWatts":127.8596161869003,"avgWattsPerKg":1.826565945527147,"hasPowerMeter":false,"lowerQuartileWatts":0,"medianWatts":77,"powerZones":null,"punchFactor":null,"upperQuartileWatts":213,"variabilityIndex":1.4244642329867025,"weightedPower":182.13145010164712,"weightedWattsPerKg":2.6018778585949587},"speedData":{"avgPace":152,"genuineAvgSpeed":23.658412176059294,"lowerQuartileSpeed":17.28,"medianSpeed":23.759999999999998,"speedZones":null,"standardDeviationSpeed":11.976818155145843,"totalAvgSpeed":23.658412176059294,"upperQuartileSpeed":29.880000000000003,"varianceSpeed":143.44417312143105},"toughnessScore":null},"hasPowerMeter":false,"id":188735913,"moving_time_raw":4862,"name":"07/04/2013 Montbonnot Saint Martin, RA, France","private":false,"short_unit":"km","start_time":"2013-04-07T15:18:42+0000","trainer":false,"type":"Ride"},{"bike_id":824321,"calories":715.5186853099999,"commute":false,"display_type":"Sortie à vélo","distance_raw":32943.4,"elapsed_time_raw":4862,"elevation_gain_raw":99.0665,"elevation_unit":"m","extendedStats":{"cadenceData":null,"elevationData":{"accumulatedElevationAscent":99.05405505251002,"accumulatedElevationDescent":108.39010530010975,"ascentSpeed":{"avg":-1,"lowerQuartile":446,"median":545,"upperQuartile":648},"ascentSpeedZones":null,"avgElevation":219,"elevationZones":null,"lowerQuartileElevation":215,"medianElevation":217,"upperQuartileElevation":220},"gradeData":{"avgGrade":0.0009490520104191727,"gradeProfile":"HILLY","gradeZones":null,"lowerQuartileGrade":-1.6,"medianGrade":0,"upFlatDownDistanceData":{"down":7.866099999999993,"flat":17.36850000000002,"up":7.7087999999999886},"upFlatDownInSeconds":{"down":1126,"flat":2554,"total":4862,"up":1182},"upFlatDownMoveData":{"down":25.149165186500866,"flat":24.481832419733777,"up":23.47857868020301},"upperQuartileGrade":1.5},"heartRateData":null,"moveRatio":1,"paceData":{"avgPace":152,"lowerQuartilePace":208.33333333333331,"medianPace":151.51515151515153,"paceZones":null,"upperQuartilePace":120.48192771084338,"variancePace":25.09687163766813},"powerData":{"avgWatts":127.8596161869003,"avgWattsPerKg":1.826565945527147,"hasPowerMeter":false,"lowerQuartileWatts":0,"medianWatts":77,"powerZones":null,"punchFactor":null,"upperQuartileWatts":213,"variabilityIndex":1.4244642329867025,"weightedPower":182.13145010164712,"weightedWattsPerKg":2.6018778585949587},"speedData":{"avgPace":152,"genuineAvgSpeed":23.658412176059294,"lowerQuartileSpeed":17.28,"medianSpeed":23.759999999999998,"speedZones":null,"standardDeviationSpeed":11.976818155145843,"totalAvgSpeed":23.658412176059294,"upperQuartileSpeed":29.880000000000003,"varianceSpeed":143.44417312143105},"toughnessScore":null},"hasPowerMeter":false,"id":188735919,"moving_time_raw":4862,"name":"14/04/2013 Montbonnot Saint Martin, RA, France","private":false,"short_unit":"km","start_time":"2013-04-14T15:18:42+0000","trainer":false,"type":"Ride"},{"bike_id":824321,"calories":715.5186853099999,"commute":false,"display_type":"Sortie à vélo","distance_raw":32943.4,"elapsed_time_raw":4862,"elevation_gain_raw":99.0665,"elevation_unit":"m","extendedStats":{"cadenceData":null,"elevationData":{"accumulatedElevationAscent":99.05405505251002,"accumulatedElevationDescent":108.39010530010975,"ascentSpeed":{"avg":-1,"lowerQuartile":446,"median":545,"upperQuartile":648},"ascentSpeedZones":null,"avgElevation":219,"elevationZones":null,"lowerQuartileElevation":215,"medianElevation":217,"upperQuartileElevation":220},"gradeData":{"avgGrade":0.0009490520104191727,"gradeProfile":"HILLY","gradeZones":null,"lowerQuartileGrade":-1.6,"medianGrade":0,"upFlatDownDistanceData":{"down":7.866099999999993,"flat":17.36850000000002,"up":7.7087999999999886},"upFlatDownInSeconds":{"down":1126,"flat":2554,"total":4862,"up":1182},"upFlatDownMoveData":{"down":25.149165186500866,"flat":24.481832419733777,"up":23.47857868020301},"upperQuartileGrade":1.5},"heartRateData":null,"moveRatio":1,"paceData":{"avgPace":152,"lowerQuartilePace":208.33333333333331,"medianPace":151.51515151515153,"paceZones":null,"upperQuartilePace":120.48192771084338,"variancePace":25.09687163766813},"powerData":{"avgWatts":127.8596161869003,"avgWattsPerKg":1.826565945527147,"hasPowerMeter":false,"lowerQuartileWatts":0,"medianWatts":77,"powerZones":null,"punchFactor":null,"upperQuartileWatts":213,"variabilityIndex":1.4244642329867025,"weightedPower":182.13145010164712,"weightedWattsPerKg":2.6018778585949587},"speedData":{"avgPace":152,"genuineAvgSpeed":23.658412176059294,"lowerQuartileSpeed":17.28,"medianSpeed":23.759999999999998,"speedZones":null,"standardDeviationSpeed":11.976818155145843,"totalAvgSpeed":23.658412176059294,"upperQuartileSpeed":29.880000000000003,"varianceSpeed":143.44417312143105},"toughnessScore":null},"hasPowerMeter":false,"id":188735950,"moving_time_raw":4862,"name":"21/04/2013 Montbonnot Saint Martin, RA, France","private":false,"short_unit":"km","start_time":"2013-04-21T15:18:42+0000","trainer":false,"type":"Ride"},{"bike_id":824321,"calories":715.5186853099999,"commute":false,"display_type":"Sortie à vélo","distance_raw":32943.4,"elapsed_time_raw":4862,"elevation_gain_raw":99.0665,"elevation_unit":"m","extendedStats":{"cadenceData":null,"elevationData":{"accumulatedElevationAscent":99.05405505251002,"accumulatedElevationDescent":108.39010530010975,"ascentSpeed":{"avg":-1,"lowerQuartile":446,"median":545,"upperQuartile":648},"ascentSpeedZones":null,"avgElevation":219,"elevationZones":null,"lowerQuartileElevation":215,"medianElevation":217,"upperQuartileElevation":220},"gradeData":{"avgGrade":0.0009490520104191727,"gradeProfile":"HILLY","gradeZones":null,"lowerQuartileGrade":-1.6,"medianGrade":0,"upFlatDownDistanceData":{"down":7.866099999999993,"flat":17.36850000000002,"up":7.7087999999999886},"upFlatDownInSeconds":{"down":1126,"flat":2554,"total":4862,"up":1182},"upFlatDownMoveData":{"down":25.149165186500866,"flat":24.481832419733777,"up":23.47857868020301},"upperQuartileGrade":1.5},"heartRateData":null,"moveRatio":1,"paceData":{"avgPace":152,"lowerQuartilePace":208.33333333333331,"medianPace":151.51515151515153,"paceZones":null,"upperQuartilePace":120.48192771084338,"variancePace":25.09687163766813},"powerData":{"avgWatts":127.8596161869003,"avgWattsPerKg":1.826565945527147,"hasPowerMeter":false,"lowerQuartileWatts":0,"medianWatts":77,"powerZones":null,"punchFactor":null,"upperQuartileWatts":213,"variabilityIndex":1.4244642329867025,"weightedPower":182.13145010164712,"weightedWattsPerKg":2.6018778585949587},"speedData":{"avgPace":152,"genuineAvgSpeed":23.658412176059294,"lowerQuartileSpeed":17.28,"medianSpeed":23.759999999999998,"speedZones":null,"standardDeviationSpeed":11.976818155145843,"totalAvgSpeed":23.658412176059294,"upperQuartileSpeed":29.880000000000003,"varianceSpeed":143.44417312143105},"toughnessScore":null},"hasPowerMeter":false,"id":188735951,"moving_time_raw":4862,"name":"28/04/2013 Montbonnot Saint Martin, RA, France","private":false,"short_unit":"km","start_time":"2013-04-28T15:18:42+0000","trainer":false,"type":"Ride"},{"bike_id":824321,"calories":715.5186853099999,"commute":false,"display_type":"Sortie à vélo","distance_raw":32943.4,"elapsed_time_raw":4862,"elevation_gain_raw":99.0665,"elevation_unit":"m","extendedStats":{"cadenceData":null,"elevationData":{"accumulatedElevationAscent":99.05405505251002,"accumulatedElevationDescent":108.39010530010975,"ascentSpeed":{"avg":-1,"lowerQuartile":446,"median":545,"upperQuartile":648},"ascentSpeedZones":null,"avgElevation":219,"elevationZones":null,"lowerQuartileElevation":215,"medianElevation":217,"upperQuartileElevation":220},"gradeData":{"avgGrade":0.0009490520104191727,"gradeProfile":"HILLY","gradeZones":null,"lowerQuartileGrade":-1.6,"medianGrade":0,"upFlatDownDistanceData":{"down":7.866099999999993,"flat":17.36850000000002,"up":7.7087999999999886},"upFlatDownInSeconds":{"down":1126,"flat":2554,"total":4862,"up":1182},"upFlatDownMoveData":{"down":25.149165186500866,"flat":24.481832419733777,"up":23.47857868020301},"upperQuartileGrade":1.5},"heartRateData":null,"moveRatio":1,"paceData":{"avgPace":152,"lowerQuartilePace":208.33333333333331,"medianPace":151.51515151515153,"paceZones":null,"upperQuartilePace":120.48192771084338,"variancePace":25.09687163766813},"powerData":{"avgWatts":127.8596161869003,"avgWattsPerKg":1.826565945527147,"hasPowerMeter":false,"lowerQuartileWatts":0,"medianWatts":77,"powerZones":null,"punchFactor":null,"upperQuartileWatts":213,"variabilityIndex":1.4244642329867025,"weightedPower":182.13145010164712,"weightedWattsPerKg":2.6018778585949587},"speedData":{"avgPace":152,"genuineAvgSpeed":23.658412176059294,"lowerQuartileSpeed":17.28,"medianSpeed":23.759999999999998,"speedZones":null,"standardDeviationSpeed":11.976818155145843,"totalAvgSpeed":23.658412176059294,"upperQuartileSpeed":29.880000000000003,"varianceSpeed":143.44417312143105},"toughnessScore":null},"hasPowerMeter":false,"id":188735958,"moving_time_raw":4862,"name":"05/05/2013 Montbonnot Saint Martin, RA, France","private":false,"short_unit":"km","start_time":"2013-05-05T15:18:42+0000","trainer":false,"type":"Ride"},{"bike_id":824321,"calories":715.5186853099999,"commute":false,"display_type":"Sortie à vélo","distance_raw":32943.4,"elapsed_time_raw":4862,"elevation_gain_raw":99.0665,"elevation_unit":"m","extendedStats":{"cadenceData":null,"elevationData":{"accumulatedElevationAscent":99.05405505251002,"accumulatedElevationDescent":108.39010530010975,"ascentSpeed":{"avg":-1,"lowerQuartile":446,"median":545,"upperQuartile":648},"ascentSpeedZones":null,"avgElevation":219,"elevationZones":null,"lowerQuartileElevation":215,"medianElevation":217,"upperQuartileElevation":220},"gradeData":{"avgGrade":0.0009490520104191727,"gradeProfile":"HILLY","gradeZones":null,"lowerQuartileGrade":-1.6,"medianGrade":0,"upFlatDownDistanceData":{"down":7.866099999999993,"flat":17.36850000000002,"up":7.7087999999999886},"upFlatDownInSeconds":{"down":1126,"flat":2554,"total":4862,"up":1182},"upFlatDownMoveData":{"down":25.149165186500866,"flat":24.481832419733777,"up":23.47857868020301},"upperQuartileGrade":1.5},"heartRateData":null,"moveRatio":1,"paceData":{"avgPace":152,"lowerQuartilePace":208.33333333333331,"medianPace":151.51515151515153,"paceZones":null,"upperQuartilePace":120.48192771084338,"variancePace":25.09687163766813},"powerData":{"avgWatts":127.8596161869003,"avgWattsPerKg":1.826565945527147,"hasPowerMeter":false,"lowerQuartileWatts":0,"medianWatts":77,"powerZones":null,"punchFactor":null,"upperQuartileWatts":213,"variabilityIndex":1.4244642329867025,"weightedPower":182.13145010164712,"weightedWattsPerKg":2.6018778585949587},"speedData":{"avgPace":152,"genuineAvgSpeed":23.658412176059294,"lowerQuartileSpeed":17.28,"medianSpeed":23.759999999999998,"speedZones":null,"standardDeviationSpeed":11.976818155145843,"totalAvgSpeed":23.658412176059294,"upperQuartileSpeed":29.880000000000003,"varianceSpeed":143.44417312143105},"toughnessScore":null},"hasPowerMeter":false,"id":188735979,"moving_time_raw":4862,"name":"12/05/2013 Montbonnot Saint Martin, RA, France","private":false,"short_unit":"km","start_time":"2013-05-12T15:18:42+0000","trainer":false,"type":"Ride"},{"bike_id":824321,"calories":715.5186853099999,"commute":false,"display_type":"Sortie à vélo","distance_raw":32943.4,"elapsed_time_raw":4862,"elevation_gain_raw":99.0665,"elevation_unit":"m","extendedStats":{"cadenceData":null,"elevationData":{"accumulatedElevationAscent":99.05405505251002,"accumulatedElevationDescent":108.39010530010975,"ascentSpeed":{"avg":-1,"lowerQuartile":446,"median":545,"upperQuartile":648},"ascentSpeedZones":null,"avgElevation":219,"elevationZones":null,"lowerQuartileElevation":215,"medianElevation":217,"upperQuartileElevation":220},"gradeData":{"avgGrade":0.0009490520104191727,"gradeProfile":"HILLY","gradeZones":null,"lowerQuartileGrade":-1.6,"medianGrade":0,"upFlatDownDistanceData":{"down":7.866099999999993,"flat":17.36850000000002,"up":7.7087999999999886},"upFlatDownInSeconds":{"down":1126,"flat":2554,"total":4862,"up":1182},"upFlatDownMoveData":{"down":25.149165186500866,"flat":24.481832419733777,"up":23.47857868020301},"upperQuartileGrade":1.5},"heartRateData":null,"moveRatio":1,"paceData":{"avgPace":152,"lowerQuartilePace":208.33333333333331,"medianPace":151.51515151515153,"paceZones":null,"upperQuartilePace":120.48192771084338,"variancePace":25.09687163766813},"powerData":{"avgWatts":127.8596161869003,"avgWattsPerKg":1.826565945527147,"hasPowerMeter":false,"lowerQuartileWatts":0,"medianWatts":77,"powerZones":null,"punchFactor":null,"upperQuartileWatts":213,"variabilityIndex":1.4244642329867025,"weightedPower":182.13145010164712,"weightedWattsPerKg":2.6018778585949587},"speedData":{"avgPace":152,"genuineAvgSpeed":23.658412176059294,"lowerQuartileSpeed":17.28,"medianSpeed":23.759999999999998,"speedZones":null,"standardDeviationSpeed":11.976818155145843,"totalAvgSpeed":23.658412176059294,"upperQuartileSpeed":29.880000000000003,"varianceSpeed":143.44417312143105},"toughnessScore":null},"hasPowerMeter":false,"id":188736002,"moving_time_raw":4862,"name":"19/05/2013 Montbonnot Saint Martin, RA, France","private":false,"short_unit":"km","start_time":"2013-05-19T15:18:42+0000","trainer":false,"type":"Ride"},{"bike_id":824321,"calories":715.5186853099999,"commute":false,"display_type":"Sortie à vélo","distance_raw":32943.4,"elapsed_time_raw":4862,"elevation_gain_raw":99.0665,"elevation_unit":"m","extendedStats":{"cadenceData":null,"elevationData":{"accumulatedElevationAscent":99.05405505251002,"accumulatedElevationDescent":108.39010530010975,"ascentSpeed":{"avg":-1,"lowerQuartile":446,"median":545,"upperQuartile":648},"ascentSpeedZones":null,"avgElevation":219,"elevationZones":null,"lowerQuartileElevation":215,"medianElevation":217,"upperQuartileElevation":220},"gradeData":{"avgGrade":0.0009490520104191727,"gradeProfile":"HILLY","gradeZones":null,"lowerQuartileGrade":-1.6,"medianGrade":0,"upFlatDownDistanceData":{"down":7.866099999999993,"flat":17.36850000000002,"up":7.7087999999999886},"upFlatDownInSeconds":{"down":1126,"flat":2554,"total":4862,"up":1182},"upFlatDownMoveData":{"down":25.149165186500866,"flat":24.481832419733777,"up":23.47857868020301},"upperQuartileGrade":1.5},"heartRateData":null,"moveRatio":1,"paceData":{"avgPace":152,"lowerQuartilePace":208.33333333333331,"medianPace":151.51515151515153,"paceZones":null,"upperQuartilePace":120.48192771084338,"variancePace":25.09687163766813},"powerData":{"avgWatts":127.8596161869003,"avgWattsPerKg":1.826565945527147,"hasPowerMeter":false,"lowerQuartileWatts":0,"medianWatts":77,"powerZones":null,"punchFactor":null,"upperQuartileWatts":213,"variabilityIndex":1.4244642329867025,"weightedPower":182.13145010164712,"weightedWattsPerKg":2.6018778585949587},"speedData":{"avgPace":152,"genuineAvgSpeed":23.658412176059294,"lowerQuartileSpeed":17.28,"medianSpeed":23.759999999999998,"speedZones":null,"standardDeviationSpeed":11.976818155145843,"totalAvgSpeed":23.658412176059294,"upperQuartileSpeed":29.880000000000003,"varianceSpeed":143.44417312143105},"toughnessScore":null},"hasPowerMeter":false,"id":188736018,"moving_time_raw":4862,"name":"26/05/2013 Montbonnot Saint Martin, RA, France","private":false,"short_unit":"km","start_time":"2013-05-26T15:18:42+0000","trainer":false,"type":"Ride"},{"bike_id":824321,"calories":715.5186853099999,"commute":false,"display_type":"Sortie à vélo","distance_raw":32943.4,"elapsed_time_raw":4862,"elevation_gain_raw":99.0665,"elevation_unit":"m","extendedStats":{"cadenceData":null,"elevationData":{"accumulatedElevationAscent":99.05405505251002,"accumulatedElevationDescent":108.39010530010975,"ascentSpeed":{"avg":-1,"lowerQuartile":446,"median":545,"upperQuartile":648},"ascentSpeedZones":null,"avgElevation":219,"elevationZones":null,"lowerQuartileElevation":215,"medianElevation":217,"upperQuartileElevation":220},"gradeData":{"avgGrade":0.0009490520104191727,"gradeProfile":"HILLY","gradeZones":null,"lowerQuartileGrade":-1.6,"medianGrade":0,"upFlatDownDistanceData":{"down":7.866099999999993,"flat":17.36850000000002,"up":7.7087999999999886},"upFlatDownInSeconds":{"down":1126,"flat":2554,"total":4862,"up":1182},"upFlatDownMoveData":{"down":25.149165186500866,"flat":24.481832419733777,"up":23.47857868020301},"upperQuartileGrade":1.5},"heartRateData":null,"moveRatio":1,"paceData":{"avgPace":152,"lowerQuartilePace":208.33333333333331,"medianPace":151.51515151515153,"paceZones":null,"upperQuartilePace":120.48192771084338,"variancePace":25.09687163766813},"powerData":{"avgWatts":127.8596161869003,"avgWattsPerKg":1.826565945527147,"hasPowerMeter":false,"lowerQuartileWatts":0,"medianWatts":77,"powerZones":null,"punchFactor":null,"upperQuartileWatts":213,"variabilityIndex":1.4244642329867025,"weightedPower":182.13145010164712,"weightedWattsPerKg":2.6018778585949587},"speedData":{"avgPace":152,"genuineAvgSpeed":23.658412176059294,"lowerQuartileSpeed":17.28,"medianSpeed":23.759999999999998,"speedZones":null,"standardDeviationSpeed":11.976818155145843,"totalAvgSpeed":23.658412176059294,"upperQuartileSpeed":29.880000000000003,"varianceSpeed":143.44417312143105},"toughnessScore":null},"hasPowerMeter":false,"id":188736066,"moving_time_raw":4862,"name":"02/06/2013 Montbonnot Saint Martin, RA, France","private":false,"short_unit":"km","start_time":"2013-06-02T15:18:42+0000","trainer":false,"type":"Ride"},{"bike_id":824321,"calories":715.5186853099999,"commute":false,"display_type":"Sortie à vélo","distance_raw":32943.4,"elapsed_time_raw":4862,"elevation_gain_raw":99.0665,"elevation_unit":"m","extendedStats":{"cadenceData":null,"elevationData":{"accumulatedElevationAscent":99.05405505251002,"accumulatedElevationDescent":108.39010530010975,"ascentSpeed":{"avg":-1,"lowerQuartile":446,"median":545,"upperQuartile":648},"ascentSpeedZones":null,"avgElevation":219,"elevationZones":null,"lowerQuartileElevation":215,"medianElevation":217,"upperQuartileElevation":220},"gradeData":{"avgGrade":0.0009490520104191727,"gradeProfile":"HILLY","gradeZones":null,"lowerQuartileGrade":-1.6,"medianGrade":0,"upFlatDownDistanceData":{"down":7.866099999999993,"flat":17.36850000000002,"up":7.7087999999999886},"upFlatDownInSeconds":{"down":1126,"flat":2554,"total":4862,"up":1182},"upFlatDownMoveData":{"down":25.149165186500866,"flat":24.481832419733777,"up":23.47857868020301},"upperQuartileGrade":1.5},"heartRateData":null,"moveRatio":1,"paceData":{"avgPace":152,"lowerQuartilePace":208.33333333333331,"medianPace":151.51515151515153,"paceZones":null,"upperQuartilePace":120.48192771084338,"variancePace":25.09687163766813},"powerData":{"avgWatts":127.8596161869003,"avgWattsPerKg":1.826565945527147,"hasPowerMeter":false,"lowerQuartileWatts":0,"medianWatts":77,"powerZones":null,"punchFactor":null,"upperQuartileWatts":213,"variabilityIndex":1.4244642329867025,"weightedPower":182.13145010164712,"weightedWattsPerKg":2.6018778585949587},"speedData":{"avgPace":152,"genuineAvgSpeed":23.658412176059294,"lowerQuartileSpeed":17.28,"medianSpeed":23.759999999999998,"speedZones":null,"standardDeviationSpeed":11.976818155145843,"totalAvgSpeed":23.658412176059294,"upperQuartileSpeed":29.880000000000003,"varianceSpeed":143.44417312143105},"toughnessScore":null},"hasPowerMeter":false,"id":188736084,"moving_time_raw":4862,"name":"09/06/2013 Montbonnot Saint Martin, RA, France","private":false,"short_unit":"km","start_time":"2013-06-09T15:18:42+0000","trainer":false,"type":"Ride"},{"bike_id":824321,"calories":715.5186853099999,"commute":false,"display_type":"Sortie à vélo","distance_raw":32943.4,"elapsed_time_raw":4862,"elevation_gain_raw":99.0665,"elevation_unit":"m","extendedStats":{"cadenceData":null,"elevationData":{"accumulatedElevationAscent":99.05405505251002,"accumulatedElevationDescent":108.39010530010975,"ascentSpeed":{"avg":-1,"lowerQuartile":446,"median":545,"upperQuartile":648},"ascentSpeedZones":null,"avgElevation":219,"elevationZones":null,"lowerQuartileElevation":215,"medianElevation":217,"upperQuartileElevation":220},"gradeData":{"avgGrade":0.0009490520104191727,"gradeProfile":"HILLY","gradeZones":null,"lowerQuartileGrade":-1.6,"medianGrade":0,"upFlatDownDistanceData":{"down":7.866099999999993,"flat":17.36850000000002,"up":7.7087999999999886},"upFlatDownInSeconds":{"down":1126,"flat":2554,"total":4862,"up":1182},"upFlatDownMoveData":{"down":25.149165186500866,"flat":24.481832419733777,"up":23.47857868020301},"upperQuartileGrade":1.5},"heartRateData":null,"moveRatio":1,"paceData":{"avgPace":152,"lowerQuartilePace":208.33333333333331,"medianPace":151.51515151515153,"paceZones":null,"upperQuartilePace":120.48192771084338,"variancePace":25.09687163766813},"powerData":{"avgWatts":127.8596161869003,"avgWattsPerKg":1.826565945527147,"hasPowerMeter":false,"lowerQuartileWatts":0,"medianWatts":77,"powerZones":null,"punchFactor":null,"upperQuartileWatts":213,"variabilityIndex":1.4244642329867025,"weightedPower":182.13145010164712,"weightedWattsPerKg":2.6018778585949587},"speedData":{"avgPace":152,"genuineAvgSpeed":23.658412176059294,"lowerQuartileSpeed":17.28,"medianSpeed":23.759999999999998,"speedZones":null,"standardDeviationSpeed":11.976818155145843,"totalAvgSpeed":23.658412176059294,"upperQuartileSpeed":29.880000000000003,"varianceSpeed":143.44417312143105},"toughnessScore":null},"hasPowerMeter":false,"id":188736197,"moving_time_raw":4862,"name":"16/06/2013 Montbonnot Saint Martin, RA, France","private":false,"short_unit":"km","start_time":"2013-06-16T15:18:42+0000","trainer":false,"type":"Ride"},{"bike_id":824321,"calories":715.5186853099999,"commute":false,"display_type":"Sortie à vélo","distance_raw":32943.4,"elapsed_time_raw":4862,"elevation_gain_raw":99.0665,"elevation_unit":"m","extendedStats":{"cadenceData":null,"elevationData":{"accumulatedElevationAscent":99.05405505251002,"accumulatedElevationDescent":108.39010530010975,"ascentSpeed":{"avg":-1,"lowerQuartile":446,"median":545,"upperQuartile":648},"ascentSpeedZones":null,"avgElevation":219,"elevationZones":null,"lowerQuartileElevation":215,"medianElevation":217,"upperQuartileElevation":220},"gradeData":{"avgGrade":0.0009490520104191727,"gradeProfile":"HILLY","gradeZones":null,"lowerQuartileGrade":-1.6,"medianGrade":0,"upFlatDownDistanceData":{"down":7.866099999999993,"flat":17.36850000000002,"up":7.7087999999999886},"upFlatDownInSeconds":{"down":1126,"flat":2554,"total":4862,"up":1182},"upFlatDownMoveData":{"down":25.149165186500866,"flat":24.481832419733777,"up":23.47857868020301},"upperQuartileGrade":1.5},"heartRateData":null,"moveRatio":1,"paceData":{"avgPace":152,"lowerQuartilePace":208.33333333333331,"medianPace":151.51515151515153,"paceZones":null,"upperQuartilePace":120.48192771084338,"variancePace":25.09687163766813},"powerData":{"avgWatts":127.8596161869003,"avgWattsPerKg":1.826565945527147,"hasPowerMeter":false,"lowerQuartileWatts":0,"medianWatts":77,"powerZones":null,"punchFactor":null,"upperQuartileWatts":213,"variabilityIndex":1.4244642329867025,"weightedPower":182.13145010164712,"weightedWattsPerKg":2.6018778585949587},"speedData":{"avgPace":152,"genuineAvgSpeed":23.658412176059294,"lowerQuartileSpeed":17.28,"medianSpeed":23.759999999999998,"speedZones":null,"standardDeviationSpeed":11.976818155145843,"totalAvgSpeed":23.658412176059294,"upperQuartileSpeed":29.880000000000003,"varianceSpeed":143.44417312143105},"toughnessScore":null},"hasPowerMeter":false,"id":188736222,"moving_time_raw":4862,"name":"23/06/2013 Montbonnot Saint Martin, RA, France","private":false,"short_unit":"km","start_time":"2013-06-23T15:18:42+0000","trainer":false,"type":"Ride"},{"bike_id":null,"calories":649.54811586,"commute":false,"display_type":"Sortie à vélo","distance_raw":31811.3,"elapsed_time_raw":5285,"elevation_gain_raw":108.197,"elevation_unit":"m","extendedStats":{"cadenceData":null,"elevationData":{"accumulatedElevationAscent":107.88042375962272,"accumulatedElevationDescent":110.498944868281,"ascentSpeed":{"avg":488.23641526008026,"lowerQuartile":391,"median":497,"upperQuartile":636},"ascentSpeedZones":null,"avgElevation":221,"elevationZones":null,"lowerQuartileElevation":215,"medianElevation":217,"upperQuartileElevation":224},"gradeData":{"avgGrade":0.00033038574343198404,"gradeProfile":"HILLY","gradeZones":null,"lowerQuartileGrade":-1.7,"medianGrade":0,"upFlatDownDistanceData":{"down":8.299400000000011,"flat":15.447600000000001,"up":8.064299999999985},"upFlatDownInSeconds":{"down":1390,"flat":2509,"total":5285,"up":1386},"upFlatDownMoveData":{"down":21.494848920863337,"flat":22.164750896771626,"up":20.946233766233732},"upperQuartileGrade":1.7},"heartRateData":null,"moveRatio":1,"paceData":{"avgPace":165,"lowerQuartilePace":222.22222222222223,"medianPace":158.73015873015873,"paceZones":null,"upperQuartilePace":126.58227848101265,"variancePace":23.660548358662908},"powerData":{"avgWatts":118.57038242473556,"avgWattsPerKg":1.6938626060676507,"hasPowerMeter":false,"lowerQuartileWatts":0,"medianWatts":71,"powerZones":null,"punchFactor":null,"upperQuartileWatts":188,"variabilityIndex":1.4761668138064974,"weightedPower":175.0296636357398,"weightedWattsPerKg":2.5004237662248543},"speedData":{"avgPace":165,"genuineAvgSpeed":21.76256196783347,"lowerQuartileSpeed":16.2,"medianSpeed":22.68,"speedZones":null,"standardDeviationSpeed":12.334991301280413,"totalAvgSpeed":21.76256196783347,"upperQuartileSpeed":28.44,"varianceSpeed":152.15201040266345},"toughnessScore":null},"hasPowerMeter":false,"id":68396942,"moving_time_raw":5054,"name":"Ballade reprise du pied","private":false,"short_unit":"km","start_time":"2013-07-20T08:32:01+0000","trainer":false,"type":"Ride"},{"bike_id":null,"calories":1744.69149787,"commute":false,"display_type":"Sortie à vélo","distance_raw":80372.9,"elapsed_time_raw":11976,"elevation_gain_raw":192.478,"elevation_unit":"m","extendedStats":{"cadenceData":null,"elevationData":{"accumulatedElevationAscent":192.16385125541623,"accumulatedElevationDescent":198.5311004839428,"ascentSpeed":{"avg":480.90152513374983,"lowerQuartile":342,"median":424,"upperQuartile":582},"ascentSpeedZones":null,"avgElevation":204,"elevationZones":null,"lowerQuartileElevation":189,"medianElevation":200,"upperQuartileElevation":215},"gradeData":{"avgGrade":0.0010011537413196273,"gradeProfile":"HILLY","gradeZones":null,"lowerQuartileGrade":-1.5,"medianGrade":0,"upFlatDownDistanceData":{"down":18.65019999999999,"flat":43.00159999999995,"up":18.695500000000056},"upFlatDownInSeconds":{"down":2742,"flat":5963,"total":11559,"up":2854},"upFlatDownMoveData":{"down":24.48603938730852,"flat":25.961053161160457,"up":23.582270497547373},"upperQuartileGrade":1.5},"heartRateData":null,"moveRatio":0.9651803607214429,"paceData":{"avgPace":143,"lowerQuartilePace":175.43859649122808,"medianPace":129.87012987012986,"paceZones":null,"upperQuartilePace":113.63636363636361,"variancePace":25.987868456275358},"powerData":{"avgWatts":144.76856905004163,"avgWattsPerKg":2.0681224150005946,"hasPowerMeter":false,"lowerQuartileWatts":0,"medianWatts":105,"powerZones":null,"punchFactor":null,"upperQuartileWatts":225,"variabilityIndex":1.3268068016358576,"weightedPower":192.07992207868554,"weightedWattsPerKg":2.743998886838365},"speedData":{"avgPace":143,"genuineAvgSpeed":25.196683104074765,"lowerQuartileSpeed":20.52,"medianSpeed":27.720000000000002,"speedZones":null,"standardDeviationSpeed":11.76971429027558,"totalAvgSpeed":24.319343687374765,"upperQuartileSpeed":31.680000000000003,"varianceSpeed":138.5261744747172},"toughnessScore":null},"hasPowerMeter":false,"id":68470482,"moving_time_raw":10898,"name":"Afternoon Ride vers valence","private":false,"short_unit":"km","start_time":"2013-07-20T12:28:51+0000","trainer":false,"type":"Ride"},{"bike_id":null,"calories":1022.897129835,"commute":false,"display_type":"Sortie à vélo","distance_raw":45430.9,"elapsed_time_raw":7571,"elevation_gain_raw":461.149,"elevation_unit":"m","extendedStats":{"cadenceData":null,"elevationData":{"accumulatedElevationAscent":461.0605890908904,"accumulatedElevationDescent":465.10807538875844,"ascentSpeed":{"avg":660.2604845198881,"lowerQuartile":437,"median":574,"upperQuartile":840},"ascentSpeedZones":null,"avgElevation":248,"elevationZones":null,"lowerQuartileElevation":227,"medianElevation":238,"upperQuartileElevation":255},"gradeData":{"avgGrade":-0.005122447362161965,"gradeProfile":"HILLY","gradeZones":null,"lowerQuartileGrade":-2.1,"medianGrade":0,"upFlatDownDistanceData":{"down":13.887099999999998,"flat":18.084099999999964,"up":13.452400000000042},"upFlatDownInSeconds":{"down":2203,"flat":2798,"total":7570,"up":2569},"upFlatDownMoveData":{"down":22.693399909214705,"flat":23.267605432451703,"up":18.851163876995},"upperQuartileGrade":2.1},"heartRateData":null,"moveRatio":0.9998679170519086,"paceData":{"avgPace":166,"lowerQuartilePace":250.00000000000003,"medianPace":161.29032258064515,"paceZones":null,"upperQuartilePace":120.48192771084338,"variancePace":18.49371078156533},"powerData":{"avgWatts":134.13964427458475,"avgWattsPerKg":1.916280632494068,"hasPowerMeter":false,"lowerQuartileWatts":0,"medianWatts":102,"powerZones":null,"punchFactor":null,"upperQuartileWatts":213,"variabilityIndex":1.6516946187602257,"weightedPower":221.55772861074257,"weightedWattsPerKg":3.165110408724894},"speedData":{"avgPace":166,"genuineAvgSpeed":21.647484808454443,"lowerQuartileSpeed":14.4,"medianSpeed":22.32,"speedZones":null,"standardDeviationSpeed":13.952088411164691,"totalAvgSpeed":21.644625544842178,"upperQuartileSpeed":29.880000000000003,"varianceSpeed":194.66077103295606},"toughnessScore":null},"hasPowerMeter":false,"id":68731739,"moving_time_raw":6979,"name":"Tencin loop","private":false,"short_unit":"km","start_time":"2013-07-21T13:23:52+0000","trainer":false,"type":"Ride"},{"bike_id":824321,"calories":424.63968854999996,"commute":false,"display_type":"Sortie à vélo","distance_raw":21445.9,"elapsed_time_raw":5224,"elevation_gain_raw":69.2377,"elevation_unit":"m","extendedStats":{"cadenceData":null,"elevationData":{"accumulatedElevationAscent":68.9909977030133,"accumulatedElevationDescent":77.95950505540131,"ascentSpeed":{"avg":405.33532589581375,"lowerQuartile":370,"median":406,"upperQuartile":492},"ascentSpeedZones":null,"avgElevation":223,"elevationZones":null,"lowerQuartileElevation":215,"medianElevation":220,"upperQuartileElevation":228},"gradeData":{"avgGrade":-0.00340294685290523,"gradeProfile":"HILLY","gradeZones":null,"lowerQuartileGrade":-1.6,"medianGrade":0,"upFlatDownDistanceData":{"down":5.308699999999997,"flat":11.053200000000016,"up":5.037199999999988},"upFlatDownInSeconds":{"down":986,"flat":2281,"total":4162,"up":895},"upFlatDownMoveData":{"down":19.38267748478701,"flat":17.444769837790467,"up":20.261363128491574},"upperQuartileGrade":1.5},"heartRateData":null,"moveRatio":0.7967075038284839,"paceData":{"avgPace":192,"lowerQuartilePace":333.3333333333333,"medianPace":178.57142857142856,"paceZones":null,"upperQuartilePace":138.88888888888889,"variancePace":17.77471667786596},"powerData":{"avgWatts":107.17521489971347,"avgWattsPerKg":1.5310744985673352,"hasPowerMeter":false,"lowerQuartileWatts":0,"medianWatts":55,"powerZones":null,"punchFactor":null,"upperQuartileWatts":170,"variabilityIndex":1.4598574218674818,"weightedPower":156.460532911589,"weightedWattsPerKg":2.235150470165557},"speedData":{"avgPace":192,"genuineAvgSpeed":18.754641999038935,"lowerQuartileSpeed":10.8,"medianSpeed":20.16,"speedZones":null,"standardDeviationSpeed":14.23147476005215,"totalAvgSpeed":14.941964012251157,"upperQuartileSpeed":25.92,"varianceSpeed":202.5348738460014},"toughnessScore":null},"hasPowerMeter":false,"id":69245269,"moving_time_raw":3729,"name":"Evening Ride trankillou","private":false,"short_unit":"km","start_time":"2013-07-23T16:08:52+0000","trainer":false,"type":"Ride"},{"bike_id":null,"calories":365.95350329999997,"commute":false,"display_type":"Sortie à vélo","distance_raw":16771.5,"elapsed_time_raw":2701,"elevation_gain_raw":58.6407,"elevation_unit":"m","extendedStats":{"cadenceData":null,"elevationData":{"accumulatedElevationAscent":58.99264462254567,"accumulatedElevationDescent":68.46803019513317,"ascentSpeed":{"avg":522.9198555404105,"lowerQuartile":429,"median":507,"upperQuartile":584},"ascentSpeedZones":null,"avgElevation":224,"elevationZones":null,"lowerQuartileElevation":220,"medianElevation":222,"upperQuartileElevation":226},"gradeData":{"avgGrade":-0.004054497212534476,"gradeProfile":"HILLY","gradeZones":null,"lowerQuartileGrade":-1.7,"medianGrade":0,"upFlatDownDistanceData":{"down":4.213000000000004,"flat":8.417699999999996,"up":4.1408},"upFlatDownInSeconds":{"down":732,"flat":1298,"total":2701,"up":671},"upFlatDownMoveData":{"down":20.719672131147558,"flat":23.34647149460708,"up":22.215916542473916},"upperQuartileGrade":1.6},"heartRateData":null,"moveRatio":1,"paceData":{"avgPace":161,"lowerQuartilePace":232.5581395348837,"medianPace":163.9344262295082,"paceZones":null,"upperQuartilePace":121.95121951219514,"variancePace":22.027087398256878},"powerData":{"avgWatts":127.07610379550736,"avgWattsPerKg":1.8153729113643908,"hasPowerMeter":false,"lowerQuartileWatts":0,"medianWatts":73,"powerZones":null,"punchFactor":null,"upperQuartileWatts":181,"variabilityIndex":1.8482531638166118,"weightedPower":234.86881088553463,"weightedWattsPerKg":3.355268726936209},"speedData":{"avgPace":161,"genuineAvgSpeed":22.370048130322015,"lowerQuartileSpeed":15.48,"medianSpeed":21.96,"speedZones":null,"standardDeviationSpeed":12.784175174111787,"totalAvgSpeed":22.370048130322015,"upperQuartileSpeed":29.52,"varianceSpeed":163.43513488237613},"toughnessScore":null},"hasPowerMeter":false,"id":69489963,"moving_time_raw":2660,"name":"Evening Ride","private":false,"short_unit":"km","start_time":"2013-07-24T16:29:49+0000","trainer":false,"type":"Ride"},{"bike_id":null,"calories":609.30484456,"commute":false,"display_type":"Sortie à vélo","distance_raw":28025.3,"elapsed_time_raw":5579,"elevation_gain_raw":123.112,"elevation_unit":"m","extendedStats":{"cadenceData":null,"elevationData":{"accumulatedElevationAscent":123.13211758579831,"accumulatedElevationDescent":130.10320839652474,"ascentSpeed":{"avg":535.7812286648121,"lowerQuartile":445,"median":536,"upperQuartile":630},"ascentSpeedZones":null,"avgElevation":221,"elevationZones":null,"lowerQuartileElevation":216,"medianElevation":219,"upperQuartileElevation":223},"gradeData":{"avgGrade":0.00008479508152890796,"gradeProfile":"HILLY","gradeZones":null,"lowerQuartileGrade":-1.8,"medianGrade":0,"upFlatDownDistanceData":{"down":7.324300000000007,"flat":13.303899999999965,"up":7.380500000000029},"upFlatDownInSeconds":{"down":1169,"flat":2357,"total":4808,"up":1282},"upFlatDownMoveData":{"down":22.555585970915335,"flat":20.319915146372452,"up":20.725273010920517},"upperQuartileGrade":1.8},"heartRateData":null,"moveRatio":0.8618031905359383,"paceData":{"avgPace":170,"lowerQuartilePace":277.77777777777777,"medianPace":158.73015873015873,"paceZones":null,"upperQuartilePace":121.95121951219514,"variancePace":15.446130061683904},"powerData":{"avgWatts":129.72154325425353,"avgWattsPerKg":1.8531649036321933,"hasPowerMeter":false,"lowerQuartileWatts":0,"medianWatts":80,"powerZones":null,"punchFactor":null,"upperQuartileWatts":204,"variabilityIndex":1.5262162185704045,"weightedPower":197.98312321262398,"weightedWattsPerKg":2.828330331608914},"speedData":{"avgPace":170,"genuineAvgSpeed":21.214916805324453,"lowerQuartileSpeed":12.96,"medianSpeed":22.68,"speedZones":null,"standardDeviationSpeed":15.26656765514711,"totalAvgSpeed":18.28308298978311,"upperQuartileSpeed":29.52,"varianceSpeed":233.06808796918392},"toughnessScore":null},"hasPowerMeter":false,"id":70230737,"moving_time_raw":4336,"name":"Loop to poisat","private":false,"short_unit":"km","start_time":"2013-07-27T16:57:28+0000","trainer":false,"type":"Ride"},{"bike_id":null,"calories":395.31417389999996,"commute":false,"display_type":"Sortie à vélo","distance_raw":20755.5,"elapsed_time_raw":4474,"elevation_gain_raw":96.7999,"elevation_unit":"m","extendedStats":{"cadenceData":null,"elevationData":{"accumulatedElevationAscent":97.08249705337519,"accumulatedElevationDescent":103.8622103115907,"ascentSpeed":{"avg":388.4048065036784,"lowerQuartile":295,"median":359,"upperQuartile":428},"ascentSpeedZones":null,"avgElevation":226,"elevationZones":null,"lowerQuartileElevation":220,"medianElevation":223,"upperQuartileElevation":230},"gradeData":{"avgGrade":-0.0005689278955700569,"gradeProfile":"HILLY","gradeZones":null,"lowerQuartileGrade":-1.8,"medianGrade":0,"upFlatDownDistanceData":{"down":5.360299999999993,"flat":9.675600000000003,"up":5.678500000000005},"upFlatDownInSeconds":{"down":1037,"flat":1935,"total":4305,"up":1333},"upFlatDownMoveData":{"down":18.608563162970086,"flat":18.001116279069773,"up":15.33578394598651},"upperQuartileGrade":1.9},"heartRateData":null,"moveRatio":0.9622261957979437,"paceData":{"avgPace":204,"lowerQuartilePace":312.49999999999994,"medianPace":222.22222222222223,"paceZones":null,"upperQuartilePace":161.29032258064515,"variancePace":29.291097373602657},"powerData":{"avgWatts":88.67894869215291,"avgWattsPerKg":1.266842124173613,"hasPowerMeter":false,"lowerQuartileWatts":0,"medianWatts":39,"powerZones":null,"punchFactor":null,"upperQuartileWatts":129,"variabilityIndex":1.8356842981445696,"weightedPower":162.78655369015303,"weightedWattsPerKg":2.3255221955736145},"speedData":{"avgPace":204,"genuineAvgSpeed":17.665254355400677,"lowerQuartileSpeed":11.520000000000001,"medianSpeed":16.2,"speedZones":null,"standardDeviationSpeed":11.08621837695149,"totalAvgSpeed":16.99797049620025,"upperQuartileSpeed":22.32,"varianceSpeed":122.9042379014569},"toughnessScore":null},"hasPowerMeter":false,"id":71207795,"moving_time_raw":4050,"name":"Slow Relax Evening Ride","private":true,"short_unit":"km","start_time":"2013-07-31T17:09:49+0000","trainer":false,"type":"Ride"},{"bike_id":824309,"calories":393.19680116500007,"commute":false,"display_type":"Sortie à vélo","distance_raw":20286.1,"elapsed_time_raw":4231,"elevation_gain_raw":96.7999,"elevation_unit":"m","extendedStats":{"cadenceData":null,"elevationData":{"accumulatedElevationAscent":96.9355844662839,"accumulatedElevationDescent":103.8030626061954,"ascentSpeed":{"avg":388.4238831834337,"lowerQuartile":295,"median":361,"upperQuartile":431},"ascentSpeedZones":null,"avgElevation":226,"elevationZones":null,"lowerQuartileElevation":220,"medianElevation":223,"upperQuartileElevation":229},"gradeData":{"avgGrade":0.0005665792224690161,"gradeProfile":"HILLY","gradeZones":null,"lowerQuartileGrade":-1.8,"medianGrade":0,"upFlatDownDistanceData":{"down":5.3393999999999995,"flat":9.285999999999996,"up":5.654200000000005},"upFlatDownInSeconds":{"down":992,"flat":1884,"total":4065,"up":1189},"upFlatDownMoveData":{"down":19.376854838709676,"flat":17.743949044585978,"up":17.11952901597983},"upperQuartileGrade":1.9},"heartRateData":null,"moveRatio":0.9607657764121957,"paceData":{"avgPace":200,"lowerQuartilePace":294.11764705882354,"medianPace":217.3913043478261,"paceZones":null,"upperQuartilePace":161.29032258064515,"variancePace":34.304555466461984},"powerData":{"avgWatts":89.67679206914083,"avgWattsPerKg":1.2810970295591548,"hasPowerMeter":false,"lowerQuartileWatts":0,"medianWatts":39,"powerZones":null,"punchFactor":null,"upperQuartileWatts":131,"variabilityIndex":2.006626994824373,"weightedPower":179.94787177519024,"weightedWattsPerKg":2.570683882502718},"speedData":{"avgPace":200,"genuineAvgSpeed":18.013948339483385,"lowerQuartileSpeed":12.24,"medianSpeed":16.56,"speedZones":null,"standardDeviationSpeed":10.244136399682263,"totalAvgSpeed":17.30718506263294,"upperQuartileSpeed":22.32,"varianceSpeed":104.9423305752951},"toughnessScore":null},"hasPowerMeter":false,"id":157272833,"moving_time_raw":3983,"name":"Loop Grésivaudan V3","private":false,"short_unit":"km","start_time":"2013-07-31T17:13:52+0000","trainer":false,"type":"Ride"},{"bike_id":null,"calories":305.6815774265,"commute":false,"display_type":"Sortie à vélo","distance_raw":18772.1,"elapsed_time_raw":4530,"elevation_gain_raw":96.307,"elevation_unit":"m","extendedStats":{"cadenceData":null,"elevationData":{"accumulatedElevationAscent":95.97266306414699,"accumulatedElevationDescent":99.20387061183627,"ascentSpeed":{"avg":348.93262618204415,"lowerQuartile":258,"median":319,"upperQuartile":542},"ascentSpeedZones":null,"avgElevation":227,"elevationZones":null,"lowerQuartileElevation":218,"medianElevation":225,"upperQuartileElevation":233},"gradeData":{"avgGrade":0.004138777688818153,"gradeProfile":"HILLY","gradeZones":null,"lowerQuartileGrade":-1.8,"medianGrade":0,"upFlatDownDistanceData":{"down":4.9491000000000085,"flat":8.908399999999999,"up":4.877499999999991},"upFlatDownInSeconds":{"down":1213,"flat":2060,"total":4526,"up":1253},"upFlatDownMoveData":{"down":14.688178070898626,"flat":15.56807766990291,"up":14.013567438148419},"upperQuartileGrade":1.7},"heartRateData":null,"moveRatio":0.9991169977924945,"paceData":{"avgPace":240,"lowerQuartilePace":357.1428571428571,"medianPace":232.5581395348837,"paceZones":null,"upperQuartilePace":169.4915254237288,"variancePace":26.844471091022324},"powerData":{"avgWatts":70.41125032628557,"avgWattsPerKg":1.0058750046612224,"hasPowerMeter":false,"lowerQuartileWatts":0,"medianWatts":35,"powerZones":null,"punchFactor":null,"upperQuartileWatts":107,"variabilityIndex":1.602868153992813,"weightedPower":112.85995083081919,"weightedWattsPerKg":1.6122850118688454},"speedData":{"avgPace":240,"genuineAvgSpeed":15.013336279275288,"lowerQuartileSpeed":10.08,"medianSpeed":15.48,"speedZones":null,"standardDeviationSpeed":11.580407037213693,"totalAvgSpeed":15.000079470198665,"upperQuartileSpeed":21.240000000000002,"varianceSpeed":134.1058271475484},"toughnessScore":null},"hasPowerMeter":false,"id":71451249,"moving_time_raw":4037,"name":"Relax Evening Ride","private":false,"short_unit":"km","start_time":"2013-08-01T17:34:11+0000","trainer":false,"type":"Ride"},{"bike_id":null,"calories":1222.24798318,"commute":false,"display_type":"Sortie à vélo","distance_raw":56060,"elapsed_time_raw":8106,"elevation_gain_raw":319.952,"elevation_unit":"m","extendedStats":{"cadenceData":null,"elevationData":{"accumulatedElevationAscent":320.3720952015931,"accumulatedElevationDescent":326.16963333605486,"ascentSpeed":{"avg":544.7860162222527,"lowerQuartile":417,"median":496,"upperQuartile":638},"ascentSpeedZones":null,"avgElevation":234,"elevationZones":null,"lowerQuartileElevation":225,"medianElevation":234,"upperQuartileElevation":240},"gradeData":{"avgGrade":0.001608652753319245,"gradeProfile":"HILLY","gradeZones":null,"lowerQuartileGrade":-1.6,"medianGrade":0,"upFlatDownDistanceData":{"down":13.517500000000016,"flat":28.705499999999997,"up":13.823899999999991},"upFlatDownInSeconds":{"down":1761,"flat":3836,"total":7798,"up":2201},"upFlatDownMoveData":{"down":27.633730834753017,"flat":26.939468196037538,"up":22.610649704679677},"upperQuartileGrade":1.6},"heartRateData":null,"moveRatio":0.9620034542314335,"paceData":{"avgPace":139,"lowerQuartilePace":185.18518518518516,"medianPace":135.13513513513513,"paceZones":null,"upperQuartilePace":109.8901098901099,"variancePace":26.250098377994565},"powerData":{"avgWatts":145.44123146787766,"avgWattsPerKg":2.077731878112538,"hasPowerMeter":false,"lowerQuartileWatts":21,"medianWatts":116,"powerZones":null,"punchFactor":null,"upperQuartileWatts":215,"variabilityIndex":1.5257209702217678,"weightedPower":221.902736785419,"weightedWattsPerKg":3.170039096934557},"speedData":{"avgPace":139,"genuineAvgSpeed":25.897332649397317,"lowerQuartileSpeed":19.44,"medianSpeed":26.64,"speedZones":null,"standardDeviationSpeed":11.710778930965892,"totalAvgSpeed":24.9133234641007,"upperQuartileSpeed":32.76,"varianceSpeed":137.14234316995464},"toughnessScore":null},"hasPowerMeter":false,"id":72137146,"moving_time_raw":7676,"name":"Afternoon Ride","private":false,"short_unit":"km","start_time":"2013-08-04T13:13:42+0000","trainer":false,"type":"Ride"},{"bike_id":null,"calories":433.98951659,"commute":false,"display_type":"Sortie à vélo","distance_raw":19324.8,"elapsed_time_raw":2758,"elevation_gain_raw":64.5612,"elevation_unit":"m","extendedStats":{"cadenceData":null,"elevationData":{"accumulatedElevationAscent":65.03343220844982,"accumulatedElevationDescent":66.69160128163927,"ascentSpeed":{"avg":433.4359626605081,"lowerQuartile":373,"median":452,"upperQuartile":501},"ascentSpeedZones":null,"avgElevation":220,"elevationZones":null,"lowerQuartileElevation":215,"medianElevation":218,"upperQuartileElevation":222},"gradeData":{"avgGrade":0.05320100939964509,"gradeProfile":"HILLY","gradeZones":null,"lowerQuartileGrade":-1.5,"medianGrade":0,"upFlatDownDistanceData":{"down":4.370599999999993,"flat":10.128500000000003,"up":4.799500000000004},"upFlatDownInSeconds":{"down":597,"flat":1400,"total":2755,"up":758},"upFlatDownMoveData":{"down":26.35537688442207,"flat":26.04471428571429,"up":22.79445910290239},"upperQuartileGrade":1.6},"heartRateData":null,"moveRatio":0.9989122552574329,"paceData":{"avgPace":143,"lowerQuartilePace":208.33333333333331,"medianPace":142.85714285714286,"paceZones":null,"upperQuartilePace":108.69565217391305,"variancePace":31.47199226870224},"powerData":{"avgWatts":142.1884110787172,"avgWattsPerKg":2.0312630154102456,"hasPowerMeter":false,"lowerQuartileWatts":0,"medianWatts":93,"powerZones":null,"punchFactor":null,"upperQuartileWatts":213,"variabilityIndex":1.419959042203283,"weightedPower":201.90172000774194,"weightedWattsPerKg":2.884310285824885},"speedData":{"avgPace":143,"genuineAvgSpeed":25.211172413793008,"lowerQuartileSpeed":17.28,"medianSpeed":25.2,"speedZones":null,"standardDeviationSpeed":10.695205471025943,"totalAvgSpeed":25.183749093545952,"upperQuartileSpeed":33.12,"varianceSpeed":114.38742006746327},"toughnessScore":null},"hasPowerMeter":false,"id":72196974,"moving_time_raw":2758,"name":"Evening Ride","private":false,"short_unit":"km","start_time":"2013-08-04T17:56:48+0000","trainer":false,"type":"Ride"},{"bike_id":null,"calories":553.0445793050001,"commute":false,"display_type":"Sortie à vélo","distance_raw":27588.9,"elapsed_time_raw":4541,"elevation_gain_raw":99.13,"elevation_unit":"m","extendedStats":{"cadenceData":null,"elevationData":{"accumulatedElevationAscent":99.11226894426142,"accumulatedElevationDescent":104.82037546041533,"ascentSpeed":{"avg":435.32533825481534,"lowerQuartile":314,"median":442,"upperQuartile":578},"ascentSpeedZones":null,"avgElevation":220,"elevationZones":null,"lowerQuartileElevation":215,"medianElevation":216,"upperQuartileElevation":224},"gradeData":{"avgGrade":-0.0008646593376301598,"gradeProfile":"HILLY","gradeZones":null,"lowerQuartileGrade":-1.6,"medianGrade":0,"upFlatDownDistanceData":{"down":6.729599999999995,"flat":13.756399999999992,"up":7.102900000000013},"upFlatDownInSeconds":{"down":1068,"flat":2239,"total":4541,"up":1234},"upFlatDownMoveData":{"down":22.684044943820208,"flat":22.118374274229556,"up":20.72158833063213},"upperQuartileGrade":1.7},"heartRateData":null,"moveRatio":1,"paceData":{"avgPace":164,"lowerQuartilePace":227.27272727272722,"medianPace":161.29032258064515,"paceZones":null,"upperQuartilePace":125.00000000000001,"variancePace":21.541160162081216},"powerData":{"avgWatts":118.34995217599234,"avgWattsPerKg":1.6907136025141762,"hasPowerMeter":false,"lowerQuartileWatts":0,"medianWatts":79,"powerZones":null,"punchFactor":null,"upperQuartileWatts":179,"variabilityIndex":1.6230097509824974,"weightedPower":192.08312640994782,"weightedWattsPerKg":2.7440446629992548},"speedData":{"avgPace":164,"genuineAvgSpeed":21.898123761285976,"lowerQuartileSpeed":15.840000000000002,"medianSpeed":22.32,"speedZones":null,"standardDeviationSpeed":12.927564267733306,"totalAvgSpeed":21.898123761285976,"upperQuartileSpeed":28.8,"varianceSpeed":167.12191789637495},"toughnessScore":null},"hasPowerMeter":false,"id":73856509,"moving_time_raw":4339,"name":"Afternoon Ride","private":false,"short_unit":"km","start_time":"2013-08-11T13:12:29+0000","trainer":false,"type":"Ride"},{"bike_id":null,"calories":381.68011,"commute":false,"display_type":"Sortie à vélo","distance_raw":16427.7,"elapsed_time_raw":2450,"elevation_gain_raw":58.8725,"elevation_unit":"m","extendedStats":{"cadenceData":null,"elevationData":{"accumulatedElevationAscent":59.04454255438276,"accumulatedElevationDescent":65.4177587195503,"ascentSpeed":{"avg":588.1800635194778,"lowerQuartile":467,"median":568,"upperQuartile":661},"ascentSpeedZones":null,"avgElevation":223,"elevationZones":null,"lowerQuartileElevation":220,"medianElevation":221,"upperQuartileElevation":224},"gradeData":{"avgGrade":-0.0012327356064017782,"gradeProfile":"HILLY","gradeZones":null,"lowerQuartileGrade":-1.7,"medianGrade":0,"upFlatDownDistanceData":{"down":4.228100000000003,"flat":8.065100000000001,"up":4.113399999999996},"upFlatDownInSeconds":{"down":605,"flat":1201,"total":2447,"up":641},"upFlatDownMoveData":{"down":25.15894214876035,"flat":24.175154038301418,"up":23.101778471138825},"upperQuartileGrade":1.7},"heartRateData":null,"moveRatio":0.9987755102040816,"paceData":{"avgPace":149,"lowerQuartilePace":238.09523809523807,"medianPace":163.9344262295082,"paceZones":null,"upperQuartilePace":106.38297872340425,"variancePace":20.13180085543503},"powerData":{"avgWatts":140.8721696171264,"avgWattsPerKg":2.0124595659589484,"hasPowerMeter":false,"lowerQuartileWatts":0,"medianWatts":78,"powerZones":null,"punchFactor":null,"upperQuartileWatts":204,"variabilityIndex":1.7011476586610814,"weightedPower":239.6443615146813,"weightedWattsPerKg":3.4234908787811613},"speedData":{"avgPace":149,"genuineAvgSpeed":24.13331426236219,"lowerQuartileSpeed":15.120000000000001,"medianSpeed":21.96,"speedZones":null,"standardDeviationSpeed":13.372417817373478,"totalAvgSpeed":24.103763265306238,"upperQuartileSpeed":33.84,"varianceSpeed":178.82155828240764},"toughnessScore":null},"hasPowerMeter":false,"id":73908303,"moving_time_raw":2450,"name":"Evening Ride","private":false,"short_unit":"km","start_time":"2013-08-11T16:26:32+0000","trainer":false,"type":"Ride"},{"bike_id":null,"calories":696.54473031,"commute":false,"display_type":"Sortie à vélo","distance_raw":32943.6,"elapsed_time_raw":4862,"elevation_gain_raw":98.9665,"elevation_unit":"m","extendedStats":{"cadenceData":null,"elevationData":{"accumulatedElevationAscent":99.05466138152931,"accumulatedElevationDescent":108.38963146088977,"ascentSpeed":{"avg":-1,"lowerQuartile":447,"median":539,"upperQuartile":649},"ascentSpeedZones":null,"avgElevation":219,"elevationZones":null,"lowerQuartileElevation":215,"medianElevation":217,"upperQuartileElevation":220},"gradeData":{"avgGrade":0.000970294685461623,"gradeProfile":"HILLY","gradeZones":null,"lowerQuartileGrade":-1.6,"medianGrade":0,"upFlatDownDistanceData":{"down":7.872399999999993,"flat":17.354299999999995,"up":7.7169000000000105},"upFlatDownInSeconds":{"down":1131,"flat":2550,"total":4862,"up":1181},"upFlatDownMoveData":{"down":25.058037135278493,"flat":24.500188235294114,"up":23.523149872989023},"upperQuartileGrade":1.5},"heartRateData":null,"moveRatio":1,"paceData":{"avgPace":152,"lowerQuartilePace":208.33333333333331,"medianPace":151.51515151515153,"paceZones":null,"upperQuartilePace":120.48192771084338,"variancePace":25.024077237965354},"powerData":{"avgWatts":124.57822277847309,"avgWattsPerKg":1.77968889683533,"hasPowerMeter":false,"lowerQuartileWatts":0,"medianWatts":78,"powerZones":null,"punchFactor":null,"upperQuartileWatts":205,"variabilityIndex":1.4301314293498597,"weightedPower":178.16323180804298,"weightedWattsPerKg":2.5451890258291856},"speedData":{"avgPace":152,"genuineAvgSpeed":23.665150143973694,"lowerQuartileSpeed":17.28,"medianSpeed":23.759999999999998,"speedZones":null,"standardDeviationSpeed":11.994225633477635,"totalAvgSpeed":23.665150143973694,"upperQuartileSpeed":29.880000000000003,"varianceSpeed":143.86144854677195},"toughnessScore":null},"hasPowerMeter":false,"id":75152536,"moving_time_raw":4862,"name":"Evening ride","private":false,"short_unit":"km","start_time":"2013-08-16T15:18:42+0000","trainer":false,"type":"Ride"},{"bike_id":null,"calories":194.19944741999998,"commute":false,"display_type":"Sortie à vélo","distance_raw":11447,"elapsed_time_raw":2253,"elevation_gain_raw":0,"elevation_unit":"m","extendedStats":{"cadenceData":null,"elevationData":{"accumulatedElevationAscent":9.79315767927261,"accumulatedElevationDescent":44.47459461964718,"ascentSpeed":{"avg":-1,"lowerQuartile":0,"median":0,"upperQuartile":0},"ascentSpeedZones":null,"avgElevation":225,"elevationZones":null,"lowerQuartileElevation":215,"medianElevation":220,"upperQuartileElevation":229},"gradeData":{"avgGrade":-0.30627483936481165,"gradeProfile":"HILLY","gradeZones":null,"lowerQuartileGrade":-2.1,"medianGrade":-0.4,"upFlatDownDistanceData":{"down":3.722600000000005,"flat":5.205699999999995,"up":2.4951000000000003},"upFlatDownInSeconds":{"down":673,"flat":1097,"total":2250,"up":480},"upFlatDownMoveData":{"down":19.912867756315034,"flat":17.08342752962624,"up":18.713250000000006},"upperQuartileGrade":1.3},"heartRateData":null,"moveRatio":0.9986684420772304,"paceData":{"avgPace":190,"lowerQuartilePace":526.3157894736842,"medianPace":166.66666666666666,"paceZones":null,"upperQuartilePace":131.57894736842104,"variancePace":15.819613538684028},"powerData":{"avgWatts":94.51178082191781,"avgWattsPerKg":1.3501682974559688,"hasPowerMeter":false,"lowerQuartileWatts":0,"medianWatts":44,"powerZones":null,"punchFactor":null,"upperQuartileWatts":147,"variabilityIndex":1.5253300144939559,"weightedPower":144.16165601094548,"weightedWattsPerKg":2.0594522287277925},"speedData":{"avgPace":190,"genuineAvgSpeed":18.898400000000024,"lowerQuartileSpeed":6.84,"medianSpeed":21.6,"speedZones":null,"standardDeviationSpeed":15.085277912275298,"totalAvgSpeed":18.873235685752356,"upperQuartileSpeed":27.36,"varianceSpeed":227.56560969058097},"toughnessScore":null},"hasPowerMeter":false,"id":76177714,"moving_time_raw":1980,"name":"Evening Ride","private":true,"short_unit":"km","start_time":"2013-08-20T17:16:04+0000","trainer":false,"type":"Ride"},{"bike_id":824321,"calories":222.782535975,"commute":false,"display_type":"Sortie à vélo","distance_raw":11030.4,"elapsed_time_raw":3309,"elevation_gain_raw":72.1118,"elevation_unit":"m","extendedStats":{"cadenceData":null,"elevationData":{"accumulatedElevationAscent":71.96994733739794,"accumulatedElevationDescent":39.40760013444583,"ascentSpeed":{"avg":368.8430123289831,"lowerQuartile":255,"median":322,"upperQuartile"