{"models":[{"id":621674333,"name":"Afternoon Hike","emoji_name":"Afternoon Hike","type":"Hike","display_type":"Hike","activity_type_display_name":"Hike","private":false,"bike_id":null,"athlete_gear_id":1022094,"start_date":"Sun, 6/26/2016","start_date_local_raw":1466959982,"start_time":"2016-06-26T14:53:02+0000","start_day":"Sun","distance":"3.5","distance_raw":3587.6,"long_unit":"kilometers","short_unit":"km","moving_time":"1:03:58","moving_time_raw":3838,"elapsed_time":"1:30:01","elapsed_time_raw":5401,"trainer":false,"static_map":true,"show_elevation":true,"has_latlng":true,"commute":false,"elevation_gain":"338","elevation_unit":"m","elevation_gain_raw":338.267,"description":null,"activity_url":"https://www.strava.com/activities/621674333","activity_url_for_twitter":"https://www.strava.com/activities/621674333?utm_content=2470979\u0026utm_medium=referral\u0026utm_source=twitter","twitter_msg":"went for a 3.5 kilometer Hike.","is_new":false,"is_changing_type":false,"suffer_score":null,"calories":316.93608925920006,"feed_data":{"entries":[]},"workout_type":null,"flagged":false,"hide_power":false,"hide_heartrate":false},{"id":619567232,"name":"Perreree ","emoji_name":"Perreree ","type":"Ride","display_type":"Workout","activity_type_display_name":"Ride","private":false,"bike_id":2042105,"athlete_gear_id":null,"start_date":"Fri, 6/24/2016","start_date_local_raw":1466796908,"start_time":"2016-06-24T17:35:08+0000","start_day":"Fri","distance":"31.4","distance_raw":31444.9,"long_unit":"kilometers","short_unit":"km","moving_time":"1:21:52","moving_time_raw":4912,"elapsed_time":"1:25:23","elapsed_time_raw":5123,"trainer":false,"static_map":true,"show_elevation":true,"has_latlng":true,"commute":false,"elevation_gain":"493","elevation_unit":"m","elevation_gain_raw":493.0,"description":"https://www.relive.cc/view/619567232","activity_url":"https://www.strava.com/activities/619567232","activity_url_for_twitter":"https://www.strava.com/activities/619567232?utm_content=2470979\u0026utm_medium=referral\u0026utm_source=twitter","twitter_msg":"went for a 31.4 kilometer road ride.","is_new":false,"is_changing_type":false,"suffer_score":null,"calories":803.10777568,"feed_data":{"entries":[]},"workout_type":12,"flagged":false,"hide_power":false,"hide_heartrate":false},{"id":617435476,"name":"Perreree - Test garmin edge 1000","emoji_name":"Perreree - Test garmin edge 1000","type":"Ride","display_type":"Workout","activity_type_display_name":"Ride","private":false,"bike_id":2042105,"athlete_gear_id":null,"start_date":"Wed, 6/22/2016","start_date_local_raw":1466620699,"start_time":"2016-06-22T16:38:19+0000","start_day":"Wed","distance":"28.4","distance_raw":28486.9,"long_unit":"kilometers","short_unit":"km","moving_time":"1:14:17","moving_time_raw":4457,"elapsed_time":"1:15:40","elapsed_time_raw":4540,"trainer":false,"static_map":true,"show_elevation":true,"has_latlng":true,"commute":false,"elevation_gain":"482","elevation_unit":"m","elevation_gain_raw":482.0,"description":"","activity_url":"https://www.strava.com/activities/617435476","activity_url_for_twitter":"https://www.strava.com/activities/617435476?utm_content=2470979\u0026utm_medium=referral\u0026utm_source=twitter","twitter_msg":"went for a 28.4 kilometer road ride.","is_new":false,"is_changing_type":false,"suffer_score":null,"calories":743.857901065,"feed_data":{"entries":[]},"workout_type":12,"flagged":false,"hide_power":false,"hide_heartrate":false},{"id":606986080,"name":"Afternoon Ride","emoji_name":"Afternoon Ride","type":"Ride","display_type":"Ride","activity_type_display_name":"Ride","private":false,"bike_id":2042105,"athlete_gear_id":null,"start_date":"Sun, 6/12/2016","start_date_local_raw":1465743938,"start_time":"2016-06-12T13:05:38+0000","start_day":"Sun","distance":"11.3","distance_raw":11387.5,"long_unit":"kilometers","short_unit":"km","moving_time":"24:28","moving_time_raw":1468,"elapsed_time":"26:11","elapsed_time_raw":1571,"trainer":false,"static_map":true,"show_elevation":true,"has_latlng":true,"commute":false,"elevation_gain":"52","elevation_unit":"m","elevation_gain_raw":52.0,"description":null,"activity_url":"https://www.strava.com/activities/606986080","activity_url_for_twitter":"https://www.strava.com/activities/606986080?utm_content=2470979\u0026utm_medium=referral\u0026utm_source=twitter","twitter_msg":"went for a 11.3 kilometer road ride.","is_new":true,"is_changing_type":false,"suffer_score":null,"calories":254.82177442000003,"feed_data":{"entries":[]},"workout_type":null,"flagged":false,"hide_power":false,"hide_heartrate":false},{"id":604927518,"name":"Skateboard from work :)","emoji_name":"Skateboard from work :)","type":"InlineSkate","display_type":"Inline Skate","activity_type_display_name":"Inline Skate","private":true,"bike_id":null,"athlete_gear_id":null,"start_date":"Fri, 6/10/2016","start_date_local_raw":1465580835,"start_time":"2016-06-10T15:47:15+0000","start_day":"Fri","distance":"0.6","distance_raw":616.1,"long_unit":"kilometers","short_unit":"km","moving_time":"3:26","moving_time_raw":206,"elapsed_time":"5:48","elapsed_time_raw":348,"trainer":false,"static_map":true,"show_elevation":true,"has_latlng":true,"commute":false,"elevation_gain":"0","elevation_unit":"m","elevation_gain_raw":0.0,"description":null,"activity_url":"https://www.strava.com/activities/604927518","activity_url_for_twitter":"https://www.strava.com/activities/604927518?utm_content=2470979\u0026utm_medium=referral\u0026utm_source=twitter","twitter_msg":"went for a 0.6 kilometer Inline Skate.","is_new":false,"is_changing_type":false,"suffer_score":null,"calories":null,"feed_data":{"entries":[]},"workout_type":null,"flagged":false,"hide_power":false,"hide_heartrate":false},{"id":602887149,"name":"Les gouttes de justesse ","emoji_name":"Les gouttes de justesse ","type":"Ride","display_type":"Workout","activity_type_display_name":"Ride","private":false,"bike_id":2042105,"athlete_gear_id":null,"start_date":"Wed, 6/8/2016","start_date_local_raw":1465409982,"start_time":"2016-06-08T16:19:42+0000","start_day":"Wed","distance":"31.6","distance_raw":31609.3,"long_unit":"kilometers","short_unit":"km","moving_time":"1:19:10","moving_time_raw":4750,"elapsed_time":"1:22:23","elapsed_time_raw":4943,"trainer":false,"static_map":true,"show_elevation":true,"has_latlng":true,"commute":false,"elevation_gain":"550","elevation_unit":"m","elevation_gain_raw":550.0,"description":"","activity_url":"https://www.strava.com/activities/602887149","activity_url_for_twitter":"https://www.strava.com/activities/602887149?utm_content=2470979\u0026utm_medium=referral\u0026utm_source=twitter","twitter_msg":"went for a 31.6 kilometer road ride.","is_new":false,"is_changing_type":false,"suffer_score":null,"calories":910.5365962499999,"feed_data":{"entries":[]},"workout_type":12,"flagged":false,"hide_power":false,"hide_heartrate":false},{"id":600329531,"name":"Sheep Ride","emoji_name":"Sheep Ride","type":"Ride","display_type":"Workout","activity_type_display_name":"Ride","private":false,"bike_id":2042105,"athlete_gear_id":null,"start_date":"Mon, 6/6/2016","start_date_local_raw":1465214571,"start_time":"2016-06-06T10:02:51+0000","start_day":"Mon","distance":"31.2","distance_raw":31244.6,"long_unit":"kilometers","short_unit":"km","moving_time":"1:14:16","moving_time_raw":4456,"elapsed_time":"1:18:41","elapsed_time_raw":4721,"trainer":false,"static_map":true,"show_elevation":true,"has_latlng":true,"commute":false,"elevation_gain":"542","elevation_unit":"m","elevation_gain_raw":542.0,"description":"","activity_url":"https://www.strava.com/activities/600329531","activity_url_for_twitter":"https://www.strava.com/activities/600329531?utm_content=2470979\u0026utm_medium=referral\u0026utm_source=twitter","twitter_msg":"went for a 31.2 kilometer road ride.","is_new":false,"is_changing_type":false,"suffer_score":null,"calories":885.5051874399999,"feed_data":{"entries":[]},"workout_type":12,"flagged":false,"hide_power":false,"hide_heartrate":false},{"id":597999523,"name":"4 Seigneurs x Vik + Murianette x Philippe","emoji_name":"4 Seigneurs x Vik + Murianette x Philippe","type":"Ride","display_type":"Ride","activity_type_display_name":"Ride","private":false,"bike_id":2042105,"athlete_gear_id":null,"start_date":"Sat, 6/4/2016","start_date_local_raw":1465033319,"start_time":"2016-06-04T07:41:59+0000","start_day":"Sat","distance":"90.2","distance_raw":90229.2,"long_unit":"kilometers","short_unit":"km","moving_time":"4:15:01","moving_time_raw":15301,"elapsed_time":"4:41:31","elapsed_time_raw":16891,"trainer":false,"static_map":true,"show_elevation":true,"has_latlng":true,"commute":false,"elevation_gain":"1,533","elevation_unit":"m","elevation_gain_raw":1533.0,"description":"","activity_url":"https://www.strava.com/activities/597999523","activity_url_for_twitter":"https://www.strava.com/activities/597999523?utm_content=2470979\u0026utm_medium=referral\u0026utm_source=twitter","twitter_msg":"went for a 90.2 kilometer road ride.","is_new":false,"is_changing_type":false,"suffer_score":null,"calories":2425.26878594,"feed_data":{"entries":[]},"workout_type":10,"flagged":false,"hide_power":false,"hide_heartrate":false},{"id":590729223,"name":"Vercors Loop v2","emoji_name":"Vercors Loop v2","type":"Ride","display_type":"Workout","activity_type_display_name":"Ride","private":false,"bike_id":2042105,"athlete_gear_id":null,"start_date":"Sat, 5/28/2016","start_date_local_raw":1464431650,"start_time":"2016-05-28T08:34:10+0000","start_day":"Sat","distance":"121.1","distance_raw":121185.0,"long_unit":"kilometers","short_unit":"km","moving_time":"4:44:42","moving_time_raw":17082,"elapsed_time":"5:14:49","elapsed_time_raw":18889,"trainer":false,"static_map":true,"show_elevation":true,"has_latlng":true,"commute":false,"elevation_gain":"1,487","elevation_unit":"m","elevation_gain_raw":1487.0,"description":"","activity_url":"https://www.strava.com/activities/590729223","activity_url_for_twitter":"https://www.strava.com/activities/590729223?utm_content=2470979\u0026utm_medium=referral\u0026utm_source=twitter","twitter_msg":"went for a 121.1 kilometer road ride.","is_new":false,"is_changing_type":false,"suffer_score":null,"calories":3065.04674775,"feed_data":{"entries":[]},"workout_type":12,"flagged":false,"hide_power":false,"hide_heartrate":false},{"id":589653480,"name":"Col de Palaquit \u0026 Venon. Snakes on road :|","emoji_name":"Col de Palaquit \u0026 Venon. Snakes on road :|","type":"Ride","display_type":"Workout","activity_type_display_name":"Ride","private":false,"bike_id":2042105,"athlete_gear_id":null,"start_date":"Fri, 5/27/2016","start_date_local_raw":1464347520,"start_time":"2016-05-27T09:12:00+0000","start_day":"Fri","distance":"77.3","distance_raw":77316.5,"long_unit":"kilometers","short_unit":"km","moving_time":"3:35:09","moving_time_raw":12909,"elapsed_time":"3:59:37","elapsed_time_raw":14377,"trainer":false,"static_map":true,"show_elevation":true,"has_latlng":true,"commute":false,"elevation_gain":"1,741","elevation_unit":"m","elevation_gain_raw":1741.0,"description":"","activity_url":"https://www.strava.com/activities/589653480","activity_url_for_twitter":"https://www.strava.com/activities/589653480?utm_content=2470979\u0026utm_medium=referral\u0026utm_source=twitter","twitter_msg":"went for a 77.3 kilometer road ride.","is_new":false,"is_changing_type":false,"suffer_score":null,"calories":2363.4040534650003,"feed_data":{"entries":[]},"workout_type":12,"flagged":false,"hide_power":false,"hide_heartrate":false},{"id":587738031,"name":"Evening Ride","emoji_name":"Evening Ride","type":"Ride","display_type":"Workout","activity_type_display_name":"Ride","private":false,"bike_id":2042105,"athlete_gear_id":null,"start_date":"Wed, 5/25/2016","start_date_local_raw":1464199415,"start_time":"2016-05-25T16:03:35+0000","start_day":"Wed","distance":"31.2","distance_raw":31238.7,"long_unit":"kilometers","short_unit":"km","moving_time":"1:20:35","moving_time_raw":4835,"elapsed_time":"1:21:12","elapsed_time_raw":4872,"trainer":false,"static_map":true,"show_elevation":true,"has_latlng":true,"commute":false,"elevation_gain":"546","elevation_unit":"m","elevation_gain_raw":546.0,"description":"","activity_url":"https://www.strava.com/activities/587738031","activity_url_for_twitter":"https://www.strava.com/activities/587738031?utm_content=2470979\u0026utm_medium=referral\u0026utm_source=twitter","twitter_msg":"went for a 31.2 kilometer road ride.","is_new":false,"is_changing_type":false,"suffer_score":null,"calories":885.2925614000001,"feed_data":{"entries":[]},"workout_type":12,"flagged":false,"hide_power":false,"hide_heartrate":false},{"id":586561709,"name":"Afternoon Ride","emoji_name":"Afternoon Ride","type":"Ride","display_type":"Ride","activity_type_display_name":"Ride","private":false,"bike_id":2042105,"athlete_gear_id":null,"start_date":"Tue, 5/24/2016","start_date_local_raw":1464111296,"start_time":"2016-05-24T15:34:56+0000","start_day":"Tue","distance":"31.2","distance_raw":31294.7,"long_unit":"kilometers","short_unit":"km","moving_time":"1:14:42","moving_time_raw":4482,"elapsed_time":"1:15:08","elapsed_time_raw":4508,"trainer":false,"static_map":true,"show_elevation":true,"has_latlng":true,"commute":false,"elevation_gain":"554","elevation_unit":"m","elevation_gain_raw":554.0,"description":"","activity_url":"https://www.strava.com/activities/586561709","activity_url_for_twitter":"https://www.strava.com/activities/586561709?utm_content=2470979\u0026utm_medium=referral\u0026utm_source=twitter","twitter_msg":"went for a 31.2 kilometer road ride.","is_new":false,"is_changing_type":false,"suffer_score":null,"calories":918.7275311999999,"feed_data":{"entries":[]},"workout_type":10,"flagged":false,"hide_power":false,"hide_heartrate":false},{"id":579068180,"name":"Afternoon Ride","emoji_name":"Afternoon Ride","type":"Ride","display_type":"Ride","activity_type_display_name":"Ride","private":false,"bike_id":2042105,"athlete_gear_id":null,"start_date":"Tue, 5/17/2016","start_date_local_raw":1463502117,"start_time":"2016-05-17T14:21:57+0000","start_day":"Tue","distance":"31.5","distance_raw":31521.3,"long_unit":"kilometers","short_unit":"km","moving_time":"1:25:11","moving_time_raw":5111,"elapsed_time":"1:27:51","elapsed_time_raw":5271,"trainer":false,"static_map":true,"show_elevation":true,"has_latlng":true,"commute":false,"elevation_gain":"546","elevation_unit":"m","elevation_gain_raw":546.0,"description":"","activity_url":"https://www.strava.com/activities/579068180","activity_url_for_twitter":"https://www.strava.com/activities/579068180?utm_content=2470979\u0026utm_medium=referral\u0026utm_source=twitter","twitter_msg":"went for a 31.5 kilometer road ride.","is_new":false,"is_changing_type":false,"suffer_score":null,"calories":839.319807965,"feed_data":{"entries":[]},"workout_type":10,"flagged":false,"hide_power":false,"hide_heartrate":false},{"id":577940202,"name":"Variante apr\u00e8s Revel","emoji_name":"Variante apr\u00e8s Revel","type":"Ride","display_type":"Workout","activity_type_display_name":"Ride","private":false,"bike_id":2042105,"athlete_gear_id":null,"start_date":"Mon, 5/16/2016","start_date_local_raw":1463406438,"start_time":"2016-05-16T11:47:18+0000","start_day":"Mon","distance":"38.1","distance_raw":38133.6,"long_unit":"kilometers","short_unit":"km","moving_time":"1:41:36","moving_time_raw":6096,"elapsed_time":"1:49:18","elapsed_time_raw":6558,"trainer":false,"static_map":true,"show_elevation":true,"has_latlng":true,"commute":false,"elevation_gain":"792","elevation_unit":"m","elevation_gain_raw":792.0,"description":"","activity_url":"https://www.strava.com/activities/577940202","activity_url_for_twitter":"https://www.strava.com/activities/577940202?utm_content=2470979\u0026utm_medium=referral\u0026utm_source=twitter","twitter_msg":"went for a 38.1 kilometer road ride.","is_new":false,"is_changing_type":false,"suffer_score":null,"calories":1103.24115648,"feed_data":{"entries":[]},"workout_type":12,"flagged":false,"hide_power":false,"hide_heartrate":false},{"id":576928985,"name":"Afternoon Ride","emoji_name":"Afternoon Ride","type":"Ride","display_type":"Workout","activity_type_display_name":"Ride","private":false,"bike_id":2042105,"athlete_gear_id":null,"start_date":"Sun, 5/15/2016","start_date_local_raw":1463325543,"start_time":"2016-05-15T13:19:03+0000","start_day":"Sun","distance":"31.4","distance_raw":31428.3,"long_unit":"kilometers","short_unit":"km","moving_time":"1:18:25","moving_time_raw":4705,"elapsed_time":"1:18:25","elapsed_time_raw":4705,"trainer":false,"static_map":true,"show_elevation":true,"has_latlng":true,"commute":false,"elevation_gain":"562","elevation_unit":"m","elevation_gain_raw":562.0,"description":"","activity_url":"https://www.strava.com/activities/576928985","activity_url_for_twitter":"https://www.strava.com/activities/576928985?utm_content=2470979\u0026utm_medium=referral\u0026utm_source=twitter","twitter_msg":"went for a 31.4 kilometer road ride.","is_new":false,"is_changing_type":false,"suffer_score":null,"calories":903.3583767749999,"feed_data":{"entries":[]},"workout_type":12,"flagged":false,"hide_power":false,"hide_heartrate":false},{"id":569640952,"name":"Pinet","emoji_name":"Pinet","type":"Ride","display_type":"Workout","activity_type_display_name":"Ride","private":false,"bike_id":2042105,"athlete_gear_id":null,"start_date":"Sun, 5/8/2016","start_date_local_raw":1462720446,"start_time":"2016-05-08T13:14:06+0000","start_day":"Sun","distance":"46.2","distance_raw":46202.6,"long_unit":"kilometers","short_unit":"km","moving_time":"1:50:30","moving_time_raw":6630,"elapsed_time":"1:57:35","elapsed_time_raw":7055,"trainer":false,"static_map":true,"show_elevation":true,"has_latlng":true,"commute":false,"elevation_gain":"726","elevation_unit":"m","elevation_gain_raw":726.0,"description":"","activity_url":"https://www.strava.com/activities/569640952","activity_url_for_twitter":"https://www.strava.com/activities/569640952?utm_content=2470979\u0026utm_medium=referral\u0026utm_source=twitter","twitter_msg":"went for a 46.2 kilometer road ride.","is_new":false,"is_changing_type":false,"suffer_score":null,"calories":1225.8160589999998,"feed_data":{"entries":[]},"workout_type":12,"flagged":false,"hide_power":false,"hide_heartrate":false},{"id":568441857,"name":"Saint Mury","emoji_name":"Saint Mury","type":"Ride","display_type":"Workout","activity_type_display_name":"Ride","private":false,"bike_id":2042105,"athlete_gear_id":null,"start_date":"Sat, 5/7/2016","start_date_local_raw":1462632869,"start_time":"2016-05-07T12:54:29+0000","start_day":"Sat","distance":"50.9","distance_raw":50901.6,"long_unit":"kilometers","short_unit":"km","moving_time":"2:08:49","moving_time_raw":7729,"elapsed_time":"2:28:29","elapsed_time_raw":8909,"trainer":false,"static_map":true,"show_elevation":true,"has_latlng":true,"commute":false,"elevation_gain":"782","elevation_unit":"m","elevation_gain_raw":782.0,"description":"","activity_url":"https://www.strava.com/activities/568441857","activity_url_for_twitter":"https://www.strava.com/activities/568441857?utm_content=2470979\u0026utm_medium=referral\u0026utm_source=twitter","twitter_msg":"went for a 50.9 kilometer road ride.","is_new":false,"is_changing_type":false,"suffer_score":null,"calories":1324.5440038299998,"feed_data":{"entries":[]},"workout_type":12,"flagged":false,"hide_power":false,"hide_heartrate":false},{"id":567394271,"name":"Afternoon Ride","emoji_name":"Afternoon Ride","type":"Ride","display_type":"Workout","activity_type_display_name":"Ride","private":false,"bike_id":2042105,"athlete_gear_id":null,"start_date":"Fri, 5/6/2016","start_date_local_raw":1462552421,"start_time":"2016-05-06T14:33:41+0000","start_day":"Fri","distance":"33.5","distance_raw":33581.2,"long_unit":"kilometers","short_unit":"km","moving_time":"1:25:36","moving_time_raw":5136,"elapsed_time":"1:27:55","elapsed_time_raw":5275,"trainer":false,"static_map":true,"show_elevation":true,"has_latlng":true,"commute":false,"elevation_gain":"555","elevation_unit":"m","elevation_gain_raw":555.0,"description":"","activity_url":"https://www.strava.com/activities/567394271","activity_url_for_twitter":"https://www.strava.com/activities/567394271?utm_content=2470979\u0026utm_medium=referral\u0026utm_source=twitter","twitter_msg":"went for a 33.5 kilometer road ride.","is_new":false,"is_changing_type":false,"suffer_score":null,"calories":902.5986369600001,"feed_data":{"entries":[]},"workout_type":12,"flagged":false,"hide_power":false,"hide_heartrate":false},{"id":566288762,"name":"Tranquille ","emoji_name":"Tranquille ","type":"Ride","display_type":"Ride","activity_type_display_name":"Ride","private":false,"bike_id":2042105,"athlete_gear_id":null,"start_date":"Thu, 5/5/2016","start_date_local_raw":1462463173,"start_time":"2016-05-05T13:46:13+0000","start_day":"Thu","distance":"26.0","distance_raw":26077.7,"long_unit":"kilometers","short_unit":"km","moving_time":"1:03:33","moving_time_raw":3813,"elapsed_time":"1:03:54","elapsed_time_raw":3834,"trainer":false,"static_map":true,"show_elevation":true,"has_latlng":true,"commute":false,"elevation_gain":"79","elevation_unit":"m","elevation_gain_raw":79.0,"description":"","activity_url":"https://www.strava.com/activities/566288762","activity_url_for_twitter":"https://www.strava.com/activities/566288762?utm_content=2470979\u0026utm_medium=referral\u0026utm_source=twitter","twitter_msg":"went for a 26.0 kilometer road ride.","is_new":false,"is_changing_type":false,"suffer_score":null,"calories":465.007265625,"feed_data":{"entries":[]},"workout_type":10,"flagged":false,"hide_power":false,"hide_heartrate":false},{"id":565218522,"name":"Afternoon Ride","emoji_name":"Afternoon Ride","type":"Ride","display_type":"Workout","activity_type_display_name":"Ride","private":false,"bike_id":2042105,"athlete_gear_id":null,"start_date":"Wed, 5/4/2016","start_date_local_raw":1462375051,"start_time":"2016-05-04T13:17:31+0000","start_day":"Wed","distance":"54.9","distance_raw":54951.5,"long_unit":"kilometers","short_unit":"km","moving_time":"2:22:56","moving_time_raw":8576,"elapsed_time":"2:55:33","elapsed_time_raw":10533,"trainer":false,"static_map":true,"show_elevation":true,"has_latlng":true,"commute":false,"elevation_gain":"637","elevation_unit":"m","elevation_gain_raw":637.0,"description":"","activity_url":"https://www.strava.com/activities/565218522","activity_url_for_twitter":"https://www.strava.com/activities/565218522?utm_content=2470979\u0026utm_medium=referral\u0026utm_source=twitter","twitter_msg":"went for a 54.9 kilometer road ride.","is_new":false,"is_changing_type":false,"suffer_score":null,"calories":1293.9527545600001,"feed_data":{"entries":[]},"workout_type":12,"flagged":false,"hide_power":false,"hide_heartrate":false}],"page":3,"perPage":20,"total":592}