{"models":[{"id":406217194,"name":"Afternoon Ride","emoji_name":"Afternoon Ride","type":"Ride","display_type":"Ride","activity_type_display_name":"Ride","private":false,"bike_id":2042105,"athlete_gear_id":null,"start_date":"Sun, 10/4/2015","start_date_local_raw":1443971883,"start_time":"2015-10-04T13:18:03+0000","start_day":"Sun","distance":"39.7","distance_raw":39737.4,"long_unit":"kilometers","short_unit":"km","moving_time":"1:38:21","moving_time_raw":5901,"elapsed_time":"1:41:12","elapsed_time_raw":6072,"trainer":false,"static_map":true,"show_elevation":true,"has_latlng":true,"commute":false,"elevation_gain":"785","elevation_unit":"m","elevation_gain_raw":784.8,"description":null,"activity_url":"https://www.strava.com/activities/406217194","activity_url_for_twitter":"https://www.strava.com/activities/406217194?utm_content=2470979\u0026utm_medium=referral\u0026utm_source=twitter","twitter_msg":"went for a 39.7 kilometer road ride.","is_new":true,"is_changing_type":false,"suffer_score":null,"calories":1106.41489917,"feed_data":{"entries":[]},"workout_type":null,"flagged":false,"hide_power":false,"hide_heartrate":false},{"id":403560066,"name":"Evening Ride","emoji_name":"Evening Ride","type":"Ride","display_type":"Ride","activity_type_display_name":"Ride","private":false,"bike_id":2042105,"athlete_gear_id":null,"start_date":"Wed, 9/30/2015","start_date_local_raw":1443636202,"start_time":"2015-09-30T16:03:22+0000","start_day":"Wed","distance":"31.4","distance_raw":31451.5,"long_unit":"kilometers","short_unit":"km","moving_time":"1:19:11","moving_time_raw":4751,"elapsed_time":"1:19:28","elapsed_time_raw":4768,"trainer":false,"static_map":true,"show_elevation":true,"has_latlng":true,"commute":false,"elevation_gain":"538","elevation_unit":"m","elevation_gain_raw":538.0,"description":null,"activity_url":"https://www.strava.com/activities/403560066","activity_url_for_twitter":"https://www.strava.com/activities/403560066?utm_content=2470979\u0026utm_medium=referral\u0026utm_source=twitter","twitter_msg":"went for a 31.4 kilometer road ride.","is_new":true,"is_changing_type":false,"suffer_score":null,"calories":873.9592777,"feed_data":{"entries":[]},"workout_type":null,"flagged":false,"hide_power":false,"hide_heartrate":false},{"id":403560013,"name":"Afternoon Ride","emoji_name":"Afternoon Ride","type":"Ride","display_type":"Ride","activity_type_display_name":"Ride","private":false,"bike_id":2042105,"athlete_gear_id":null,"start_date":"Tue, 9/22/2015","start_date_local_raw":1442944068,"start_time":"2015-09-22T15:47:48+0000","start_day":"Tue","distance":"31.3","distance_raw":31314.1,"long_unit":"kilometers","short_unit":"km","moving_time":"1:21:24","moving_time_raw":4884,"elapsed_time":"1:23:03","elapsed_time_raw":4983,"trainer":false,"static_map":true,"show_elevation":true,"has_latlng":true,"commute":false,"elevation_gain":"534","elevation_unit":"m","elevation_gain_raw":534.0,"description":null,"activity_url":"https://www.strava.com/activities/403560013","activity_url_for_twitter":"https://www.strava.com/activities/403560013?utm_content=2470979\u0026utm_medium=referral\u0026utm_source=twitter","twitter_msg":"went for a 31.3 kilometer road ride.","is_new":true,"is_changing_type":false,"suffer_score":null,"calories":827.3318955,"feed_data":{"entries":[]},"workout_type":null,"flagged":false,"hide_power":false,"hide_heartrate":false},{"id":397193741,"name":"Canada diet week 01","emoji_name":"Canada diet week 01","type":"Ride","display_type":"Ride","activity_type_display_name":"Ride","private":false,"bike_id":2042105,"athlete_gear_id":null,"start_date":"Mon, 9/21/2015","start_date_local_raw":1442858506,"start_time":"2015-09-21T16:01:46+0000","start_day":"Mon","distance":"31.5","distance_raw":31551.0,"long_unit":"kilometers","short_unit":"km","moving_time":"1:16:53","moving_time_raw":4613,"elapsed_time":"1:16:53","elapsed_time_raw":4613,"trainer":false,"static_map":true,"show_elevation":true,"has_latlng":true,"commute":false,"elevation_gain":"544","elevation_unit":"m","elevation_gain_raw":544.0,"description":"","activity_url":"https://www.strava.com/activities/397193741","activity_url_for_twitter":"https://www.strava.com/activities/397193741?utm_content=2470979\u0026utm_medium=referral\u0026utm_source=twitter","twitter_msg":"went for a 31.5 kilometer road ride.","is_new":false,"is_changing_type":false,"suffer_score":null,"calories":850.8935213450001,"feed_data":{"entries":[]},"workout_type":null,"flagged":false,"hide_power":false,"hide_heartrate":false},{"id":393874622,"name":"Tadoussac walk, QC, Canada","emoji_name":"Tadoussac walk, QC, Canada","type":"Hike","display_type":"Hike","activity_type_display_name":"Hike","private":false,"bike_id":null,"athlete_gear_id":382540,"start_date":"Wed, 9/16/2015","start_date_local_raw":1442424481,"start_time":"2015-09-16T21:28:01+0000","start_day":"Wed","distance":"3.0","distance_raw":3053.9,"long_unit":"kilometers","short_unit":"km","moving_time":"51:16","moving_time_raw":3076,"elapsed_time":"1:35:45","elapsed_time_raw":5745,"trainer":false,"static_map":true,"show_elevation":true,"has_latlng":true,"commute":false,"elevation_gain":"78","elevation_unit":"m","elevation_gain_raw":77.9225,"description":"","activity_url":"https://www.strava.com/activities/393874622","activity_url_for_twitter":"https://www.strava.com/activities/393874622?utm_content=2470979\u0026utm_medium=referral\u0026utm_source=twitter","twitter_msg":"went for a 3.0 kilometer Hike.","is_new":false,"is_changing_type":false,"suffer_score":null,"calories":255.15407793600005,"feed_data":{"entries":[]},"workout_type":null,"flagged":false,"hide_power":false,"hide_heartrate":false},{"id":393116784,"name":"Chicoutimi Run, QC, Canada","emoji_name":"Chicoutimi Run, QC, Canada","type":"Run","display_type":"Workout","activity_type_display_name":"Run","private":false,"bike_id":null,"athlete_gear_id":1022094,"start_date":"Tue, 9/15/2015","start_date_local_raw":1442341525,"start_time":"2015-09-15T22:25:25+0000","start_day":"Tue","distance":"5.2","distance_raw":5218.7,"long_unit":"kilometers","short_unit":"km","moving_time":"36:38","moving_time_raw":2198,"elapsed_time":"43:06","elapsed_time_raw":2586,"trainer":false,"static_map":true,"show_elevation":true,"has_latlng":true,"commute":false,"elevation_gain":"64","elevation_unit":"m","elevation_gain_raw":63.8963,"description":"","activity_url":"https://www.strava.com/activities/393116784","activity_url_for_twitter":"https://www.strava.com/activities/393116784?utm_content=2470979\u0026utm_medium=referral\u0026utm_source=twitter","twitter_msg":"went for a 5.2 kilometer Run.","is_new":false,"is_changing_type":false,"suffer_score":null,"calories":476.27322839999994,"feed_data":{"entries":[]},"workout_type":3,"flagged":false,"hide_power":false,"hide_heartrate":false},{"id":392354127,"name":"Val Jalbert walk, QC, Canada","emoji_name":"Val Jalbert walk, QC, Canada","type":"Hike","display_type":"Hike","activity_type_display_name":"Hike","private":false,"bike_id":null,"athlete_gear_id":382540,"start_date":"Mon, 9/14/2015","start_date_local_raw":1442239479,"start_time":"2015-09-14T18:04:39+0000","start_day":"Mon","distance":"3.7","distance_raw":3727.7,"long_unit":"kilometers","short_unit":"km","moving_time":"53:07","moving_time_raw":3187,"elapsed_time":"1:26:42","elapsed_time_raw":5202,"trainer":false,"static_map":true,"show_elevation":true,"has_latlng":true,"commute":false,"elevation_gain":"181","elevation_unit":"m","elevation_gain_raw":180.592,"description":"","activity_url":"https://www.strava.com/activities/392354127","activity_url_for_twitter":"https://www.strava.com/activities/392354127?utm_content=2470979\u0026utm_medium=referral\u0026utm_source=twitter","twitter_msg":"went for a 3.7 kilometer Hike.","is_new":false,"is_changing_type":false,"suffer_score":null,"calories":311.450229648,"feed_data":{"entries":[]},"workout_type":null,"flagged":false,"hide_power":false,"hide_heartrate":false},{"id":387847432,"name":"Ptite P\u00e9r\u00e9rr\u00e9e","emoji_name":"Ptite P\u00e9r\u00e9rr\u00e9e","type":"Ride","display_type":"Ride","activity_type_display_name":"Ride","private":false,"bike_id":2042105,"athlete_gear_id":null,"start_date":"Tue, 9/8/2015","start_date_local_raw":1441736277,"start_time":"2015-09-08T16:17:57+0000","start_day":"Tue","distance":"31.4","distance_raw":31477.5,"long_unit":"kilometers","short_unit":"km","moving_time":"1:17:40","moving_time_raw":4660,"elapsed_time":"1:19:24","elapsed_time_raw":4764,"trainer":false,"static_map":true,"show_elevation":true,"has_latlng":true,"commute":false,"elevation_gain":"542","elevation_unit":"m","elevation_gain_raw":542.0,"description":"","activity_url":"https://www.strava.com/activities/387847432","activity_url_for_twitter":"https://www.strava.com/activities/387847432?utm_content=2470979\u0026utm_medium=referral\u0026utm_source=twitter","twitter_msg":"went for a 31.4 kilometer road ride.","is_new":false,"is_changing_type":false,"suffer_score":null,"calories":837.6778021,"feed_data":{"entries":[]},"workout_type":null,"flagged":false,"hide_power":false,"hide_heartrate":false},{"id":387059955,"name":"Evening Ride","emoji_name":"Evening Ride","type":"Ride","display_type":"Ride","activity_type_display_name":"Ride","private":false,"bike_id":2042105,"athlete_gear_id":null,"start_date":"Mon, 9/7/2015","start_date_local_raw":1441649220,"start_time":"2015-09-07T16:07:00+0000","start_day":"Mon","distance":"28.9","distance_raw":28933.4,"long_unit":"kilometers","short_unit":"km","moving_time":"55:32","moving_time_raw":3332,"elapsed_time":"55:32","elapsed_time_raw":3332,"trainer":false,"static_map":true,"show_elevation":true,"has_latlng":true,"commute":false,"elevation_gain":"146","elevation_unit":"m","elevation_gain_raw":146.0,"description":null,"activity_url":"https://www.strava.com/activities/387059955","activity_url_for_twitter":"https://www.strava.com/activities/387059955?utm_content=2470979\u0026utm_medium=referral\u0026utm_source=twitter","twitter_msg":"went for a 28.9 kilometer road ride.","is_new":true,"is_changing_type":false,"suffer_score":null,"calories":709.0235271,"feed_data":{"entries":[]},"workout_type":null,"flagged":false,"hide_power":false,"hide_heartrate":false},{"id":386268058,"name":"Empty","emoji_name":"Empty","type":"Ride","display_type":"Ride","activity_type_display_name":"Ride","private":false,"bike_id":2042105,"athlete_gear_id":null,"start_date":"Sun, 9/6/2015","start_date_local_raw":1441555493,"start_time":"2015-09-06T14:04:53+0000","start_day":"Sun","distance":"10.0","distance_raw":10000.1,"long_unit":"kilometers","short_unit":"km","moving_time":"25:19","moving_time_raw":1519,"elapsed_time":"1:18:49","elapsed_time_raw":4729,"trainer":false,"static_map":true,"show_elevation":true,"has_latlng":true,"commute":false,"elevation_gain":"73","elevation_unit":"m","elevation_gain_raw":73.0,"description":"","activity_url":"https://www.strava.com/activities/386268058","activity_url_for_twitter":"https://www.strava.com/activities/386268058?utm_content=2470979\u0026utm_medium=referral\u0026utm_source=twitter","twitter_msg":"went for a 10.0 kilometer road ride.","is_new":false,"is_changing_type":false,"suffer_score":null,"calories":209.11589958,"feed_data":{"entries":[]},"workout_type":null,"flagged":false,"hide_power":false,"hide_heartrate":false},{"id":385490294,"name":"Afternoon Ride","emoji_name":"Afternoon Ride","type":"Ride","display_type":"Ride","activity_type_display_name":"Ride","private":false,"bike_id":2042105,"athlete_gear_id":null,"start_date":"Sat, 9/5/2015","start_date_local_raw":1441466999,"start_time":"2015-09-05T13:29:59+0000","start_day":"Sat","distance":"70.0","distance_raw":70064.2,"long_unit":"kilometers","short_unit":"km","moving_time":"2:29:56","moving_time_raw":8996,"elapsed_time":"2:29:56","elapsed_time_raw":8996,"trainer":false,"static_map":true,"show_elevation":true,"has_latlng":true,"commute":false,"elevation_gain":"153","elevation_unit":"m","elevation_gain_raw":153.0,"description":null,"activity_url":"https://www.strava.com/activities/385490294","activity_url_for_twitter":"https://www.strava.com/activities/385490294?utm_content=2470979\u0026utm_medium=referral\u0026utm_source=twitter","twitter_msg":"went for a 70.0 kilometer road ride.","is_new":true,"is_changing_type":false,"suffer_score":null,"calories":1278.17165112,"feed_data":{"entries":[]},"workout_type":null,"flagged":false,"hide_power":false,"hide_heartrate":false},{"id":384884871,"name":"Test Cam | http://youtu.be/i2hHnrgTj_s + http://youtu.be/5D6ZcfpzO74","emoji_name":"Test Cam | http://youtu.be/i2hHnrgTj_s + http://youtu.be/5D6ZcfpzO74","type":"Ride","display_type":"Ride","activity_type_display_name":"Ride","private":false,"bike_id":2042105,"athlete_gear_id":null,"start_date":"Fri, 9/4/2015","start_date_local_raw":1441389470,"start_time":"2015-09-04T15:57:50+0000","start_day":"Fri","distance":"31.3","distance_raw":31335.7,"long_unit":"kilometers","short_unit":"km","moving_time":"1:17:50","moving_time_raw":4670,"elapsed_time":"1:24:06","elapsed_time_raw":5046,"trainer":false,"static_map":true,"show_elevation":true,"has_latlng":true,"commute":false,"elevation_gain":"534","elevation_unit":"m","elevation_gain_raw":534.0,"description":"","activity_url":"https://www.strava.com/activities/384884871","activity_url_for_twitter":"https://www.strava.com/activities/384884871?utm_content=2470979\u0026utm_medium=referral\u0026utm_source=twitter","twitter_msg":"went for a 31.3 kilometer road ride.","is_new":false,"is_changing_type":false,"suffer_score":null,"calories":826.09327545,"feed_data":{"entries":[]},"workout_type":null,"flagged":false,"hide_power":false,"hide_heartrate":false},{"id":377946066,"name":"Evening Ride","emoji_name":"Evening Ride","type":"Ride","display_type":"Ride","activity_type_display_name":"Ride","private":false,"bike_id":2042105,"athlete_gear_id":null,"start_date":"Wed, 8/26/2015","start_date_local_raw":1440613422,"start_time":"2015-08-26T16:23:42+0000","start_day":"Wed","distance":"21.2","distance_raw":21275.0,"long_unit":"kilometers","short_unit":"km","moving_time":"40:16","moving_time_raw":2416,"elapsed_time":"41:14","elapsed_time_raw":2474,"trainer":false,"static_map":true,"show_elevation":true,"has_latlng":true,"commute":false,"elevation_gain":"51","elevation_unit":"m","elevation_gain_raw":51.0,"description":null,"activity_url":"https://www.strava.com/activities/377946066","activity_url_for_twitter":"https://www.strava.com/activities/377946066?utm_content=2470979\u0026utm_medium=referral\u0026utm_source=twitter","twitter_msg":"went for a 21.2 kilometer road ride.","is_new":true,"is_changing_type":false,"suffer_score":null,"calories":499.04194151999997,"feed_data":{"entries":[]},"workout_type":null,"flagged":false,"hide_power":false,"hide_heartrate":false},{"id":377239233,"name":"Cram\u00e9 !!","emoji_name":"Cram\u00e9 !!","type":"Ride","display_type":"Ride","activity_type_display_name":"Ride","private":false,"bike_id":2042105,"athlete_gear_id":null,"start_date":"Tue, 8/25/2015","start_date_local_raw":1440527419,"start_time":"2015-08-25T16:30:19+0000","start_day":"Tue","distance":"30.4","distance_raw":30404.0,"long_unit":"kilometers","short_unit":"km","moving_time":"1:11:55","moving_time_raw":4315,"elapsed_time":"1:17:51","elapsed_time_raw":4671,"trainer":false,"static_map":true,"show_elevation":true,"has_latlng":true,"commute":false,"elevation_gain":"523","elevation_unit":"m","elevation_gain_raw":523.0,"description":"Enfin le record battu sur le segment p\u00e9r\u00e9rr\u00e9e... 1 an que j'essaie de faire mieux...","activity_url":"https://www.strava.com/activities/377239233","activity_url_for_twitter":"https://www.strava.com/activities/377239233?utm_content=2470979\u0026utm_medium=referral\u0026utm_source=twitter","twitter_msg":"went for a 30.4 kilometer road ride.","is_new":false,"is_changing_type":false,"suffer_score":null,"calories":829.9940472,"feed_data":{"entries":[]},"workout_type":null,"flagged":false,"hide_power":false,"hide_heartrate":false},{"id":375518033,"name":"MTB Chamrousse - GoPro @ http://youtu.be/C05qJKfJjmQ","emoji_name":"MTB Chamrousse - GoPro @ http://youtu.be/C05qJKfJjmQ","type":"Ride","display_type":"Ride","activity_type_display_name":"Ride","private":false,"bike_id":824309,"athlete_gear_id":null,"start_date":"Sat, 8/22/2015","start_date_local_raw":1440242347,"start_time":"2015-08-22T09:19:07+0000","start_day":"Sat","distance":"43.3","distance_raw":43347.6,"long_unit":"kilometers","short_unit":"km","moving_time":"2:33:22","moving_time_raw":9202,"elapsed_time":"3:56:12","elapsed_time_raw":14172,"trainer":false,"static_map":true,"show_elevation":true,"has_latlng":true,"commute":false,"elevation_gain":"2,621","elevation_unit":"m","elevation_gain_raw":2621.0,"description":"# Video: \r\nhttps://youtu.be/C05qJKfJjmQ\r\n\r\n# Raw Footages: \r\nhttps://www.youtube.com/playlist?list=PLwjCg6LnfYTBW2ZfGqe5VgURCx8-sRAbh","activity_url":"https://www.strava.com/activities/375518033","activity_url_for_twitter":"https://www.strava.com/activities/375518033?utm_content=2470979\u0026utm_medium=referral\u0026utm_source=twitter","twitter_msg":"went for a 43.3 kilometer road ride.","is_new":false,"is_changing_type":false,"suffer_score":null,"calories":2317.84751838,"feed_data":{"entries":[]},"workout_type":null,"flagged":false,"hide_power":false,"hide_heartrate":false},{"id":375518573,"name":"Evening Ride","emoji_name":"Evening Ride","type":"Ride","display_type":"Ride","activity_type_display_name":"Ride","private":false,"bike_id":824309,"athlete_gear_id":null,"start_date":"Thu, 8/20/2015","start_date_local_raw":1440097753,"start_time":"2015-08-20T17:09:13+0000","start_day":"Thu","distance":"29.4","distance_raw":29460.4,"long_unit":"kilometers","short_unit":"km","moving_time":"1:39:01","moving_time_raw":5941,"elapsed_time":"1:46:39","elapsed_time_raw":6399,"trainer":false,"static_map":true,"show_elevation":true,"has_latlng":true,"commute":false,"elevation_gain":"58","elevation_unit":"m","elevation_gain_raw":58.0,"description":"","activity_url":"https://www.strava.com/activities/375518573","activity_url_for_twitter":"https://www.strava.com/activities/375518573?utm_content=2470979\u0026utm_medium=referral\u0026utm_source=twitter","twitter_msg":"went for a 29.4 kilometer road ride.","is_new":false,"is_changing_type":false,"suffer_score":null,"calories":431.79680508900003,"feed_data":{"entries":[]},"workout_type":null,"flagged":false,"hide_power":false,"hide_heartrate":false},{"id":372761597,"name":"Rodage plaquettes","emoji_name":"Rodage plaquettes","type":"Ride","display_type":"Ride","activity_type_display_name":"Ride","private":false,"bike_id":824309,"athlete_gear_id":null,"start_date":"Wed, 8/19/2015","start_date_local_raw":1440011342,"start_time":"2015-08-19T17:09:02+0000","start_day":"Wed","distance":"18.2","distance_raw":18248.3,"long_unit":"kilometers","short_unit":"km","moving_time":"1:11:57","moving_time_raw":4317,"elapsed_time":"1:15:47","elapsed_time_raw":4547,"trainer":false,"static_map":true,"show_elevation":true,"has_latlng":true,"commute":false,"elevation_gain":"83","elevation_unit":"m","elevation_gain_raw":83.0,"description":"","activity_url":"https://www.strava.com/activities/372761597","activity_url_for_twitter":"https://www.strava.com/activities/372761597?utm_content=2470979\u0026utm_medium=referral\u0026utm_source=twitter","twitter_msg":"went for a 18.2 kilometer road ride.","is_new":false,"is_changing_type":false,"suffer_score":null,"calories":282.40540485,"feed_data":{"entries":[]},"workout_type":null,"flagged":false,"hide_power":false,"hide_heartrate":false},{"id":371317512,"name":"Fast Fast Fast \u0026 Pschitt","emoji_name":"Fast Fast Fast \u0026 Pschitt","type":"Ride","display_type":"Ride","activity_type_display_name":"Ride","private":false,"bike_id":2042105,"athlete_gear_id":null,"start_date":"Mon, 8/17/2015","start_date_local_raw":1439835858,"start_time":"2015-08-17T16:24:18+0000","start_day":"Mon","distance":"40.7","distance_raw":40729.6,"long_unit":"kilometers","short_unit":"km","moving_time":"1:12:46","moving_time_raw":4366,"elapsed_time":"1:14:22","elapsed_time_raw":4462,"trainer":false,"static_map":true,"show_elevation":true,"has_latlng":true,"commute":false,"elevation_gain":"107","elevation_unit":"m","elevation_gain_raw":107.0,"description":"","activity_url":"https://www.strava.com/activities/371317512","activity_url_for_twitter":"https://www.strava.com/activities/371317512?utm_content=2470979\u0026utm_medium=referral\u0026utm_source=twitter","twitter_msg":"went for a 40.7 kilometer road ride.","is_new":false,"is_changing_type":false,"suffer_score":null,"calories":997.8805605600002,"feed_data":{"entries":[]},"workout_type":null,"flagged":false,"hide_power":false,"hide_heartrate":false},{"id":368210547,"name":"Natation","emoji_name":"Natation","type":"Swim","display_type":"Swim","activity_type_display_name":"Swim","private":false,"bike_id":null,"athlete_gear_id":null,"start_date":"Thu, 8/13/2015","start_date_local_raw":1439490000,"start_time":"2015-08-13T16:20:00+0000","start_day":"Thu","distance":"0","distance_raw":0.0,"long_unit":"meters","short_unit":"m","moving_time":"31:40","moving_time_raw":1900,"elapsed_time":"31:40","elapsed_time_raw":1900,"trainer":false,"static_map":false,"show_elevation":false,"has_latlng":false,"commute":false,"elevation_gain":"0","elevation_unit":"m","elevation_gain_raw":0,"description":"","activity_url":"https://www.strava.com/activities/368210547","activity_url_for_twitter":"https://www.strava.com/activities/368210547?utm_content=2470979\u0026utm_medium=referral\u0026utm_source=twitter","twitter_msg":"went for a 0 kilometer Swim.","is_new":false,"is_changing_type":false,"suffer_score":null,"calories":null,"feed_data":{"entries":[]},"workout_type":null,"flagged":false,"hide_power":false,"hide_heartrate":false},{"id":367463594,"name":"Venon","emoji_name":"Venon","type":"Ride","display_type":"Ride","activity_type_display_name":"Ride","private":false,"bike_id":2042105,"athlete_gear_id":null,"start_date":"Wed, 8/12/2015","start_date_local_raw":1439404754,"start_time":"2015-08-12T16:39:14+0000","start_day":"Wed","distance":"34.1","distance_raw":34118.5,"long_unit":"kilometers","short_unit":"km","moving_time":"1:30:19","moving_time_raw":5419,"elapsed_time":"1:36:35","elapsed_time_raw":5795,"trainer":false,"static_map":true,"show_elevation":true,"has_latlng":true,"commute":false,"elevation_gain":"688","elevation_unit":"m","elevation_gain_raw":688.0,"description":"","activity_url":"https://www.strava.com/activities/367463594","activity_url_for_twitter":"https://www.strava.com/activities/367463594?utm_content=2470979\u0026utm_medium=referral\u0026utm_source=twitter","twitter_msg":"went for a 34.1 kilometer road ride.","is_new":false,"is_changing_type":false,"suffer_score":null,"calories":956.592687015,"feed_data":{"entries":[]},"workout_type":null,"flagged":false,"hide_power":false,"hide_heartrate":false}],"page":7,"perPage":20,"total":592}