{"models":[{"id":799672885,"name":"Running back... Hard !","emoji_name":"Running back... Hard !","type":"Run","display_type":"Course","activity_type_display_name":"Course \u00e0 pied","private":true,"bike_id":null,"athlete_gear_id":1022094,"start_date":"dim. 11/12/2016","start_date_local_raw":1481471150,"start_time":"2016-12-11T14:45:50+0000","start_day":"Sun","distance":"4,0","distance_raw":4014.8,"long_unit":"kilom\u00e8tres","short_unit":"km","moving_time":"36:36","moving_time_raw":2196,"elapsed_time":"39:18","elapsed_time_raw":2358,"trainer":false,"static_map":true,"show_elevation":true,"has_latlng":true,"commute":false,"elevation_gain":"17","elevation_unit":"m","elevation_gain_raw":17.2,"description":"","activity_url":"https://www.strava.com/activities/799672885","activity_url_for_twitter":"https://www.strava.com/activities/799672885?utm_content=2470979\u0026utm_medium=referral\u0026utm_source=twitter","twitter_msg":"a parcouru 4,0 kilom\u00e8tre sur Course \u00e0 pied.","is_new":false,"is_changing_type":false,"suffer_score":null,"calories":357.37026476759996,"feed_data":{"entries":[]},"workout_type":0,"flagged":false,"hide_power":false,"hide_heartrate":false},{"id":727632286,"name":"Lunch Ride","emoji_name":"Lunch Ride","type":"Ride","display_type":"Sortie \u00e0 v\u00e9lo","activity_type_display_name":"Sortie \u00e0 v\u00e9lo","private":false,"bike_id":2042105,"athlete_gear_id":null,"start_date":"mer. 28/9/2016","start_date_local_raw":1475064395,"start_time":"2016-09-28T10:06:35+0000","start_day":"Wed","distance":"24,7","distance_raw":24780.0,"long_unit":"kilom\u00e8tres","short_unit":"km","moving_time":"51:45","moving_time_raw":3105,"elapsed_time":"53:04","elapsed_time_raw":3184,"trainer":false,"static_map":true,"show_elevation":true,"has_latlng":true,"commute":false,"elevation_gain":"111","elevation_unit":"m","elevation_gain_raw":111.0,"description":null,"activity_url":"https://www.strava.com/activities/727632286","activity_url_for_twitter":"https://www.strava.com/activities/727632286?utm_content=2470979\u0026utm_medium=referral\u0026utm_source=twitter","twitter_msg":"a parcouru 24,7 kilom\u00e8tre sur Sortie \u00e0 v\u00e9lo.","is_new":true,"is_changing_type":false,"suffer_score":null,"calories":536.3377348500001,"feed_data":{"entries":[]},"workout_type":null,"flagged":false,"hide_power":false,"hide_heartrate":false},{"id":723224273,"name":"Bon rythme ! 33 KPH !!","emoji_name":"Bon rythme ! 33 KPH !!","type":"Ride","display_type":"Sortie \u00e0 v\u00e9lo","activity_type_display_name":"Sortie \u00e0 v\u00e9lo","private":false,"bike_id":2042105,"athlete_gear_id":null,"start_date":"sam. 24/9/2016","start_date_local_raw":1474727427,"start_time":"2016-09-24T12:30:27+0000","start_day":"Sat","distance":"56,2","distance_raw":56283.2,"long_unit":"kilom\u00e8tres","short_unit":"km","moving_time":"1:42:08","moving_time_raw":6128,"elapsed_time":"1:42:08","elapsed_time_raw":6128,"trainer":false,"static_map":true,"show_elevation":true,"has_latlng":true,"commute":false,"elevation_gain":"390","elevation_unit":"m","elevation_gain_raw":390.0,"description":"","activity_url":"https://www.strava.com/activities/723224273","activity_url_for_twitter":"https://www.strava.com/activities/723224273?utm_content=2470979\u0026utm_medium=referral\u0026utm_source=twitter","twitter_msg":"a parcouru 56,2 kilom\u00e8tre sur Sortie \u00e0 v\u00e9lo.","is_new":false,"is_changing_type":false,"suffer_score":null,"calories":1444.437008,"feed_data":{"entries":[]},"workout_type":10,"flagged":false,"hide_power":false,"hide_heartrate":false},{"id":722210052,"name":"Fort saint eynard","emoji_name":"Fort saint eynard","type":"Hike","display_type":"Randonn\u00e9e","activity_type_display_name":"Randonn\u00e9e","private":false,"bike_id":null,"athlete_gear_id":1022094,"start_date":"ven. 23/9/2016","start_date_local_raw":1474645614,"start_time":"2016-09-23T13:46:54+0000","start_day":"Fri","distance":"6,3","distance_raw":6350.9,"long_unit":"kilom\u00e8tres","short_unit":"km","moving_time":"1:37:10","moving_time_raw":5830,"elapsed_time":"1:49:28","elapsed_time_raw":6568,"trainer":false,"static_map":true,"show_elevation":true,"has_latlng":true,"commute":false,"elevation_gain":"595","elevation_unit":"m","elevation_gain_raw":594.8,"description":"","activity_url":"https://www.strava.com/activities/722210052","activity_url_for_twitter":"https://www.strava.com/activities/722210052?utm_content=2470979\u0026utm_medium=referral\u0026utm_source=twitter","twitter_msg":"a parcouru 6,3 kilom\u00e8tre sur Randonn\u00e9e.","is_new":false,"is_changing_type":false,"suffer_score":null,"calories":554.0288906520001,"feed_data":{"entries":[]},"workout_type":null,"flagged":false,"hide_power":false,"hide_heartrate":false},{"id":721113868,"name":"Afternoon Ride","emoji_name":"Afternoon Ride","type":"Ride","display_type":"Sortie \u00e0 v\u00e9lo","activity_type_display_name":"Sortie \u00e0 v\u00e9lo","private":false,"bike_id":2042105,"athlete_gear_id":null,"start_date":"jeu. 22/9/2016","start_date_local_raw":1474552254,"start_time":"2016-09-22T11:50:54+0000","start_day":"Thu","distance":"69,6","distance_raw":69634.9,"long_unit":"kilom\u00e8tres","short_unit":"km","moving_time":"2:44:30","moving_time_raw":9870,"elapsed_time":"3:12:02","elapsed_time_raw":11522,"trainer":false,"static_map":true,"show_elevation":true,"has_latlng":true,"commute":false,"elevation_gain":"661","elevation_unit":"m","elevation_gain_raw":661.0,"description":null,"activity_url":"https://www.strava.com/activities/721113868","activity_url_for_twitter":"https://www.strava.com/activities/721113868?utm_content=2470979\u0026utm_medium=referral\u0026utm_source=twitter","twitter_msg":"a parcouru 69,6 kilom\u00e8tre sur Sortie \u00e0 v\u00e9lo.","is_new":true,"is_changing_type":false,"suffer_score":null,"calories":1640.73189945,"feed_data":{"entries":[]},"workout_type":null,"flagged":false,"hide_power":false,"hide_heartrate":false},{"id":718908064,"name":"P\u00e9dalage avec Madame Jeannie Longo","emoji_name":"P\u00e9dalage avec Madame Jeannie Longo","type":"Ride","display_type":"Entra\u00eenement","activity_type_display_name":"Sortie \u00e0 v\u00e9lo","private":false,"bike_id":2042105,"athlete_gear_id":null,"start_date":"mar. 20/9/2016","start_date_local_raw":1474386294,"start_time":"2016-09-20T13:44:54+0000","start_day":"Tue","distance":"67,1","distance_raw":67134.0,"long_unit":"kilom\u00e8tres","short_unit":"km","moving_time":"2:22:37","moving_time_raw":8557,"elapsed_time":"2:29:04","elapsed_time_raw":8944,"trainer":false,"static_map":true,"show_elevation":true,"has_latlng":true,"commute":false,"elevation_gain":"497","elevation_unit":"m","elevation_gain_raw":497.0,"description":"","activity_url":"https://www.strava.com/activities/718908064","activity_url_for_twitter":"https://www.strava.com/activities/718908064?utm_content=2470979\u0026utm_medium=referral\u0026utm_source=twitter","twitter_msg":"a parcouru 67,1 kilom\u00e8tre sur Sortie \u00e0 v\u00e9lo.","is_new":false,"is_changing_type":false,"suffer_score":null,"calories":1527.188968575,"feed_data":{"entries":[]},"workout_type":12,"flagged":false,"hide_power":false,"hide_heartrate":false},{"id":717815211,"name":"Afternoon Ride","emoji_name":"Afternoon Ride","type":"Ride","display_type":"Sortie \u00e0 v\u00e9lo","activity_type_display_name":"Sortie \u00e0 v\u00e9lo","private":false,"bike_id":2042105,"athlete_gear_id":null,"start_date":"lun. 19/9/2016","start_date_local_raw":1474301566,"start_time":"2016-09-19T14:12:46+0000","start_day":"Mon","distance":"31,1","distance_raw":31184.9,"long_unit":"kilom\u00e8tres","short_unit":"km","moving_time":"1:24:20","moving_time_raw":5060,"elapsed_time":"1:28:13","elapsed_time_raw":5293,"trainer":false,"static_map":true,"show_elevation":true,"has_latlng":true,"commute":false,"elevation_gain":"508","elevation_unit":"m","elevation_gain_raw":508.0,"description":null,"activity_url":"https://www.strava.com/activities/717815211","activity_url_for_twitter":"https://www.strava.com/activities/717815211?utm_content=2470979\u0026utm_medium=referral\u0026utm_source=twitter","twitter_msg":"a parcouru 31,1 kilom\u00e8tre sur Sortie \u00e0 v\u00e9lo.","is_new":true,"is_changing_type":false,"suffer_score":null,"calories":825.2350710999999,"feed_data":{"entries":[]},"workout_type":null,"flagged":false,"hide_power":false,"hide_heartrate":false},{"id":716901962,"name":"Evening Run","emoji_name":"Evening Run","type":"Run","display_type":"Course","activity_type_display_name":"Course \u00e0 pied","private":false,"bike_id":null,"athlete_gear_id":1022094,"start_date":"dim. 18/9/2016","start_date_local_raw":1474223801,"start_time":"2016-09-18T16:36:41+0000","start_day":"Sun","distance":"3,2","distance_raw":3211.2,"long_unit":"kilom\u00e8tres","short_unit":"km","moving_time":"25:32","moving_time_raw":1532,"elapsed_time":"30:31","elapsed_time_raw":1831,"trainer":false,"static_map":true,"show_elevation":true,"has_latlng":true,"commute":false,"elevation_gain":"19","elevation_unit":"m","elevation_gain_raw":18.6843,"description":null,"activity_url":"https://www.strava.com/activities/716901962","activity_url_for_twitter":"https://www.strava.com/activities/716901962?utm_content=2470979\u0026utm_medium=referral\u0026utm_source=twitter","twitter_msg":"a parcouru 3,2 kilom\u00e8tre sur Course \u00e0 pied.","is_new":false,"is_changing_type":false,"suffer_score":null,"calories":293.6017113336,"feed_data":{"entries":[]},"workout_type":0,"flagged":false,"hide_power":false,"hide_heartrate":false},{"id":708752345,"name":"Bastille","emoji_name":"Bastille","type":"Run","display_type":"Entra\u00eenement","activity_type_display_name":"Course \u00e0 pied","private":false,"bike_id":null,"athlete_gear_id":1022094,"start_date":"dim. 11/9/2016","start_date_local_raw":1473616656,"start_time":"2016-09-11T15:57:36+0000","start_day":"Sun","distance":"6,1","distance_raw":6106.6,"long_unit":"kilom\u00e8tres","short_unit":"km","moving_time":"56:09","moving_time_raw":3369,"elapsed_time":"1:07:50","elapsed_time_raw":4070,"trainer":false,"static_map":true,"show_elevation":true,"has_latlng":true,"commute":false,"elevation_gain":"343","elevation_unit":"m","elevation_gain_raw":343.19,"description":"","activity_url":"https://www.strava.com/activities/708752345","activity_url_for_twitter":"https://www.strava.com/activities/708752345?utm_content=2470979\u0026utm_medium=referral\u0026utm_source=twitter","twitter_msg":"a parcouru 6,1 kilom\u00e8tre sur Course \u00e0 pied.","is_new":false,"is_changing_type":false,"suffer_score":null,"calories":737.6812138152002,"feed_data":{"entries":[]},"workout_type":3,"flagged":false,"hide_power":false,"hide_heartrate":false},{"id":707356065,"name":"Je suis un gros lent !","emoji_name":"Je suis un gros lent !","type":"Run","display_type":"Course","activity_type_display_name":"Course \u00e0 pied","private":false,"bike_id":null,"athlete_gear_id":1022094,"start_date":"sam. 10/9/2016","start_date_local_raw":1473531914,"start_time":"2016-09-10T16:25:14+0000","start_day":"Sat","distance":"6,2","distance_raw":6223.1,"long_unit":"kilom\u00e8tres","short_unit":"km","moving_time":"53:20","moving_time_raw":3200,"elapsed_time":"54:22","elapsed_time_raw":3262,"trainer":false,"static_map":true,"show_elevation":true,"has_latlng":true,"commute":false,"elevation_gain":"18","elevation_unit":"m","elevation_gain_raw":18.2708,"description":null,"activity_url":"https://www.strava.com/activities/707356065","activity_url_for_twitter":"https://www.strava.com/activities/707356065?utm_content=2470979\u0026utm_medium=referral\u0026utm_source=twitter","twitter_msg":"a parcouru 6,2 kilom\u00e8tre sur Course \u00e0 pied.","is_new":false,"is_changing_type":false,"suffer_score":null,"calories":567.5991452064001,"feed_data":{"entries":[]},"workout_type":0,"flagged":false,"hide_power":false,"hide_heartrate":false},{"id":705118424,"name":"Baladinette","emoji_name":"Baladinette","type":"Ride","display_type":"Sortie \u00e0 v\u00e9lo","activity_type_display_name":"Sortie \u00e0 v\u00e9lo","private":false,"bike_id":824309,"athlete_gear_id":null,"start_date":"jeu. 8/9/2016","start_date_local_raw":1473360181,"start_time":"2016-09-08T16:43:01+0000","start_day":"Thu","distance":"17,0","distance_raw":17022.2,"long_unit":"kilom\u00e8tres","short_unit":"km","moving_time":"1:04:10","moving_time_raw":3850,"elapsed_time":"1:08:51","elapsed_time_raw":4131,"trainer":false,"static_map":true,"show_elevation":true,"has_latlng":true,"commute":false,"elevation_gain":"48","elevation_unit":"m","elevation_gain_raw":48.0,"description":"","activity_url":"https://www.strava.com/activities/705118424","activity_url_for_twitter":"https://www.strava.com/activities/705118424?utm_content=2470979\u0026utm_medium=referral\u0026utm_source=twitter","twitter_msg":"a parcouru 17,0 kilom\u00e8tre sur Sortie \u00e0 v\u00e9lo.","is_new":false,"is_changing_type":false,"suffer_score":null,"calories":225.649691575,"feed_data":{"entries":[]},"workout_type":10,"flagged":false,"hide_power":false,"hide_heartrate":false},{"id":703993615,"name":"Reprise avec Florent et mon poignet en carton","emoji_name":"Reprise avec Florent et mon poignet en carton","type":"Ride","display_type":"Sortie \u00e0 v\u00e9lo","activity_type_display_name":"Sortie \u00e0 v\u00e9lo","private":false,"bike_id":2042105,"athlete_gear_id":null,"start_date":"mer. 7/9/2016","start_date_local_raw":1473273305,"start_time":"2016-09-07T16:35:05+0000","start_day":"Wed","distance":"34,4","distance_raw":34490.6,"long_unit":"kilom\u00e8tres","short_unit":"km","moving_time":"1:33:27","moving_time_raw":5607,"elapsed_time":"1:34:33","elapsed_time_raw":5673,"trainer":false,"static_map":true,"show_elevation":true,"has_latlng":true,"commute":false,"elevation_gain":"509","elevation_unit":"m","elevation_gain_raw":509.0,"description":"","activity_url":"https://www.strava.com/activities/703993615","activity_url_for_twitter":"https://www.strava.com/activities/703993615?utm_content=2470979\u0026utm_medium=referral\u0026utm_source=twitter","twitter_msg":"a parcouru 34,4 kilom\u00e8tre sur Sortie \u00e0 v\u00e9lo.","is_new":false,"is_changing_type":false,"suffer_score":null,"calories":868.3757145000001,"feed_data":{"entries":[]},"workout_type":10,"flagged":false,"hide_power":false,"hide_heartrate":false},{"id":700301520,"name":"Baladinette","emoji_name":"Baladinette","type":"Ride","display_type":"Sortie \u00e0 v\u00e9lo","activity_type_display_name":"Sortie \u00e0 v\u00e9lo","private":false,"bike_id":824309,"athlete_gear_id":null,"start_date":"dim. 4/9/2016","start_date_local_raw":1473002921,"start_time":"2016-09-04T13:28:41+0000","start_day":"Sun","distance":"18,5","distance_raw":18538.0,"long_unit":"kilom\u00e8tres","short_unit":"km","moving_time":"1:03:36","moving_time_raw":3816,"elapsed_time":"1:05:00","elapsed_time_raw":3900,"trainer":false,"static_map":true,"show_elevation":true,"has_latlng":true,"commute":false,"elevation_gain":"43","elevation_unit":"m","elevation_gain_raw":43.0,"description":"","activity_url":"https://www.strava.com/activities/700301520","activity_url_for_twitter":"https://www.strava.com/activities/700301520?utm_content=2470979\u0026utm_medium=referral\u0026utm_source=twitter","twitter_msg":"a parcouru 18,5 kilom\u00e8tre sur Sortie \u00e0 v\u00e9lo.","is_new":false,"is_changing_type":false,"suffer_score":null,"calories":246.58627381200003,"feed_data":{"entries":[]},"workout_type":10,"flagged":false,"hide_power":false,"hide_heartrate":false},{"id":687620700,"name":"Evening Ride","emoji_name":"Evening Ride","type":"Ride","display_type":"Sortie \u00e0 v\u00e9lo","activity_type_display_name":"Sortie \u00e0 v\u00e9lo","private":true,"bike_id":2042105,"athlete_gear_id":null,"start_date":"mer. 24/8/2016","start_date_local_raw":1472062129,"start_time":"2016-08-24T16:08:49+0000","start_day":"Wed","distance":"50,7","distance_raw":50700.2,"long_unit":"kilom\u00e8tres","short_unit":"km","moving_time":"1:54:13","moving_time_raw":6853,"elapsed_time":"2:00:47","elapsed_time_raw":7247,"trainer":false,"static_map":true,"show_elevation":true,"has_latlng":true,"commute":false,"elevation_gain":"104","elevation_unit":"m","elevation_gain_raw":104.0,"description":"","activity_url":"https://www.strava.com/activities/687620700","activity_url_for_twitter":"https://www.strava.com/activities/687620700?utm_content=2470979\u0026utm_medium=referral\u0026utm_source=twitter","twitter_msg":"a parcouru 50,7 kilom\u00e8tre sur Sortie \u00e0 v\u00e9lo.","is_new":false,"is_changing_type":false,"suffer_score":null,"calories":956.2066283,"feed_data":{"entries":[]},"workout_type":10,"flagged":false,"hide_power":false,"hide_heartrate":false},{"id":685081571,"name":"Test Ant+ app Android","emoji_name":"Test Ant+ app Android","type":"Ride","display_type":"Sortie \u00e0 v\u00e9lo","activity_type_display_name":"Sortie \u00e0 v\u00e9lo","private":true,"bike_id":824309,"athlete_gear_id":null,"start_date":"lun. 22/8/2016","start_date_local_raw":1471890175,"start_time":"2016-08-22T16:22:55+0000","start_day":"Mon","distance":"16,9","distance_raw":16917.3,"long_unit":"kilom\u00e8tres","short_unit":"km","moving_time":"57:17","moving_time_raw":3437,"elapsed_time":"58:58","elapsed_time_raw":3538,"trainer":false,"static_map":true,"show_elevation":true,"has_latlng":true,"commute":false,"elevation_gain":"30","elevation_unit":"m","elevation_gain_raw":30.4762,"description":null,"activity_url":"https://www.strava.com/activities/685081571","activity_url_for_twitter":"https://www.strava.com/activities/685081571?utm_content=2470979\u0026utm_medium=referral\u0026utm_source=twitter","twitter_msg":"a parcouru 16,9 kilom\u00e8tre sur Sortie \u00e0 v\u00e9lo.","is_new":false,"is_changing_type":false,"suffer_score":null,"calories":334.191030824,"feed_data":{"entries":[]},"workout_type":10,"flagged":false,"hide_power":false,"hide_heartrate":false},{"id":684099116,"name":"Balade","emoji_name":"Balade","type":"Hike","display_type":"Randonn\u00e9e","activity_type_display_name":"Randonn\u00e9e","private":false,"bike_id":null,"athlete_gear_id":1022094,"start_date":"dim. 21/8/2016","start_date_local_raw":1471802889,"start_time":"2016-08-21T16:08:09+0000","start_day":"Sun","distance":"3,0","distance_raw":3070.5,"long_unit":"kilom\u00e8tres","short_unit":"km","moving_time":"1:03:47","moving_time_raw":3827,"elapsed_time":"1:22:17","elapsed_time_raw":4937,"trainer":false,"static_map":true,"show_elevation":true,"has_latlng":true,"commute":false,"elevation_gain":"288","elevation_unit":"m","elevation_gain_raw":287.8,"description":"","activity_url":"https://www.strava.com/activities/684099116","activity_url_for_twitter":"https://www.strava.com/activities/684099116?utm_content=2470979\u0026utm_medium=referral\u0026utm_source=twitter","twitter_msg":"a parcouru 3,0 kilom\u00e8tre sur Randonn\u00e9e.","is_new":false,"is_changing_type":false,"suffer_score":null,"calories":271.63165968000004,"feed_data":{"entries":[]},"workout_type":null,"flagged":false,"hide_power":false,"hide_heartrate":false},{"id":675927371,"name":"Afternoon Ride","emoji_name":"Afternoon Ride","type":"Ride","display_type":"Entra\u00eenement","activity_type_display_name":"Sortie \u00e0 v\u00e9lo","private":false,"bike_id":2042105,"athlete_gear_id":null,"start_date":"dim. 14/8/2016","start_date_local_raw":1471191241,"start_time":"2016-08-14T14:14:01+0000","start_day":"Sun","distance":"43,7","distance_raw":43760.3,"long_unit":"kilom\u00e8tres","short_unit":"km","moving_time":"1:48:23","moving_time_raw":6503,"elapsed_time":"2:03:24","elapsed_time_raw":7404,"trainer":false,"static_map":true,"show_elevation":true,"has_latlng":true,"commute":false,"elevation_gain":"559","elevation_unit":"m","elevation_gain_raw":559.0,"description":"","activity_url":"https://www.strava.com/activities/675927371","activity_url_for_twitter":"https://www.strava.com/activities/675927371?utm_content=2470979\u0026utm_medium=referral\u0026utm_source=twitter","twitter_msg":"a parcouru 43,7 kilom\u00e8tre sur Sortie \u00e0 v\u00e9lo.","is_new":false,"is_changing_type":false,"suffer_score":null,"calories":1104.862008565,"feed_data":{"entries":[]},"workout_type":12,"flagged":false,"hide_power":false,"hide_heartrate":false},{"id":666600070,"name":"Balcons de Belledonne avec Aur\u00e9lie. EZ !","emoji_name":"Balcons de Belledonne avec Aur\u00e9lie. EZ !","type":"Ride","display_type":"Sortie \u00e0 v\u00e9lo","activity_type_display_name":"Sortie \u00e0 v\u00e9lo","private":false,"bike_id":2042105,"athlete_gear_id":null,"start_date":"sam. 6/8/2016","start_date_local_raw":1470489349,"start_time":"2016-08-06T11:15:49+0000","start_day":"Sat","distance":"63,2","distance_raw":63259.9,"long_unit":"kilom\u00e8tres","short_unit":"km","moving_time":"3:46:45","moving_time_raw":13605,"elapsed_time":"4:17:09","elapsed_time_raw":15429,"trainer":false,"static_map":true,"show_elevation":true,"has_latlng":true,"commute":false,"elevation_gain":"1\u00a0050","elevation_unit":"m","elevation_gain_raw":1050.0,"description":"","activity_url":"https://www.strava.com/activities/666600070","activity_url_for_twitter":"https://www.strava.com/activities/666600070?utm_content=2470979\u0026utm_medium=referral\u0026utm_source=twitter","twitter_msg":"a parcouru 63,2 kilom\u00e8tre sur Sortie \u00e0 v\u00e9lo.","is_new":false,"is_changing_type":false,"suffer_score":null,"calories":1433.4474726674998,"feed_data":{"entries":[]},"workout_type":10,"flagged":false,"hide_power":false,"hide_heartrate":false},{"id":661113141,"name":"Reprise apr\u00e8s vacances","emoji_name":"Reprise apr\u00e8s vacances","type":"Ride","display_type":"Entra\u00eenement","activity_type_display_name":"Sortie \u00e0 v\u00e9lo","private":false,"bike_id":2042105,"athlete_gear_id":null,"start_date":"lun. 1/8/2016","start_date_local_raw":1470076570,"start_time":"2016-08-01T16:36:10+0000","start_day":"Mon","distance":"31,6","distance_raw":31682.3,"long_unit":"kilom\u00e8tres","short_unit":"km","moving_time":"1:22:48","moving_time_raw":4968,"elapsed_time":"1:25:19","elapsed_time_raw":5119,"trainer":false,"static_map":true,"show_elevation":true,"has_latlng":true,"commute":false,"elevation_gain":"502","elevation_unit":"m","elevation_gain_raw":502.0,"description":"","activity_url":"https://www.strava.com/activities/661113141","activity_url_for_twitter":"https://www.strava.com/activities/661113141?utm_content=2470979\u0026utm_medium=referral\u0026utm_source=twitter","twitter_msg":"a parcouru 31,6 kilom\u00e8tre sur Sortie \u00e0 v\u00e9lo.","is_new":false,"is_changing_type":false,"suffer_score":null,"calories":784.5615882,"feed_data":{"entries":[]},"workout_type":12,"flagged":false,"hide_power":false,"hide_heartrate":false},{"id":657225503,"name":"Hardtail Galibier Downhill","emoji_name":"Hardtail Galibier Downhill","type":"Ride","display_type":"Sortie \u00e0 v\u00e9lo","activity_type_display_name":"Sortie \u00e0 v\u00e9lo","private":false,"bike_id":1493775,"athlete_gear_id":null,"start_date":"ven. 29/7/2016","start_date_local_raw":1469785882,"start_time":"2016-07-29T07:51:22+0000","start_day":"Fri","distance":"23,5","distance_raw":23556.3,"long_unit":"kilom\u00e8tres","short_unit":"km","moving_time":"1:15:41","moving_time_raw":4541,"elapsed_time":"1:57:21","elapsed_time_raw":7041,"trainer":false,"static_map":true,"show_elevation":true,"has_latlng":true,"commute":false,"elevation_gain":"23","elevation_unit":"m","elevation_gain_raw":23.0,"description":" + Story at http://storyteller.fit/story/142","activity_url":"https://www.strava.com/activities/657225503","activity_url_for_twitter":"https://www.strava.com/activities/657225503?utm_content=2470979\u0026utm_medium=referral\u0026utm_source=twitter","twitter_msg":"a parcouru 23,5 kilom\u00e8tre sur Sortie \u00e0 v\u00e9lo.","is_new":false,"is_changing_type":false,"suffer_score":null,"calories":206.4571485185,"feed_data":{"entries":[]},"workout_type":10,"flagged":false,"hide_power":false,"hide_heartrate":false}],"page":1,"perPage":20,"total":592}