{"models":[{"id":431449241,"name":"Zwift - Watopia 11/12/2015","emoji_name":"Zwift - Watopia 11/12/2015","type":"VirtualRide","display_type":"Virtual Ride","activity_type_display_name":"Virtual Ride","private":false,"bike_id":2179055,"athlete_gear_id":null,"start_date":"Thu, 11/12/2015","start_date_local_raw":1447353611,"start_time":"2015-11-12T17:40:11+0000","start_day":"Thu","distance":"19.0","distance_raw":19097.1,"long_unit":"kilometers","short_unit":"km","moving_time":"38:56","moving_time_raw":2336,"elapsed_time":"40:31","elapsed_time_raw":2431,"trainer":false,"static_map":true,"show_elevation":true,"has_latlng":true,"commute":false,"elevation_gain":"218","elevation_unit":"m","elevation_gain_raw":218.0,"description":"","activity_url":"https://www.strava.com/activities/431449241","activity_url_for_twitter":"https://www.strava.com/activities/431449241?utm_content=2470979\u0026utm_medium=referral\u0026utm_source=twitter","twitter_msg":"went for a 19.0 kilometer road ride.","is_new":false,"is_changing_type":false,"suffer_score":null,"calories":378.89437616,"feed_data":{"entries":[]},"workout_type":null,"flagged":false,"hide_power":false,"hide_heartrate":false},{"id":431464624,"name":"Zwift - Watopia 11/12/2015 // Cut // Crashed app","emoji_name":"Zwift - Watopia 11/12/2015 // Cut // Crashed app","type":"VirtualRide","display_type":"Virtual Ride","activity_type_display_name":"Virtual Ride","private":false,"bike_id":2179055,"athlete_gear_id":null,"start_date":"Thu, 11/12/2015","start_date_local_raw":1447351926,"start_time":"2015-11-12T17:12:06+0000","start_day":"Thu","distance":"8.9","distance_raw":8989.7,"long_unit":"kilometers","short_unit":"km","moving_time":"17:30","moving_time_raw":1050,"elapsed_time":"20:43","elapsed_time_raw":1243,"trainer":false,"static_map":true,"show_elevation":true,"has_latlng":true,"commute":false,"elevation_gain":"101","elevation_unit":"m","elevation_gain_raw":100.8,"description":"","activity_url":"https://www.strava.com/activities/431464624","activity_url_for_twitter":"https://www.strava.com/activities/431464624?utm_content=2470979\u0026utm_medium=referral\u0026utm_source=twitter","twitter_msg":"went for a 8.9 kilometer road ride.","is_new":false,"is_changing_type":false,"suffer_score":null,"calories":205.85531400000002,"feed_data":{"entries":[]},"workout_type":null,"flagged":false,"hide_power":false,"hide_heartrate":false},{"id":430765595,"name":"Afternoon Ride","emoji_name":"Afternoon Ride","type":"Ride","display_type":"Ride","activity_type_display_name":"Ride","private":false,"bike_id":2042105,"athlete_gear_id":null,"start_date":"Wed, 11/11/2015","start_date_local_raw":1447252145,"start_time":"2015-11-11T13:29:05+0000","start_day":"Wed","distance":"31.7","distance_raw":31756.3,"long_unit":"kilometers","short_unit":"km","moving_time":"1:22:39","moving_time_raw":4959,"elapsed_time":"1:25:18","elapsed_time_raw":5118,"trainer":false,"static_map":true,"show_elevation":true,"has_latlng":true,"commute":false,"elevation_gain":"549","elevation_unit":"m","elevation_gain_raw":549.0,"description":null,"activity_url":"https://www.strava.com/activities/430765595","activity_url_for_twitter":"https://www.strava.com/activities/430765595?utm_content=2470979\u0026utm_medium=referral\u0026utm_source=twitter","twitter_msg":"went for a 31.7 kilometer road ride.","is_new":true,"is_changing_type":false,"suffer_score":null,"calories":864.2161869299999,"feed_data":{"entries":[]},"workout_type":null,"flagged":false,"hide_power":false,"hide_heartrate":false},{"id":430204077,"name":"Zwift - Richmond, VA - FTP Test (shorter)","emoji_name":"Zwift - Richmond, VA - FTP Test (shorter)","type":"VirtualRide","display_type":"Virtual Ride","activity_type_display_name":"Virtual Ride","private":false,"bike_id":2179055,"athlete_gear_id":null,"start_date":"Tue, 11/10/2015","start_date_local_raw":1447179764,"start_time":"2015-11-10T17:22:44+0000","start_day":"Tue","distance":"20.9","distance_raw":20933.4,"long_unit":"kilometers","short_unit":"km","moving_time":"45:32","moving_time_raw":2732,"elapsed_time":"45:32","elapsed_time_raw":2732,"trainer":false,"static_map":true,"show_elevation":true,"has_latlng":true,"commute":false,"elevation_gain":"144","elevation_unit":"m","elevation_gain_raw":144.0,"description":"","activity_url":"https://www.strava.com/activities/430204077","activity_url_for_twitter":"https://www.strava.com/activities/430204077?utm_content=2470979\u0026utm_medium=referral\u0026utm_source=twitter","twitter_msg":"went for a 20.9 kilometer road ride.","is_new":false,"is_changing_type":false,"suffer_score":null,"calories":450.4447289600001,"feed_data":{"entries":[]},"workout_type":null,"flagged":false,"hide_power":false,"hide_heartrate":false},{"id":429628737,"name":"Zwift - Richmond, VA 11/09/2015","emoji_name":"Zwift - Richmond, VA 11/09/2015","type":"VirtualRide","display_type":"Virtual Ride","activity_type_display_name":"Virtual Ride","private":false,"bike_id":2179055,"athlete_gear_id":null,"start_date":"Mon, 11/9/2015","start_date_local_raw":1447093479,"start_time":"2015-11-09T17:24:39+0000","start_day":"Mon","distance":"28.9","distance_raw":28998.8,"long_unit":"kilometers","short_unit":"km","moving_time":"1:01:09","moving_time_raw":3669,"elapsed_time":"1:01:09","elapsed_time_raw":3669,"trainer":false,"static_map":true,"show_elevation":true,"has_latlng":true,"commute":false,"elevation_gain":"166","elevation_unit":"m","elevation_gain_raw":166.0,"description":"","activity_url":"https://www.strava.com/activities/429628737","activity_url_for_twitter":"https://www.strava.com/activities/429628737?utm_content=2470979\u0026utm_medium=referral\u0026utm_source=twitter","twitter_msg":"went for a 28.9 kilometer road ride.","is_new":false,"is_changing_type":false,"suffer_score":null,"calories":598.81470156,"feed_data":{"entries":[]},"workout_type":null,"flagged":false,"hide_power":false,"hide_heartrate":false},{"id":429009625,"name":"86k","emoji_name":"86k","type":"Ride","display_type":"Ride","activity_type_display_name":"Ride","private":false,"bike_id":2042105,"athlete_gear_id":null,"start_date":"Sun, 11/8/2015","start_date_local_raw":1446992101,"start_time":"2015-11-08T13:15:01+0000","start_day":"Sun","distance":"86.5","distance_raw":86591.7,"long_unit":"kilometers","short_unit":"km","moving_time":"3:00:01","moving_time_raw":10801,"elapsed_time":"3:03:41","elapsed_time_raw":11021,"trainer":false,"static_map":true,"show_elevation":true,"has_latlng":true,"commute":false,"elevation_gain":"172","elevation_unit":"m","elevation_gain_raw":172.0,"description":"","activity_url":"https://www.strava.com/activities/429009625","activity_url_for_twitter":"https://www.strava.com/activities/429009625?utm_content=2470979\u0026utm_medium=referral\u0026utm_source=twitter","twitter_msg":"went for a 86.5 kilometer road ride.","is_new":false,"is_changing_type":false,"suffer_score":null,"calories":1711.59159003,"feed_data":{"entries":[]},"workout_type":null,"flagged":false,"hide_power":false,"hide_heartrate":false},{"id":428142857,"name":"Afternoon Ride","emoji_name":"Afternoon Ride","type":"Ride","display_type":"Ride","activity_type_display_name":"Ride","private":false,"bike_id":2042105,"athlete_gear_id":null,"start_date":"Sat, 11/7/2015","start_date_local_raw":1446908086,"start_time":"2015-11-07T13:54:46+0000","start_day":"Sat","distance":"34.0","distance_raw":34069.8,"long_unit":"kilometers","short_unit":"km","moving_time":"1:30:07","moving_time_raw":5407,"elapsed_time":"1:31:21","elapsed_time_raw":5481,"trainer":false,"static_map":true,"show_elevation":true,"has_latlng":true,"commute":false,"elevation_gain":"545","elevation_unit":"m","elevation_gain_raw":545.0,"description":null,"activity_url":"https://www.strava.com/activities/428142857","activity_url_for_twitter":"https://www.strava.com/activities/428142857?utm_content=2470979\u0026utm_medium=referral\u0026utm_source=twitter","twitter_msg":"went for a 34.0 kilometer road ride.","is_new":true,"is_changing_type":false,"suffer_score":null,"calories":850.272513175,"feed_data":{"entries":[]},"workout_type":null,"flagged":false,"hide_power":false,"hide_heartrate":false},{"id":427606185,"name":"1st zwift ride","emoji_name":"1st zwift ride","type":"VirtualRide","display_type":"Virtual Ride","activity_type_display_name":"Virtual Ride","private":false,"bike_id":2179055,"athlete_gear_id":null,"start_date":"Fri, 11/6/2015","start_date_local_raw":1446834689,"start_time":"2015-11-06T17:31:29+0000","start_day":"Fri","distance":"11.0","distance_raw":11051.3,"long_unit":"kilometers","short_unit":"km","moving_time":"30:13","moving_time_raw":1813,"elapsed_time":"30:13","elapsed_time_raw":1813,"trainer":false,"static_map":true,"show_elevation":true,"has_latlng":true,"commute":false,"elevation_gain":"160","elevation_unit":"m","elevation_gain_raw":160.0,"description":"","activity_url":"https://www.strava.com/activities/427606185","activity_url_for_twitter":"https://www.strava.com/activities/427606185?utm_content=2470979\u0026utm_medium=referral\u0026utm_source=twitter","twitter_msg":"went for a 11.0 kilometer road ride.","is_new":false,"is_changing_type":false,"suffer_score":null,"calories":241.81931788,"feed_data":{"entries":[]},"workout_type":null,"flagged":false,"hide_power":false,"hide_heartrate":false},{"id":424565561,"name":"Chartreuse Rousse et Herbe fluo !!","emoji_name":"Chartreuse Rousse et Herbe fluo !!","type":"Ride","display_type":"Ride","activity_type_display_name":"Ride","private":false,"bike_id":2042105,"athlete_gear_id":null,"start_date":"Sun, 11/1/2015","start_date_local_raw":1446385117,"start_time":"2015-11-01T12:38:37+0000","start_day":"Sun","distance":"78.3","distance_raw":78345.7,"long_unit":"kilometers","short_unit":"km","moving_time":"3:42:02","moving_time_raw":13322,"elapsed_time":"4:00:27","elapsed_time_raw":14427,"trainer":false,"static_map":true,"show_elevation":true,"has_latlng":true,"commute":false,"elevation_gain":"1,321","elevation_unit":"m","elevation_gain_raw":1321.0,"description":"","activity_url":"https://www.strava.com/activities/424565561","activity_url_for_twitter":"https://www.strava.com/activities/424565561?utm_content=2470979\u0026utm_medium=referral\u0026utm_source=twitter","twitter_msg":"went for a 78.3 kilometer road ride.","is_new":false,"is_changing_type":false,"suffer_score":null,"calories":1995.4309740800002,"feed_data":{"entries":[]},"workout_type":null,"flagged":false,"hide_power":false,"hide_heartrate":false},{"id":423706687,"name":"Couleurs d'Automne","emoji_name":"Couleurs d'Automne","type":"Ride","display_type":"Ride","activity_type_display_name":"Ride","private":false,"bike_id":2042105,"athlete_gear_id":null,"start_date":"Sat, 10/31/2015","start_date_local_raw":1446292408,"start_time":"2015-10-31T10:53:28+0000","start_day":"Sat","distance":"66.1","distance_raw":66132.7,"long_unit":"kilometers","short_unit":"km","moving_time":"3:02:28","moving_time_raw":10948,"elapsed_time":"4:00:36","elapsed_time_raw":14436,"trainer":false,"static_map":true,"show_elevation":true,"has_latlng":true,"commute":false,"elevation_gain":"1,225","elevation_unit":"m","elevation_gain_raw":1225.0,"description":"","activity_url":"https://www.strava.com/activities/423706687","activity_url_for_twitter":"https://www.strava.com/activities/423706687?utm_content=2470979\u0026utm_medium=referral\u0026utm_source=twitter","twitter_msg":"went for a 66.1 kilometer road ride.","is_new":false,"is_changing_type":false,"suffer_score":null,"calories":1831.93190544,"feed_data":{"entries":[]},"workout_type":null,"flagged":false,"hide_power":false,"hide_heartrate":false},{"id":420778529,"name":"Morning Ride","emoji_name":"Morning Ride","type":"Ride","display_type":"Ride","activity_type_display_name":"Ride","private":false,"bike_id":2179055,"athlete_gear_id":null,"start_date":"Mon, 10/26/2015","start_date_local_raw":1445850474,"start_time":"2015-10-26T08:07:54+0000","start_day":"Mon","distance":"10.7","distance_raw":10749.2,"long_unit":"kilometers","short_unit":"km","moving_time":"27:49","moving_time_raw":1669,"elapsed_time":"8:35:49","elapsed_time_raw":30949,"trainer":false,"static_map":true,"show_elevation":true,"has_latlng":true,"commute":true,"elevation_gain":"75","elevation_unit":"m","elevation_gain_raw":75.0,"description":"","activity_url":"https://www.strava.com/activities/420778529","activity_url_for_twitter":"https://www.strava.com/activities/420778529?utm_content=2470979\u0026utm_medium=referral\u0026utm_source=twitter","twitter_msg":"commuted 10.7 kilometer by bike.","is_new":false,"is_changing_type":false,"suffer_score":null,"calories":193.535379065,"feed_data":{"entries":[]},"workout_type":null,"flagged":false,"hide_power":false,"hide_heartrate":false},{"id":420018674,"name":"Lunch Ride","emoji_name":"Lunch Ride","type":"Ride","display_type":"Ride","activity_type_display_name":"Ride","private":false,"bike_id":2179055,"athlete_gear_id":null,"start_date":"Sat, 10/24/2015","start_date_local_raw":1445690827,"start_time":"2015-10-24T10:47:07+0000","start_day":"Sat","distance":"8.8","distance_raw":8807.2,"long_unit":"kilometers","short_unit":"km","moving_time":"22:26","moving_time_raw":1346,"elapsed_time":"3:19:52","elapsed_time_raw":11992,"trainer":false,"static_map":true,"show_elevation":true,"has_latlng":true,"commute":true,"elevation_gain":"65","elevation_unit":"m","elevation_gain_raw":65.0,"description":"","activity_url":"https://www.strava.com/activities/420018674","activity_url_for_twitter":"https://www.strava.com/activities/420018674?utm_content=2470979\u0026utm_medium=referral\u0026utm_source=twitter","twitter_msg":"commuted 8.8 kilometer by bike.","is_new":false,"is_changing_type":false,"suffer_score":null,"calories":169.16904879999998,"feed_data":{"entries":[]},"workout_type":null,"flagged":false,"hide_power":false,"hide_heartrate":false},{"id":420020088,"name":"Lunch Ride","emoji_name":"Lunch Ride","type":"Ride","display_type":"Ride","activity_type_display_name":"Ride","private":false,"bike_id":2179055,"athlete_gear_id":null,"start_date":"Fri, 10/23/2015","start_date_local_raw":1445601529,"start_time":"2015-10-23T09:58:49+0000","start_day":"Fri","distance":"10.9","distance_raw":10935.3,"long_unit":"kilometers","short_unit":"km","moving_time":"30:33","moving_time_raw":1833,"elapsed_time":"5:45:48","elapsed_time_raw":20748,"trainer":false,"static_map":true,"show_elevation":true,"has_latlng":true,"commute":true,"elevation_gain":"62","elevation_unit":"m","elevation_gain_raw":62.0,"description":"","activity_url":"https://www.strava.com/activities/420020088","activity_url_for_twitter":"https://www.strava.com/activities/420020088?utm_content=2470979\u0026utm_medium=referral\u0026utm_source=twitter","twitter_msg":"commuted 10.9 kilometer by bike.","is_new":false,"is_changing_type":false,"suffer_score":null,"calories":199.9254575565,"feed_data":{"entries":[]},"workout_type":null,"flagged":false,"hide_power":false,"hide_heartrate":false},{"id":420019984,"name":"Morning Ride","emoji_name":"Morning Ride","type":"Ride","display_type":"Ride","activity_type_display_name":"Ride","private":false,"bike_id":2179055,"athlete_gear_id":null,"start_date":"Fri, 10/23/2015","start_date_local_raw":1445590812,"start_time":"2015-10-23T07:00:12+0000","start_day":"Fri","distance":"3.0","distance_raw":3003.3,"long_unit":"kilometers","short_unit":"km","moving_time":"7:45","moving_time_raw":465,"elapsed_time":"7:45","elapsed_time_raw":465,"trainer":false,"static_map":true,"show_elevation":true,"has_latlng":true,"commute":true,"elevation_gain":"8","elevation_unit":"m","elevation_gain_raw":8.0,"description":"","activity_url":"https://www.strava.com/activities/420019984","activity_url_for_twitter":"https://www.strava.com/activities/420019984?utm_content=2470979\u0026utm_medium=referral\u0026utm_source=twitter","twitter_msg":"commuted 3.0 kilometer by bike.","is_new":false,"is_changing_type":false,"suffer_score":null,"calories":43.6032808725,"feed_data":{"entries":[]},"workout_type":null,"flagged":false,"hide_power":false,"hide_heartrate":false},{"id":420019949,"name":"Morning Ride","emoji_name":"Morning Ride","type":"Ride","display_type":"Ride","activity_type_display_name":"Ride","private":false,"bike_id":2179055,"athlete_gear_id":null,"start_date":"Thu, 10/22/2015","start_date_local_raw":1445504790,"start_time":"2015-10-22T07:06:30+0000","start_day":"Thu","distance":"10.6","distance_raw":10642.1,"long_unit":"kilometers","short_unit":"km","moving_time":"29:28","moving_time_raw":1768,"elapsed_time":"8:44:17","elapsed_time_raw":31457,"trainer":false,"static_map":true,"show_elevation":true,"has_latlng":true,"commute":true,"elevation_gain":"64","elevation_unit":"m","elevation_gain_raw":64.0,"description":"","activity_url":"https://www.strava.com/activities/420019949","activity_url_for_twitter":"https://www.strava.com/activities/420019949?utm_content=2470979\u0026utm_medium=referral\u0026utm_source=twitter","twitter_msg":"commuted 10.6 kilometer by bike.","is_new":false,"is_changing_type":false,"suffer_score":null,"calories":191.92554674800002,"feed_data":{"entries":[]},"workout_type":null,"flagged":false,"hide_power":false,"hide_heartrate":false},{"id":417483106,"name":"Tafe","emoji_name":"Tafe","type":"Ride","display_type":"Ride","activity_type_display_name":"Ride","private":false,"bike_id":2179055,"athlete_gear_id":null,"start_date":"Wed, 10/21/2015","start_date_local_raw":1445418036,"start_time":"2015-10-21T07:00:36+0000","start_day":"Wed","distance":"12.0","distance_raw":12052.5,"long_unit":"kilometers","short_unit":"km","moving_time":"38:01","moving_time_raw":2281,"elapsed_time":"9:00:01","elapsed_time_raw":32401,"trainer":false,"static_map":true,"show_elevation":true,"has_latlng":true,"commute":true,"elevation_gain":"50","elevation_unit":"m","elevation_gain_raw":49.6433,"description":"","activity_url":"https://www.strava.com/activities/417483106","activity_url_for_twitter":"https://www.strava.com/activities/417483106?utm_content=2470979\u0026utm_medium=referral\u0026utm_source=twitter","twitter_msg":"commuted 12.0 kilometer by bike.","is_new":false,"is_changing_type":false,"suffer_score":null,"calories":259.563098955,"feed_data":{"entries":[]},"workout_type":null,"flagged":false,"hide_power":false,"hide_heartrate":false},{"id":420019810,"name":"Afternoon Ride","emoji_name":"Afternoon Ride","type":"Ride","display_type":"Ride","activity_type_display_name":"Ride","private":false,"bike_id":2179055,"athlete_gear_id":null,"start_date":"Sat, 10/17/2015","start_date_local_raw":1445098492,"start_time":"2015-10-17T14:14:52+0000","start_day":"Sat","distance":"4.5","distance_raw":4528.3,"long_unit":"kilometers","short_unit":"km","moving_time":"10:51","moving_time_raw":651,"elapsed_time":"10:51","elapsed_time_raw":651,"trainer":false,"static_map":true,"show_elevation":true,"has_latlng":true,"commute":true,"elevation_gain":"23","elevation_unit":"m","elevation_gain_raw":23.0,"description":"","activity_url":"https://www.strava.com/activities/420019810","activity_url_for_twitter":"https://www.strava.com/activities/420019810?utm_content=2470979\u0026utm_medium=referral\u0026utm_source=twitter","twitter_msg":"commuted 4.5 kilometer by bike.","is_new":false,"is_changing_type":false,"suffer_score":null,"calories":76.197678375,"feed_data":{"entries":[]},"workout_type":null,"flagged":false,"hide_power":false,"hide_heartrate":false},{"id":420019708,"name":"Lunch Ride","emoji_name":"Lunch Ride","type":"Ride","display_type":"Ride","activity_type_display_name":"Ride","private":false,"bike_id":2179055,"athlete_gear_id":null,"start_date":"Sat, 10/17/2015","start_date_local_raw":1445083136,"start_time":"2015-10-17T09:58:56+0000","start_day":"Sat","distance":"12.2","distance_raw":12223.4,"long_unit":"kilometers","short_unit":"km","moving_time":"27:39","moving_time_raw":1659,"elapsed_time":"27:39","elapsed_time_raw":1659,"trainer":false,"static_map":true,"show_elevation":true,"has_latlng":true,"commute":true,"elevation_gain":"57","elevation_unit":"m","elevation_gain_raw":57.0,"description":"","activity_url":"https://www.strava.com/activities/420019708","activity_url_for_twitter":"https://www.strava.com/activities/420019708?utm_content=2470979\u0026utm_medium=referral\u0026utm_source=twitter","twitter_msg":"commuted 12.2 kilometer by bike.","is_new":false,"is_changing_type":false,"suffer_score":null,"calories":256.733509935,"feed_data":{"entries":[]},"workout_type":null,"flagged":false,"hide_power":false,"hide_heartrate":false},{"id":420019631,"name":"Morning Ride","emoji_name":"Morning Ride","type":"Ride","display_type":"Ride","activity_type_display_name":"Ride","private":false,"bike_id":2179055,"athlete_gear_id":null,"start_date":"Sat, 10/17/2015","start_date_local_raw":1445078747,"start_time":"2015-10-17T08:45:47+0000","start_day":"Sat","distance":"6.3","distance_raw":6312.8,"long_unit":"kilometers","short_unit":"km","moving_time":"14:54","moving_time_raw":894,"elapsed_time":"16:02","elapsed_time_raw":962,"trainer":false,"static_map":true,"show_elevation":true,"has_latlng":true,"commute":true,"elevation_gain":"11","elevation_unit":"m","elevation_gain_raw":11.0,"description":"","activity_url":"https://www.strava.com/activities/420019631","activity_url_for_twitter":"https://www.strava.com/activities/420019631?utm_content=2470979\u0026utm_medium=referral\u0026utm_source=twitter","twitter_msg":"commuted 6.3 kilometer by bike.","is_new":false,"is_changing_type":false,"suffer_score":null,"calories":102.91963569,"feed_data":{"entries":[]},"workout_type":null,"flagged":false,"hide_power":false,"hide_heartrate":false},{"id":406963466,"name":"Evening Run","emoji_name":"Evening Run","type":"Run","display_type":"Workout","activity_type_display_name":"Run","private":false,"bike_id":null,"athlete_gear_id":1022094,"start_date":"Mon, 10/5/2015","start_date_local_raw":1444069912,"start_time":"2015-10-05T16:31:52+0000","start_day":"Mon","distance":"5.5","distance_raw":5547.8,"long_unit":"kilometers","short_unit":"km","moving_time":"38:22","moving_time_raw":2302,"elapsed_time":"45:52","elapsed_time_raw":2752,"trainer":false,"static_map":true,"show_elevation":true,"has_latlng":true,"commute":false,"elevation_gain":"34","elevation_unit":"m","elevation_gain_raw":33.6,"description":"","activity_url":"https://www.strava.com/activities/406963466","activity_url_for_twitter":"https://www.strava.com/activities/406963466?utm_content=2470979\u0026utm_medium=referral\u0026utm_source=twitter","twitter_msg":"went for a 5.5 kilometer Run.","is_new":false,"is_changing_type":false,"suffer_score":null,"calories":499.0554129600001,"feed_data":{"entries":[]},"workout_type":3,"flagged":false,"hide_power":false,"hide_heartrate":false}],"page":6,"perPage":20,"total":592}