{"models":[{"id":560069623,"name":"Chamrousse 1750","emoji_name":"Chamrousse 1750","type":"Ride","display_type":"Workout","activity_type_display_name":"Ride","private":false,"bike_id":2042105,"athlete_gear_id":null,"start_date":"Fri, 4/29/2016","start_date_local_raw":1461939995,"start_time":"2016-04-29T12:26:35+0000","start_day":"Fri","distance":"66.9","distance_raw":66983.0,"long_unit":"kilometers","short_unit":"km","moving_time":"3:12:37","moving_time_raw":11557,"elapsed_time":"3:33:30","elapsed_time_raw":12810,"trainer":false,"static_map":true,"show_elevation":true,"has_latlng":true,"commute":false,"elevation_gain":"1,578","elevation_unit":"m","elevation_gain_raw":1578.0,"description":"","activity_url":"https://www.strava.com/activities/560069623","activity_url_for_twitter":"https://www.strava.com/activities/560069623?utm_content=2470979\u0026utm_medium=referral\u0026utm_source=twitter","twitter_msg":"went for a 66.9 kilometer road ride.","is_new":false,"is_changing_type":false,"suffer_score":null,"calories":1983.3313832150002,"feed_data":{"entries":[]},"workout_type":12,"flagged":false,"hide_power":false,"hide_heartrate":false},{"id":559166446,"name":"Afternoon Ride","emoji_name":"Afternoon Ride","type":"Ride","display_type":"Workout","activity_type_display_name":"Ride","private":false,"bike_id":2042105,"athlete_gear_id":null,"start_date":"Thu, 4/28/2016","start_date_local_raw":1461856240,"start_time":"2016-04-28T13:10:40+0000","start_day":"Thu","distance":"33.5","distance_raw":33499.5,"long_unit":"kilometers","short_unit":"km","moving_time":"1:36:05","moving_time_raw":5765,"elapsed_time":"1:38:39","elapsed_time_raw":5919,"trainer":false,"static_map":true,"show_elevation":true,"has_latlng":true,"commute":false,"elevation_gain":"629","elevation_unit":"m","elevation_gain_raw":629.0,"description":"","activity_url":"https://www.strava.com/activities/559166446","activity_url_for_twitter":"https://www.strava.com/activities/559166446?utm_content=2470979\u0026utm_medium=referral\u0026utm_source=twitter","twitter_msg":"went for a 33.5 kilometer road ride.","is_new":false,"is_changing_type":false,"suffer_score":null,"calories":883.7887107250001,"feed_data":{"entries":[]},"workout_type":12,"flagged":false,"hide_power":false,"hide_heartrate":false},{"id":558458998,"name":"Ptits balcons de Belledonne","emoji_name":"Ptits balcons de Belledonne","type":"Ride","display_type":"Workout","activity_type_display_name":"Ride","private":false,"bike_id":2042105,"athlete_gear_id":null,"start_date":"Wed, 4/27/2016","start_date_local_raw":1461780265,"start_time":"2016-04-27T16:04:25+0000","start_day":"Wed","distance":"48.6","distance_raw":48655.3,"long_unit":"kilometers","short_unit":"km","moving_time":"2:06:09","moving_time_raw":7569,"elapsed_time":"2:12:39","elapsed_time_raw":7959,"trainer":false,"static_map":true,"show_elevation":true,"has_latlng":true,"commute":false,"elevation_gain":"916","elevation_unit":"m","elevation_gain_raw":916.0,"description":"","activity_url":"https://www.strava.com/activities/558458998","activity_url_for_twitter":"https://www.strava.com/activities/558458998?utm_content=2470979\u0026utm_medium=referral\u0026utm_source=twitter","twitter_msg":"went for a 48.6 kilometer road ride.","is_new":false,"is_changing_type":false,"suffer_score":null,"calories":1343.262671775,"feed_data":{"entries":[]},"workout_type":12,"flagged":false,"hide_power":false,"hide_heartrate":false},{"id":556443499,"name":"75k @ 31.5 KPH // 181 BPM","emoji_name":"75k @ 31.5 KPH // 181 BPM","type":"Ride","display_type":"Workout","activity_type_display_name":"Ride","private":false,"bike_id":2042105,"athlete_gear_id":null,"start_date":"Mon, 4/25/2016","start_date_local_raw":1461594377,"start_time":"2016-04-25T12:26:17+0000","start_day":"Mon","distance":"75.0","distance_raw":75017.3,"long_unit":"kilometers","short_unit":"km","moving_time":"2:22:48","moving_time_raw":8568,"elapsed_time":"2:25:41","elapsed_time_raw":8741,"trainer":false,"static_map":true,"show_elevation":true,"has_latlng":true,"commute":false,"elevation_gain":"578","elevation_unit":"m","elevation_gain_raw":578.0,"description":"","activity_url":"https://www.strava.com/activities/556443499","activity_url_for_twitter":"https://www.strava.com/activities/556443499?utm_content=2470979\u0026utm_medium=referral\u0026utm_source=twitter","twitter_msg":"went for a 75.0 kilometer road ride.","is_new":false,"is_changing_type":false,"suffer_score":null,"calories":1891.9872593999999,"feed_data":{"entries":[]},"workout_type":12,"flagged":false,"hide_power":false,"hide_heartrate":false},{"id":555456547,"name":"80k. Climb Challenge Done.","emoji_name":"80k. Climb Challenge Done.","type":"Ride","display_type":"Workout","activity_type_display_name":"Ride","private":false,"bike_id":2042105,"athlete_gear_id":null,"start_date":"Sun, 4/24/2016","start_date_local_raw":1461505033,"start_time":"2016-04-24T11:37:13+0000","start_day":"Sun","distance":"81.7","distance_raw":81723.6,"long_unit":"kilometers","short_unit":"km","moving_time":"3:05:53","moving_time_raw":11153,"elapsed_time":"3:13:52","elapsed_time_raw":11632,"trainer":false,"static_map":true,"show_elevation":true,"has_latlng":true,"commute":false,"elevation_gain":"856","elevation_unit":"m","elevation_gain_raw":856.0,"description":"","activity_url":"https://www.strava.com/activities/555456547","activity_url_for_twitter":"https://www.strava.com/activities/555456547?utm_content=2470979\u0026utm_medium=referral\u0026utm_source=twitter","twitter_msg":"went for a 81.7 kilometer road ride.","is_new":false,"is_changing_type":false,"suffer_score":null,"calories":2033.1078621450001,"feed_data":{"entries":[]},"workout_type":12,"flagged":false,"hide_power":false,"hide_heartrate":false},{"id":553573871,"name":"Zwift Session","emoji_name":"Zwift Session","type":"VirtualRide","display_type":"Virtual Ride","activity_type_display_name":"Virtual Ride","private":false,"bike_id":null,"athlete_gear_id":null,"start_date":"Fri, 4/22/2016","start_date_local_raw":1461350653,"start_time":"2016-04-22T16:44:13+0000","start_day":"Fri","distance":"28.6","distance_raw":28602.9,"long_unit":"kilometers","short_unit":"km","moving_time":"1:03:09","moving_time_raw":3789,"elapsed_time":"1:03:09","elapsed_time_raw":3789,"trainer":false,"static_map":true,"show_elevation":true,"has_latlng":true,"commute":false,"elevation_gain":"262","elevation_unit":"m","elevation_gain_raw":262.0,"description":"","activity_url":"https://www.strava.com/activities/553573871","activity_url_for_twitter":"https://www.strava.com/activities/553573871?utm_content=2470979\u0026utm_medium=referral\u0026utm_source=twitter","twitter_msg":"went for a 28.6 kilometer Virtual Ride.","is_new":false,"is_changing_type":false,"suffer_score":null,"calories":599.426525475,"feed_data":{"entries":[]},"workout_type":null,"flagged":false,"hide_power":false,"hide_heartrate":false},{"id":552562511,"name":"Pererree 1.4","emoji_name":"Pererree 1.4","type":"Ride","display_type":"Workout","activity_type_display_name":"Ride","private":false,"bike_id":2042105,"athlete_gear_id":null,"start_date":"Thu, 4/21/2016","start_date_local_raw":1461262814,"start_time":"2016-04-21T16:20:14+0000","start_day":"Thu","distance":"31.6","distance_raw":31607.8,"long_unit":"kilometers","short_unit":"km","moving_time":"1:16:48","moving_time_raw":4608,"elapsed_time":"1:17:51","elapsed_time_raw":4671,"trainer":false,"static_map":true,"show_elevation":true,"has_latlng":true,"commute":false,"elevation_gain":"538","elevation_unit":"m","elevation_gain_raw":538.0,"description":"","activity_url":"https://www.strava.com/activities/552562511","activity_url_for_twitter":"https://www.strava.com/activities/552562511?utm_content=2470979\u0026utm_medium=referral\u0026utm_source=twitter","twitter_msg":"went for a 31.6 kilometer road ride.","is_new":false,"is_changing_type":false,"suffer_score":null,"calories":873.6673305600001,"feed_data":{"entries":[]},"workout_type":12,"flagged":false,"hide_power":false,"hide_heartrate":false},{"id":551497751,"name":"Perreree 1.3","emoji_name":"Perreree 1.3","type":"Ride","display_type":"Ride","activity_type_display_name":"Ride","private":false,"bike_id":2042105,"athlete_gear_id":null,"start_date":"Wed, 4/20/2016","start_date_local_raw":1461175663,"start_time":"2016-04-20T16:07:43+0000","start_day":"Wed","distance":"38.0","distance_raw":38007.5,"long_unit":"kilometers","short_unit":"km","moving_time":"1:29:46","moving_time_raw":5386,"elapsed_time":"1:30:15","elapsed_time_raw":5415,"trainer":false,"static_map":true,"show_elevation":true,"has_latlng":true,"commute":false,"elevation_gain":"575","elevation_unit":"m","elevation_gain_raw":575.0,"description":"","activity_url":"https://www.strava.com/activities/551497751","activity_url_for_twitter":"https://www.strava.com/activities/551497751?utm_content=2470979\u0026utm_medium=referral\u0026utm_source=twitter","twitter_msg":"went for a 38.0 kilometer road ride.","is_new":false,"is_changing_type":false,"suffer_score":null,"calories":1031.47978101,"feed_data":{"entries":[]},"workout_type":null,"flagged":false,"hide_power":false,"hide_heartrate":false},{"id":549238663,"name":"120k with froozen feet \u0026 rain ! Strong race with a doe !","emoji_name":"120k with froozen feet \u0026 rain ! Strong race with a doe !","type":"Ride","display_type":"Workout","activity_type_display_name":"Ride","private":false,"bike_id":2042105,"athlete_gear_id":null,"start_date":"Mon, 4/18/2016","start_date_local_raw":1460980977,"start_time":"2016-04-18T10:02:57+0000","start_day":"Mon","distance":"122.5","distance_raw":122555.0,"long_unit":"kilometers","short_unit":"km","moving_time":"4:17:34","moving_time_raw":15454,"elapsed_time":"4:56:21","elapsed_time_raw":17781,"trainer":false,"static_map":true,"show_elevation":true,"has_latlng":true,"commute":false,"elevation_gain":"505","elevation_unit":"m","elevation_gain_raw":505.0,"description":"","activity_url":"https://www.strava.com/activities/549238663","activity_url_for_twitter":"https://www.strava.com/activities/549238663?utm_content=2470979\u0026utm_medium=referral\u0026utm_source=twitter","twitter_msg":"went for a 122.5 kilometer road ride.","is_new":false,"is_changing_type":false,"suffer_score":null,"calories":2583.5442401399996,"feed_data":{"entries":[]},"workout_type":12,"flagged":false,"hide_power":false,"hide_heartrate":false},{"id":547228287,"name":"No punctures ! Woow !","emoji_name":"No punctures ! Woow !","type":"Ride","display_type":"Ride","activity_type_display_name":"Ride","private":false,"bike_id":2042105,"athlete_gear_id":null,"start_date":"Sat, 4/16/2016","start_date_local_raw":1460823350,"start_time":"2016-04-16T14:15:50+0000","start_day":"Sat","distance":"75.3","distance_raw":75337.0,"long_unit":"kilometers","short_unit":"km","moving_time":"2:56:36","moving_time_raw":10596,"elapsed_time":"3:02:48","elapsed_time_raw":10968,"trainer":false,"static_map":true,"show_elevation":true,"has_latlng":true,"commute":false,"elevation_gain":"679","elevation_unit":"m","elevation_gain_raw":679.0,"description":"","activity_url":"https://www.strava.com/activities/547228287","activity_url_for_twitter":"https://www.strava.com/activities/547228287?utm_content=2470979\u0026utm_medium=referral\u0026utm_source=twitter","twitter_msg":"went for a 75.3 kilometer road ride.","is_new":false,"is_changing_type":false,"suffer_score":null,"calories":1877.8029876,"feed_data":{"entries":[]},"workout_type":10,"flagged":false,"hide_power":false,"hide_heartrate":false},{"id":545304771,"name":"Roule et cr\u00e8ve ! All\u00e9 je change ce pneu de merde !","emoji_name":"Roule et cr\u00e8ve ! All\u00e9 je change ce pneu de merde !","type":"Ride","display_type":"Ride","activity_type_display_name":"Ride","private":false,"bike_id":2042105,"athlete_gear_id":null,"start_date":"Thu, 4/14/2016","start_date_local_raw":1460657826,"start_time":"2016-04-14T16:17:06+0000","start_day":"Thu","distance":"8.4","distance_raw":8443.6,"long_unit":"kilometers","short_unit":"km","moving_time":"18:16","moving_time_raw":1096,"elapsed_time":"29:42","elapsed_time_raw":1782,"trainer":false,"static_map":true,"show_elevation":true,"has_latlng":true,"commute":false,"elevation_gain":"29","elevation_unit":"m","elevation_gain_raw":29.0,"description":"","activity_url":"https://www.strava.com/activities/545304771","activity_url_for_twitter":"https://www.strava.com/activities/545304771?utm_content=2470979\u0026utm_medium=referral\u0026utm_source=twitter","twitter_msg":"went for a 8.4 kilometer road ride.","is_new":false,"is_changing_type":false,"suffer_score":null,"calories":175.22342743999997,"feed_data":{"entries":[]},"workout_type":10,"flagged":false,"hide_power":false,"hide_heartrate":false},{"id":541369026,"name":"Chamrousse et Pschitt ! Putin de chambre \u00e0 valve courte ! Bien oui \u00e7a marche pas sur les Cosmics :/ Merci victor pour le sauvetage ;)","emoji_name":"Chamrousse et Pschitt ! Putin de chambre \u00e0 valve courte ! Bien oui \u00e7a marche pas sur les Cosmics :/ Merci victor pour le sauvetage ;)","type":"Ride","display_type":"Workout","activity_type_display_name":"Ride","private":false,"bike_id":2042105,"athlete_gear_id":null,"start_date":"Sun, 4/10/2016","start_date_local_raw":1460297748,"start_time":"2016-04-10T12:15:48+0000","start_day":"Sun","distance":"29.8","distance_raw":29875.0,"long_unit":"kilometers","short_unit":"km","moving_time":"1:57:17","moving_time_raw":7037,"elapsed_time":"2:53:43","elapsed_time_raw":10423,"trainer":false,"static_map":true,"show_elevation":true,"has_latlng":true,"commute":false,"elevation_gain":"1,170","elevation_unit":"m","elevation_gain_raw":1170.0,"description":"","activity_url":"https://www.strava.com/activities/541369026","activity_url_for_twitter":"https://www.strava.com/activities/541369026?utm_content=2470979\u0026utm_medium=referral\u0026utm_source=twitter","twitter_msg":"went for a 29.8 kilometer road ride.","is_new":false,"is_changing_type":false,"suffer_score":null,"calories":1347.931685215,"feed_data":{"entries":[]},"workout_type":12,"flagged":false,"hide_power":false,"hide_heartrate":false},{"id":540223951,"name":"Pinet avec Vik","emoji_name":"Pinet avec Vik","type":"Ride","display_type":"Ride","activity_type_display_name":"Ride","private":false,"bike_id":2042105,"athlete_gear_id":null,"start_date":"Sat, 4/9/2016","start_date_local_raw":1460215795,"start_time":"2016-04-09T13:29:55+0000","start_day":"Sat","distance":"39.2","distance_raw":39290.7,"long_unit":"kilometers","short_unit":"km","moving_time":"1:58:46","moving_time_raw":7126,"elapsed_time":"2:02:50","elapsed_time_raw":7370,"trainer":false,"static_map":true,"show_elevation":true,"has_latlng":true,"commute":false,"elevation_gain":"725","elevation_unit":"m","elevation_gain_raw":725.0,"description":"","activity_url":"https://www.strava.com/activities/540223951","activity_url_for_twitter":"https://www.strava.com/activities/540223951?utm_content=2470979\u0026utm_medium=referral\u0026utm_source=twitter","twitter_msg":"went for a 39.2 kilometer road ride.","is_new":false,"is_changing_type":false,"suffer_score":null,"calories":1051.64121993,"feed_data":{"entries":[]},"workout_type":10,"flagged":false,"hide_power":false,"hide_heartrate":false},{"id":538490670,"name":"Perreree 1.2","emoji_name":"Perreree 1.2","type":"Ride","display_type":"Workout","activity_type_display_name":"Ride","private":false,"bike_id":2042105,"athlete_gear_id":null,"start_date":"Thu, 4/7/2016","start_date_local_raw":1460052443,"start_time":"2016-04-07T16:07:23+0000","start_day":"Thu","distance":"31.1","distance_raw":31195.3,"long_unit":"kilometers","short_unit":"km","moving_time":"1:18:22","moving_time_raw":4702,"elapsed_time":"1:20:27","elapsed_time_raw":4827,"trainer":false,"static_map":true,"show_elevation":true,"has_latlng":true,"commute":false,"elevation_gain":"546","elevation_unit":"m","elevation_gain_raw":546.0,"description":"","activity_url":"https://www.strava.com/activities/538490670","activity_url_for_twitter":"https://www.strava.com/activities/538490670?utm_content=2470979\u0026utm_medium=referral\u0026utm_source=twitter","twitter_msg":"went for a 31.1 kilometer road ride.","is_new":false,"is_changing_type":false,"suffer_score":null,"calories":889.44487269,"feed_data":{"entries":[]},"workout_type":12,"flagged":false,"hide_power":false,"hide_heartrate":false},{"id":531863498,"name":"Perreree 1.1","emoji_name":"Perreree 1.1","type":"Ride","display_type":"Workout","activity_type_display_name":"Ride","private":false,"bike_id":2042105,"athlete_gear_id":null,"start_date":"Thu, 3/31/2016","start_date_local_raw":1459447873,"start_time":"2016-03-31T16:11:13+0000","start_day":"Thu","distance":"31.8","distance_raw":31853.1,"long_unit":"kilometers","short_unit":"km","moving_time":"1:27:42","moving_time_raw":5262,"elapsed_time":"1:28:00","elapsed_time_raw":5280,"trainer":false,"static_map":true,"show_elevation":true,"has_latlng":true,"commute":false,"elevation_gain":"553","elevation_unit":"m","elevation_gain_raw":553.0,"description":"","activity_url":"https://www.strava.com/activities/531863498","activity_url_for_twitter":"https://www.strava.com/activities/531863498?utm_content=2470979\u0026utm_medium=referral\u0026utm_source=twitter","twitter_msg":"went for a 31.8 kilometer road ride.","is_new":false,"is_changing_type":false,"suffer_score":null,"calories":839.77991829,"feed_data":{"entries":[]},"workout_type":12,"flagged":false,"hide_power":false,"hide_heartrate":false},{"id":530939100,"name":"Perreree 1.0","emoji_name":"Perreree 1.0","type":"Ride","display_type":"Workout","activity_type_display_name":"Ride","private":false,"bike_id":2042105,"athlete_gear_id":null,"start_date":"Wed, 3/30/2016","start_date_local_raw":1459361290,"start_time":"2016-03-30T16:08:10+0000","start_day":"Wed","distance":"31.8","distance_raw":31866.2,"long_unit":"kilometers","short_unit":"km","moving_time":"1:29:56","moving_time_raw":5396,"elapsed_time":"1:33:10","elapsed_time_raw":5590,"trainer":false,"static_map":true,"show_elevation":true,"has_latlng":true,"commute":false,"elevation_gain":"578","elevation_unit":"m","elevation_gain_raw":578.0,"description":"","activity_url":"https://www.strava.com/activities/530939100","activity_url_for_twitter":"https://www.strava.com/activities/530939100?utm_content=2470979\u0026utm_medium=referral\u0026utm_source=twitter","twitter_msg":"went for a 31.8 kilometer road ride.","is_new":false,"is_changing_type":false,"suffer_score":null,"calories":890.72468084,"feed_data":{"entries":[]},"workout_type":12,"flagged":false,"hide_power":false,"hide_heartrate":false},{"id":527288373,"name":"78k","emoji_name":"78k","type":"Ride","display_type":"Workout","activity_type_display_name":"Ride","private":false,"bike_id":2042105,"athlete_gear_id":null,"start_date":"Sat, 3/26/2016","start_date_local_raw":1458996460,"start_time":"2016-03-26T11:47:40+0000","start_day":"Sat","distance":"78.0","distance_raw":78022.1,"long_unit":"kilometers","short_unit":"km","moving_time":"3:19:16","moving_time_raw":11956,"elapsed_time":"3:27:59","elapsed_time_raw":12479,"trainer":false,"static_map":true,"show_elevation":true,"has_latlng":true,"commute":false,"elevation_gain":"913","elevation_unit":"m","elevation_gain_raw":913.0,"description":"","activity_url":"https://www.strava.com/activities/527288373","activity_url_for_twitter":"https://www.strava.com/activities/527288373?utm_content=2470979\u0026utm_medium=referral\u0026utm_source=twitter","twitter_msg":"went for a 78.0 kilometer road ride.","is_new":false,"is_changing_type":false,"suffer_score":null,"calories":1782.3066851799997,"feed_data":{"entries":[]},"workout_type":12,"flagged":false,"hide_power":false,"hide_heartrate":false},{"id":514962248,"name":"Get back on Aeroad CF","emoji_name":"Get back on Aeroad CF","type":"Ride","display_type":"Workout","activity_type_display_name":"Ride","private":false,"bike_id":2042105,"athlete_gear_id":null,"start_date":"Sat, 3/12/2016","start_date_local_raw":1457792900,"start_time":"2016-03-12T13:28:20+0000","start_day":"Sat","distance":"43.5","distance_raw":43536.6,"long_unit":"kilometers","short_unit":"km","moving_time":"1:41:45","moving_time_raw":6105,"elapsed_time":"1:43:27","elapsed_time_raw":6207,"trainer":false,"static_map":true,"show_elevation":true,"has_latlng":true,"commute":false,"elevation_gain":"151","elevation_unit":"m","elevation_gain_raw":151.0,"description":"","activity_url":"https://www.strava.com/activities/514962248","activity_url_for_twitter":"https://www.strava.com/activities/514962248?utm_content=2470979\u0026utm_medium=referral\u0026utm_source=twitter","twitter_msg":"went for a 43.5 kilometer road ride.","is_new":false,"is_changing_type":false,"suffer_score":null,"calories":834.445288875,"feed_data":{"entries":[]},"workout_type":12,"flagged":false,"hide_power":false,"hide_heartrate":false},{"id":500553714,"name":"Zwift -Skiing crash return","emoji_name":"Zwift -Skiing crash return","type":"VirtualRide","display_type":"Virtual Ride","activity_type_display_name":"Virtual Ride","private":false,"bike_id":null,"athlete_gear_id":null,"start_date":"Tue, 2/23/2016","start_date_local_raw":1456252635,"start_time":"2016-02-23T17:37:15+0000","start_day":"Tue","distance":"17.6","distance_raw":17650.5,"long_unit":"kilometers","short_unit":"km","moving_time":"40:34","moving_time_raw":2434,"elapsed_time":"40:34","elapsed_time_raw":2434,"trainer":false,"static_map":true,"show_elevation":true,"has_latlng":true,"commute":false,"elevation_gain":"156","elevation_unit":"m","elevation_gain_raw":156.0,"description":"","activity_url":"https://www.strava.com/activities/500553714","activity_url_for_twitter":"https://www.strava.com/activities/500553714?utm_content=2470979\u0026utm_medium=referral\u0026utm_source=twitter","twitter_msg":"went for a 17.6 kilometer Virtual Ride.","is_new":false,"is_changing_type":false,"suffer_score":null,"calories":329.19999691000004,"feed_data":{"entries":[]},"workout_type":null,"flagged":false,"hide_power":false,"hide_heartrate":false},{"id":481714535,"name":"Petit Swisssssss ! Et bim une fesse en moins ! (Videos in description)","emoji_name":"Petit Swisssssss ! Et bim une fesse en moins ! (Videos in description)","type":"AlpineSki","display_type":"Alpine Ski","activity_type_display_name":"Alpine Ski","private":false,"bike_id":null,"athlete_gear_id":null,"start_date":"Sat, 1/30/2016","start_date_local_raw":1454146282,"start_time":"2016-01-30T08:31:22+0000","start_day":"Sat","distance":"42.8","distance_raw":42875.9,"long_unit":"kilometers","short_unit":"km","moving_time":"2:23:55","moving_time_raw":8635,"elapsed_time":"3:44:54","elapsed_time_raw":13494,"trainer":false,"static_map":true,"show_elevation":true,"has_latlng":true,"commute":false,"elevation_gain":"3,405","elevation_unit":"m","elevation_gain_raw":3405.46,"description":"Swiss wall 90% grade: https://www.youtube.com/watch?v=oxhRAhmbt5I\r\n\r\n\r\n\r\n\r\n\r\n\r\n\r\n\r\n\r\n\r\n\r\n\r\n\r\n\r\n\r\nMy first punish since 14 years :/  (backward ride) https://www.youtube.com/watch?v=gVu8iIOUKPk","activity_url":"https://www.strava.com/activities/481714535","activity_url_for_twitter":"https://www.strava.com/activities/481714535?utm_content=2470979\u0026utm_medium=referral\u0026utm_source=twitter","twitter_msg":"went for a 42.8 kilometer Alpine Ski.","is_new":false,"is_changing_type":false,"suffer_score":null,"calories":null,"feed_data":{"entries":[]},"workout_type":null,"flagged":false,"hide_power":false,"hide_heartrate":false}],"page":4,"perPage":20,"total":592}