{"models":[{"id":656401541,"name":"Easy XC MTB","emoji_name":"Easy XC MTB","type":"Ride","display_type":"Ride","activity_type_display_name":"Ride","private":false,"bike_id":1493775,"athlete_gear_id":null,"start_date":"Thu, 7/28/2016","start_date_local_raw":1469715147,"start_time":"2016-07-28T12:12:27+0000","start_day":"Thu","distance":"21.3","distance_raw":21379.9,"long_unit":"kilometers","short_unit":"km","moving_time":"1:29:00","moving_time_raw":5340,"elapsed_time":"2:22:09","elapsed_time_raw":8529,"trainer":false,"static_map":true,"show_elevation":true,"has_latlng":true,"commute":false,"elevation_gain":"213","elevation_unit":"m","elevation_gain_raw":213.0,"description":"","activity_url":"https://www.strava.com/activities/656401541","activity_url_for_twitter":"https://www.strava.com/activities/656401541?utm_content=2470979\u0026utm_medium=referral\u0026utm_source=twitter","twitter_msg":"went for a 21.3 kilometer cross ride.","is_new":false,"is_changing_type":false,"suffer_score":null,"calories":525.85479921,"feed_data":{"entries":[]},"workout_type":10,"flagged":false,"hide_power":false,"hide_heartrate":false},{"id":652212776,"name":"Test Swim","emoji_name":"Test Swim","type":"Swim","display_type":"Swim","activity_type_display_name":"Swim","private":true,"bike_id":null,"athlete_gear_id":null,"start_date":"Sun, 7/24/2016","start_date_local_raw":1469379889,"start_time":"2016-07-24T15:04:49+0000","start_day":"Sun","distance":"34","distance_raw":34.0,"long_unit":"meters","short_unit":"m","moving_time":"2:13","moving_time_raw":133,"elapsed_time":"2:19","elapsed_time_raw":139,"trainer":true,"static_map":false,"show_elevation":false,"has_latlng":false,"commute":false,"elevation_gain":"0","elevation_unit":"m","elevation_gain_raw":0,"description":"","activity_url":"https://www.strava.com/activities/652212776","activity_url_for_twitter":"https://www.strava.com/activities/652212776?utm_content=2470979\u0026utm_medium=referral\u0026utm_source=twitter","twitter_msg":"went for a 0.0 kilometer Swim.","is_new":false,"is_changing_type":false,"suffer_score":null,"calories":null,"feed_data":{"entries":[]},"workout_type":null,"flagged":false,"hide_power":false,"hide_heartrate":false},{"id":651874303,"name":"Course orientation. Win !!","emoji_name":"Course orientation. Win !!","type":"Walk","display_type":"Walk","activity_type_display_name":"Walk","private":false,"bike_id":null,"athlete_gear_id":1022094,"start_date":"Sun, 7/24/2016","start_date_local_raw":1469373516,"start_time":"2016-07-24T13:18:36+0000","start_day":"Sun","distance":"3.7","distance_raw":3735.9,"long_unit":"kilometers","short_unit":"km","moving_time":"42:07","moving_time_raw":2527,"elapsed_time":"42:54","elapsed_time_raw":2574,"trainer":false,"static_map":true,"show_elevation":true,"has_latlng":true,"commute":false,"elevation_gain":"124","elevation_unit":"m","elevation_gain_raw":124.0,"description":"","activity_url":"https://www.strava.com/activities/651874303","activity_url_for_twitter":"https://www.strava.com/activities/651874303?utm_content=2470979\u0026utm_medium=referral\u0026utm_source=twitter","twitter_msg":"went for a 3.7 kilometer Walk.","is_new":false,"is_changing_type":false,"suffer_score":null,"calories":330.49624406399994,"feed_data":{"entries":[]},"workout_type":null,"flagged":false,"hide_power":false,"hide_heartrate":false},{"id":651564771,"name":"Lunch Walk","emoji_name":"Lunch Walk","type":"Walk","display_type":"Walk","activity_type_display_name":"Walk","private":false,"bike_id":null,"athlete_gear_id":1022094,"start_date":"Sun, 7/24/2016","start_date_local_raw":1469358428,"start_time":"2016-07-24T09:07:08+0000","start_day":"Sun","distance":"4.2","distance_raw":4207.2,"long_unit":"kilometers","short_unit":"km","moving_time":"1:00:18","moving_time_raw":3618,"elapsed_time":"1:08:31","elapsed_time_raw":4111,"trainer":false,"static_map":true,"show_elevation":true,"has_latlng":true,"commute":false,"elevation_gain":"87","elevation_unit":"m","elevation_gain_raw":87.0,"description":"","activity_url":"https://www.strava.com/activities/651564771","activity_url_for_twitter":"https://www.strava.com/activities/651564771?utm_content=2470979\u0026utm_medium=referral\u0026utm_source=twitter","twitter_msg":"went for a 4.2 kilometer Walk.","is_new":false,"is_changing_type":false,"suffer_score":null,"calories":372.1897797120001,"feed_data":{"entries":[]},"workout_type":null,"flagged":false,"hide_power":false,"hide_heartrate":false},{"id":648202709,"name":"Morning Ride","emoji_name":"Morning Ride","type":"Ride","display_type":"Ride","activity_type_display_name":"Ride","private":false,"bike_id":2042105,"athlete_gear_id":null,"start_date":"Thu, 7/21/2016","start_date_local_raw":1469092695,"start_time":"2016-07-21T07:18:15+0000","start_day":"Thu","distance":"1.5","distance_raw":1552.7,"long_unit":"kilometers","short_unit":"km","moving_time":"6:18","moving_time_raw":378,"elapsed_time":"6:34","elapsed_time_raw":394,"trainer":false,"static_map":true,"show_elevation":true,"has_latlng":true,"commute":false,"elevation_gain":"2","elevation_unit":"m","elevation_gain_raw":2.0,"description":null,"activity_url":"https://www.strava.com/activities/648202709","activity_url_for_twitter":"https://www.strava.com/activities/648202709?utm_content=2470979\u0026utm_medium=referral\u0026utm_source=twitter","twitter_msg":"went for a 1.5 kilometer road ride.","is_new":true,"is_changing_type":false,"suffer_score":null,"calories":16.666525386,"feed_data":{"entries":[]},"workout_type":null,"flagged":false,"hide_power":false,"hide_heartrate":false},{"id":646390253,"name":"Test Trimp/h Connect IQ","emoji_name":"Test Trimp/h Connect IQ","type":"Ride","display_type":"Ride","activity_type_display_name":"Ride","private":false,"bike_id":2042105,"athlete_gear_id":null,"start_date":"Tue, 7/19/2016","start_date_local_raw":1468951322,"start_time":"2016-07-19T16:02:02+0000","start_day":"Tue","distance":"31.2","distance_raw":31248.9,"long_unit":"kilometers","short_unit":"km","moving_time":"1:19:21","moving_time_raw":4761,"elapsed_time":"1:21:58","elapsed_time_raw":4918,"trainer":false,"static_map":true,"show_elevation":true,"has_latlng":true,"commute":false,"elevation_gain":"485","elevation_unit":"m","elevation_gain_raw":485.0,"description":"","activity_url":"https://www.strava.com/activities/646390253","activity_url_for_twitter":"https://www.strava.com/activities/646390253?utm_content=2470979\u0026utm_medium=referral\u0026utm_source=twitter","twitter_msg":"went for a 31.2 kilometer road ride.","is_new":false,"is_changing_type":false,"suffer_score":null,"calories":779.942949345,"feed_data":{"entries":[]},"workout_type":10,"flagged":false,"hide_power":false,"hide_heartrate":false},{"id":644365059,"name":"Sortie avec vik","emoji_name":"Sortie avec vik","type":"Ride","display_type":"Ride","activity_type_display_name":"Ride","private":false,"bike_id":2042105,"athlete_gear_id":null,"start_date":"Sun, 7/17/2016","start_date_local_raw":1468777236,"start_time":"2016-07-17T15:40:36+0000","start_day":"Sun","distance":"50.4","distance_raw":50485.5,"long_unit":"kilometers","short_unit":"km","moving_time":"2:22:53","moving_time_raw":8573,"elapsed_time":"3:36:06","elapsed_time_raw":12966,"trainer":false,"static_map":true,"show_elevation":true,"has_latlng":true,"commute":false,"elevation_gain":"610","elevation_unit":"m","elevation_gain_raw":610.0,"description":"","activity_url":"https://www.strava.com/activities/644365059","activity_url_for_twitter":"https://www.strava.com/activities/644365059?utm_content=2470979\u0026utm_medium=referral\u0026utm_source=twitter","twitter_msg":"went for a 50.4 kilometer road ride.","is_new":false,"is_changing_type":false,"suffer_score":null,"calories":1147.01004663,"feed_data":{"entries":[]},"workout_type":10,"flagged":false,"hide_power":false,"hide_heartrate":false},{"id":642780978,"name":"Relax","emoji_name":"Relax","type":"Ride","display_type":"Ride","activity_type_display_name":"Ride","private":false,"bike_id":2042105,"athlete_gear_id":null,"start_date":"Sat, 7/16/2016","start_date_local_raw":1468679504,"start_time":"2016-07-16T12:31:44+0000","start_day":"Sat","distance":"34.7","distance_raw":34764.5,"long_unit":"kilometers","short_unit":"km","moving_time":"1:21:28","moving_time_raw":4888,"elapsed_time":"2:28:15","elapsed_time_raw":8895,"trainer":false,"static_map":true,"show_elevation":true,"has_latlng":true,"commute":false,"elevation_gain":"150","elevation_unit":"m","elevation_gain_raw":150.0,"description":"","activity_url":"https://www.strava.com/activities/642780978","activity_url_for_twitter":"https://www.strava.com/activities/642780978?utm_content=2470979\u0026utm_medium=referral\u0026utm_source=twitter","twitter_msg":"went for a 34.7 kilometer road ride.","is_new":false,"is_changing_type":false,"suffer_score":null,"calories":648.05741884,"feed_data":{"entries":[]},"workout_type":10,"flagged":false,"hide_power":false,"hide_heartrate":false},{"id":641842346,"name":"Afternoon Ride","emoji_name":"Afternoon Ride","type":"Ride","display_type":"Workout","activity_type_display_name":"Ride","private":false,"bike_id":2042105,"athlete_gear_id":null,"start_date":"Fri, 7/15/2016","start_date_local_raw":1468602742,"start_time":"2016-07-15T15:12:22+0000","start_day":"Fri","distance":"40.0","distance_raw":40024.7,"long_unit":"kilometers","short_unit":"km","moving_time":"1:41:46","moving_time_raw":6106,"elapsed_time":"1:43:58","elapsed_time_raw":6238,"trainer":false,"static_map":true,"show_elevation":true,"has_latlng":true,"commute":false,"elevation_gain":"516","elevation_unit":"m","elevation_gain_raw":516.0,"description":"","activity_url":"https://www.strava.com/activities/641842346","activity_url_for_twitter":"https://www.strava.com/activities/641842346?utm_content=2470979\u0026utm_medium=referral\u0026utm_source=twitter","twitter_msg":"went for a 40.0 kilometer road ride.","is_new":false,"is_changing_type":false,"suffer_score":null,"calories":947.7545135199999,"feed_data":{"entries":[]},"workout_type":12,"flagged":false,"hide_power":false,"hide_heartrate":false},{"id":639823327,"name":"Running avec Aur\u00e9lie ","emoji_name":"Running avec Aur\u00e9lie ","type":"Run","display_type":"Run","activity_type_display_name":"Run","private":false,"bike_id":null,"athlete_gear_id":1022094,"start_date":"Wed, 7/13/2016","start_date_local_raw":1468434808,"start_time":"2016-07-13T16:33:28+0000","start_day":"Wed","distance":"10.0","distance_raw":10019.6,"long_unit":"kilometers","short_unit":"km","moving_time":"1:16:18","moving_time_raw":4578,"elapsed_time":"1:16:25","elapsed_time_raw":4585,"trainer":false,"static_map":true,"show_elevation":true,"has_latlng":true,"commute":false,"elevation_gain":"18","elevation_unit":"m","elevation_gain_raw":18.0,"description":"","activity_url":"https://www.strava.com/activities/639823327","activity_url_for_twitter":"https://www.strava.com/activities/639823327?utm_content=2470979\u0026utm_medium=referral\u0026utm_source=twitter","twitter_msg":"went for a 10.0 kilometer Run.","is_new":false,"is_changing_type":false,"suffer_score":null,"calories":888.5420582400001,"feed_data":{"entries":[]},"workout_type":0,"flagged":false,"hide_power":false,"hide_heartrate":false},{"id":636437864,"name":"Castor @ https://www.relive.cc/view/636437864","emoji_name":"Castor @ https://www.relive.cc/view/636437864","type":"Ride","display_type":"Workout","activity_type_display_name":"Ride","private":false,"bike_id":2042105,"athlete_gear_id":null,"start_date":"Sun, 7/10/2016","start_date_local_raw":1468146333,"start_time":"2016-07-10T08:25:33+0000","start_day":"Sun","distance":"136.8","distance_raw":136889.0,"long_unit":"kilometers","short_unit":"km","moving_time":"5:40:02","moving_time_raw":20402,"elapsed_time":"6:23:13","elapsed_time_raw":22993,"trainer":false,"static_map":true,"show_elevation":true,"has_latlng":true,"commute":false,"elevation_gain":"1,581","elevation_unit":"m","elevation_gain_raw":1581.0,"description":"https://www.relive.cc/view/636437864","activity_url":"https://www.strava.com/activities/636437864","activity_url_for_twitter":"https://www.strava.com/activities/636437864?utm_content=2470979\u0026utm_medium=referral\u0026utm_source=twitter","twitter_msg":"went for a 136.8 kilometer road ride.","is_new":false,"is_changing_type":false,"suffer_score":null,"calories":3121.9670852,"feed_data":{"entries":[]},"workout_type":12,"flagged":false,"hide_power":false,"hide_heartrate":false},{"id":635350470,"name":"Afternoon Ride","emoji_name":"Afternoon Ride","type":"Ride","display_type":"Workout","activity_type_display_name":"Ride","private":false,"bike_id":2042105,"athlete_gear_id":null,"start_date":"Sat, 7/9/2016","start_date_local_raw":1468083151,"start_time":"2016-07-09T14:52:31+0000","start_day":"Sat","distance":"45.8","distance_raw":45843.2,"long_unit":"kilometers","short_unit":"km","moving_time":"1:39:40","moving_time_raw":5980,"elapsed_time":"1:47:09","elapsed_time_raw":6429,"trainer":false,"static_map":true,"show_elevation":true,"has_latlng":true,"commute":false,"elevation_gain":"100","elevation_unit":"m","elevation_gain_raw":100.0,"description":"","activity_url":"https://www.strava.com/activities/635350470","activity_url_for_twitter":"https://www.strava.com/activities/635350470?utm_content=2470979\u0026utm_medium=referral\u0026utm_source=twitter","twitter_msg":"went for a 45.8 kilometer road ride.","is_new":false,"is_changing_type":false,"suffer_score":null,"calories":880.9498594,"feed_data":{"entries":[]},"workout_type":12,"flagged":false,"hide_power":false,"hide_heartrate":false},{"id":634869308,"name":"Morning Ride","emoji_name":"Morning Ride","type":"Ride","display_type":"Ride","activity_type_display_name":"Ride","private":false,"bike_id":2042105,"athlete_gear_id":null,"start_date":"Sat, 7/9/2016","start_date_local_raw":1468059849,"start_time":"2016-07-09T08:24:09+0000","start_day":"Sat","distance":"15.5","distance_raw":15561.9,"long_unit":"kilometers","short_unit":"km","moving_time":"33:56","moving_time_raw":2036,"elapsed_time":"1:09:29","elapsed_time_raw":4169,"trainer":false,"static_map":true,"show_elevation":true,"has_latlng":true,"commute":false,"elevation_gain":"76","elevation_unit":"m","elevation_gain_raw":76.0,"description":null,"activity_url":"https://www.strava.com/activities/634869308","activity_url_for_twitter":"https://www.strava.com/activities/634869308?utm_content=2470979\u0026utm_medium=referral\u0026utm_source=twitter","twitter_msg":"went for a 15.5 kilometer road ride.","is_new":true,"is_changing_type":false,"suffer_score":null,"calories":328.17370853999995,"feed_data":{"entries":[]},"workout_type":null,"flagged":false,"hide_power":false,"hide_heartrate":false},{"id":633374437,"name":"Perreree avec Aur\u00e9lie ","emoji_name":"Perreree avec Aur\u00e9lie ","type":"Ride","display_type":"Workout","activity_type_display_name":"Ride","private":false,"bike_id":2042105,"athlete_gear_id":null,"start_date":"Thu, 7/7/2016","start_date_local_raw":1467916240,"start_time":"2016-07-07T16:30:40+0000","start_day":"Thu","distance":"31.8","distance_raw":31831.2,"long_unit":"kilometers","short_unit":"km","moving_time":"1:52:27","moving_time_raw":6747,"elapsed_time":"1:56:43","elapsed_time_raw":7003,"trainer":false,"static_map":true,"show_elevation":true,"has_latlng":true,"commute":false,"elevation_gain":"509","elevation_unit":"m","elevation_gain_raw":509.0,"description":"","activity_url":"https://www.strava.com/activities/633374437","activity_url_for_twitter":"https://www.strava.com/activities/633374437?utm_content=2470979\u0026utm_medium=referral\u0026utm_source=twitter","twitter_msg":"went for a 31.8 kilometer road ride.","is_new":false,"is_changing_type":false,"suffer_score":null,"calories":727.3076847855,"feed_data":{"entries":[]},"workout_type":12,"flagged":false,"hide_power":false,"hide_heartrate":false},{"id":632205691,"name":"Evening Ride","emoji_name":"Evening Ride","type":"Ride","display_type":"Workout","activity_type_display_name":"Ride","private":false,"bike_id":2042105,"athlete_gear_id":null,"start_date":"Wed, 7/6/2016","start_date_local_raw":1467828671,"start_time":"2016-07-06T16:11:11+0000","start_day":"Wed","distance":"35.7","distance_raw":35742.8,"long_unit":"kilometers","short_unit":"km","moving_time":"1:31:13","moving_time_raw":5473,"elapsed_time":"1:31:52","elapsed_time_raw":5512,"trainer":false,"static_map":true,"show_elevation":true,"has_latlng":true,"commute":false,"elevation_gain":"502","elevation_unit":"m","elevation_gain_raw":502.0,"description":"","activity_url":"https://www.strava.com/activities/632205691","activity_url_for_twitter":"https://www.strava.com/activities/632205691?utm_content=2470979\u0026utm_medium=referral\u0026utm_source=twitter","twitter_msg":"went for a 35.7 kilometer road ride.","is_new":false,"is_changing_type":false,"suffer_score":null,"calories":856.3612951399999,"feed_data":{"entries":[]},"workout_type":12,"flagged":false,"hide_power":false,"hide_heartrate":false},{"id":628842674,"name":"4 Seigneurs \u0026 Balcons de Belledonne - https://www.relive.cc/view/628842674","emoji_name":"4 Seigneurs \u0026 Balcons de Belledonne - https://www.relive.cc/view/628842674","type":"Ride","display_type":"Workout","activity_type_display_name":"Ride","private":false,"bike_id":2042105,"athlete_gear_id":null,"start_date":"Sun, 7/3/2016","start_date_local_raw":1467552016,"start_time":"2016-07-03T11:20:16+0000","start_day":"Sun","distance":"95.3","distance_raw":95313.4,"long_unit":"kilometers","short_unit":"km","moving_time":"4:14:40","moving_time_raw":15280,"elapsed_time":"4:40:19","elapsed_time_raw":16819,"trainer":false,"static_map":true,"show_elevation":true,"has_latlng":true,"commute":false,"elevation_gain":"1,748","elevation_unit":"m","elevation_gain_raw":1748.0,"description":"https://www.relive.cc/view/628842674","activity_url":"https://www.strava.com/activities/628842674","activity_url_for_twitter":"https://www.strava.com/activities/628842674?utm_content=2470979\u0026utm_medium=referral\u0026utm_source=twitter","twitter_msg":"went for a 95.3 kilometer road ride.","is_new":false,"is_changing_type":false,"suffer_score":null,"calories":2565.4956504,"feed_data":{"entries":[]},"workout_type":12,"flagged":false,"hide_power":false,"hide_heartrate":false},{"id":626807611,"name":"Perreree avec Aur\u00e9lie","emoji_name":"Perreree avec Aur\u00e9lie","type":"Ride","display_type":"Ride","activity_type_display_name":"Ride","private":false,"bike_id":2042105,"athlete_gear_id":null,"start_date":"Fri, 7/1/2016","start_date_local_raw":1467398247,"start_time":"2016-07-01T16:37:27+0000","start_day":"Fri","distance":"31.3","distance_raw":31381.9,"long_unit":"kilometers","short_unit":"km","moving_time":"2:02:04","moving_time_raw":7324,"elapsed_time":"2:10:42","elapsed_time_raw":7842,"trainer":false,"static_map":true,"show_elevation":true,"has_latlng":true,"commute":false,"elevation_gain":"499","elevation_unit":"m","elevation_gain_raw":499.0,"description":"https://www.relive.cc/view/626807611","activity_url":"https://www.strava.com/activities/626807611","activity_url_for_twitter":"https://www.strava.com/activities/626807611?utm_content=2470979\u0026utm_medium=referral\u0026utm_source=twitter","twitter_msg":"went for a 31.3 kilometer road ride.","is_new":false,"is_changing_type":false,"suffer_score":null,"calories":664.867490664,"feed_data":{"entries":[]},"workout_type":10,"flagged":false,"hide_power":false,"hide_heartrate":false},{"id":625798007,"name":".","emoji_name":".","type":"Ride","display_type":"Workout","activity_type_display_name":"Ride","private":false,"bike_id":2042105,"athlete_gear_id":null,"start_date":"Thu, 6/30/2016","start_date_local_raw":1467311207,"start_time":"2016-06-30T16:26:47+0000","start_day":"Thu","distance":"31.3","distance_raw":31366.5,"long_unit":"kilometers","short_unit":"km","moving_time":"1:24:25","moving_time_raw":5065,"elapsed_time":"1:25:22","elapsed_time_raw":5122,"trainer":false,"static_map":true,"show_elevation":true,"has_latlng":true,"commute":false,"elevation_gain":"495","elevation_unit":"m","elevation_gain_raw":495.0,"description":"https://www.relive.cc/view/625798007","activity_url":"https://www.strava.com/activities/625798007","activity_url_for_twitter":"https://www.strava.com/activities/625798007?utm_content=2470979\u0026utm_medium=referral\u0026utm_source=twitter","twitter_msg":"went for a 31.3 kilometer road ride.","is_new":false,"is_changing_type":false,"suffer_score":null,"calories":778.7755075499999,"feed_data":{"entries":[]},"workout_type":12,"flagged":false,"hide_power":false,"hide_heartrate":false},{"id":624735627,"name":"Fish?!","emoji_name":"Fish?!","type":"Ride","display_type":"Workout","activity_type_display_name":"Ride","private":false,"bike_id":2042105,"athlete_gear_id":null,"start_date":"Wed, 6/29/2016","start_date_local_raw":1467224403,"start_time":"2016-06-29T16:20:03+0000","start_day":"Wed","distance":"29.6","distance_raw":29601.6,"long_unit":"kilometers","short_unit":"km","moving_time":"1:01:41","moving_time_raw":3701,"elapsed_time":"1:02:33","elapsed_time_raw":3753,"trainer":false,"static_map":true,"show_elevation":true,"has_latlng":true,"commute":false,"elevation_gain":"140","elevation_unit":"m","elevation_gain_raw":140.0,"description":"https://www.relive.cc/view/624735627","activity_url":"https://www.strava.com/activities/624735627","activity_url_for_twitter":"https://www.strava.com/activities/624735627?utm_content=2470979\u0026utm_medium=referral\u0026utm_source=twitter","twitter_msg":"went for a 29.6 kilometer road ride.","is_new":false,"is_changing_type":false,"suffer_score":null,"calories":661.0300770050001,"feed_data":{"entries":[]},"workout_type":12,"flagged":false,"hide_power":false,"hide_heartrate":false},{"id":623709272,"name":"Venon par Perreree ","emoji_name":"Venon par Perreree ","type":"Ride","display_type":"Workout","activity_type_display_name":"Ride","private":false,"bike_id":2042105,"athlete_gear_id":null,"start_date":"Tue, 6/28/2016","start_date_local_raw":1467138153,"start_time":"2016-06-28T16:22:33+0000","start_day":"Tue","distance":"35.0","distance_raw":35082.3,"long_unit":"kilometers","short_unit":"km","moving_time":"1:34:07","moving_time_raw":5647,"elapsed_time":"1:36:38","elapsed_time_raw":5798,"trainer":false,"static_map":true,"show_elevation":true,"has_latlng":true,"commute":false,"elevation_gain":"610","elevation_unit":"m","elevation_gain_raw":610.0,"description":"https://www.relive.cc/view/623709272","activity_url":"https://www.strava.com/activities/623709272","activity_url_for_twitter":"https://www.strava.com/activities/623709272?utm_content=2470979\u0026utm_medium=referral\u0026utm_source=twitter","twitter_msg":"went for a 35.0 kilometer road ride.","is_new":false,"is_changing_type":false,"suffer_score":null,"calories":891.1616816750001,"feed_data":{"entries":[]},"workout_type":12,"flagged":false,"hide_power":false,"hide_heartrate":false}],"page":2,"perPage":20,"total":592}